title,url,created_at,updated_at,published_date,summary,content,category,author,thumbnail_url,image_url,publisher_id,publisher_name,publisher_url
Pertama Digital shares plunge below RM1; RM571 mil market cap wiped out in one week,https://www.klsescreener.com/v2/news/view/1402793,2024-10-04 14:19:16,2024-10-04 20:19:54,2024-10-04 14:02:56,"Pertama Digital Bhd (KL:PERTAMA) hit its limit down again during the early trading session on Friday, with the stock plunging below the RM1 mark, reaching its lowest level since April 2022.","<div class=newsTextDataWrapInner><p>KUALA LUMPUR (Oct 4): Pertama Digital Bhd (KL:<a href=""/askedge/klse/8532"" class=""ce-stock"" target=""_blank"">PERTAMA</a>) hit its limit down again during the early trading session on Friday, with the stock plunging below the RM1 mark, reaching its lowest level since April 2022.</p></div><div class=newsTextDataWrapInner><p>Shares of Pertama Digital dropped 33.5 sen, or 30%, to 78.5 sen, with 903,800 shares changing hands by the midday break, making it the second-largest loser on the local stock market for the day.</p></div><div class=newsTextDataWrapInner><p>T",Edge,,https://assets.theedgemarkets.com/pertamadigital-1_20241003133331604_pertamadigital.com_.jpg,https://assets.theedgemarkets.com/pertamadigital-1_20241003133331604_pertamadigital.com_.jpg,52,TheEdge,http://www.theedgemarkets.com/categories/malaysia
Techna-X unchanged on aborted plan for 85-acre algae farm,https://www.klsescreener.com/v2/news/view/1402783,2024-10-04 14:01:05,2024-10-04 14:01:05,2024-10-04 13:56:06,"KUALA LUMPUR: Technology company, Techna-X Bhd’s share price was unchanged at midday, after it  announced the termination of plans to develop an 85-acre microalgae farm and produce algae biofuel for renewable energy technology projects.","<div itemprop=""articleBody"" class=""dable-content-wrapper""><p>KUALA LUMPUR: Technology company, Techna-X Bhd&#039;s share price was unchanged at midday, after it  announced the termination of plans to develop an 85-acre microalgae farm and produce algae biofuel for renewable energy technology projects.</p><p>It was trading at 13 sen a share.</p><p>In its filing with Bursa Malaysia yesterday, Techna said its wholly owned subsidiary, Techna-X Aerobeidou Sdn Bhd has mutually terminated its tripartite agreement with MYKO Global Sdn Bhd and RTA E&amp;C Sdn Bhd.</p><p>""The termination agreement will ",Corporate,,https://assets.nst.com.my/images/articles/tech04_NSTfield_image_listing_featured_v2.var_1728021362.jpg,https://assets.nst.com.my/images/articles/tech_1728021355.jpg,79,NST,https://www.nst.com.my/business/corporate
Hong Kong shares reach again for 20-month peak,https://www.klsescreener.com/v2/news/view/1402781,2024-10-04 14:00:38,2024-10-04 14:00:38,2024-10-04 13:55:00,"SINGAPORE: Hong Kong stocks rose more than 2% on Friday, still cheering China's massive economic stimulus proposals, while other global markets were skittish about escalating tensions in the Middle East.","<div class=""inline-img""><div class=""story-image""></div></div><div id=""story-body"" class=""story bot-15 relative""><p>SINGAPORE: Hong Kong stocks rose more than 2% on Friday, still cheering China's massive economic stimulus proposals, while other global markets were skittish about escalating tensions in the Middle East.</p><p>Asian stocks fell and oil prices were headed for their sharpest weekly gain in more than a year on those tensions and as investors waited for a U.S. jobs report later in the day.</p><p>Chinese ADRs fell more than 2% overnight.</p><p>Mainland markets are closed for a week-lon",,,https://apicms.thestar.com.my/uploads/images/2024/10/04/2946539.JPG,https://apicms.thestar.com.my/uploads/images/2024/10/04/2946539.JPG,28,TheStar,http://www.thestar.com.my/news/latest/?tag=Business
"Tropicana Corp tops off Edelweiss Serviced Residences, SOFO and Shoppes at Tropicana Gardens",https://www.klsescreener.com/v2/news/view/1402789,2024-10-04 14:06:56,2024-10-04 20:17:45,2024-10-04 13:46:10,"Tropicana Corp Bhd (KL:TROP) has topped off the RM932 million Edelweiss Serviced Residences, SOFO and Shoppes with a 100% take-up rate for the residential component and 60% for the retail units, according to a press statement on Thursday.","<div class=newsTextDataWrapInner><p>KUALA LUMPUR (Oct 4): Tropicana Corp Bhd (KL:<a href=""/askedge/klse/5401"" class=""ce-stock"" target=""_blank"">TROP</a>) has topped off the RM932 million Edelweiss Serviced Residences, SOFO and Shoppes with a 100% take-up rate for the residential component and 60% for the retail units, according to a press statement on Thursday.</p></div><div class=newsTextDataWrapInner><p>Edelweiss Serviced Residences, SOFO and Shoppes is the seventh phase of Tropicana Corp’s transit-oriented development (TOD) called Tropicana Gardens in Tropicana Indah, Selangor. It is targete",新闻,,https://assets.theedgemarkets.com/Edelweiss Official Topping Off Ceremony.jpg,https://assets.theedgemarkets.com/Edelweiss Official Topping Off Ceremony.jpg,52,TheEdge,http://www.theedgemarkets.com/categories/malaysia
Asian currencies dip as Mideast tensions occupy centre-stage,https://www.klsescreener.com/v2/news/view/1402773,2024-10-04 13:51:55,2024-10-04 13:51:55,2024-10-04 13:45:16,"LONDON: Emerging Asian currencies slipped on Friday, with the South Korean won and the Taiwan dollar weakening the most, while shares traded mixed as geopolitical tensions in the Middle East clouded investor sentiment.","<div itemprop=""articleBody"" class=""dable-content-wrapper""><p>LONDON: Emerging Asian currencies slipped on Friday, with the South Korean won and the Taiwan dollar weakening the most, while shares traded mixed as geopolitical tensions in the Middle East clouded investor sentiment.</p><p>The dollar was on the front foot, as the prospect of Israel retaliating for  Tehran&#039;s largest ever assault prompted safe-haven inflows, while the likelihood of another outsized rate cut will be assessed following a key jobs report later on Friday.</p><p>Investors are now pricing in a near 32 per cent chance ",Economy,,https://assets.nst.com.my/images/articles/afx04_NSTfield_image_listing_featured_v2.var_1728020713.jpg,https://assets.nst.com.my/images/articles/MATAWANG_MALAYSIA_RINGGIT_MALAYSIA_CURRENCYyh_1728020705.jpg,81,NST,https://www.nst.com.my/business/economy
"MSIA: 53% of E&E, semiconductor companies optimistic on business outlook in 4Q",https://www.klsescreener.com/v2/news/view/1402775,2024-10-04 13:55:26,2024-10-04 13:55:26,2024-10-04 13:45:00,KUALA LUMPUR: The Malaysia Semiconductor Industry Association (MSIA) reports that 53 per cent of companies in the electrical and electronics (E&amp;E) and semiconductor sectors are optimistic about the business outlook for the fourth quarter of 2024 (4Q).,"<div class=""inline-img""><div class=""story-image""></div></div><div id=""story-body"" class=""story bot-15 relative""><p>KUALA LUMPUR: The Malaysia Semiconductor Industry Association (MSIA) reports that 53 per cent of companies in the electrical and electronics (E&amp;E) and semiconductor sectors are optimistic about the business outlook for the fourth quarter of 2024 (4Q).</p><p>The association’s MSIA E&amp;E/ Semiconductor Quarterly Pulse Survey for 3Q outlook indicated a continued positive sentiment, although it is lower compared to the 60 per cent optimism reported in 2Q for 3Q.</p><p>""For the n",,,https://apicms.thestar.com.my/uploads/images/2024/10/04/2946450.jpg,https://apicms.thestar.com.my/uploads/images/2024/10/04/2946450.jpg,28,TheStar,http://www.thestar.com.my/news/latest/?tag=Business
"Bursa Malaysia ends lower in line with Indonesia, Taiwan markets",https://www.klsescreener.com/v2/news/view/1402771,2024-10-04 13:51:03,2024-10-04 13:51:03,2024-10-04 13:42:29,"KUALA LUMPUR: Bursa Malaysia extended its decline, ending lower at midday along with Indonesian and Taiwan markets as sentiments remained cautious.","<div itemprop=""articleBody"" class=""dable-content-wrapper""><p>KUALA LUMPUR: Bursa Malaysia extended its decline, ending lower at midday along with Indonesian and Taiwan markets as sentiments remained cautious.</p><p>At 12.30 pm, the FTSE Bursa Malaysia KLCI (FBM KLCI) declined by 9.23 points, or 0.56 per cent, to 1,632.32, from Thursday&#039;s close of 1,641.55.</p><p>The benchmark index, which opened 3.06 points lower at 1,638.49, moved between 1,629.94 and 1,639.29 throughout the session.</p><p>On the broader market, decliners outnumbered gainers 582 to 302, with 459 counters unchanged, 1,065",Corporate,,https://assets.nst.com.my/images/articles/mid04_NSTfield_image_listing_featured_v2.var_1728020546.jpg,https://assets.nst.com.my/images/articles/23bhbursa_1728020540.jpg,79,NST,https://www.nst.com.my/business/corporate
M&M Ventures unveils RM50 mil retail park project next to ICC Pudu,https://www.klsescreener.com/v2/news/view/1402767,2024-10-04 13:47:09,2024-10-04 19:49:54,2024-10-04 13:32:39,"M&M Ventures Holdings Sdn Bhd, through its affiliated company M&M Construction Sdn Bhd, has announced the development of its maiden venture retail park project next to ICC Pudu in Kuala Lumpur.","<div class=newsTextDataWrapInner><p>KUALA LUMPUR (Oct 4): M&amp;M Ventures Holdings Sdn Bhd, through its affiliated company M&amp;M Construction Sdn Bhd, has announced the development of its maiden venture retail park project next to ICC Pudu in Kuala Lumpur.</p></div>

<div class=newsTextDataWrapInner><p>With a budget of RM50 million and located within Kuala Lumpur's Golden Triangle, the four-acre retail park will offer shopping and dining experiences catering to both locals and tourists. The project is expected to be completed in the first quarter of 2025.</p></div>

<div class=newsTextD",,,https://assets.theedgemarkets.com/CEO of M&M Ventures Holdings.jpg,https://assets.theedgemarkets.com/CEO of M&M Ventures Holdings.jpg,52,TheEdge,http://www.theedgemarkets.com/categories/malaysia
Energy stocks defy market trend with oil rally,https://www.klsescreener.com/v2/news/view/1402761,2024-10-04 13:31:17,2024-10-04 13:31:17,2024-10-04 13:26:12,"KUALA LUMPUR: Local energy stocks surged on Friday, driven by a sustained rally in oil prices amid escalating concerns over tensions in the Middle East.","<div itemprop=""articleBody"" class=""dable-content-wrapper""><p>KUALA LUMPUR: Local energy stocks surged on Friday, driven by a sustained rally in oil prices amid escalating concerns over tensions in the Middle East.</p><p>The Bursa Malaysia Energy Index gained 3.29 per cent, or 28.20 points, to close at 886.01, an almost one-month high.</p><p>The benchmark FTSE Bursa Malaysia  KLCI index on the other hand was down 0.56 per cent to 1,632.32 points.</p><p>The index is up 3.49 per cent from a year ago, while the FBM KCI is up 15.2 per cent.</p><p>The 23-stock energy sector index  counts the likes o",Corporate,,https://assets.nst.com.my/images/articles/es04_NSTfield_image_listing_featured_v2.var_1728019569.jpg,https://assets.nst.com.my/images/articles/oil_and_gas_1728019561.jpg,79,NST,https://www.nst.com.my/business/corporate
Sime Darby Property’s XME Business Park 2 achieves full take-up at preview,https://www.klsescreener.com/v2/news/view/1402763,2024-10-04 13:33:29,2024-10-04 13:33:29,2024-10-04 13:21:00,KUALA LUMPUR: Sime Darby Property Bhd has achieved a 100% take-up rate for XME Business Park 2 during its preview.,"<div class=""inline-img""><div class=""story-image""></div></div><div id=""story-body"" class=""story bot-15 relative""><p>KUALA LUMPUR: <a href=""/business/marketwatch/stocks/?qcounter=SIMEPROP"" target=""_blank"">Sime Darby Property Bhd</a><a href=""http://charts.thestar.com.my/?s=SIMEPROP"" target=""_blank""><img class=""go-chart"" src=""https://cdn.thestar.com.my/Themes/img/chart.png""></a> has achieved a 100% take-up rate for XME Business Park 2 during its preview.</p><p>In a statement, the developer said the newly launched XME Business Park 2 is its latest industrial development, projected for completion in",,,https://apicms.thestar.com.my/uploads/images/2024/10/04/2946567.jpg,https://apicms.thestar.com.my/uploads/images/2024/10/04/2946567.jpg,28,TheStar,http://www.thestar.com.my/news/latest/?tag=Business
Velesto Energy signs MoU with SLB to improve rig capabilities,https://www.klsescreener.com/v2/news/view/1402759,2024-10-04 13:22:35,2024-10-04 13:22:35,2024-10-04 13:10:00,"KUALA LUMPUR: Velesto Energy Bhd, through its subsidiary Velesto Drilling Sdn Bhd, has signed a memorandum of understanding (MoU) with global technology company, SLB to enhance rig capabilities.","<div class=""inline-img""><div class=""story-image""></div></div><div id=""story-body"" class=""story bot-15 relative""><p>KUALA LUMPUR: <a href=""/business/marketwatch/stocks/?qcounter=VELESTO"" target=""_blank"">Velesto Energy Bhd</a><a href=""http://charts.thestar.com.my/?s=VELESTO"" target=""_blank""><img class=""go-chart"" src=""https://cdn.thestar.com.my/Themes/img/chart.png""></a>, through its subsidiary Velesto Drilling Sdn Bhd, has signed a memorandum of understanding (MoU) with global technology company, SLB to enhance rig capabilities.</p><p>In a filing with Bursa Malaysia, Velesto said the three-year ",,,https://apicms.thestar.com.my/uploads/images/2024/10/04/2946533.jpeg,https://apicms.thestar.com.my/uploads/images/2024/10/04/2946533.jpeg,28,TheStar,http://www.thestar.com.my/news/latest/?tag=Business
"FBM KLCI sinks deeper at midday, energy stocks gain amid Middle East tensions",https://www.klsescreener.com/v2/news/view/1402751,2024-10-04 12:55:26,2024-10-04 12:55:26,2024-10-04 12:44:00,"KUALA LUMPUR: The FBM KLCI sinks deeper into the red at midday as market sentiment weakens, while some energy counters gain ground amid escalating tensions in the Middle East.","<div class=""inline-img""><div class=""story-image""></div></div><div id=""story-body"" class=""story bot-15 relative""><p>KUALA LUMPUR: The FBM KLCI sinks deeper into the red at midday as market sentiment weakens, while some energy counters gain ground amid escalating tensions in the Middle East.</p><p>At lunch break, the market bellwether lost 9.23 points, or 0.56%, to 1,632.32, recovering from its intra-morning low of 1,629.94. The Bursa Malaysia Energy Index surged 3.29% or 28.20 points to 886.01 points.</p><p>In the broader market, losers outnumbered gainers 581 to 302, with 1.82 billion shares w",,,https://apicms.thestar.com.my/uploads/images/2024/10/04/2946501.jpg,https://apicms.thestar.com.my/uploads/images/2024/10/04/2946501.jpg,28,TheStar,http://www.thestar.com.my/news/latest/?tag=Business
"Oil extends rally on Middle East conflict, disruption in crude flows",https://www.klsescreener.com/v2/news/view/1402741,2024-10-04 12:30:42,2024-10-04 12:30:42,2024-10-04 12:23:02,"LONDON: Oil prices inched up in early Asian trading hours on Friday, holding on to their strong weekly gains, as investors weighed the Middle East conflict and the potential disruption in crude flows against an amply-supplied global market.","<div itemprop=""articleBody"" class=""dable-content-wrapper""><p>LONDON: Oil prices inched up in early Asian trading hours on Friday, holding on to their strong weekly gains, as investors weighed the Middle East conflict and the potential disruption in crude flows against an amply-supplied global market.</p><p>Brent crude futures were up 9 cents, or 0.12 per cent, to US$77.71 a barrel as of 0010 GMT. U.S. West Texas Intermediate crude futures were up 8 cents, or 0.11 pe rcent, to US$73.79 a barrel.</p><p>Both benchmarks were on track for weekly gains of about 8 per cent.</p><p>President Joe Biden ",Economy,,https://assets.nst.com.my/images/articles/oilp04_NSTfield_image_listing_featured_v2.var_1728015777.jpg,https://assets.nst.com.my/images/articles/03hmBrentOil_1728015770.jpg,81,NST,https://www.nst.com.my/business/economy
"HLIB: Banking system continues to be strong, well-positioned to weather shocks",https://www.klsescreener.com/v2/news/view/1402731,2024-10-04 12:22:25,2024-10-04 12:22:25,2024-10-04 12:15:00,"KUALA LUMPUR: Malaysia’s banking system is strong, well-positioned to weather shocks and supportive of financial intermediation activities, and continues to be backed by healthy capital and liquidity buffers, said Hong Leong Investment Bank (HLIB).","<div class=""inline-img""><div class=""story-image""></div></div><div id=""story-body"" class=""story bot-15 relative""><p>KUALA LUMPUR: Malaysia’s banking system is strong, well-positioned to weather shocks and supportive of financial intermediation activities, and continues to be backed by healthy capital and liquidity buffers, said Hong Leong Investment Bank (HLIB).</p><p>In a note today, HLIB said risks to financial stability such as credit, market, liquidity and contagion were very much contained in the first half of 2024, with household and business segments remaining in good shape.</p><p>""Total",,,https://apicms.thestar.com.my/uploads/images/2024/10/04/2946396.jpeg,https://apicms.thestar.com.my/uploads/images/2024/10/04/2946396.jpeg,28,TheStar,http://www.thestar.com.my/news/latest/?tag=Business
Anwar arrives in Bangladesh,https://www.klsescreener.com/v2/news/view/1402729,2024-10-04 12:21:50,2024-10-05 10:02:52,2024-10-04 12:14:39,"Prime Minister Datuk Seri Anwar Ibrahim arrived here on Friday for an official visit to pave the way for closer ties between Malaysia and Bangladesh.

His aircraft landed at the Hazrat Shahjalal International Airport at 2pm local time (4pm Malaysian time).","<div class=newsTextDataWrapInner><p>DHAKA (Oct 4): Prime Minister Datuk Seri Anwar Ibrahim arrived here on Friday for an official visit to pave the way for closer ties between Malaysia and Bangladesh.</p></div>

<div class=newsTextDataWrapInner><p>His aircraft landed at the Hazrat Shahjalal International Airport at 2pm local time (4pm Malaysian time).</p></div>

<div class=newsTextDataWrapInner><p>Chief Advisor of the Bangladesh's Interim Government Dr Muhammad Yunus welcomed Anwar upon his arrival, along with Bangladesh Advisors and senior officials of the Bangladesh government and Malays",新闻,,https://assets.theedgemarkets.com/anwar ibrahim 1004_fb.jpg,https://assets.theedgemarkets.com/anwar ibrahim 1004_fb.jpg,52,TheEdge,http://www.theedgemarkets.com/categories/malaysia
Daim’s wife Na’imah gets temporary custody of her passport to meet lawyers overseas,https://www.klsescreener.com/v2/news/view/1402727,2024-10-04 12:21:49,2024-10-04 19:49:51,2024-10-04 11:58:37,"KUALA LUMPUR (Oct 4): Former finance minister Tun Daim Zainuddin’s wife, Toh Puan Na’imah Abdul Khalid, was allowed to obtain temporary custody of her passport from the Sessions Court here, as she will be travelling to the United Kingdom and Japan to meet her lawyers.","<div class=newsTextDataWrapInner><p>KUALA LUMPUR (Oct 4): Former finance minister Tun Daim Zainuddin’s wife, Toh Puan Na’imah Abdul Khalid, was allowed to obtain temporary custody of her passport from the Sessions Court here, as she will be travelling to the United Kingdom and Japan to meet her lawyers.</p></div>

<div class=newsTextDataWrapInner><p>Sessions Court judge Azura Alwi allowed Na’imah’s application after the prosecutor Maziah Mohaide did not object to it. &nbsp;</p></div>

<div class=newsTextDataWrapInner><p>Na’imah’s legal counsel Nizamuddin Hamid had told the judge that his c",,,https://assets.theedgemarkets.com/20241004-TOH-PUAN-NA'IMAH-KL-COURT-ZHD-991_20241004115723_theedgemalaysia.jpg,https://assets.theedgemarkets.com/20241004-TOH-PUAN-NA'IMAH-KL-COURT-ZHD-991_20241004115723_theedgemalaysia.jpg,52,TheEdge,http://www.theedgemarkets.com/categories/malaysia
CIMB Securities foresees Bermaz Auto potentially getting a special dividend from its associate,https://www.klsescreener.com/v2/news/view/1402707,2024-10-04 11:49:38,2024-10-04 19:35:06,2024-10-04 11:38:53,"KUALA LUMPUR (Oct 4): Bermaz Auto Bhd (KL:BAUTO) could potentially get a special dividend from its 30%-owned associate Mazda Malaysia Sdn Bhd, which could serve as a re-rating catalyst, CIMB Securities flagged on Friday.","<div class=newsTextDataWrapInner><p>KUALA LUMPUR (Oct 4): Bermaz Auto Bhd (KL:<a href=""/askedge/klse/5248"" class=""ce-stock"" target=""_blank"">BAUTO</a>) could potentially get a special dividend from its 30%-owned associate Mazda Malaysia Sdn Bhd, which could serve as a re-rating catalyst, CIMB Securities flagged on Friday.</p></div>

<div class=newsTextDataWrapInner><p>A special dividend of between RM200 million and RM300 million from the associate could translate into RM60 million to RM90 million in income for Bermaz Auto, according to CIMB Securities’ estimate. That could add as much as 7.7 ",新闻,,https://assets.theedgemarkets.com/Bermaz-Auto_20241004112917_bauto.com_.my_.jpg,https://assets.theedgemarkets.com/Bermaz-Auto_20241004112917_bauto.com_.my_.jpg,52,TheEdge,http://www.theedgemarkets.com/categories/malaysia
Energy stocks rise as crude oil prices climb; Bursa Malaysia Energy Index jumps 29.63 points,https://www.klsescreener.com/v2/news/view/1402711,2024-10-04 11:55:25,2024-10-04 11:55:25,2024-10-04 11:34:00,"KUALA LUMPUR: Shares of refiners Hengyuan Refining Company Bhd and Petron Malaysia Refining &amp; Marketing Bhd climbed on Friday, driven by increased buying interest due to rising crude oil prices amid escalating tensions in the Middle East.","<div class=""inline-img""><div class=""story-image""></div></div><div id=""story-body"" class=""story bot-15 relative""><p>KUALA LUMPUR: Shares of refiners <a href=""/business/marketwatch/stocks/?qcounter=HENGYUAN"" target=""_blank"">Hengyuan Refining Company Bhd</a><a href=""http://charts.thestar.com.my/?s=HENGYUAN"" target=""_blank""><img class=""go-chart"" src=""https://cdn.thestar.com.my/Themes/img/chart.png""></a> and <a href=""/business/marketwatch/stocks/?qcounter=PETRONM"" target=""_blank"">Petron Malaysia Refining &amp; Marketing Bhd</a><a href=""http://charts.thestar.com.my/?s=PETRONM"" target=""_blank""><img c",,,https://apicms.thestar.com.my/uploads/images/2024/10/04/2946361.jpg,https://apicms.thestar.com.my/uploads/images/2024/10/04/2946361.jpg,28,TheStar,http://www.thestar.com.my/news/latest/?tag=Business
My Say: Four suggestions for Budget 2025,https://www.klsescreener.com/v2/news/view/1402697,2024-10-04 11:32:23,2024-10-07 15:51:21,2024-10-04 11:30:00,"It’s that time of the year again, when public finance economists get quite excited. Yes, you guessed it, it’s national budget time, when economists put forward their suggestions for the budget, with fiscal and monetary policies in mind. Industrialists do the same, usually requesting things that w...","<div class=newsTextDataWrapInner><p><span style=""font-style: italics;"">This article first appeared in Forum, The Edge Malaysia Weekly on September 30, 2024 - October 6, 2024</span></p></div><div class=newsTextDataWrapInner><p>It’s that time of the year again, when public finance economists get quite excited. Yes, you guessed it, it’s national budget time, when economists put forward their suggestions for the budget, with fiscal and monetary policies in mind. Industrialists do the same, usually requesting things that would benefit either their industry or company. Most vocal of all would be the",Edge,,https://assets.theedgemarkets.com/P56-Anwar-SB-TEM1543_Forum_20240930145736_theedgemalaysia.jpg,https://assets.theedgemarkets.com/P56-Anwar-SB-TEM1543_Forum_20240930145736_theedgemalaysia.jpg,54,TheEdge,http://www.theedgemarkets.com/options/edge
"Maybank to see impact from US rate cuts in Singapore, says HLIB",https://www.klsescreener.com/v2/news/view/1402701,2024-10-04 11:34:44,2024-10-04 19:35:02,2024-10-04 11:29:59,"Malaysia's largest banking group by assets, Malayan Banking Bhd (KL:MAYBANK), could face headwinds due to the Federal Reserve's rate cuts and currency fluctuations, which could impact its operations in Singapore.","<div class=newsTextDataWrapInner><p>KUALA LUMPUR (Oct 4): Malaysia's largest banking group by assets, Malayan Banking Bhd (KL:<a href=""/askedge/klse/1155"" class=""ce-stock"" target=""_blank"">MAYBANK</a>), could face headwinds due to the Federal Reserve's rate cuts and currency fluctuations, which could impact its operations in Singapore.</p></div>

<div class=newsTextDataWrapInner><p>Maybank’s Singapore unit, the fifth-largest financier in the country with a market share of 3-4%, contributes about 25-27% of the group’s profit before tax (PBT).</p></div>

<div class=newsTextDataWrapInner><p>In",新闻,,https://assets.theedgemarkets.com/Maybank-6_20230524132447_theedgemalaysia_5.jpg,https://assets.theedgemarkets.com/Maybank-6_20230524132447_theedgemalaysia_5.jpg,52,TheEdge,http://www.theedgemarkets.com/categories/malaysia
