title,url,created_at,updated_at,published_date,summary,content,category,author,thumbnail_url,image_url,publisher_id,publisher_name,publisher_url
Wall St Week Ahead: Surging US energy shares reflect robust growth,https://www.klsescreener.com/v2/news/view/1308155,2024-04-13 07:33:24,2024-04-13 07:33:24,2024-04-13 07:22:00,"US energy shares are soaring as investors benefit from rising oil prices and a stronger-than-expected economy, while seeking to protect their portfolios from a feared resurgence of inflation.","<div class=""inline-img""><div class=""story-image""><p class=""caption"">The economy will be in focus in the coming week as first-quarter earnings season heats up.</p></div></div><div id=""story-body"" class=""story bot-15 relative""><div class=""premium-sign-overlay absolute""></div><p>NEW YORK: US energy shares are soaring as investors benefit from rising oil prices and a stronger-than-expected economy, while seeking to protect their portfolios from a feared resurgence of inflation.</p><p>The S&amp;P 500 energy sector is up about 17% in 2024, roughly doubling the broader index's year-to-date return. It",,,https://apicms.thestar.com.my/uploads/images/2024/04/13/2641111.JPG,https://apicms.thestar.com.my/uploads/images/2024/04/13/2641111.JPG,28,TheStar,http://www.thestar.com.my/news/latest/?tag=Business
Wall St ends sharply lower on sticky inflation,https://www.klsescreener.com/v2/news/view/1308153,2024-04-13 07:33:23,2024-04-13 07:33:23,2024-04-13 07:17:00,"US stocks sold off on Friday after major US banks' results failed to impress, capping a week marked by market-moving inflation data, evolving expectations for US Federal Reserve policy, and looming geopolitical tensions.","<div class=""inline-img""><div class=""story-image""><p class=""caption"">The Dow fell 475.84 points, or 1.24%, to 37,983.24. The S&amp;P 500 lost 75.65 points, or 1.46%, at 5,123.41 and the Nasdaq dropped 267.10 points, or 1.62%, to 16,175.09.</p></div></div><div id=""story-body"" class=""story bot-15 relative""><div class=""premium-sign-overlay absolute""></div><p>NEW YORK: US stocks sold off on Friday after major US banks' results failed to impress, capping a week marked by market-moving inflation data, evolving expectations for US Federal Reserve policy, and looming geopolitical tensions.</p><p>All th",,,https://apicms.thestar.com.my/uploads/images/2024/04/13/2641107.JPG,https://apicms.thestar.com.my/uploads/images/2024/04/13/2641107.JPG,28,TheStar,http://www.thestar.com.my/news/latest/?tag=Business
MyNewsHub's social media operator to give statement on old video clip — MCMC,https://www.klsescreener.com/v2/news/view/1308103,2024-04-13 00:46:52,2024-04-15 11:45:25,2024-04-13 00:34:32,"The Malaysian Communications and Multimedia Commission (MCMC) has called the operator of MyNewsHub news portal's social media account to give a statement regarding the uploading and replaying of an old video clip, which resulted in confusion among social media users.","<div class=newsTextDataWrapInner><p>PUTRAJAYA (April 12): The Malaysian Communications and Multimedia Commission (MCMC) has called the operator of MyNewsHub news portal's social media account to give a statement regarding the uploading and replaying of an old video clip, which resulted in confusion among social media users.</p></div>

<div class=newsTextDataWrapInner><p>In a statement, MCMC expressed grave concern over the spread of a&nbsp; one-minute and 10-second video entitled ""Tanya pasal kuarters jer dh kene mcm tu depan KSN!!"", which was perceived as aiming to portray civil servants ne",新闻,,https://assets.theedgemarkets.com/mcmc new_2.jpg,https://assets.theedgemarkets.com/mcmc new_2.jpg,52,TheEdge,http://www.theedgemarkets.com/categories/malaysia
"CPO futures end lower, in line with CBOT soybean oil weakness",https://www.klsescreener.com/v2/news/view/1308101,2024-04-13 00:46:51,2024-04-15 11:30:28,2024-04-13 00:30:50,"Crude palm oil futures contract on Bursa Malaysia Derivatives closed lower, following the weakness of soybean oil futures on Chicago Board of Trade (CBOT).

The CBOT’s soy oil futures fell 0.4% on Friday.","<div class=newsTextDataWrapInner><p>KUALA LUMPUR (April 12): Crude palm oil futures contract on Bursa Malaysia Derivatives closed lower, following the weakness of soybean oil futures on Chicago Board of Trade (CBOT).</p></div>

<div class=newsTextDataWrapInner><p>The CBOT’s soy oil futures fell 0.4% on Friday.</p></div>

<div class=newsTextDataWrapInner><p>Palm oil trader David Ng said buying activities will be confined to stock replenishment on a steady basis hence putting pressure on the CPO price.</p></div><div class=inPageAd id=div-gpt-ad-inpage></div>

<div class=newsTextDataWrapInn",新闻,,https://assets.theedgemarkets.com/palm-oil-2_theedgemalaysia_6.jpg,https://assets.theedgemarkets.com/palm-oil-2_theedgemalaysia_6.jpg,52,TheEdge,http://www.theedgemarkets.com/categories/malaysia
Will EVs take off in Malaysia?,https://www.klsescreener.com/v2/news/view/1308151,2024-04-13 07:22:22,2024-04-13 07:22:22,2024-04-13 00:00:00,"The electric vehicle (EV) industry has a lot of ground momentum driving its growth and adoption globally, but there are still key chokepoints that could impede any widespread adoption locally – at least for the moment.","<div class=""inline-img""><div class=""story-image""></div></div><div id=""story-body"" class=""story bot-15 relative""><p>THE electric vehicle (EV) industry has a lot of ground momentum driving its growth and adoption globally, but there are still key chokepoints that could impede any widespread adoption locally – at least for the moment.</p><p>No doubt, the EV sector is still touted as the biggest shift in the automotive industry that is still in progress since the development of the petrol internal combustion engine (ICE) which took off in the 20th Century.</p><p>Apart from the promise of vehicles ",,,https://apicms.thestar.com.my/uploads/images/2024/04/13/2641105.jpeg,https://apicms.thestar.com.my/uploads/images/2024/04/13/2641166.jpg,28,TheStar,http://www.thestar.com.my/news/latest/?tag=Business
Genting frontrunner in clinching New York City casino licence,https://www.klsescreener.com/v2/news/view/1308149,2024-04-13 07:11:55,2024-04-13 07:11:55,2024-04-13 00:00:00,"While the potential delays due to local approvals that may push the awarding of new casino licences in New York City to as late as 2025, Genting Malaysia Bhd is expected to remain a leading contender.","<div class=""inline-img""><div class=""story-image""><p class=""caption"">The company is aiming to secure one of three highly sought-after casino licences in New York City to expand its successful Resorts World casino.</p></div></div><div id=""story-body"" class=""story bot-15 relative""><div class=""premium-sign-overlay absolute""></div><p>PETALING JAYA: While the potential delays due to local approvals that may push the awarding of new casino licences in New York City to as late as 2025, <a href=""/business/marketwatch/stocks/?qcounter=GENM"" target=""_blank"">Genting Malaysia Bhd</a><a href=""http://charts.",,,https://apicms.thestar.com.my/uploads/images/2024/04/13/2641100.jpeg,https://apicms.thestar.com.my/uploads/images/2024/04/13/2641100.jpeg,28,TheStar,http://www.thestar.com.my/news/latest/?tag=Business
Singapore economy expands 2.7% in 1Q,https://www.klsescreener.com/v2/news/view/1308147,2024-04-13 07:11:53,2024-04-13 07:11:53,2024-04-13 00:00:00,"Singapore’s economy, in the first three months of 2024, grew at its weakest quarter-on-quarter (q-o-q) pace in a year as manufacturing slowed, but economists see growth strengthening ahead.","<div class=""inline-img""><div class=""story-image""><p class=""caption"">Cruising along: The Marina Bay Sands hotel and casino in Singapore. The city-state’s growth trajectory is tipped to strengthen for the subsequent quarters of 2024, predicated on an improvement in the manufacturing recovery theme. — Bloomberg</p></div></div><div id=""story-body"" class=""story bot-15 relative""><div class=""premium-sign-overlay absolute""></div><p>SINGAPORE: Singapore’s economy, in the first three months of 2024, grew at its weakest quarter-on-quarter (q-o-q) pace in a year as manufacturing slowed, but economists see",,,https://apicms.thestar.com.my/uploads/images/2024/04/13/2640768.jpg,https://apicms.thestar.com.my/uploads/images/2024/04/13/2640768.jpg,28,TheStar,http://www.thestar.com.my/news/latest/?tag=Business
Property mogul eyes ‘city-towns’ from Patagonia to Paraguay,https://www.klsescreener.com/v2/news/view/1308145,2024-04-13 07:11:51,2024-04-13 07:11:51,2024-04-13 00:00:00,"Eduardo Costantini, the Argentine real estate mogul who popularised the gated community concept in his home country, plans to spend up to US$1.5bil developing more of the projects, including in new geographies.","<div class=""inline-img""><div class=""story-image""><p class=""caption"">Argentine President Javier Milei. — AFP</p></div></div><div id=""story-body"" class=""story bot-15 relative""><div class=""premium-sign-overlay absolute""></div><p>EDUARDO Costantini, the Argentine real estate mogul who popularised the gated community concept in his home country, plans to spend up to US$1.5bil developing more of the projects, including in new geographies.</p><p>Consultatio SA, his publicly traded holding company, is doing due diligence on four new properties in Paraguay, Uruguay, Argentina’s Patagonia region and the",,,https://apicms.thestar.com.my/uploads/images/2024/04/13/2641085.jpeg,https://apicms.thestar.com.my/uploads/images/2024/04/13/2641085.jpeg,28,TheStar,http://www.thestar.com.my/news/latest/?tag=Business
Foreign investment push,https://www.klsescreener.com/v2/news/view/1308143,2024-04-13 07:11:49,2024-04-13 07:11:49,2024-04-13 00:00:00,"THE local property market is on track to benefit from steady streams of foreign investments into the country, as rising investor sentiment and business confidence levels will have a positive impact on the real estate segment.","<div class=""inline-img""><div class=""story-image""><p class=""caption"">UOBKH Research says it is positive on substantial growth of FDI in Penang, Johor, Kedah and Perak.</p></div></div><div id=""story-body"" class=""story bot-15 relative""><div class=""premium-sign-overlay absolute""></div><p>THE local property market is on track to benefit from steady streams of foreign investments into the country, as rising investor sentiment and business confidence levels will have a positive impact on the real estate segment.</p><p>Last month, Prime Minister Datuk Seri Anwar Ibrahim revealed that Malaysia had succ",,,https://apicms.thestar.com.my/uploads/images/2024/04/13/2641090.jpeg,https://apicms.thestar.com.my/uploads/images/2024/04/13/2641090.jpeg,28,TheStar,http://www.thestar.com.my/news/latest/?tag=Business
Limitless Technology aims to be dominant force in the gifting space,https://www.klsescreener.com/v2/news/view/1308141,2024-04-13 07:11:47,2024-04-13 07:11:47,2024-04-13 00:00:00,"IT was not long ago when Maximillian Lotz and Niklas Frassa sat in an apartment in Mont Kiara, Kuala Lumpur and developed an application over one weekend in 2016.","<div class=""inline-img""><div class=""story-image""><p class=""caption"">Limitless Technology Sdn Bhd will ramp up its expansion plans this year —SHAARI CHEMAT / THESTAR</p></div></div><div id=""story-body"" class=""story bot-15 relative""><div class=""premium-sign-overlay absolute""></div><p>IT was not long ago when Maximillian Lotz and Niklas Frassa sat in an apartment in Mont Kiara, Kuala Lumpur and developed an application over one weekend in 2016.</p><p>This would become the foundation for South-East Asia-based company, Limitless Technology Sdn Bhd.</p></div>",,,https://apicms.thestar.com.my/uploads/images/2024/04/13/2640783.jpg,https://apicms.thestar.com.my/uploads/images/2024/04/13/2640783.jpg,28,TheStar,http://www.thestar.com.my/news/latest/?tag=Business
MAS keeps currency policy unchanged to fight elevated inflation,https://www.klsescreener.com/v2/news/view/1308139,2024-04-13 07:11:45,2024-04-13 07:11:45,2024-04-13 00:00:00,Singapore’s central bank has kept unchanged its monetary policy stance aimed at strengthening the trade-weighted Singapore dollar to fight still-elevated inflation.,"<div class=""inline-img""><div class=""story-image""><p class=""caption"">MAS' decision to stand pat was widely expected after core inflation in February shot up more than expected. — The Straits Times</p></div></div><div id=""story-body"" class=""story bot-15 relative""><div class=""premium-sign-overlay absolute""></div><p>SINGAPORE: Singapore’s central bank has kept unchanged its monetary policy stance aimed at strengthening the trade-weighted Singapore dollar to fight still-elevated inflation.</p><p>The Monetary Authority of Singapore (MAS) said yesterday that it would maintain the prevailing rate of a",,,https://apicms.thestar.com.my/uploads/images/2024/04/13/2641093.jpeg,https://apicms.thestar.com.my/uploads/images/2024/04/13/2641093.jpeg,28,TheStar,http://www.thestar.com.my/news/latest/?tag=Business
Nextgreen IOI Pulp in production facility deal,https://www.klsescreener.com/v2/news/view/1308137,2024-04-13 07:11:44,2024-04-13 07:11:44,2024-04-13 00:00:00,"Nextgreen IOI Pulp Sdn Bhd (NIP), a joint venture between Nextgreen Global Bhd (NGGB) and IOI Corp Bhd, has inked a memorandum of understanding (MoU) with China’s Xiamen C&amp;D Paper &amp; Pulp Group Co Ltd (Xiamen C&amp;D) for the proposed development and operation of a green and sustainable paper pulp production facility.","<div class=""inline-img""><div class=""story-image""></div></div><div id=""story-body"" class=""story bot-15 relative""><div class=""premium-sign-overlay absolute""></div><p>PETALING JAYA: Nextgreen IOI Pulp Sdn Bhd (NIP), a joint venture between <a href=""/business/marketwatch/stocks/?qcounter=NGGB"" target=""_blank"">Nextgreen Global Bhd</a><a href=""http://charts.thestar.com.my/?s=NGGB"" target=""_blank""><img class=""go-chart"" src=""https://cdn.thestar.com.my/Themes/img/chart.png""></a> (NGGB) and <a href=""/business/marketwatch/stocks/?qcounter=IOICORP"" target=""_blank"">IOI Corp Bhd</a><a href=""http://charts.th",,,https://apicms.thestar.com.my/uploads/images/2024/04/13/2641099.JPG,https://apicms.thestar.com.my/uploads/images/2024/04/13/2641099.JPG,28,TheStar,http://www.thestar.com.my/news/latest/?tag=Business
Chief of Indeed wants to be ‘world’s most powerless CEO’,https://www.klsescreener.com/v2/news/view/1308135,2024-04-13 07:11:42,2024-04-13 07:11:42,2024-04-13 00:00:00,"Hisayuki “Deko” Idekoba, chief executive officer of the company behind top job-search engine Indeed.com, doesn’t seem to place much significance on his own position.","<div class=""inline-img""><div class=""story-image""><p class=""caption"">Recruit Holdings Co CEO Hisayuki “Deko” Idekoba. — Bloomberg</p></div></div><div id=""story-body"" class=""story bot-15 relative""><div class=""premium-sign-overlay absolute""></div><p>TOKYO: Hisayuki “Deko” Idekoba, chief executive officer of the company behind top job-search engine Indeed.com, doesn’t seem to place much significance on his own position.</p><p>“I want be the most powerless CEO in the world,” Idekoba of Japan’s Recruit Holdings Co told Haslinda Amin in an interview for Bloomberg TV’s Latitude. “What I think is, ‘How",,,https://apicms.thestar.com.my/uploads/images/2024/04/13/2641097.jpeg,https://apicms.thestar.com.my/uploads/images/2024/04/13/2641097.jpeg,28,TheStar,http://www.thestar.com.my/news/latest/?tag=Business
Unlocking success,https://www.klsescreener.com/v2/news/view/1308133,2024-04-13 07:11:41,2024-04-13 07:11:41,2024-04-13 00:00:00,"While online sales have picked up at a rapid phase amid the eCommerce boom, many online brands in Malaysia are also setting up physical stores to achieve omnichannel presence and ramp up their bottom lines. Similar trends can be seen in overseas markets.","<div class=""inline-img""><div class=""story-image""><p class=""caption"">Data-driven: Chang with his business partners. His company is committed to staying attuned to evolving consumer trends and market dynamics.</p></div></div><div id=""story-body"" class=""story bot-15 relative""><div class=""premium-sign-overlay absolute""></div><p>WHILE online sales have picked up at a rapid phase amid the eCommerce boom, many online brands in Malaysia are also setting up physical stores to achieve omnichannel presence and ramp up their bottom lines. Similar trends can be seen in overseas markets.</p><p>This concept ",,,https://apicms.thestar.com.my/uploads/images/2024/04/13/2640766.jpg,https://apicms.thestar.com.my/uploads/images/2024/04/13/2640766.jpg,28,TheStar,http://www.thestar.com.my/news/latest/?tag=Business
Right time to tap into alternative investments,https://www.klsescreener.com/v2/news/view/1308131,2024-04-13 07:11:40,2024-04-13 07:11:40,2024-04-13 00:00:00,"Anyone well-versed with the Malaysian capital markets will espouse the idea that for solid and dividend bearing investments, it would be best to be banking on the banks, pun intended.","<div class=""inline-img""><div class=""story-image""><p class=""caption"">Alta Alternative Investments Pte Ltd CEO and co-founder Kelvin Lee.</p></div></div><div id=""story-body"" class=""story bot-15 relative""><div class=""premium-sign-overlay absolute""></div><p>ANYONE well-versed with the Malaysian capital markets will espouse the idea that for solid and dividend bearing investments, it would be best to be banking on the banks, pun intended.</p><p>While it is nothing new that lenders form a majority of the blue-chip companies on the FBM KLCI, the advent of private equity activities and the rise of cre",,,https://apicms.thestar.com.my/uploads/images/2024/04/13/2641083.jpeg,https://apicms.thestar.com.my/uploads/images/2024/04/13/2641083.jpeg,28,TheStar,http://www.thestar.com.my/news/latest/?tag=Business
Tough for LC Corp to find buyer for LC Titan,https://www.klsescreener.com/v2/news/view/1308129,2024-04-13 07:11:38,2024-04-13 07:11:38,2024-04-13 00:00:00,"It is no secret that South Korean chemical company Lotte Chemical Corp (LC Corp) is mulling disposing of its stakes in loss-making Malaysian unit, Lotte Chemical Titan Holding Bhd (LC Titan).","<div class=""inline-img""><div class=""story-image""><p class=""caption"">TA Research's Ong says that it will be difficult to find a buyer as the petrochemical industry is still plagued by oversupply and poor product spreads.</p></div></div><div id=""story-body"" class=""story bot-15 relative""><div class=""premium-sign-overlay absolute""></div><p>IT is no secret that South Korean chemical company Lotte Chemical Corp (LC Corp) is mulling disposing of its stakes in loss-making Malaysian unit, <a href=""/business/marketwatch/stocks/?qcounter=LCTITAN"" target=""_blank"">Lotte Chemical Titan Holding Bhd</a><a hre",,,https://apicms.thestar.com.my/uploads/images/2024/04/13/2641084.jpeg,https://apicms.thestar.com.my/uploads/images/2024/04/13/2641084.jpeg,28,TheStar,http://www.thestar.com.my/news/latest/?tag=Business
All systems go for Lumut as an engine of growth,https://www.klsescreener.com/v2/news/view/1308127,2024-04-13 07:11:36,2024-04-13 07:11:36,2024-04-13 00:00:00,Perak stands on the brink of a transformative leap with the Lumut Maritime Industrial City (LuMIC) project set to redefine the region’s identity from a quiet state on the west coast to a bustling hub of maritime and industrial activity.,"<div class=""inline-img""><div class=""story-image""><p class=""caption"">(Fifth from left) Perak State Development Corp (PKNPk) chief executive Datuk Redza Rafiq Abdul Razak and (fourth from right) Port of Antwerp-Bruges International (PoABI) managing director Kristof Waterschoot at the signing of the joint venture shareholders' agreement between PoABI and PKNPk.</p></div></div><div id=""story-body"" class=""story bot-15 relative""><div class=""premium-sign-overlay absolute""></div><p>PERAK stands on the brink of a transformative leap with the Lumut Maritime Industrial City (LuMIC) project set to redefin",,,https://apicms.thestar.com.my/uploads/images/2024/04/13/2640777.jpeg,https://apicms.thestar.com.my/uploads/images/2024/04/13/2640777.jpeg,28,TheStar,http://www.thestar.com.my/news/latest/?tag=Business
Traders bet ECB will chart own rate-cut path,https://www.klsescreener.com/v2/news/view/1308125,2024-04-13 07:11:35,2024-04-13 07:11:35,2024-04-13 00:00:00,"Traders' bets on multiple European Central Bank (ECB) interest rate cuts this year have barely been shaken by hot US inflation that slashed Federal Reserve (Fed) easing expectations this week, highlighting a growing investor focus on the divergence between the two regions.","<div class=""inline-img""><div class=""story-image""><p class=""caption"">Lagarde stressed the ECB is “data-dependent, not Fed-dependent.” — Reuters</p></div></div><div id=""story-body"" class=""story bot-15 relative""><div class=""premium-sign-overlay absolute""></div><p>TRADERS’ bets on multiple European Central Bank (ECB) interest rate cuts this year have barely been shaken by hot US inflation that slashed Federal Reserve (Fed) easing expectations this week, highlighting a growing investor focus on the divergence between the two regions.</p><p>The ECB cemented that conviction on Thursday, signalling th",,,https://apicms.thestar.com.my/uploads/images/2024/04/13/2641069.jpeg,https://apicms.thestar.com.my/uploads/images/2024/04/13/2641069.jpeg,28,TheStar,http://www.thestar.com.my/news/latest/?tag=Business
Financial literacy is crucial to fight scams,https://www.klsescreener.com/v2/news/view/1308123,2024-04-13 07:11:33,2024-04-13 07:11:33,2024-04-13 00:00:00,"The Securities Commission (SC) recently published its annual report for 2023. There were many important statistics in the report regarding the capital markets, but one of the most worrying data points is related to scams and unlicensed activities.","<div class=""inline-img""><div class=""story-image""><p class=""caption""> Enhancing financial literacy of the general population is the best answer to the challenge at hand.</p></div></div><div id=""story-body"" class=""story bot-15 relative""><div class=""premium-sign-overlay absolute""></div><p>The Securities Commission (SC) recently published its annual report for 2023. There were many important statistics in the report regarding the capital markets, but one of the most worrying data points is related to scams and unlicensed activities.</p><p>In 2023, the SC received 5,318 complaints and enquiries com",,,https://apicms.thestar.com.my/uploads/images/2024/04/13/2640794.jpg,https://apicms.thestar.com.my/uploads/images/2024/04/13/2640794.jpg,28,TheStar,http://www.thestar.com.my/news/latest/?tag=Business
"Bahvest Resources, Nextgreen Global, IOI Corp, S P Setia and Yinson",https://www.klsescreener.com/v2/news/view/1308079,2024-04-13 00:02:07,2024-04-15 10:34:45,2024-04-12 23:52:10,"KUALA LUMPUR (April 12): Here is a brief recap of some business news and corporate announcements that made the headlines on Friday:

Bahvest Resources Bhd's subsidiary, Wullersdorf Resources Sdn Bhd, has obtained approval from the federal government's mining regulator, t...","<div class=newsTextDataWrapInner><p>KUALA LUMPUR (April 12): Here is a brief recap of some business news and corporate announcements that made the headlines on Friday:</p></div>

<div class=newsTextDataWrapInner><p><strong>Bahvest Resources Bhd</strong>'s subsidiary, Wullersdorf Resources Sdn Bhd, has obtained approval from the federal government's mining regulator, the Department of Mineral and Geoscience Malaysia (JMG), for its gold mining operations in Tawau, Sabah. This approval, granted under Section 10 of the Mineral Development Act 1994 (MDA), complements the previous approval from th",Edge,,https://assets.theedgemarkets.com/companies_126.jpg,https://assets.theedgemarkets.com/companies_126.jpg,52,TheEdge,http://www.theedgemarkets.com/categories/malaysia
Penang on track to become catalyst for Malaysia to move up chip value chain — Chow,https://www.klsescreener.com/v2/news/view/1308067,2024-04-12 22:33:56,2024-04-15 10:32:37,2024-04-12 22:13:00,"Penang is set to become a catalyst for Malaysia to move up the chip value chain and solidify its position as the preferred investment destination for electrical and electronics and semiconductor production in the region, said Chief Minister Chow Kon Yeow.","<div class=newsTextDataWrapInner><p>GEORGE TOWN (April 12): Penang is set to become a catalyst for Malaysia to move up the chip value chain and solidify its position as the preferred investment destination for electrical and electronics and semiconductor production in the region, said Chief Minister Chow Kon Yeow.</p></div>

<div class=newsTextDataWrapInner><p>He said with over 50 years of industrial excellence and leadership, Penang can contribute to Malaysia’s goals as envisioned in the New Industrial Master Plan 2030 (NIMP 2030).</p></div>

<div class=newsTextDataWrapInner><p>Chow noted",新闻,,https://assets.theedgemarkets.com/Chow Kon Yeow_CM-lpr_20240412220730_bernama.jpg,https://assets.theedgemarkets.com/Chow Kon Yeow_CM-lpr_20240412220730_bernama.jpg,52,TheEdge,http://www.theedgemarkets.com/categories/malaysia
