title,url,created_at,updated_at,published_date,summary,content,category,author,thumbnail_url,image_url,publisher_id,publisher_name,publisher_url
LYC Healthcare&#039;s unit files preliminary documents for Singapore&#039;s Catalist listing,https://www.klsescreener.com/v2/news/view/1301809,2024-03-29 19:01:11,2024-03-29 19:01:11,2024-03-29 18:58:52,"KUALA LUMPUR: LYC Healthcare Bhd&#039;s subsidiary LYC Medicare Singapore Ltd today has lodged the preliminary offer document with the Singapore Exchange Ltd&#039;s (SGX) Catalist Board. The mother and child care services company said this pivotal step, guided by ...","<div itemprop=""articleBody"" class=""dable-content-wrapper""><p>KUALA LUMPUR: LYC Healthcare Bhd&#039;s subsidiary LYC Medicare Singapore Ltd today has lodged the preliminary offer document with the Singapore Exchange Ltd&#039;s (SGX) Catalist Board. </p><p>The mother and child care services company said this pivotal step, guided by Evolve Capital Advisory Private Ltd as the sponsor, marks a significant milestone in its strategic expansion and growth trajectory.</p><p>The initiative to lodge the offer document for LYC Medicare Singapore highlights LYC Healthcare&#039;s adherence to the regulatory",Corporate,,https://assets.nst.com.my/images/articles/Lyc29_NSTfield_image_listing_featured_v2.var_1711709929.jpg,https://assets.nst.com.my/images/articles/lyc_1711709922.jpg,79,NST,https://www.nst.com.my/business/corporate
Capital A’s digital arm to form strategic partnership with Ant International,https://www.klsescreener.com/v2/news/view/1301817,2024-03-29 19:22:22,2024-03-29 19:22:22,2024-03-29 18:52:00,"KUALA LUMPUR: Capital A Bhd’s digital arm, Move Digital and BigPay, has partnered strategically with Ant International.","<div class=""inline-img""><div class=""story-image""></div></div><div id=""story-body"" class=""story bot-15 relative""><p>KUALA LUMPUR: <a href=""/business/marketwatch/stocks/?qcounter=CAPITALA"" target=""_blank"">Capital A Bhd</a><a href=""http://charts.thestar.com.my/?s=CAPITALA"" target=""_blank""><img class=""go-chart"" src=""https://cdn.thestar.com.my/Themes/img/chart.png""></a>’s digital arm, Move Digital and BigPay, has partnered strategically with Ant International.</p><p>In a statement, Capital A said the partnership includes expanding payment methods and offering acquiring services on Capital A’s platf",,,https://apicms.thestar.com.my/uploads/images/2024/03/29/2618366.jpeg,https://apicms.thestar.com.my/uploads/images/2024/03/29/2618366.jpeg,28,TheStar,http://www.thestar.com.my/news/latest/?tag=Business
PetDag says will continue to diversify portfolios to future-proof business,https://www.klsescreener.com/v2/news/view/1301799,2024-03-29 18:50:53,2024-03-30 23:49:15,2024-03-29 18:44:05,"KUALA LUMPUR (March 29): Petronas Dagangan Bhd (PetDag), the marketing arm of Petroliam Nasional Bhd (Petronas) for petroleum products and service stations, will continue to work on diversifying its portfolio, with an emphasis on expanding into the convenience sector and providing low-carbon mobility solutions for its customers.","<div class=newsTextDataWrapInner><p>KUALA LUMPUR (March 29):&nbsp;Petronas Dagangan Bhd (PetDag), the marketing arm of Petroliam Nasional Bhd (Petronas) for petroleum products and service stations, will continue to work on diversifying its portfolio, with an emphasis on expanding into the convenience sector and providing low-carbon mobility solutions for its customers.</p></div>

<div class=newsTextDataWrapInner><p>Its managing director and chief executive officer Azrul Osman Rani said strategic partnerships would play a key role in supporting the company’s strategies to future-proof its bus",,,https://assets.theedgemarkets.com/PetDag-Petronas-Dagangan-Bhd_20240329183620_reuters.jpg,https://assets.theedgemarkets.com/PetDag-Petronas-Dagangan-Bhd_20240329183620_reuters.jpg,52,TheEdge,http://www.theedgemarkets.com/categories/malaysia
TMC Life Sciences issues second show-cause letter to Wan Nadiah,https://www.klsescreener.com/v2/news/view/1301805,2024-03-29 18:55:24,2024-03-29 18:55:24,2024-03-29 18:37:00,KUALA LUMPUR: TMC Life Sciences Bhd has issued a second show cause letter to Wan Nadiah Wan Mohd Abdullah Yaakob that contains allegations that are different from the first show cause letter.,"<div class=""inline-img""><div class=""story-image""></div></div><div id=""story-body"" class=""story bot-15 relative""><p>KUALA LUMPUR: <a href=""/business/marketwatch/stocks/?qcounter=TMCLIFE"" target=""_blank"">TMC Life Sciences Bhd</a><a href=""http://charts.thestar.com.my/?s=TMCLIFE"" target=""_blank""><img class=""go-chart"" src=""https://cdn.thestar.com.my/Themes/img/chart.png""></a> has issued a second show cause letter to Wan Nadiah Wan Mohd Abdullah Yaakob that contains allegations that are different from the first show cause letter.</p><p>The first show cause was issued on Jan 29, 2024.</p><p>“The audi",,,https://apicms.thestar.com.my/uploads/images/2024/03/29/2618337.jpg,https://apicms.thestar.com.my/uploads/images/2024/03/29/2618337.jpg,28,TheStar,http://www.thestar.com.my/news/latest/?tag=Business
Signature International gets takeover offer from Chin Hin at 84 sen per share,https://www.klsescreener.com/v2/news/view/1301791,2024-03-29 18:32:03,2024-03-30 21:34:08,2024-03-29 18:20:36,"KUALA LUMPUR (March 29): Kitchen cabinet manufacturer Signature International Bhd has received a conditional takeover offer from home-grown building materials specialist Chin Hin Group Bhd on Friday to acquire all remaining shares Chin Hin does not own, at 84 sen a share.","<div class=newsTextDataWrapInner><p>KUALA LUMPUR (March 29): Kitchen cabinet manufacturer Signature International Bhd has received a conditional takeover offer from home-grown building materials specialist Chin Hin Group Bhd on Friday to acquire all remaining shares Chin Hin does not own, at 84 sen per&nbsp;share.</p></div>

<div class=newsTextDataWrapInner><p>The mandatory takeover offer was triggered subsequent to Chin Hin’s acquisition of a 4.77% stake in Signature, which brought Chin Hin’s holdings in Signature, together with persons acting in concerts (PACs) with it, to 33.49%, accordin",新闻,,https://assets.theedgemarkets.com/signature-intl-berhad_20240329181016_signatureinternational.com_.my_.jpg,https://assets.theedgemarkets.com/signature-intl-berhad_20240329181016_signatureinternational.com_.my_.jpg,52,TheEdge,http://www.theedgemarkets.com/categories/malaysia
Perak Sultan's Office lodges police report over doctored video of Sultan Nazrin's speech,https://www.klsescreener.com/v2/news/view/1301775,2024-03-29 18:18:56,2024-03-30 21:19:01,2024-03-29 18:10:58,"The Office of the Sultan of Perak has lodged a police report concerning the viral racist statement which used a quote from Sultan Nazrin Shah’s decree 19 years ago, which was taken completely out of context.","<div class=newsTextDataWrapInner><p>IPOH (March 29): The Office of the Sultan of Perak has lodged a police report concerning the viral racist statement which used a quote from Sultan Nazrin Shah’s decree 19 years ago, which was taken completely out of context.</p></div>

<div class=newsTextDataWrapInner><p>Orang Kaya Bendahara Seri Maharaja General (Rtd) Tan Sri Dr Mohd Zahidi Zainuddin said that the report was lodged on Thursday as it was believed that certain parties were trying to stoke racial and religious tensions by using the quote from the sultan’s decree in 2005.</p></div>

<div cl",新闻,,https://assets.theedgemarkets.com/Nazrin_20230610174242_bernama_2.jpg,https://assets.theedgemarkets.com/Nazrin_20230610174242_bernama_2.jpg,52,TheEdge,http://www.theedgemarkets.com/categories/malaysia
LYC Healthcare subsidiary prepares to lodge offer document with SGX,https://www.klsescreener.com/v2/news/view/1301781,2024-03-29 18:22:21,2024-03-29 18:22:21,2024-03-29 18:09:00,"KUALA LUMPUR: LYC Healthcare Bhd’s 64.5% owned subsidiary, LYC Medicare Singapore Limited has lodged the preliminary offer document with the Singapore Exchange Limited (SGX) Catalist Board.","<div class=""inline-img""><div class=""story-image""></div></div><div id=""story-body"" class=""story bot-15 relative""><p>KUALA LUMPUR: <a href=""/business/marketwatch/stocks/?qcounter=LYC"" target=""_blank"">LYC Healthcare Bhd</a><a href=""http://charts.thestar.com.my/?s=LYC"" target=""_blank""><img class=""go-chart"" src=""https://cdn.thestar.com.my/Themes/img/chart.png""></a>’s 64.5% owned subsidiary, LYC Medicare Singapore Limited has lodged the preliminary offer document with the Singapore Exchange Limited (SGX) Catalist Board.</p><p>In a statement, LYC Healthcare said the pivotal step, guided by Evolve Cap",,,https://apicms.thestar.com.my/uploads/images/2024/03/29/2618291.jpeg,https://apicms.thestar.com.my/uploads/images/2024/03/29/2618291.jpeg,28,TheStar,http://www.thestar.com.my/news/latest/?tag=Business
IGP tells public not to take matters into own hands over 'Allah' socks issue,https://www.klsescreener.com/v2/news/view/1301761,2024-03-29 18:04:08,2024-03-30 19:34:08,2024-03-29 17:50:08,"Inspector-General of Police (IGP) Tan Sri Razarudin Husain issued a public reminder for all parties not to take matters into their own hands and violate the law over the “Allah” socks case.

Everyone has to obey the country’s law, he said as he urged the public to allow the police to determine the lawful course of action.","<div class=newsTextDataWrapInner><p>KUALA LUMPUR (March 29): Inspector-General of Police (IGP) Tan Sri Razarudin Husain issued a public reminder for all parties not to take matters into their own hands and violate the law over the “Allah” socks case.</p></div>

<div class=newsTextDataWrapInner><p>Everyone has to obey the country’s law, he said as he urged the public to allow the police to determine the lawful course of action.</p></div>

<div class=newsTextDataWrapInner><p>“Let us [police] act, there’s no need for those who are dissatisfied to take matters into their own hands to torch or ",新闻,,https://assets.theedgemarkets.com/Razarudin_husain-IGP-Anwar threats_KK-Mart_20240329174711_bernama.jpg,https://assets.theedgemarkets.com/Razarudin_husain-IGP-Anwar threats_KK-Mart_20240329174711_bernama.jpg,52,TheEdge,http://www.theedgemarkets.com/categories/malaysia
Public Mutual declares RM160mil distributions for five funds,https://www.klsescreener.com/v2/news/view/1301767,2024-03-29 18:11:22,2024-03-29 18:11:22,2024-03-29 17:46:00,"KUALA LUMPUR: Public Bank Bhd’s wholly-owned subsidiary, Public Mutual has declared distributions of more than RM160mil for five funds.","<div class=""inline-img""><div class=""story-image""></div></div><div id=""story-body"" class=""story bot-15 relative""><p>KUALA LUMPUR: <a href=""/business/marketwatch/stocks/?qcounter=PBBANK"" target=""_blank"">Public Bank Bhd</a><a href=""http://charts.thestar.com.my/?s=PBBANK"" target=""_blank""><img class=""go-chart"" src=""https://cdn.thestar.com.my/Themes/img/chart.png""></a>’s wholly-owned subsidiary, Public Mutual has declared distributions of more than RM160mil for five funds.</p><p>The unit trust company, in a statement, said the gross distributions declared are 1.82 sen per unit for the Public Regular",,,https://apicms.thestar.com.my/uploads/images/2024/03/29/2618247.JPG,https://apicms.thestar.com.my/uploads/images/2024/03/29/2618247.JPG,28,TheStar,http://www.thestar.com.my/news/latest/?tag=Business
Bursa Malaysia closes higher fueled by bargain hunting,https://www.klsescreener.com/v2/news/view/1301765,2024-03-29 18:10:19,2024-03-29 18:10:19,2024-03-29 17:39:26,"KUALA LUMPUR: Bursa Malaysia extended its gains to close higher for the day as bargain hunting activities emerged following a few lacklustre trading sessions earlier.At 5pm, the FTSE Bursa Malaysia KLCI (FBM KLCI) gained 5.47 points to 1,536.07 from Wednesday&#039;s ...","<div itemprop=""articleBody"" class=""dable-content-wrapper""><p>KUALA LUMPUR: Bursa Malaysia extended its gains to close higher for the day as bargain hunting activities emerged following a few lacklustre trading sessions earlier.</p><p>At 5pm, the FTSE Bursa Malaysia KLCI (FBM KLCI) gained 5.47 points to 1,536.07 from Wednesday&#039;s close of 1,530.60. </p><p>The benchmark index opened 1.51 points higher at 1,532.11 and moved between 1,532.03 and 1,542.00 throughout the day.  </p><p>On the broader market, gainers outpaced losers 516 to 469, while 502 counters were unchanged, 833 untraded, and 5",Corporate,,https://assets.nst.com.my/images/articles/bur29_NSTfield_image_listing_featured_v2.var_1711706481.jpg,https://assets.nst.com.my/images/articles/HQ190324AZ006_1711705156.jpg,79,NST,https://www.nst.com.my/business/corporate
Bursa Malaysia closes higher fueeled by bargain hunting,https://www.klsescreener.com/v2/news/view/1301739,2024-03-29 17:40:28,2024-03-29 17:40:28,2024-03-29 17:39:26,"KUALA LUMPUR: Bursa Malaysia extended its gains to close higher for the day as bargain hunting activities emerged following a few lacklustre trading sessions earlier.At 5pm, the FTSE Bursa Malaysia KLCI (FBM KLCI) gained 5.47 points to 1,536.07 from Wednesday&#039;s ...","<div itemprop=""articleBody"" class=""dable-content-wrapper""><p>KUALA LUMPUR: Bursa Malaysia extended its gains to close higher for the day as bargain hunting activities emerged following a few lacklustre trading sessions earlier.</p><p>At 5pm, the FTSE Bursa Malaysia KLCI (FBM KLCI) gained 5.47 points to 1,536.07 from Wednesday&#039;s close of 1,530.60. </p><p>The benchmark index opened 1.51 points higher at 1,532.11 and moved between 1,532.03 and 1,542.00 throughout the day.  </p><p>On the broader market, gainers outpaced losers 516 to 469, while 502 counters were unchanged, 833 untraded, and 5",Corporate,,https://assets.nst.com.my/images/articles/bur29_NSTfield_image_listing_featured_v2.var_1711705162.jpg,https://assets.nst.com.my/images/articles/HQ190324AZ006_1711705156.jpg,79,NST,https://www.nst.com.my/business/corporate
Bursa closes higher on bargain hunting,https://www.klsescreener.com/v2/news/view/1301747,2024-03-29 17:51:04,2024-03-30 21:04:14,2024-03-29 17:31:08,"Bursa Malaysia closed marginally higher on Friday, hitting an intraday high as bargain-hunting activities emerged following a few lacklustre trading sessions earlier.

At 5pm, the FTSE Bursa Malaysia KLCI (FBM KLCI) gained 5.47 points to 1,536.07 from Wednesday’s (March 27) close of 1,530.6.","<div class=newsTextDataWrapInner><p>KUALA LUMPUR (March 29): Bursa Malaysia closed marginally higher on Friday, hitting an intraday high as bargain-hunting activities emerged following a few lacklustre trading sessions earlier.</p></div>

<div class=newsTextDataWrapInner><p>At 5pm, the FTSE Bursa Malaysia KLCI (FBM KLCI) gained 5.47 points to 1,536.07 from Wednesday’s (March 27) close of 1,530.6.&nbsp;</p></div>

<div class=newsTextDataWrapInner><p>The benchmark index opened 1.51 points higher at 1,532.11 and moved between 1,532.03 and 1,542 throughout the day. &nbsp;</p></div><div class=i",Edge,,https://assets.theedgemarkets.com/closing-market-up_20240329165618_theedgemalaysia.jpg,https://assets.theedgemarkets.com/closing-market-up_20240329165618_theedgemalaysia.jpg,52,TheEdge,http://www.theedgemarkets.com/categories/malaysia
FBM KLCI ends first quarter trading day stronger,https://www.klsescreener.com/v2/news/view/1301755,2024-03-29 17:55:24,2024-03-29 17:55:24,2024-03-29 17:30:00,KUALA LUMPUR: The FBM KLCI ended the last trading day of the first quarter on a strong note.,"<div class=""inline-img""><div class=""story-image""></div></div><div id=""story-body"" class=""story bot-15 relative""><p></p><p>KUALA LUMPUR: The FBM KLCI ended the last trading day of the first quarter on a strong note.</p><p>The market bellwether rose 5.47 points, or 0.36% to 1,536.07 after moving between an intraday high of 1,542.0 and low of 1,532.03.</p><p>During the quarter, the index gained a whopping 87.73 points, or 5.6% from 1,454.66 points as at Dec 29, 2023. For the week, the index fell 0.41%, or 6.32 points.</p><p>There were 516 gainers, 469 losers and 502 counters traded unchanged on t",,,https://apicms.thestar.com.my/uploads/images/2024/03/29/2618205.JPG,https://apicms.thestar.com.my/uploads/images/2024/03/29/2618205.JPG,28,TheStar,http://www.thestar.com.my/news/latest/?tag=Business
MKH Oil Palm expects Indonesian refineries to take up all of its palm oil,https://www.klsescreener.com/v2/news/view/1301737,2024-03-29 17:36:13,2024-03-30 19:00:36,2024-03-29 17:27:59,"MKH Oil Palm (East Kalimantan) Bhd, which launched its initial public offering (IPO) on Friday for the Main Market, expects almost all of its crude palm oil to be taken up by Indonesian refineries amid the government’s push for biofuel.","<div class=newsTextDataWrapInner><p>KUALA LUMPUR (March 29): MKH Oil Palm (East Kalimantan) Bhd, which launched its initial public offering (IPO) on Friday for the Main Market, expects almost all of its crude palm oil to be taken up by Indonesian refineries amid the government’s push for biofuel.</p></div>

<div class=newsTextDataWrapInner><p>In Indonesia, where the government has mandated 35% blend of palm oil into diesel, the company is planning to acquire another 5,000 hectares of land in East Kalimantan by the second quarter of 2024. MKH Oil Palm currently owns more than 18,000 hectares ",新闻,,https://assets.theedgemarkets.com/20240327MKH OIL PALM ZHD-1330_20240329172549_theedgemalaysia.jpg,https://assets.theedgemarkets.com/20240327MKH OIL PALM ZHD-1330_20240329172549_theedgemalaysia.jpg,52,TheEdge,http://www.theedgemarkets.com/categories/malaysia
"Sunway Property, GCH Retail sign deal to open Mercato store at Sunway d&#039;Hill",https://www.klsescreener.com/v2/news/view/1301731,2024-03-29 17:10:34,2024-03-29 17:10:34,2024-03-29 17:02:23,"KUALA LUMPUR: Sunway Property, via subsidiary Sunway PKNS Sdn Bhd, has entered into a lease agreement with GCH Retail (Malaysia) Sdn Bhd for the opening of a Mercato grocery store at the retail space of Sunway d&#039;Hill, Kota Damansara. ...","<div itemprop=""articleBody"" class=""dable-content-wrapper""><p>KUALA LUMPUR: Sunway Property, via subsidiary Sunway PKNS Sdn Bhd, has entered into a lease agreement with GCH Retail (Malaysia) Sdn Bhd for the opening of a Mercato grocery store at the retail space of Sunway d&#039;Hill, Kota Damansara. </p><p>The store measures a total of 20,409 sq. ft across 11 of the 29 retail lots available within the development which represents 38 per cent of the total net floor area.</p><p>Sunway Property chief executive officer Chong Sau Min said CGH Retail has consistently demonstrated a knack for identify",Corporate,,https://assets.nst.com.my/images/articles/sunway29_NSTfield_image_listing_featured_v2.var_1711702939.jpg,https://assets.nst.com.my/images/articles/sunway_1711702932.jpg,79,NST,https://www.nst.com.my/business/corporate
"LTAT appoints Azizan Ariffin as new chairman, Mohammad Ashraf as new chief executive",https://www.klsescreener.com/v2/news/view/1301723,2024-03-29 16:55:25,2024-03-29 16:55:25,2024-03-29 16:50:00,"KUALA LUMPUR: The Armed Forces Fund Board (LTAT) today announced the appointment of General (retired) Tan Sri Azizan Ariffin as its new chairman and Mohammad Ashraf Md Radzi as new chief executive, effective April 1, 2024.","<div class=""inline-img""><div class=""story-image""></div></div><div id=""story-body"" class=""story bot-15 relative""><p>KUALA LUMPUR: The Armed Forces Fund Board (LTAT) today announced the appointment of General (retired) Tan Sri Azizan Ariffin as its new chairman and Mohammad Ashraf Md Radzi as new chief executive, effective April 1, 2024.</p><p>It said in a statement that Azizan brings with him a wealth of experience and leadership acumen, having served with distinction in the Malaysian Armed Forces for 40 years, including becoming the 17th Chief of Defence Force, the first from the Royal Malaysi",,,https://apicms.thestar.com.my/uploads/images/2024/03/29/2618118.jpg,https://apicms.thestar.com.my/uploads/images/2024/03/29/2618118.jpg,28,TheStar,http://www.thestar.com.my/news/latest/?tag=Business
LTAT names Azizan Ariffin as new chairman and Mohammad Ashraf Md Radzi as chief executive,https://www.klsescreener.com/v2/news/view/1301727,2024-03-29 17:00:27,2024-03-29 17:00:27,2024-03-29 16:27:21,"KUALA LUMPUR: The Armed Forces Fund Board (LTAT) has appointed General (Rtd) Tan Sri Azizan Ariffin as its new chairman and Mohammad Ashraf Md Radzi as its new chief executive effective from April 1. According to LTAT, Azizan&#039;s extensive background ...","<div itemprop=""articleBody"" class=""dable-content-wrapper""><p>KUALA LUMPUR: The Armed Forces Fund Board (LTAT) has appointed General (Rtd) Tan Sri Azizan Ariffin as its new chairman and Mohammad Ashraf Md Radzi as its new chief executive effective from April 1. </p><p>According to LTAT, Azizan&#039;s extensive background in military affairs, diplomacy and leadership development will be instrumental in guiding LTAT towards its strategic objectives.</p><p>This will also enhance its role in supporting the welfare of our armed forces personnel and their families, it said. </p><p>Azizan brings with ",Corporate,,https://assets.nst.com.my/images/articles/ltat29_NSTfield_image_listing_featured_v2.var_1711702592.jpg,https://assets.nst.com.my/images/articles/LTAT_-_Baru_1711700830.jpg,79,NST,https://www.nst.com.my/business/corporate
LTAT names Azizan Ariffin as new chairman and Mohammad Ashraf Ms Radzi as chief executive,https://www.klsescreener.com/v2/news/view/1301709,2024-03-29 16:30:50,2024-03-29 16:30:50,2024-03-29 16:27:21,"KUALA LUMPUR: The Armed Forces Fund Board (LTAT) has appointed General (Rtd) Tan Sri Azizan Ariffin as its new chairman and Mohammad Ashraf Md Radzi as its new chief executive effective from April 1. According to LTAT, Azizan&#039;s extensive background ...","<div itemprop=""articleBody"" class=""dable-content-wrapper""><p>KUALA LUMPUR: The Armed Forces Fund Board (LTAT) has appointed General (Rtd) Tan Sri Azizan Ariffin as its new chairman and Mohammad Ashraf Md Radzi as its new chief executive effective from April 1. </p><p>According to LTAT, Azizan&#039;s extensive background in military affairs, diplomacy and leadership development will be instrumental in guiding LTAT towards its strategic objectives.</p><p>This will also enhance its role in supporting the welfare of our armed forces personnel and their families, it said. </p><p>Azizan brings with ",Corporate,,https://assets.nst.com.my/images/articles/ltat29_NSTfield_image_listing_featured_v2.var_1711700837.jpg,https://assets.nst.com.my/images/articles/LTAT_-_Baru_1711700830.jpg,79,NST,https://www.nst.com.my/business/corporate
BNM: Malaysia’s end-February official reserve assets at US$114.28 bil,https://www.klsescreener.com/v2/news/view/1301697,2024-03-29 16:17:05,2024-03-30 13:19:05,2024-03-29 16:12:02,"KUALA LUMPUR (March 29): Malaysia’s official reserve assets amounted to US$114.28 billion (approximately RM540.54 billion) as at end-February 2024, while other foreign currency assets stood at US$202.69 million (approximately RM958.72 million), according to Bank Negara Malaysia (BNM).","<div class=newsTextDataWrapInner><p>KUALA LUMPUR (March 29): Malaysia’s official reserve assets amounted to US$114.28 billion (approximately RM540.54 billion) as at end-February 2024, while other foreign currency assets stood at US$202.69 million (approximately RM958.72 million), according to Bank Negara Malaysia (BNM).</p></div>

<div class=newsTextDataWrapInner><p>The central bank said that the detailed breakdown of international reserves provides forward-looking information on the size, composition and usability of reserves and other foreign currency assets, in accordance with the Interna",Edge,,https://assets.theedgemarkets.com/20240320-PLACE-BANK-NEGARA-ZHD-1229_20240329160437_theedgemalaysia.jpg,https://assets.theedgemarkets.com/20240320-PLACE-BANK-NEGARA-ZHD-1229_20240329160437_theedgemalaysia.jpg,52,TheEdge,http://www.theedgemarkets.com/categories/malaysia
February records higher loan growth on sustained lending to private non-financial sector — BNM,https://www.klsescreener.com/v2/news/view/1301695,2024-03-29 16:17:04,2024-03-30 14:34:09,2024-03-29 16:04:01,"Malaysia continued to show an overall improvement in loan growth as of end-February, after credit extended to the private non-financial sector grew by 5.1% year-on-year (y-o-y), surpassing the 5% growth recorded in January 2024.","<div class=newsTextDataWrapInner><p>KUALA LUMPUR (March 29): Malaysia continued to show an overall improvement in loan growth as of end-February, after credit extended to the private non-financial sector grew by 5.1% year-on-year (y-o-y), surpassing the 5% growth recorded in January 2024.</p></div>

<div class=newsTextDataWrapInner><p>Outstanding loans experienced a higher growth rate of 5.6% y-o-y, compared to the 5.4% reported in the previous month, Bank Negara Malaysia (BNM) said in its Monthly Highlights Report for February 2024, released on Friday.</p></div>

<div class=newsTextDataWr",Edge,,https://assets.theedgemarkets.com/bank-negara-malaysia-bnm-a_20240329155635_theedgemalaysia.jpg,https://assets.theedgemarkets.com/bank-negara-malaysia-bnm-a_20240329155635_theedgemalaysia.jpg,52,TheEdge,http://www.theedgemarkets.com/categories/malaysia
