title,url,created_at,updated_at,published_date,summary,content,category,author,thumbnail_url,image_url,publisher_id,publisher_name,publisher_url
Global spotlight on Malaysia as it emerges as semiconductor powerhouse,https://www.klsescreener.com/v2/news/view/1308061,2024-04-12 22:18:50,2024-04-15 10:05:05,2024-04-12 22:03:45,Malaysia’s vibrant semiconductor industry has been the talk of the town of late as the country emerges as a new semiconductor powerhouse with the global spotlight on Penang.,"<div class=newsTextDataWrapInner><p>KUALA LUMPUR (April 12): Malaysia’s vibrant semiconductor industry has been the talk of the town of late as the country emerges as a new semiconductor powerhouse with the global spotlight on Penang.</p></div>

<div class=newsTextDataWrapInner><p>The World Economic Forum (WEF) stated on its LinkedIn page that Penang has major industry players from Europe and the US setting up units or expanding existing operations as they seek to build new global supply chains for these vital components.</p></div>

<div class=newsTextDataWrapInner><p>“Semiconductors are a",新闻,,https://assets.theedgemarkets.com/CS-Bayan-Lepas_20240412215558_theedgemalaysia_0.jpg,https://assets.theedgemarkets.com/CS-Bayan-Lepas_20240412215558_theedgemalaysia_0.jpg,52,TheEdge,http://www.theedgemarkets.com/categories/malaysia
ASB trims 2.18% stake in S P Setia for RM141 mil,https://www.klsescreener.com/v2/news/view/1308059,2024-04-12 22:06:03,2024-04-15 09:49:45,2024-04-12 22:00:14,"Amanahraya Trustees Bhd, the trustee of Amanah Saham Bumiputera (ASB), has trimmed its stake in property developer S P Setia Bhd after converting some of the redeemable convertible preference shares it holds into ordinary shares.

According to a bourse filing on Friday, Amanahraya Trustees sold 100 million shares representing 2.18% in S P Setia from ASB’s portfolio on April 8. The disposal cut the fund’s stake in the property developer to 22.37% or 1.03 billion shares, from 24.54% as on April 5.","<div class=newsTextDataWrapInner><p>KUALA LUMPUR (April 12): Amanahraya Trustees Bhd, the trustee of Amanah Saham Bumiputera (ASB), has trimmed its stake in property developer S P Setia Bhd after converting some of the redeemable convertible preference shares it holds into ordinary shares.</p></div>

<div class=newsTextDataWrapInner><p>According to a bourse filing on Friday, Amanahraya Trustees sold 100 million shares representing 2.18% in S P Setia from ASB’s portfolio on April 8. The disposal cut the fund’s stake in the property developer to 22.37% or 1.03 billion shares, from 24.54% as on",Edge,,https://assets.theedgemarkets.com/SP-Setia-Bhd-2_spsetia.com__3.jpg,https://assets.theedgemarkets.com/SP-Setia-Bhd-2_spsetia.com__3.jpg,52,TheEdge,http://www.theedgemarkets.com/categories/malaysia
Wall St set for lower open as some big bank earnings disappoint,https://www.klsescreener.com/v2/news/view/1308049,2024-04-12 21:11:23,2024-04-12 21:11:23,2024-04-12 21:03:00,"WALL Street's main stock indexes were on track for a lower open on Friday as most megacap growth stocks and chipmakers receded, while some big banks dipped after dour quarterly results.","<div class=""inline-img""><div class=""story-image""></div></div><div id=""story-body"" class=""story bot-15 relative""><p>WALL Street's main stock indexes were on track for a lower open on Friday as most megacap growth stocks and chipmakers receded, while some big banks dipped after dour quarterly results.</p><p>JPMorgan Chase &amp; Co fell 2.8% in premarket trading after the bank's forecast for its income from interest payments came in below analysts' expectations.</p><p>Wells Fargo lost 0.3% after reporting a more than 7% fall in first-quarter profit, as it earned less from customer interest paymen",,,https://apicms.thestar.com.my/uploads/images/2024/04/12/2640518.jpg,https://apicms.thestar.com.my/uploads/images/2024/04/12/2640518.jpg,28,TheStar,http://www.thestar.com.my/news/latest/?tag=Business
Nextgreen-IOI Corp JV to rope in Xiamen C&D for paper pulp plant in Pahang,https://www.klsescreener.com/v2/news/view/1308045,2024-04-12 21:06:03,2024-04-15 09:34:58,2024-04-12 20:57:07,"Nextgreen IOI Pulp Sdn Bhd (NIP), a 55:45 joint venture between Nextgreen Global Bhd and IOI Corp Bhd that is planning a RM600 million paper pulp plant in Pekan, Pahang, wants to rope in a Chinese partner to help develop and operate the facility.","<div class=newsTextDataWrapInner><p>KUALA LUMPUR (April 12): Nextgreen IOI Pulp Sdn Bhd (NIP), a 55:45 joint venture between Nextgreen Global Bhd and IOI Corp Bhd that is planning a RM600 million paper pulp plant in Pekan, Pahang, wants to rope in a Chinese partner to help develop and operate the facility.</p></div>

<div class=newsTextDataWrapInner><p>NIP has inked a memorandum of understanding (MOU) with Xiamen C&amp;D Paper &amp; Pulp Group Co Ltd (Xiamen C&amp;D), a wholly-owned subsidiary of Xiamen C&amp;D Inc under Xiamen C&amp;D Corp Ltd, a Fortune 500 company that is involved in supp",新闻,,https://assets.theedgemarkets.com/Datuk Lim Thiam Huat-Nextgreen Global_20240412205417_bernama.jpg,https://assets.theedgemarkets.com/Datuk Lim Thiam Huat-Nextgreen Global_20240412205417_bernama.jpg,52,TheEdge,http://www.theedgemarkets.com/categories/malaysia
"Citi profit drops as costs rise for employee severance, deposit insurance",https://www.klsescreener.com/v2/news/view/1308025,2024-04-12 20:55:24,2024-04-12 20:55:24,2024-04-12 20:42:00,CITIGROUP's profit fell in the first quarter as it spent more on severance payments for laid-off employees and set aside money to refill a government deposit insurance fund.,"<div class=""inline-img""><div class=""story-image""><p class=""caption"">File pic — Bloomberg</p></div></div><div id=""story-body"" class=""story bot-15 relative""><p>Citigroup's profit fell in the first quarter as it spent more on severance payments for laid-off employees and set aside money to refill a government deposit insurance fund.</p><p>Net income fell to $3.4 billion, or $1.58 per share, in the three months ended March 31, the bank said on Friday. That compares with $4.6 billion, or $2.19 per share, a year earlier.</p><p>""Last month marked the end to the organizational simplification we announ",,,https://apicms.thestar.com.my/uploads/images/2024/04/12/2640496.jpeg,https://apicms.thestar.com.my/uploads/images/2024/04/12/2640496.jpeg,28,TheStar,http://www.thestar.com.my/news/latest/?tag=Business
"Bursa's property index hits six-year high, boosted by positive market sentiment",https://www.klsescreener.com/v2/news/view/1308021,2024-04-12 20:36:04,2024-04-15 08:49:11,2024-04-12 20:18:05,Bursa Malaysia's Property Index climbed to a six-year high on Friday amid better market sentiment surrounding the sector.,"<div class=newsTextDataWrapInner><p>KUALA LUMPUR (April 12): Bursa Malaysia's Property Index climbed to a six-year high on Friday amid better market sentiment surrounding the sector.</p></div>

<div class=newsTextDataWrapInner><p>The index, which tracks property sector-linked stocks on the local bourse, surged to an intra-day high of 1,036.15 points — its highest since touching 1,093.73 points on Sept 3, 2018 — after climbing 20.08 points or 1.98%.</p></div>

<div class=newsTextDataWrapInner><p>It later pared some gains to close at 1,033.72 points, still up 17.65 points or 1.74%. In contra",新闻,,https://assets.theedgemarkets.com/Property_House_20240412201729_theedgemalaysia.jpg,https://assets.theedgemarkets.com/Property_House_20240412201729_theedgemalaysia.jpg,52,TheEdge,http://www.theedgemarkets.com/categories/malaysia
"Asia spot LNG at 3-month peak on steady demand, supply disruption",https://www.klsescreener.com/v2/news/view/1308005,2024-04-12 20:11:23,2024-04-12 20:11:23,2024-04-12 20:04:00,"SINGAPORE: Asian spot liquefied natural gas (LNG) prices edged up this week, reaching the highest levels in three months, as they remained supported by steady demand and supply disruption concerns.","<div class=""inline-img""><div class=""story-image""><p class=""caption"">An LNG (Liquefied Natural Gas) ship loads gas to a cruise ship in Barcelona, Spain, January 29, 2024. - REUTERS/Albert Gea/File Photo </p></div></div><div id=""story-body"" class=""story bot-15 relative""><p>SINGAPORE: Asian spot liquefied natural gas (LNG) prices edged up this week, reaching the highest levels in three months, as they remained supported by steady demand and supply disruption concerns.</p><p>The average LNG price for May delivery into northeast Asia rose to $9.80 per million British thermal units (mmBtu), its high",,,https://apicms.thestar.com.my/uploads/images/2024/04/12/2640463.JPG,https://apicms.thestar.com.my/uploads/images/2024/04/12/2640463.JPG,28,TheStar,http://www.thestar.com.my/news/latest/?tag=Business
"Hearing of govt, AG’s appeal to strike out lawsuits by Lawyers for Liberty on May 17",https://www.klsescreener.com/v2/news/view/1307997,2024-04-12 20:04:09,2024-04-15 08:34:26,2024-04-12 19:55:59,The Federal Court has set May 17 to hear the appeals by the government of Malaysia and the Attorney-General (AG) to strike out two suits brought by Lawyers for Liberty (LFL) against the Malaysian and Singapore governments.,"<div class=newsTextDataWrapInner><p>PUTRAJAYA (April 12): The Federal Court has set May 17 to hear the appeals by the government of Malaysia and the Attorney-General (AG) to strike out two suits brought by Lawyers for Liberty (LFL) against the Malaysian and Singapore governments.</p></div>

<div class=newsTextDataWrapInner><p>Senior federal counsel Liew Horng Bin, who is appearing for the AG and the government, confirmed the hearing date when contacted by Bernama on Friday.</p></div>

<div class=newsTextDataWrapInner><p>On May 16 last year, the Federal Court granted leave (permission) to t",Edge,,https://assets.theedgemarkets.com/Liew Horng Bin_ZHD_20240412194853_theedgemalaysia.jpg,https://assets.theedgemarkets.com/Liew Horng Bin_ZHD_20240412194853_theedgemalaysia.jpg,52,TheEdge,http://www.theedgemarkets.com/categories/malaysia
Bahvest’s gold mining ops in Sabah get approval from federal govt's mining regulator,https://www.klsescreener.com/v2/news/view/1307987,2024-04-12 19:48:55,2024-04-15 08:32:26,2024-04-12 19:44:37,"Bahvest Resources Bhd’s unit has received approval from the federal government's mining regulator for its gold mining operations in Tawau, Sabah.","<div class=newsTextDataWrapInner><p>KUALA LUMPUR (April 12): Bahvest Resources Bhd’s unit has received approval from the federal government's mining regulator for its gold mining operations in Tawau, Sabah.</p></div>

<div class=newsTextDataWrapInner><p>Bahvest said its wholly owned Wullersdorf Resources Sdn Bhd received the approval from the Department of Mineral and Geoscience Malaysia (JMG) for the operational mining scheme in accordance with Section 10 of the Mineral Development Act 1994 (MDA).</p></div>

<div class=newsTextDataWrapInner><p>“With the above approval, Wullersdorf is now ",新闻,,https://assets.theedgemarkets.com/bahvest_20240412194017_annual report.jpg,https://assets.theedgemarkets.com/bahvest_20240412194017_annual report.jpg,52,TheEdge,http://www.theedgemarkets.com/categories/malaysia
Global spotlight on Malaysia as it emerges as semiconductor powerhouse,https://www.klsescreener.com/v2/news/view/1307985,2024-04-12 19:44:23,2024-04-12 19:44:23,2024-04-12 19:40:00,KUALA LUMPUR: Malaysia’s vibrant semiconductor industry has been the talk of the town of late as the country emerges as a new semiconductor powerhouse with the global spotlight on Penang.,"<div class=""inline-img""><div class=""story-image""></div></div><div id=""story-body"" class=""story bot-15 relative""><p>KUALA LUMPUR: Malaysia’s vibrant semiconductor industry has been the talk of the town of late as the country emerges as a new semiconductor powerhouse with the global spotlight on Penang.</p><p>The World Economic Forum (WEF) stated on its LinkedIn page that Penang has major industry players from Europe and the United States setting up units or expanding existing operations as they seek to build new global supply chains for these vital components.</p><p>""Semiconductors are also kno",,,https://apicms.thestar.com.my/uploads/images/2024/04/12/2640430.jpg,https://apicms.thestar.com.my/uploads/images/2024/04/12/2640430.jpg,28,TheStar,http://www.thestar.com.my/news/latest/?tag=Business
Ringgit ends easier versus US dollar on higher-than-expected US inflation data,https://www.klsescreener.com/v2/news/view/1307979,2024-04-12 19:33:23,2024-04-12 19:33:23,2024-04-12 19:25:00,KUALA LUMPUR: The ringgit ended easier against the US dollar on Friday as the greenback strengthened following higher-than-expected United States inflation data.,"<div class=""inline-img""><div class=""story-image""></div></div><div id=""story-body"" class=""story bot-15 relative""><p>KUALA LUMPUR: The ringgit ended easier against the US dollar on Friday as the greenback strengthened following higher-than-expected United States inflation data.</p><p>At 6 pm, the ringgit fell to 4.7680/7730 against the US dollar from Tuesday’s close of 4.7455/7500.</p><p>Bank Muamalat Malaysia Bhd chief economist Mohd Afzanizam Abdul Rashid said a sticky US inflation rate seems to have turbocharged the value of the US dollar as the Federal Reserve is likely to maintain its restr",,,https://apicms.thestar.com.my/uploads/images/2024/04/12/2640408.jpg,https://apicms.thestar.com.my/uploads/images/2024/04/12/2640408.jpg,28,TheStar,http://www.thestar.com.my/news/latest/?tag=Business
Nextgreen IOI Pulp inks MoU with Xiamen C&D for pulp production facility,https://www.klsescreener.com/v2/news/view/1307975,2024-04-12 19:22:22,2024-04-12 19:22:22,2024-04-12 19:14:00,"KUALA LUMPUR: Nextgreen Global Bhd’s 55%-owned subsidiary, Nextgreen IOI Pulp Sdn Bhd (NIP) has signed a memorandum of understanding (MoU) with Xiamen C&amp;D Paper &amp; Pulp Group Co. Ltd to establish a joint venture company (JVC) for a paper pulp production facility in Green Technology Park, Pekan, Pahang.","<div class=""inline-img""><div class=""story-image""><p class=""caption"">From left: Nextgreen Global Bhd managing director Datuk Lim Thiam Huat, Xiamen C&amp;D Inc CEO Lin Mao and IOI Group group managing director and chief executive Datuk Lee Yeow Chor. </p></div></div><div id=""story-body"" class=""story bot-15 relative""><p>KUALA LUMPUR: <a href=""/business/marketwatch/stocks/?qcounter=NGGB"" target=""_blank"">Nextgreen Global Bhd</a><a href=""http://charts.thestar.com.my/?s=NGGB"" target=""_blank""><img class=""go-chart"" src=""https://cdn.thestar.com.my/Themes/img/chart.png""></a>’s 55%-owned subsidiary, Next",,,https://apicms.thestar.com.my/uploads/images/2024/04/12/2640405.jpeg,https://apicms.thestar.com.my/uploads/images/2024/04/12/2640405.jpeg,28,TheStar,http://www.thestar.com.my/news/latest/?tag=Business
Ringgit ends easier versus US dollar on higher-than-expected US inflation data,https://www.klsescreener.com/v2/news/view/1307965,2024-04-12 19:02:10,2024-04-15 08:15:23,2024-04-12 18:42:15,The ringgit ended easier against the US dollar on Friday as the greenback strengthened following higher-than-expected US inflation data.,"<div class=newsTextDataWrapInner><p>KUALA LUMPUR (April 12): The ringgit ended easier against the US dollar on Friday as the greenback strengthened following higher-than-expected US inflation data.</p></div>

<div class=newsTextDataWrapInner><p>At 6pm, the ringgit fell to 4.7680/7730 against the US dollar from Tuesday’s close of 4.7455/7500.</p></div>

<div class=newsTextDataWrapInner><p>Bank Muamalat Malaysia Bhd chief economist Mohd Afzanizam Abdul Rashid said a sticky US inflation rate seems to have turbocharged the value of the US dollar as the Federal Reserve is likely to maintain its",Edge,,https://assets.theedgemarkets.com/ringgit10_20240412184047_reuters.jpg,https://assets.theedgemarkets.com/ringgit10_20240412184047_reuters.jpg,52,TheEdge,http://www.theedgemarkets.com/categories/malaysia
Mosti to launch Single Window Initiative to strengthen Malaysia's startup ecosystem,https://www.klsescreener.com/v2/news/view/1307959,2024-04-12 18:44:22,2024-04-12 18:44:22,2024-04-12 18:40:00,"KUALA LUMPUR: The Ministry of Science, Technology and Innovation (MOSTI) will be launching the Single Window Initiative to strengthen Malaysia’s startup ecosystem by streamlining processes and consolidating resources under one platform.","<div class=""inline-img""><div class=""story-image""><p class=""caption"">The Ministry of Science, Technology  Innovation Chang Lih Kang  —LOW LAY PHON/The Star</p></div></div><div id=""story-body"" class=""story bot-15 relative""><p>KUALA LUMPUR: The Ministry of Science, Technology and Innovation (MOSTI) will be launching the Single Window Initiative to strengthen Malaysia’s startup ecosystem by streamlining processes and consolidating resources under one platform.</p><p>Its Minister Chang Lih Kang said the initiative will dismantle bureaucratic hurdles, expedite approvals and empower entrepreneurs to ",,,https://apicms.thestar.com.my/uploads/images/2024/04/12/2640310.jpg,https://apicms.thestar.com.my/uploads/images/2024/04/12/2640310.jpg,28,TheStar,http://www.thestar.com.my/news/latest/?tag=Business
Theta Edge closes at highest in nearly 30 months after share price hit limit-up,https://www.klsescreener.com/v2/news/view/1307961,2024-04-12 18:47:00,2024-04-15 08:04:23,2024-04-12 18:35:00,"KUALA LUMPUR (April 12): E-government service provider Theta Edge Bhd’s share price hit limit-up on Friday and closed at its highest in nearly 30 months, making it one of the top gainers of the day across Bursa Malaysia.","<div class=newsTextDataWrapInner><p>KUALA LUMPUR (April 12): E-government service provider Theta Edge Bhd’s share price hit limit-up on Friday and closed at its highest in nearly 30 months, making it one of the top gainers of the day across Bursa Malaysia.</p></div>

<div class=newsTextDataWrapInner><p>The counter, which has been enjoying a good run since February even without announcing any new contract wins, saw its share price climb as much as 29.6% or 39 sen to close at RM1.71, a level last breached on Oct 13, 2021. The counter saw 17.37 million shares exchange hands on Friday.</p></div>",新闻,,https://assets.theedgemarkets.com/Theta-Edge-Bhd-new-logo-purple-April10.2024_20240412182311_theta-edge-bhd.jpg,https://assets.theedgemarkets.com/Theta-Edge-Bhd-new-logo-purple-April10.2024_20240412182311_theta-edge-bhd.jpg,52,TheEdge,http://www.theedgemarkets.com/categories/malaysia
China strengthens company delisting rules to improve markets,https://www.klsescreener.com/v2/news/view/1307955,2024-04-12 18:33:26,2024-04-12 18:33:26,2024-04-12 18:26:00,SHANGHAI: China's securities regulator issued draft rules on strengthening company delistings on Friday in a move to improve the quality of the stock market and protect investor interests.,"<div class=""inline-img""><div class=""story-image""><p class=""caption"">File pic — Reuters</p></div></div><div id=""story-body"" class=""story bot-15 relative""><p>SHANGHAI: China's securities regulator issued draft rules on strengthening company delistings on Friday in a move to improve the quality of the stock market and protect investor interests.</p><p>Ther China Securities Regulatory Commission (CSRC) strengthened delisting requirements to force unqualified companies to exit the market and vowed to step up efforts to audit delistings. - Reuters</p></div>",,,https://apicms.thestar.com.my/uploads/images/2024/04/12/2640305.jpeg,https://apicms.thestar.com.my/uploads/images/2024/04/12/2640305.jpeg,28,TheStar,http://www.thestar.com.my/news/latest/?tag=Business
King expresses hope for increased investments from Chinese companies in Malaysia,https://www.klsescreener.com/v2/news/view/1307939,2024-04-12 18:04:20,2024-04-14 23:34:27,2024-04-12 17:50:57,"KUALA LUMPUR (April 12): His Majesty Sultan Ibrahim King of Malaysia expressed his hope for increased investments from Chinese companies within Malaysia, as this will lead to the creation of more job opportunities for the people in this country.","<div class=newsTextDataWrapInner><p>KUALA LUMPUR (April 12): His Majesty Sultan Ibrahim King of Malaysia&nbsp;expressed his hope for increased investments from Chinese companies within Malaysia, as this will lead to the creation of more job opportunities for the people in this country.</p></div>

<div class=newsTextDataWrapInner><p>His Majesty expressed this sentiment when receiving the Ambassador of China to Malaysia, Ouyang Yujing, who was accompanied by FAW Hongqi Global president Wang Lingyu, as well as renowned businessmen Tan Sri Lim Kok Thay and Datuk Lim Chee Wah on Friday.</p></div>",Edge,,https://assets.theedgemarkets.com/31012024-17th-YDP-Agong-His-Majesty-Sultan-Ibrahim-King-of-Malaysia-swearing-in-cer-Istana-Ng-crp_20240412173844_bernama.jpg,https://assets.theedgemarkets.com/King-CTR-Amb-of-Ch-to-MY-Ouyang-Yujing-2nd-L-FAW-Hongqi-Global-president-Wang-Lingyu-R-bizmen-TS-Lim-Kok-Thay-2nd-R-Dtk-Lim-Chee-Wah-L_20240412180940_officialsultanibrahim@facebook.jpg,52,TheEdge,http://www.theedgemarkets.com/categories/malaysia
"Gamuda Land collaborates with Kiddypedia for Discovery Centres at Gamuda Gardens, twentyfive7",https://www.klsescreener.com/v2/news/view/1307953,2024-04-12 18:33:26,2024-04-12 18:33:26,2024-04-12 17:49:00,"PETALING JAYA: Gamuda Land is partnering with Kiddypedia, a prominent advocate for children's education and development to introduce Kiddypedia Discovery Centres at its townships.","<div class=""inline-img""><div class=""story-image""></div></div><div id=""story-body"" class=""story bot-15 relative""><p>PETALING JAYA: Gamuda Land is partnering with Kiddypedia, a prominent advocate for children's education and development to introduce Kiddypedia Discovery Centres at its townships.</p><p>Chief operating officer Jess Teng said the group is mindful of all the elements it brings together – from the landscaping to the infrastructure to the home design, to all the community meeting places.</p><p>“Everything we do has a reason behind it, and it all blends together to create a sense of co",,,https://apicms.thestar.com.my/uploads/images/2024/04/12/2640264.jpg,https://apicms.thestar.com.my/uploads/images/2024/04/12/2640264.jpg,28,TheStar,http://www.thestar.com.my/news/latest/?tag=Business
Bursa Malaysia closes mixed as key index ends week in negative territory ,https://www.klsescreener.com/v2/news/view/1307919,2024-04-12 17:40:12,2024-04-12 17:40:12,2024-04-12 17:37:58,"KUALA LUMPUR: Bursa Malaysia closed mixed following a lacklustre trading session although buying interests are seen in the property and tech sectors, said analysts.Key regional indices trended mixed following mixed cue from Wall Street overnight. Following a mixed set ...","<div itemprop=""articleBody"" class=""dable-content-wrapper""><p>KUALA LUMPUR: Bursa Malaysia closed mixed following a lacklustre trading session although buying interests are seen in the property and tech sectors, said analysts.</p><p>Key regional indices trended mixed following mixed cue from Wall Street overnight. </p><p>Following a mixed set of data regarding inflation and the U.S. economy, US Treasury yields stayed relatively unchanged. </p><p>At 5pm, the FTSE Bursa Malaysia KLCI (FBM KLCI) fell 2.47 points or 0.16 per cent to 1,551.04 from Tuesday&#039;s close of 1,553.51.</p><p>The benchmar",Corporate,,https://assets.nst.com.my/images/articles/CLO12_NSTfield_image_listing_featured_v2.var_1712914675.jpg,https://assets.nst.com.my/images/articles/HQ190324AZ005_1712914667.jpg,79,NST,https://www.nst.com.my/business/corporate
FBM KLCI ends lower in line with regional peers,https://www.klsescreener.com/v2/news/view/1307933,2024-04-12 17:55:26,2024-04-12 17:55:26,2024-04-12 17:24:00,"KUALA LUMPUR: Bursa Malaysia ended Friday on a lower note, with no notable market-moving factors in play.","<div class=""inline-img""><div class=""story-image""></div></div><div id=""story-body"" class=""story bot-15 relative""><p>KUALA LUMPUR: Bursa Malaysia ended Friday on a lower note, with no notable market-moving factors in play.</p><p>The FBM KLCI closed down 2.47 points, or 0.16% at 1,551.04 after hitting an intraday high of 1,556.64. For the week, the benchmark index was down 0.27%.</p><p>Daily losers for FBM KLCI constituents at 16 counters outweigh the gainers at 11 counters, while three remained unchanged.</p><p>On the broader market, there were 580 gainers against 515 decliners while 470 counter",,,https://apicms.thestar.com.my/uploads/images/2024/04/12/2640150.jpg,https://apicms.thestar.com.my/uploads/images/2024/04/12/2640150.jpg,28,TheStar,http://www.thestar.com.my/news/latest/?tag=Business
