title,url,created_at,updated_at,published_date,summary,content,category,author,thumbnail_url,image_url,publisher_id,publisher_name,publisher_url
Tanco gets nod from transport ministry to build smart AI container port in Negeri Sembilan,https://www.klsescreener.com/v2/news/view/1263243,2024-01-16 00:20:31,2024-01-16 17:32:38,2024-01-16 00:13:30,Tanco Holdings Bhd said the Ministry of Transport has no objections to its subsidiary's proposed development of a smart AI container port in Negeri Sembilan.,"<div class=newsTextDataWrapInner><p>KUALA LUMPUR (Jan 16): Tanco Holdings Bhd said the Ministry of Transport has no objections to its subsidiary's proposed development of a smart AI container port in Negeri Sembilan.&nbsp;</p></div>

<div class=newsTextDataWrapInner><p>Tanco said its 79%-owned subsidiary, Midports Holdings Sdn Bhd, was notified of this on Monday by the Malaysia Marine Department (MMD).</p></div>

<div class=newsTextDataWrapInner><p>MMD went on to inform Midports that the department is giving its approval-in-principle to the port project, subject to various technical studie",Edge,,https://assets.theedgemarkets.com/tanco-holding_www.tancoholdings.com__5_0.jpg,,52,TheEdge,http://www.theedgemarkets.com/categories/malaysia
"Econframe, MGB, Tien Wah Press, Alpha IVF, George Kent, MSM Malaysia, Magna Prima, Sunview, Wentel Engineering",https://www.klsescreener.com/v2/news/view/1263241,2024-01-16 00:20:30,2024-01-16 17:19:14,2024-01-16 00:01:16,Here is a brief recap of some corporate announcements that made the news on Monday:,"<div class=newsTextDataWrapInner><p>KUALA LUMPUR (Jan 15): Here is a brief recap of some corporate announcements that made the news on Monday:</p></div>

<div class=newsTextDataWrapInner><p><b>Econframe Bhd</b> has acquired industrial property builder ETA World Sdn Bhd for RM56 million. The total door system solutions provider said it has entered into a conditional share sale agreement with ETA Industries Sdn Bhd for the proposed acquisition. ETA World provides turnkey design and build solutions of industrial buildings such as factories and warehouses, customising each project based on its c",新闻,,https://assets.theedgemarkets.com/Companies-in-the-news_theedgemalaysia_54.jpg,,52,TheEdge,http://www.theedgemarkets.com/categories/malaysia
Power plant a ‘game changer’ for SunCon,https://www.klsescreener.com/v2/news/view/1263405,2024-01-16 10:44:35,2024-01-16 10:44:35,2024-01-16 00:00:00,"PETALING JAYA: A US$2.4bil power plant project in Vietnam will be a “game changer” for Sunway Construction Group Bhd (SunCon), says CGS-CIMB Research.","<div class=""inline-img""><div class=""story-image""></div></div><div id=""story-body"" class=""story bot-15 relative""><p>PETALING JAYA: A US$2.4bil power plant project in Vietnam will be a “game changer” for <a href=""/business/marketwatch/stocks/?qcounter=SUNCON"" target=""_blank"">Sunway Construction Group Bhd</a><a href=""http://charts.thestar.com.my/?s=SUNCON"" target=""_blank""><img class=""go-chart"" src=""https://cdn.thestar.com.my/Themes/img/chart.png""></a> (SunCon), says CGS-CIMB Research.</p><p></p><p>The Song Hau 2 power plant, in which SunCon has a 55% stake worth RM6bil, is expected to award a con",,,https://apicms.thestar.com.my/uploads/images/2024/01/16/2493161.jpeg,https://apicms.thestar.com.my/uploads/images/2024/01/16/2493161.jpeg,28,TheStar,http://www.thestar.com.my/news/latest/?tag=Business
REIT sector earnings poised to grow 9.1% in 2024,https://www.klsescreener.com/v2/news/view/1263379,2024-01-16 09:33:52,2024-01-16 09:33:52,2024-01-16 00:00:00,"KUALA LUMPUR: Maybank Investment Bank Research (Maybank IB Research) is forecasting the earnings of Malaysian real estate investment trusts (REITs) to grow by a decent 9.1% this year, supported by sustained occupancy and rental rates, plus several new asset injections.","<div class=""inline-img""><div class=""story-image""></div></div><div id=""story-body"" class=""story bot-15 relative""><p>KUALA LUMPUR: Maybank Investment Bank Research (Maybank IB Research) is forecasting the earnings of Malaysian real estate investment trusts (REITs) to grow by a decent 9.1% this year, supported by sustained occupancy and rental rates, plus several new asset injections.</p><p>The forecast is up from the estimated 6.9% growth in 2023, said the research house, which retained its “neutral” rating on the sector.</p><p>“We expect Bank Negara to pause on interest rates, with the overnigh",,,https://apicms.thestar.com.my/uploads/images/2024/01/16/2493136.jpeg,https://apicms.thestar.com.my/uploads/images/2024/01/16/2493136.jpeg,28,TheStar,http://www.thestar.com.my/news/latest/?tag=Business
Equities and bonds likely to see modest growth,https://www.klsescreener.com/v2/news/view/1263377,2024-01-16 09:33:50,2024-01-16 09:33:50,2024-01-16 00:00:00,"PETALING JAYA: The Malaysian capital market may see modest growth especially in equities and bonds as the FBM KLCI is poised to hit 1,510 points by the end of 2024, according to HSBC Global Research.","<div class=""inline-img""><div class=""story-image""></div></div><div id=""story-body"" class=""story bot-15 relative""><p>PETALING JAYA: The Malaysian capital market may see modest growth especially in equities and bonds as the FBM KLCI is poised to hit 1,510 points by the end of 2024, according to HSBC Global Research.</p><p></p><p>The research house said the nascent recovery in the global electronics cycle, as seen in peers such as South Korea and Singapore, provides some hope that Malaysia’s exports are seeing the light at the end of the tunnel.</p><p>Consistent foreign direct investments (FDI) co",,,https://apicms.thestar.com.my/uploads/images/2024/01/16/2493140.JPG,https://apicms.thestar.com.my/uploads/images/2024/01/16/2493140.JPG,28,TheStar,http://www.thestar.com.my/news/latest/?tag=Business
George Kent expands operations in Vietnam,https://www.klsescreener.com/v2/news/view/1263375,2024-01-16 09:33:48,2024-01-16 09:33:48,2024-01-16 00:00:00,"PETALING JAYA: George Kent (M) Bhd has set up a new subsidiary named George Kent (Vietnam) Co Ltd (GK Vietnam), with the aim of expanding its presence and operations in Vietnam.","<div class=""inline-img""><div class=""story-image""></div></div><div id=""story-body"" class=""story bot-15 relative""><p>PETALING JAYA: <a href=""/business/marketwatch/stocks/?qcounter=GKENT"" target=""_blank"">George Kent (M) Bhd</a><a href=""http://charts.thestar.com.my/?s=GKENT"" target=""_blank""><img class=""go-chart"" src=""https://cdn.thestar.com.my/Themes/img/chart.png""></a> has set up a new subsidiary named George Kent (Vietnam) Co Ltd (GK Vietnam), with the aim of expanding its presence and operations in Vietnam.</p><p></p><p>In a statement, George Kent said its wholly-owned subsidiary George Kent In",,,https://apicms.thestar.com.my/uploads/images/2024/01/16/2493139.JPG,https://apicms.thestar.com.my/uploads/images/2024/01/16/2493139.JPG,28,TheStar,http://www.thestar.com.my/news/latest/?tag=Business
Econframe buys property developer for RM56mil,https://www.klsescreener.com/v2/news/view/1263373,2024-01-16 09:33:46,2024-01-16 09:33:46,2024-01-16 00:00:00,PETALING JAYA: Econframe Bhd is proposing to acquire a 70% stake in ETA World Sdn Bhd (ETAW) from ETA Industries Sdn Bhd for RM56mil as part of its move to diversify the group’s business into construction services and property development.,"<div class=""inline-img""><div class=""story-image""><p class=""caption"">Managing director Lim Chin Horng said this was part of the company’s efforts to grow its business and diversify its revenue stream.</p></div></div><div id=""story-body"" class=""story bot-15 relative""><p>PETALING JAYA: <a href=""/business/marketwatch/stocks/?qcounter=EFRAME"" target=""_blank"">Econframe Bhd</a><a href=""http://charts.thestar.com.my/?s=EFRAME"" target=""_blank""><img class=""go-chart"" src=""https://cdn.thestar.com.my/Themes/img/chart.png""></a> is proposing to acquire a 70% stake in ETA World Sdn Bhd (ETAW) from ETA Industri",,,https://apicms.thestar.com.my/uploads/images/2024/01/16/2493145.jpg,https://apicms.thestar.com.my/uploads/images/2024/01/16/2493145.jpg,28,TheStar,http://www.thestar.com.my/news/latest/?tag=Business
"Sunview Groupinks deal forRE projectin Cambodia",https://www.klsescreener.com/v2/news/view/1263371,2024-01-16 09:33:44,2024-01-16 09:33:44,2024-01-16 00:00:00,"PETALING JAYA: Sunview Group Bhd’s subsidiary, Fabulous Sunview Sdn Bhd, has entered into a strategic business alliance agreement with a few Cambodian partners for the commision of a renewable energy (RE) project.","<div class=""inline-img""><div class=""story-image""></div></div><div id=""story-body"" class=""story bot-15 relative""><p>PETALING JAYA: Sunview Group Bhd’s subsidiary, Fabulous Sunview Sdn Bhd, has entered into a strategic business alliance agreement with a few Cambodian partners for the commision of a renewable energy (RE) project.</p><p></p><p>Sunview executive director and chief executive officer H P Ong said the RE project will have a targeted capacity of 500 megawatts on land in an undisclosed province in Cambodia.</p><p>“We are enthusiastic about this collaboration as it empowers us to expand ",,,https://apicms.thestar.com.my/uploads/images/2024/01/16/2493138.JPG,https://apicms.thestar.com.my/uploads/images/2024/01/16/2493138.JPG,28,TheStar,http://www.thestar.com.my/news/latest/?tag=Business
Alpha IVF gets  approval to list on ACE Market,https://www.klsescreener.com/v2/news/view/1263369,2024-01-16 09:33:42,2024-01-16 09:33:42,2024-01-16 00:00:00,KUALA LUMPUR: Alpha IVF Group Bhd has received approval from Bursa Malaysia to list on the ACE Market of Bursa Malaysia.,"<div class=""inline-img""><div class=""story-image""></div></div><div id=""story-body"" class=""story bot-15 relative""><p>KUALA LUMPUR: Alpha IVF Group Bhd has received approval from Bursa Malaysia to list on the ACE Market of Bursa Malaysia.</p><p>Alpha IVF is a fertility care specialist currently operating in Malaysia and Singapore, providing assisted reproductive services with a primary focus on in-vitro fertilisation. It currently operates two specialist centres in Malaysia and one specialist centre in Singapore.</p><p>The company targets to be listed in the first quarter of 2024.</p></div>",,,https://apicms.thestar.com.my/uploads/images/2024/01/16/2493137.jpg,https://apicms.thestar.com.my/uploads/images/2024/01/16/2493137.jpg,28,TheStar,http://www.thestar.com.my/news/latest/?tag=Business
MBSB eyes 8% ROE in next three years,https://www.klsescreener.com/v2/news/view/1263367,2024-01-16 09:33:40,2024-01-16 09:33:40,2024-01-16 00:00:00,PETALING JAYA: Malaysia Building Society Bhd (MBSB) aims to raise its return on equity (ROE) to 8% in the next three years through improved interest margins and a more diversified customer base.,"<div class=""inline-img""><div class=""story-image""></div></div><div id=""story-body"" class=""story bot-15 relative""><p>PETALING JAYA: <a href=""/business/marketwatch/stocks/?qcounter=MBSB"" target=""_blank"">Malaysia Building Society Bhd</a><a href=""http://charts.thestar.com.my/?s=MBSB"" target=""_blank""><img class=""go-chart"" src=""https://cdn.thestar.com.my/Themes/img/chart.png""></a> (MBSB) aims to raise its return on equity (ROE) to 8% in the next three years through improved interest margins and a more diversified customer base.</p><p></p><p>The Islamic banking-based lender aims to up its ROE by raisi",,,https://apicms.thestar.com.my/uploads/images/2024/01/16/2493158.JPG,https://apicms.thestar.com.my/uploads/images/2024/01/16/2493158.JPG,28,TheStar,http://www.thestar.com.my/news/latest/?tag=Business
MAXIS BUSINESS DRIVES THE SMART MOBILITY REVOLUTION,https://www.klsescreener.com/v2/news/view/1263365,2024-01-16 09:33:39,2024-01-16 09:33:39,2024-01-16 00:00:00,"‘We work closely with partners like EV Connection to fine-tune our network, ensuring that charging stations are reliable when people go to charge their vehicles,’ said Claire FeatherstoneIN a world where innovation and efficiency intersect, smart mobility is the latest ...","<div class=""inline-img""><div class=""story-image""><p class=""caption"">‘We work closely with partners like EV Connection to fine-tune our network, ensuring that charging stations are reliable when people go to charge their vehicles,’ said Claire Featherstone</p></div></div><div id=""story-body"" class=""story bot-15 relative""><p>IN a world where innovation and efficiency intersect, smart mobility is the latest buzzword and a new area many businesses are eager to dive into.</p><p>At the forefront of this transformative journey is Maxis Business, a key player connecting the future of smart mobility.</",,,https://apicms.thestar.com.my/uploads/images/2024/01/16/2492762.jpg,https://apicms.thestar.com.my/uploads/images/2024/01/16/2492762.jpg,28,TheStar,http://www.thestar.com.my/news/latest/?tag=Business
IOI Properties to gain from southern projects,https://www.klsescreener.com/v2/news/view/1263359,2024-01-16 09:22:35,2024-01-16 09:22:35,2024-01-16 00:00:00,"PETALING JAYA: IOI Properties Group Bhd’s Bandar Putra Kulai township development in Johor will be a major sales driver for the property giant in the coming years, according to RHB Research.","<div class=""inline-img""><div class=""story-image""></div></div><div id=""story-body"" class=""story bot-15 relative""><p>PETALING JAYA: <a href=""/business/marketwatch/stocks/?qcounter=IOIPG"" target=""_blank"">IOI Properties Group Bhd</a><a href=""http://charts.thestar.com.my/?s=IOIPG"" target=""_blank""><img class=""go-chart"" src=""https://cdn.thestar.com.my/Themes/img/chart.png""></a>’s Bandar Putra Kulai township development in Johor will be a major sales driver for the property giant in the coming years, according to RHB Research.</p><p></p><p>The 25-year-old township is expected to not only see a further",,,https://apicms.thestar.com.my/uploads/images/2024/01/16/2493135.png,https://apicms.thestar.com.my/uploads/images/2024/01/16/2493135.png,28,TheStar,http://www.thestar.com.my/news/latest/?tag=Business
BPMB approves financing for Perlis Inland Port,https://www.klsescreener.com/v2/news/view/1263357,2024-01-16 09:22:35,2024-01-16 09:22:35,2024-01-16 00:00:00,PETALING JAYA: Bank Pembangunan Malaysia Bhd (BPMB) has announced the approval of Tawarruq Asset Financing Facilities amounting to RM373.54mil to Inland Port Perlis Sdn Bhd.,"<div class=""inline-img""><div class=""story-image""></div></div><div id=""story-body"" class=""story bot-15 relative""><p>PETALING JAYA: Bank Pembangunan Malaysia Bhd (BPMB) has announced the approval of Tawarruq Asset Financing Facilities amounting to RM373.54mil to Inland Port Perlis Sdn Bhd.</p><p></p><p>In a statement, BPMB said this dedicated financing, spanning up to 20 years, is allocated for the engineering, procurement, construction and commissioning costs of the integrated inland port facility, Perlis Inland Port, situated in the Chuping Valley Industrial Area in Perlis.</p><p>Occupying 500",,,https://apicms.thestar.com.my/uploads/images/2024/01/16/2493142.jpg,https://apicms.thestar.com.my/uploads/images/2024/01/16/2493142.jpg,28,TheStar,http://www.thestar.com.my/news/latest/?tag=Business
MSM extends CFO’s garden leave until Feb 15,https://www.klsescreener.com/v2/news/view/1263355,2024-01-16 09:22:33,2024-01-16 09:22:33,2024-01-16 00:00:00,KUALA LUMPUR: MSM Malaysia Holdings Bhd has extended the garden leave of its chief financial officer Mazatul ‘Aini Shahar Abdul Malek Shahar from Jan 15 to Feb 15 or until further notice from the board.,"<div class=""inline-img""><div class=""story-image""></div></div><div id=""story-body"" class=""story bot-15 relative""><p>KUALA LUMPUR: <a href=""/business/marketwatch/stocks/?qcounter=MSM"" target=""_blank"">MSM Malaysia Holdings Bhd</a><a href=""http://charts.thestar.com.my/?s=MSM"" target=""_blank""><img class=""go-chart"" src=""https://cdn.thestar.com.my/Themes/img/chart.png""></a> has extended the garden leave of its chief financial officer Mazatul ‘Aini Shahar Abdul Malek Shahar from Jan 15 to Feb 15 or until further notice from the board.</p><p></p><p>“MSM will continue its business operations as usual,” ",,,https://apicms.thestar.com.my/uploads/images/2024/01/16/2493141.jpeg,https://apicms.thestar.com.my/uploads/images/2024/01/16/2493141.jpeg,28,TheStar,http://www.thestar.com.my/news/latest/?tag=Business
"Seven consortia present proposals for KL-S’pore HSR",https://www.klsescreener.com/v2/news/view/1263353,2024-01-16 09:11:39,2024-01-16 09:11:39,2024-01-16 00:00:00,"PETALING JAYA: Seven local and international consortia submitted their concept proposals to build the Malaysia-Singapore high-speed rail (HSR), days after Japanese companies reportedly opted out of the project for being “too risky”.","<div class=""inline-img""><div class=""story-image""></div></div><div id=""story-body"" class=""story bot-15 relative""><p>PETALING JAYA: Seven local and international consortia submitted their concept proposals to build the Malaysia-Singapore high-speed rail (HSR), days after Japanese companies reportedly opted out of the project for being “too risky”.</p><p>MyHSR Corp Sdn Bhd, the government’s project delivery vehicle for the HSR, said in a statement that the seven consortia comprises 31 firms, although it did not name the companies.</p><p>However, in the same statement, MyHSR hinted that it may not",,,https://apicms.thestar.com.my/uploads/images/2024/01/16/2493123.jpg,https://apicms.thestar.com.my/uploads/images/2024/01/16/2493123.jpg,28,TheStar,http://www.thestar.com.my/news/latest/?tag=Business
Bond bulls risk getting smacked around,https://www.klsescreener.com/v2/news/view/1263351,2024-01-16 09:11:38,2024-01-16 09:11:38,2024-01-16 00:00:00,"NEW YORK: Bond traders are growing more convinced that US yields are heading lower as they bet on a series of Federal Reserve (Fed) interest-rate cuts, yet the path to cheaper borrowing costs is set to be extremely bumpy.","<div class=""inline-img""><div class=""story-image""></div></div><div id=""story-body"" class=""story bot-15 relative""><p>NEW YORK: Bond traders are growing more convinced that US yields are heading lower as they bet on a series of Federal Reserve (Fed) interest-rate cuts, yet the path to cheaper borrowing costs is set to be extremely bumpy.</p><p></p><p>Having endured some major swings last year, US Treasuries rallied into the end of 2023 as investors latched on to signs inflation was cooling and central bankers opened the door to rate-cut speculation.</p><p>While markets have been choppier to start",,,https://apicms.thestar.com.my/uploads/images/2024/01/16/2493121.jpeg,https://apicms.thestar.com.my/uploads/images/2024/01/16/2493121.jpeg,28,TheStar,http://www.thestar.com.my/news/latest/?tag=Business
Synergy           House taps online sales            for growth,https://www.klsescreener.com/v2/news/view/1263349,2024-01-16 09:11:37,2024-01-16 09:11:37,2024-01-16 00:00:00,"PETALING JAYA: As Malaysia’s only cross-border eCommerce furniture distributor, Synergy House Bhd is in a good position to see exponential earnings growth in the near term, thanks to its asset-light model.","<div class=""inline-img""><div class=""story-image""></div></div><div id=""story-body"" class=""story bot-15 relative""><p>PETALING JAYA: As Malaysia’s only cross-border eCommerce furniture distributor, Synergy House Bhd is in a good position to see exponential earnings growth in the near term, thanks to its asset-light model.</p><p>The company’s business model focuses on design and primarily selling online as currently 80% of the company’s sales are over the Internet. By adopting the model, Synergy House is spared from high overhead costs and this allows it to be versatile and quick in adapting to ma",,,https://apicms.thestar.com.my/uploads/images/2024/01/16/2493125.JPG,https://apicms.thestar.com.my/uploads/images/2024/01/16/2493125.JPG,28,TheStar,http://www.thestar.com.my/news/latest/?tag=Business
Moody’s: AEON Bank to spur Islamic banking sector,https://www.klsescreener.com/v2/news/view/1263347,2024-01-16 09:11:35,2024-01-16 09:11:35,2024-01-16 00:00:00,"PETALING JAYA: Moody’s Investors Service anticipates that AEON Bank Bhd will act as a driver for further growth in Malaysia’s Islamic banking sector, due to the strong awareness and interest in digital Islamic banking.","<div class=""inline-img""><div class=""story-image""></div></div><div id=""story-body"" class=""story bot-15 relative""><p>PETALING JAYA: Moody’s Investors Service anticipates that AEON Bank Bhd will act as a driver for further growth in Malaysia’s Islamic banking sector, due to the strong awareness and interest in digital Islamic banking.</p><p>On Jan 8, 2024, AEON Bank announced that it had obtained regulatory approval to commence an Islamic digital bank business in Malaysia and it will release its roll-out plan in the first half of 2024.</p><p>Moody’s said the approval was credit-positive because i",,,https://apicms.thestar.com.my/uploads/images/2024/01/16/2493124.jpeg,https://apicms.thestar.com.my/uploads/images/2024/01/16/2493124.jpeg,28,TheStar,http://www.thestar.com.my/news/latest/?tag=Business
Hacker for hire: Cyber guardians a growing trade,https://www.klsescreener.com/v2/news/view/1263339,2024-01-16 08:55:54,2024-01-16 08:55:54,2024-01-16 00:00:00,"JAKARTA: In Indonesia, the term “hacker” is often viewed negatively, with most people linking it to criminal activities and other problems, but some hackers want to assist hacking victims and prevent future cybersecurity threats.","<div class=""inline-img""><div class=""story-image""><p class=""caption"">FILE - This combination of 2017-2022 photos shows the logos of Facebook, YouTube, TikTok and Snapchat on mobile devices. A trade group representing TikTok, Snapchat, Meta and other major tech companies sued Ohio on Friday, Jan. 5, 2024 over a pending law that requires children to get parental consent to use social media apps. (AP Photo/File)</p></div></div><div id=""story-body"" class=""story bot-15 relative""><p>JAKARTA: In Indonesia, the term “hacker” is often viewed negatively, with most people linking it to criminal activities",,,https://apicms.thestar.com.my/uploads/images/2024/01/16/2492790.jpg,https://apicms.thestar.com.my/uploads/images/2024/01/16/2492790.jpg,28,TheStar,http://www.thestar.com.my/news/latest/?tag=Business
Kanger executive director Wu Wai Kong emerges as substantial shareholder,https://www.klsescreener.com/v2/news/view/1263221,2024-01-15 23:48:47,2024-01-16 17:19:12,2024-01-15 23:31:10,Kanger International Bhd said its executive director Wu Wai Kong has emerged as a substantial shareholder on Monday after acquiring 50.50 million shares in the company.,"<div class=newsTextDataWrapInner><p>KUALA LUMPUR (Jan 15): Kanger International Bhd said its executive director Wu Wai Kong has emerged as a substantial shareholder on Monday after acquiring 50.50 million shares in the company.</p></div>

<div class=newsTextDataWrapInner><p>In a bourse filing, the construction outfit said the shares were acquired through the exercise of options under a share issuance scheme, at 5.8 sen per share or a total of RM2.93 million.</p></div>

<div class=newsTextDataWrapInner><p>Post-transaction, Wu now owns a direct interest of 7% or 51.17 million shares and an i",新闻,,https://assets.theedgemarkets.com/Kanger-Intl_20210427114531_annual-report_1_0.jpg,,52,TheEdge,http://www.theedgemarkets.com/categories/malaysia
EVD’s unit faces lawsuit from subcontractor,https://www.klsescreener.com/v2/news/view/1263219,2024-01-15 23:16:57,2024-01-16 17:04:45,2024-01-15 23:08:56,"EVD Bhd on Monday said its wholly-owned unit, EVD Engineering Sdn Bhd (EVDE), is being sued over a claim of RM600,292 by a subcontractor for the supply of civil and structural building works.","<div class=newsTextDataWrapInner><p>KUALA LUMPUR (Jan 15): EVD Bhd on Monday said its wholly-owned unit, EVD Engineering Sdn Bhd (EVDE), is being sued over a claim of RM600,292 by a subcontractor for the supply of civil and structural building works.</p></div>

<div class=newsTextDataWrapInner><p>This comes after EVD announced on Jan 11 that the subcontractor, North Line Eng (M) Sdn Bhd, had obtained a judgment in default of appearance against EVDE over the claim.</p></div>

<div class=newsTextDataWrapInner><p>The claim is over a dispute on the scope of work claimed by North Line and the v",Edge,,https://assets.theedgemarkets.com/evd bhd_0.jpg,,52,TheEdge,http://www.theedgemarkets.com/categories/malaysia
Ferrotec’s new facility in Kulim opens for production,https://www.klsescreener.com/v2/news/view/1263211,2024-01-15 22:48:55,2024-01-16 17:04:42,2024-01-15 22:28:34,"ALOR SETAR (Jan 15): Ferrotec Holdings Corporation, a global supplier of materials, components, and precision system solutions, has opened its manufacturing facility at Kulim Hi-Tech Park, Kedah.","<div class=newsTextDataWrapInner><p>ALOR SETAR (Jan 15): Ferrotec Holdings Corporation, a global supplier of materials, components, and precision system solutions, has opened its&nbsp;manufacturing facility at Kulim Hi-Tech Park, Kedah.</p></div>

<div class=newsTextDataWrapInner><p>The Tokyo-listed company has invested about&nbsp;RM850 million in the project and created&nbsp;more than 800 job opportunities&nbsp;mostly&nbsp;for&nbsp;local talents, according to a joint statement issued by the Malaysian Investment Development Authority (Mida) and Ferrotec.</p></div>

<div class=newsTextDataW",Edge,,https://assets.theedgemarkets.com/Ferrotec-Holdings-Corp-logo-graphic-svdoff-Bernama-18052022_20240115215846_ferrotecholdingscorporation.jpg,,52,TheEdge,http://www.theedgemarkets.com/categories/malaysia
