title,url,created_at,updated_at,published_date,summary,content,category,author,thumbnail_url,image_url,publisher_id,publisher_name,publisher_url
Proper planning and management the key,https://www.klsescreener.com/v2/news/view/1301995,2024-03-30 07:55:22,2024-03-30 07:55:22,2024-03-30 00:00:00,"With more shopping malls heading their way into 2024, it’s hardly surprising that we are witnessing a glut in the sector.","<div class=""inline-img""><div class=""story-image""><p class=""caption"">'CLICK TO ENLARGE'</p></div></div><div id=""story-body"" class=""story bot-15 relative""><div class=""premium-sign-overlay absolute""></div><p>WITH more shopping malls heading their way into 2024, it’s hardly surprising that we are witnessing a glut in the sector.</p><p>As of the fourth quarter of 2023, Malaysia boasted 1,074 shopping malls with a combined retail space of 17.69 million sq m, with the Klang Valley contributing roughly 200 shopping malls and offering a retail space of 6.5 million sq m.</p></div>",,,https://apicms.thestar.com.my/uploads/images/2024/03/30/2619225.jpg,https://apicms.thestar.com.my/uploads/images/2024/03/30/2619225.jpg,28,TheStar,http://www.thestar.com.my/news/latest/?tag=Business
A case of one too many malls,https://www.klsescreener.com/v2/news/view/1301993,2024-03-30 07:55:21,2024-03-30 07:55:21,2024-03-30 00:00:00,The opening of The Exchange TRX in late November last year came with much fanfare.,"<div class=""inline-img""><div class=""story-image""></div></div><div id=""story-body"" class=""story bot-15 relative""><div class=""premium-sign-overlay absolute""></div><p>THE opening of The Exchange TRX in late November last year came with much fanfare.</p><p>Despite being mired with challenges such as negative press and intense competition in the local mall landscape due to the seemingly endless supply of new floor space, The Exchange TRX continues to defy expectations by attracting a significant number of visitors.</p></div>",,,https://apicms.thestar.com.my/uploads/images/2024/03/30/2619186.jpeg,https://apicms.thestar.com.my/uploads/images/2024/03/30/2619263.jpg,28,TheStar,http://www.thestar.com.my/news/latest/?tag=Business
MKHOP seeks land for plantation in Indonesia,https://www.klsescreener.com/v2/news/view/1301991,2024-03-30 07:11:36,2024-03-30 07:11:36,2024-03-30 00:00:00,Main Market-bound MKH Oil Palm (East Kalimantan) Bhd (MKHOP) is actively seeking land in Indonesia to expand its land bank for oil palm plantations.,"<div class=""inline-img""><div class=""story-image""><p class=""caption"">From left: MKHOP independent non-executive director Yahya Ariffin, executive director Emily Chen Wei Chyong, executive director Datuk Andy Lee Khee Meng, non-executive director Tan Sri Eddy.</p></div></div><div id=""story-body"" class=""story bot-15 relative""><div class=""premium-sign-overlay absolute""></div><p>KUALA LUMPUR: Main Market-bound MKH Oil Palm (East Kalimantan) Bhd (MKHOP) is actively seeking land in Indonesia to expand its land bank for oil palm plantations.</p><p>The company, which has about 18,000ha of plantation la",,,https://apicms.thestar.com.my/uploads/images/2024/03/30/2619155.jpeg,https://apicms.thestar.com.my/uploads/images/2024/03/30/2619155.jpeg,28,TheStar,http://www.thestar.com.my/news/latest/?tag=Business
Liannex’s stake buy in Icon Offshore a positive development,https://www.klsescreener.com/v2/news/view/1301989,2024-03-30 07:11:36,2024-03-30 07:11:36,2024-03-30 00:00:00,"Earlier in the week, Icon Offshore Bhd grabbed headlines when the story broke that its major shareholder, the government’s private equity (PE) fund Ekuiti Nasional Bhd (Ekuinas) is divesting most of its stake in the local offshore service vessels (OSV) provider.","<div class=""inline-img""><div class=""story-image""></div></div><div id=""story-body"" class=""story bot-15 relative""><div class=""premium-sign-overlay absolute""></div><p>EARLIER in the week, <a href=""/business/marketwatch/stocks/?qcounter=ICON"" target=""_blank"">Icon Offshore Bhd</a><a href=""http://charts.thestar.com.my/?s=ICON"" target=""_blank""><img class=""go-chart"" src=""https://cdn.thestar.com.my/Themes/img/chart.png""></a> grabbed headlines when the story broke that its major shareholder, the government’s private equity (PE) fund Ekuiti Nasional Bhd (Ekuinas) is divesting most of its stake in the loc",,,https://apicms.thestar.com.my/uploads/images/2024/03/30/2619133.jpeg,https://apicms.thestar.com.my/uploads/images/2024/03/30/2619301.jpg,28,TheStar,http://www.thestar.com.my/news/latest/?tag=Business
Narrowing the gap between share price and fair value,https://www.klsescreener.com/v2/news/view/1301987,2024-03-30 07:11:34,2024-03-30 07:11:34,2024-03-30 00:00:00,"Less than a month ago, a minority shareholder of Singapore-listed Great Eastern Holdings Ltd (GEH), representing a group of other minority shareholders, requested for the company to table, among others, three resolutions in the upcoming annual general meeting (AGM).","<div class=""inline-img""><div class=""story-image""><p class=""caption"">Value disparity: A file photo of Bursa Malaysia in Kuala Lumpur. A dividend reinvestment plan is one way for a company to conserve cash outlay and improve equity value.</p></div></div><div id=""story-body"" class=""story bot-15 relative""><div class=""premium-sign-overlay absolute""></div><p>Less than a month ago, a minority shareholder of Singapore-listed Great Eastern Holdings Ltd (GEH), representing a group of other minority shareholders, requested for the company to table, among others, three resolutions in the upcoming annual g",,,https://apicms.thestar.com.my/uploads/images/2024/03/30/2618934.jpg,https://apicms.thestar.com.my/uploads/images/2024/03/30/2618934.jpg,28,TheStar,http://www.thestar.com.my/news/latest/?tag=Business
Forex chief calls yen’s slump unusual,https://www.klsescreener.com/v2/news/view/1301985,2024-03-30 07:11:33,2024-03-30 07:11:33,2024-03-30 00:00:00,"Japan’s top currency official says the recent yen weakness is odd and out of line with current economic fundamentals, reaffirming his commitment to act if needed to prevent excessive swings in the exchange rate.","<div class=""inline-img""><div class=""story-image""><p class=""caption"">“Many people think the yen is now moving in the opposite direction of where it should be going,” Kanda said. — Bloomberg</p></div></div><div id=""story-body"" class=""story bot-15 relative""><div class=""premium-sign-overlay absolute""></div><p>TOKYO: Japan’s top currency official says the recent yen weakness is odd and out of line with current economic fundamentals, reaffirming his commitment to act if needed to prevent excessive swings in the exchange rate.</p><p>“I strongly feel the recent sharp depreciation of the yen is unusual",,,https://apicms.thestar.com.my/uploads/images/2024/03/30/2619129.jpeg,https://apicms.thestar.com.my/uploads/images/2024/03/30/2619129.jpeg,28,TheStar,http://www.thestar.com.my/news/latest/?tag=Business
Asean business sentiment rises,https://www.klsescreener.com/v2/news/view/1301983,2024-03-30 07:11:31,2024-03-30 07:11:31,2024-03-30 00:00:00,Over 80% of Malaysian businesses plan to invest in technology and digitalisation to keep pace with an evolving digitalised world to support their operations in Asean.,"<div class=""inline-img""><div class=""story-image""></div></div><div id=""story-body"" class=""story bot-15 relative""><div class=""premium-sign-overlay absolute""></div><p><a href=""https://cdn.thestar.com.my/Content/Images/Digital_3003_Grow_business_in_Asean.jpg"" target=""_blank""><span class=""embeded-image inline-image-center""><img alt=""'CLICK TO ENLARGE'"" src=""https://apicms.thestar.com.my/uploads/images/2024/03/30/2619130.jpg"" onerror=""this.src='https://cdn.thestar.com.my/Themes/img/tsol-default-image2023.png'"" style=""width: 400px; height: 555px;""><span class=""inline-caption"">'CLICK TO ENLARGE'</span",,,https://apicms.thestar.com.my/uploads/images/2024/03/30/2619130.jpg,https://apicms.thestar.com.my/uploads/images/2024/03/30/2619231.jpg,28,TheStar,http://www.thestar.com.my/news/latest/?tag=Business
Keyfield riding on growth in O&G offshore accommodation,https://www.klsescreener.com/v2/news/view/1301981,2024-03-30 07:11:30,2024-03-30 07:11:30,2024-03-30 00:00:00,"As Malaysia’s offshore support vessel sector witnesses growth, offshore accommodation provider Keyfield International Bhd emerges as a beneficiary, poised to make waves within the oil and gas (O&amp;G) sector with its imminent listing.","<div class=""inline-img""><div class=""story-image""><p class=""caption"">Keyfield International Bhd executive director and group chief executive officer Datuk Darren Kee Chit Hue—ONG SOON HIN/TheStar</p></div></div><div id=""story-body"" class=""story bot-15 relative""><div class=""premium-sign-overlay absolute""></div><p>AS Malaysia’s offshore support vessel sector witnesses growth, offshore accommodation provider Keyfield International Bhd emerges as a beneficiary, poised to make waves within the oil and gas (O&amp;G) sector with its imminent listing.</p><p>Keyfield’s initial public offering (IPO) woul",,,https://apicms.thestar.com.my/uploads/images/2024/03/30/2619131.jpeg,https://apicms.thestar.com.my/uploads/images/2024/03/30/2619131.jpeg,28,TheStar,http://www.thestar.com.my/news/latest/?tag=Business
Yinson raises RM283mil via private placement,https://www.klsescreener.com/v2/news/view/1301979,2024-03-30 07:11:29,2024-03-30 07:11:29,2024-03-30 00:00:00,Yinson Holdings Bhd has raised RM283.2mil from a private placement to support its energy transition business.,"<div class=""inline-img""><div class=""story-image""></div></div><div id=""story-body"" class=""story bot-15 relative""><p>PETALING JAYA: <a href=""/business/marketwatch/stocks/?qcounter=YINSON"" target=""_blank"">Yinson Holdings Bhd</a><a href=""http://charts.thestar.com.my/?s=YINSON"" target=""_blank""><img class=""go-chart"" src=""https://cdn.thestar.com.my/Themes/img/chart.png""></a> has raised RM283.2mil from a private placement to support its energy transition business.</p><p>The energy infrastructure and technology company said the exercise involved 120 million new ordinary shares, representing about 4.1% ",,,https://apicms.thestar.com.my/uploads/images/2024/03/30/2619154.JPG,https://apicms.thestar.com.my/uploads/images/2024/03/30/2619154.JPG,28,TheStar,http://www.thestar.com.my/news/latest/?tag=Business
Pawnbrokers in for a strong financial year,https://www.klsescreener.com/v2/news/view/1301977,2024-03-30 07:11:27,2024-03-30 07:11:27,2024-03-30 00:00:00,The festive period and the rally in gold price is leading many with gold-based items to the 790 or so licensed pawnbroking service providers in the country.,"<div class=""inline-img""><div class=""story-image""><p class=""caption"">The pawnbroking business has been the fastest growing segment in the financial services sector in Malaysia. — Bloomberg</p></div></div><div id=""story-body"" class=""story bot-15 relative""><div class=""premium-sign-overlay absolute""></div><p>THE festive period and the rally in gold price is leading many with gold-based items to the 790 or so licensed pawnbroking service providers in the country.</p><p>Newspaper reports stated cash-strapped traders have been pawning their gold ornaments and jewellery to fund their Ramadan bazaar st",,,https://apicms.thestar.com.my/uploads/images/2024/03/30/2619134.jpeg,https://apicms.thestar.com.my/uploads/images/2024/03/30/2619134.jpeg,28,TheStar,http://www.thestar.com.my/news/latest/?tag=Business
Retail REITs stay cautious,https://www.klsescreener.com/v2/news/view/1301975,2024-03-30 07:11:26,2024-03-30 07:11:26,2024-03-30 00:00:00,"While retail real estate investment trust (REIT) players are confident of their prospects for the year ahead, they are wary of the market’s persisting challenges.","<div class=""inline-img""><div class=""story-image""><p class=""caption"">KLCCP Stapled Group chief executive officer Datuk Md Shah Mahmood.</p></div></div><div id=""story-body"" class=""story bot-15 relative""><div class=""premium-sign-overlay absolute""></div><p>WHILE retail real estate investment trust (REIT) players are confident of their prospects for the year ahead, they are wary of the market’s persisting challenges.</p><p>According to Retail Group Malaysia (RGM) in its latest retail industry report, the biggest challenge facing the local retail industry this year remains the rising cost of living ",,,https://apicms.thestar.com.my/uploads/images/2024/03/30/2619138.jpg,https://apicms.thestar.com.my/uploads/images/2024/03/30/2619138.jpg,28,TheStar,http://www.thestar.com.my/news/latest/?tag=Business
"China property woes deepen with Vanke slump, Country Garden halt",https://www.klsescreener.com/v2/news/view/1301973,2024-03-30 07:11:25,2024-03-30 07:11:25,2024-03-30 00:00:00,One of China’s biggest property firms delayed its earnings report while another posted a record profit decline as the nation’s real estate crisis shows no signs of easing.,"<div class=""inline-img""><div class=""story-image""><p class=""caption"">Annual price declines deepened in February for both new and used homes. — Bloomberg</p></div></div><div id=""story-body"" class=""story bot-15 relative""><div class=""premium-sign-overlay absolute""></div><p>ONE of China’s biggest property firms delayed its earnings report while another posted a record profit decline as the nation’s real estate crisis shows no signs of easing.</p><p>Country Garden Holdings Co, once the nation’s top residential builder by sales, made a surprise announcement late Thursday that it will miss a deadline ",,,https://apicms.thestar.com.my/uploads/images/2024/03/30/2619143.jpeg,https://apicms.thestar.com.my/uploads/images/2024/03/30/2619143.jpeg,28,TheStar,http://www.thestar.com.my/news/latest/?tag=Business
Battle for Walt Disney board seats heats up,https://www.klsescreener.com/v2/news/view/1301971,2024-03-30 07:11:24,2024-03-30 07:11:24,2024-03-30 00:00:00,"With less than a week to go before shareholders elect Walt Disney’s board, the race for votes heated up as one institutional investor sided with chief executive officer Bob Iger and the company’s directors, while another backed hedge fund manager Nelson Peltz’s Trian Fund Management.","<div class=""inline-img""><div class=""story-image""><p class=""caption"">Shareholders will vote on April 3 on who will end up sitting on the company’s 12-member board. — Reuters</p></div></div><div id=""story-body"" class=""story bot-15 relative""><div class=""premium-sign-overlay absolute""></div><p>NEW YORK: With less than a week to go before shareholders elect Walt Disney’s board, the race for votes heated up as one institutional investor sided with chief executive officer Bob Iger and the company’s directors, while another backed hedge fund manager Nelson Peltz’s Trian Fund Management.</p><p>The New ",,,https://apicms.thestar.com.my/uploads/images/2024/03/30/2619145.jpeg,https://apicms.thestar.com.my/uploads/images/2024/03/30/2619145.jpeg,28,TheStar,http://www.thestar.com.my/news/latest/?tag=Business
Ensuring sustainability of Malaysia’s food security,https://www.klsescreener.com/v2/news/view/1301969,2024-03-30 07:11:22,2024-03-30 07:11:22,2024-03-30 00:00:00,"Although Malaysia’s food security landscape is not at an alarming level, it has been a continuous concern and there are challenges which need to be addressed to ensure its long-term sustainability.","<div class=""inline-img""><div class=""story-image""><p class=""caption"">Malaysian Research Accelerator for Technology and Innovation chief ecosystem development officer Safuan Zairi.</p></div></div><div id=""story-body"" class=""story bot-15 relative""><div class=""premium-sign-overlay absolute""></div><p>ALTHOUGH Malaysia’s food security landscape is not at an alarming level, it has been a continuous concern and there are challenges which need to be addressed to ensure its long-term sustainability. This is where the small and medium enterprises (SMEs) as the backbone of the economy can assist.</p><p>Ac",,,https://apicms.thestar.com.my/uploads/images/2024/03/30/2619152.jpg,https://apicms.thestar.com.my/uploads/images/2024/03/30/2619152.jpg,28,TheStar,http://www.thestar.com.my/news/latest/?tag=Business
Spilling the beans about cocoa prices,https://www.klsescreener.com/v2/news/view/1301967,2024-03-30 07:11:20,2024-03-30 07:11:20,2024-03-30 00:00:00,"From US$4,200 per tonne at the start of 2024, cocoa prices saw a dizzying spiral to an all-time high of US$10,080 this month.","<div class=""inline-img""><div class=""story-image""><p class=""caption"">CEO Tay says Guan Chong’s orders have been increasing.</p></div></div><div id=""story-body"" class=""story bot-15 relative""><div class=""premium-sign-overlay absolute""></div><p>FROM US$4,200 per tonne at the start of 2024, cocoa prices saw a dizzying spiral to an all-time high of US$10,080 this month.</p><p>For <a href=""/business/marketwatch/stocks/?qcounter=GCB"" target=""_blank"">Guan Chong Bhd</a><a href=""http://charts.thestar.com.my/?s=GCB"" target=""_blank""><img class=""go-chart"" src=""https://cdn.thestar.com.my/Themes/img/chart.png",,,https://apicms.thestar.com.my/uploads/images/2024/03/30/2619137.jpeg,https://apicms.thestar.com.my/uploads/images/2024/03/30/2619137.jpeg,28,TheStar,http://www.thestar.com.my/news/latest/?tag=Business
"Gamuda, Capital A, Cypark, Mudajaya, Poh Huat, Sapura Resources, LYC Healthcare, MKH Palm Oil",https://www.klsescreener.com/v2/news/view/1301947,2024-03-29 23:04:11,2024-04-01 09:34:39,2024-03-29 22:54:50,Here is a brief recap of some business news and corporate announcements that made the headlines on Friday.,"<div class=newsTextDataWrapInner><p>KUALA LUMPUR (March 29): Here is a brief recap of some business news and corporate announcements that made the headlines on Friday:&nbsp;</p></div>

<div class=newsTextDataWrapInner><p>The government has offered <strong>Gamuda Bhd</strong>’s 60%-owned SRS Consortium Sdn Bhd civil works contracts on the first segment of the Penang Light Rail Transit (Penang LRT) and hopes to conclude talks with the company within six months. SRS Consortium is being offered the contract on the so-called single sourcing request-for-proposal mechanism based on the request by t",Edge,,https://assets.theedgemarkets.com/Companies-in-the-news_theedgemalaysia_72.jpg,https://assets.theedgemarkets.com/Companies-in-the-news_theedgemalaysia_72.jpg,52,TheEdge,http://www.theedgemarkets.com/categories/malaysia
"‘Reckless’ to say Padu developed using outdated methods, says DOSM",https://www.klsescreener.com/v2/news/view/1301943,2024-03-29 22:36:03,2024-04-01 09:45:25,2024-03-29 22:26:27,"The Department of Statistics Malaysia (DOSM) said it is “reckless” to state that the Central Database Hub (Padu) was developed using outdated methods, as details of its system and architecture were not disclosed to the public.","<div class=newsTextDataWrapInner><p>KUALA LUMPUR (March 29): The Department of Statistics Malaysia (DOSM) said it is “reckless” to state that the Central Database Hub (Padu) was developed using outdated methods, as details of its system and architecture were not disclosed to the public.</p></div>

<div class=newsTextDataWrapInner><p>“The details of the Padu system and architecture are also not disclosed to the public, so the statement that the Padu system development method is outdated is inappropriate and imprudent,” said the department in a statement on Friday.</p></div>

<div class=news",新闻,,https://assets.theedgemarkets.com/20231229-Padu-ZHD-190_20240104180205_theedgemalaysia_1.jpg,https://assets.theedgemarkets.com/20231229-Padu-ZHD-190_20240104180205_theedgemalaysia_1.jpg,52,TheEdge,http://www.theedgemarkets.com/categories/malaysia
Cypark records 3Q net loss of RM27.7 mil on amortisation expenses adjustments,https://www.klsescreener.com/v2/news/view/1301939,2024-03-29 22:20:47,2024-04-01 09:19:40,2024-03-29 22:11:14,"Cypark Resources Bhd has registered a net loss of RM27.7 million for its third quarter ended Jan 31, 2024 (3QFY2024) on revenue of RM35.89 million.

There are no comparative figures given that the group had changed its financial year end from Oct 31, 2022 to April 30, 2023.","<div class=newsTextDataWrapInner><p>KUALA LUMPUR (March 29): Cypark Resources Bhd has registered a net loss of RM27.7 million for its third quarter ended Jan 31, 2024 (3QFY2024) on revenue of RM35.89 million.</p></div>

<div class=newsTextDataWrapInner><p>There are no comparative figures given that the group had changed its financial year end from Oct 31, 2022 to April 30, 2023.</p></div>

<div class=newsTextDataWrapInner><p>Cypark said the net loss largely stemmed from losses recorded by its waste management and waste-to-energy (WTE) division due to adjustments made on amortisation on tra",,,https://assets.theedgemarkets.com/solar-panels3-cypark_20240329220717_reuters.jpg,https://assets.theedgemarkets.com/solar-panels3-cypark_20240329220717_reuters.jpg,52,TheEdge,http://www.theedgemarkets.com/categories/malaysia
MRCA worries over risk of 'malicious persecution tactics' following 'Allah' socks furore,https://www.klsescreener.com/v2/news/view/1301937,2024-03-29 22:20:46,2024-04-01 08:49:15,2024-03-29 22:10:11,"Malaysia Retail Chain Association (MRCA) expressed concern about potential ""malicious persecution tactics"" in the wake of the controversy surrounding the ""Allah"" socks sold by convenience store chain KK Mart.","<div class=newsTextDataWrapInner><p>KUALA LUMPUR (March 29): Malaysia Retail Chain Association (MRCA) expressed concern about potential ""malicious persecution tactics"" in the wake of the controversy surrounding the ""Allah"" socks sold by convenience store chain KK Mart.</p></div>

<div class=newsTextDataWrapInner><p>""MRCA does not condone any provocative action whether verbal or otherwise, by any individual or corporation that has the capacity to intentionally or unintentionally trigger any public sentiment on sensitive matters relating to race, religion and royalty,” the association said. &n",新闻,,https://assets.theedgemarkets.com/327282708_742789543656475_7093599434231537940_n.jpg,https://assets.theedgemarkets.com/327282708_742789543656475_7093599434231537940_n.jpg,52,TheEdge,http://www.theedgemarkets.com/categories/malaysia
"Repatriate & convert export earnings into ringgit, Samenta tells SMEs",https://www.klsescreener.com/v2/news/view/1301933,2024-03-29 22:10:27,2024-03-29 22:10:27,2024-03-29 22:05:03,KUALA LUMPUR: The Small and Medium Enterprises Association of Malaysia (SAMENTA) has encouraged small and medium enterprises (SMEs) to repatriate and convert export proceeds into ringgit to bolster the local currency. Its president Datuk William Ng said this follows the ...,"<div itemprop=""articleBody"" class=""dable-content-wrapper""><p>KUALA LUMPUR: The Small and Medium Enterprises Association of Malaysia (SAMENTA) has encouraged small and medium enterprises (SMEs) to repatriate and convert export proceeds into ringgit to bolster the local currency. </p><p>Its president Datuk William Ng said this follows the call by Bank Negara Malaysia for businesses to do so as part of a ""whole-of-nation"" approach to ensure the stability of the ringgit. </p><p>""Government-linked companies and government-linked investment companies have already begun doing so, and we are already s",Economy,,https://assets.nst.com.my/images/articles/Sme29_NSTfield_image_listing_featured_v2.var_1711721099.jpg,https://assets.nst.com.my/images/articles/forex_1711721092.jpg,81,NST,https://www.nst.com.my/business/economy
Breaking the mold: How Petronas is championing diversity and inclusion in O&G,https://www.klsescreener.com/v2/news/view/1301931,2024-03-29 22:03:58,2024-04-01 08:49:13,2024-03-29 22:00:11,"The oil and gas (O&G) industry has long struggled with gender diversity, despite its importance for innovation and progress. Women remain vastly under-represented, especially in technical roles and leadership positions, making up only an average 23% of the O&G workforce — one of the lowest numbers of any major sector — and only 20% at the senior level,  according to a report released by the Boston Consulting Group last September.","<div class=newsTextDataWrapInner><p>The oil and gas (O&amp;G) industry has long struggled with gender diversity, despite its importance for innovation and progress. Women remain vastly under-represented, especially in technical roles and leadership positions, making up only an average 23% of the O&amp;G workforce — one of the lowest numbers of any major sector — and only 20% at the senior level, according to a report released by the Boston Consulting Group last September.</p></div>

<div class=newsTextDataWrapInner><p>However, companies like Petronas are demonstrating a strong commitment to ",新闻,,https://assets.theedgemarkets.com/petronas-bc010424thumb_theedgemalaysia.png,https://assets.theedgemarkets.com/petronas-bc010424thumb_theedgemalaysia.png,52,TheEdge,http://www.theedgemarkets.com/categories/malaysia
