title,url,created_at,updated_at,published_date,summary,content,category,author,thumbnail_url,image_url,publisher_id,publisher_name,publisher_url
Govt ready to examine restructuring of existing rice system — minister,https://www.klsescreener.com/v2/news/view/1266205,2024-01-21 20:16:48,2024-01-22 14:00:37,2024-01-21 20:02:56,A LUMPUR (Jan 21): The government is ready to examine the restructuring of the existing rice system to avoid the occurrence of irregularities or cartel syndicates in the country's paddy and rice industry.,"<div class=newsTextDataWrapInner><p>KUALA LUMPUR (Jan 21): The government is ready to examine the restructuring of the existing rice system to avoid the occurrence of irregularities or cartel syndicates in the country's paddy and rice industry.</p></div>

<div class=newsTextDataWrapInner><p>Agriculture and Food Security Minister Datuk Seri Mohamad Sabu said the ministry views&nbsp;seriously, the allegations of the existence of rice cartels or the occurrence of ""games""&nbsp;by certain parties in the sector.</p></div>

<div class=newsTextDataWrapInner><p>""We view this (rice issue) seriously ",,,https://assets.theedgemarkets.com/20230915-rice-supply-at-store-2-SY_20240121195524_theedgemalaysia.jpg,,52,TheEdge,http://www.theedgemarkets.com/categories/malaysia
Labuan’s new power plant project set for Cabinet approval on Jan 24,https://www.klsescreener.com/v2/news/view/1266197,2024-01-21 17:33:39,2024-01-22 13:49:06,2024-01-21 17:19:44,LABUAN (Jan 21): The proposed construction of a new power plant by Petroliam Nasional Bhd (Petronas) to address the persistent power supply disruptions in this duty-free island will be discussed during a Cabinet meeting on Jan 24.,"<div class=newsTextDataWrapInner><p>LABUAN (Jan 21): The proposed construction of a new power plant by Petroliam Nasional Bhd (Petronas) to address the persistent power supply disruptions in this duty-free island will be discussed during a Cabinet meeting on Jan 24.</p></div>

<div class=newsTextDataWrapInner><p>Deputy Prime Minister Datuk Seri Fadillah Yusof said the proposed power plant, spearheaded by Petronas, would be a collaborative effort with the Sabah Energy Commission (SEC) and Sabah Electricity Sdn Bhd (SESB), and that the completion target for the project is set for 2027.</p></di",Edge,,https://assets.theedgemarkets.com/20231108-DPM-n-Min-of-Plant-n-Comm-DS-Fadillah-Yusoff-PIPOC2023-SB2-cropped-MPOB-name_20240121170811_theedgemalaysia.jpg,,52,TheEdge,http://www.theedgemarkets.com/categories/malaysia
Ehsan Bina optimistic about ForestHill project sellout,https://www.klsescreener.com/v2/news/view/1266189,2024-01-21 16:50:53,2024-01-21 16:50:53,2024-01-21 16:43:34,KUALA LUMPUR: Ehsan Bina Group is confident that its ForestHill Residences at Damansara Perdana will achieve 100 per cent take-up rate this year.Chief financial officer Jamie Lai said the positive outlook was based on the overwhelming response to ForestHill Residences....,"<div itemprop=""articleBody"" class=""dable-content-wrapper""><p>KUALA LUMPUR: Ehsan Bina Group is confident that its ForestHill Residences at Damansara Perdana will achieve 100 per cent take-up rate this year.</p><p>Chief financial officer Jamie Lai said the positive outlook was based on the overwhelming response to ForestHill Residences.</p><p>The project has achieved over 70 per cent in sales since its soft launch in January last year for both towers.</p><p>""We believe that the demand for pure residential titled homes set amid nature&#039;s surroundings, with panoramic lake view and good access",Corporate,,https://assets.nst.com.my/images/articles/esan21_NSTfield_image_listing_featured_v2.var_1705826610.jpg,https://assets.nst.com.my/images/articles/ehsab_1705826602.jpg,79,NST,https://www.nst.com.my/business/corporate
Malaysian Bar's complaint against Zaid Ibrahim and two partners in handling Najib’s SRC appeal dismissed,https://www.klsescreener.com/v2/news/view/1266181,2024-01-21 15:03:49,2024-01-22 13:19:05,2024-01-21 14:52:19,KUALA LUMPUR (Jan 21): The Advocates and Solicitors disciplinary board had on Saturday (Jan 20) dismissed a complaint made by the Malaysian Bar against de-facto former law minister Datuk Zaid Ibrahim and his partners Liew Teck Huat and Rueben Mathiavarnam in their handling of former prime minister Datuk Seri Najib Razak’s SRC International Sdn Bhd case at the Federal Court.,"<div class=newsTextDataWrapInner><p>KUALA LUMPUR (Jan 21): The Advocates and Solicitors disciplinary board had on Saturday (Jan 20) dismissed a complaint made by the Malaysian Bar against de-facto former law minister Datuk Zaid Ibrahim and his partners Liew Teck Huat and Rueben Mathiavarnam in their handling of former prime minister Datuk Seri Najib Razak’s SRC International Sdn Bhd case at the Federal Court.</p></div>

<div class=newsTextDataWrapInner><p>The complaint was dismissed by former Court of Appeal president Tan Sri Rohana Yusof.</p></div>

<div class=newsTextDataWrapInner><p>Zai",Edge,,https://assets.theedgemarkets.com/Zaid-Ibrahim-cropped-enlarged120pct_20240121143432_zaiduntukrakyat@facebook.jpg,,52,TheEdge,http://www.theedgemarkets.com/categories/malaysia
"Devaki Krishnan, first Malaysian woman elected to public office, passes away at 100",https://www.klsescreener.com/v2/news/view/1266175,2024-01-21 14:33:43,2024-01-22 13:17:20,2024-01-21 14:10:29,"KUALA LUMPUR (Jan 21): Tan Sri Devaki Krishnan, the first Malaysian woman to be elected to public office, died on Saturday (Jan 20) night at the age of 100.","<div class=newsTextDataWrapInner><p>KUALA LUMPUR (Jan 21): Tan Sri Devaki Krishnan, the first Malaysian woman to be elected to public office, died on Saturday (Jan 20) night at the age of 100.</p></div>

<div class=newsTextDataWrapInner><p>The news of her passing was shared by her grandson&nbsp;Deputy Entrepreneur and Cooperatives Development Minister Datuk R&nbsp;Ramanan in a Facebook post, early morning on Sunday.</p></div>

<div class=newsTextDataWrapInner><p>“Her loss is irreplaceable. The memories will continue to be with us all. May her soul rest in peace,"" he said.</p></div><div cla",新闻,,https://assets.theedgemarkets.com/First-Malaysian-woman-to-be-elected-to-public-office-Devaki-Krishnan-dies-at-100_20240121140330_bernama.jpg,,52,TheEdge,http://www.theedgemarkets.com/categories/malaysia
Bursa Malaysia likely to stay in consolidation mode next week  ,https://www.klsescreener.com/v2/news/view/1266167,2024-01-21 14:01:06,2024-01-21 14:01:06,2024-01-21 13:59:20,"KUALA LUMPUR: Bursa Malaysia is expected to stay in consolidation mode with a slight positive bias next week, and the benchmark index is seen as hovering in the 1,475-1,495 range.Rakuten Trade equity research vice-president Thong Pak Leng said economists ...","<div itemprop=""articleBody"" class=""dable-content-wrapper""><p>KUALA LUMPUR: Bursa Malaysia is expected to stay in consolidation mode with a slight positive bias next week, and the benchmark index is seen as hovering in the 1,475-1,495 range.</p><p>Rakuten Trade equity research vice-president Thong Pak Leng said economists are predicting that Bank Negara Malaysia will maintain the Overnight Policy Rate at three per cent at least until end-2025.</p><p>""We believe this will instil confidence in the improving economy, providing greater stability in corporate earnings and, in turn, enhancing the fun",Corporate,,https://assets.nst.com.my/images/articles/bosa21_NSTfield_image_listing_featured_v2.var_1705816756.jpg,https://assets.nst.com.my/images/articles/794453bursa_1705816750.jpg,79,NST,https://www.nst.com.my/business/corporate
Ringgit likely to trade at 4.70 level next week,https://www.klsescreener.com/v2/news/view/1266169,2024-01-21 14:01:12,2024-01-21 14:01:12,2024-01-21 13:55:54,"KUALA LUMPUR: The ringgit is likely to continue trading at the 4.70 level against the US dollar next week, underpinned by an unfavourable risk environment marked by geopolitical uncertainty, the waning US Federal Reserve (Fed) rate cut expectations and China&#039;s ...","<div itemprop=""articleBody"" class=""dable-content-wrapper""><p>KUALA LUMPUR: The ringgit is likely to continue trading at the 4.70 level against the US dollar next week, underpinned by an unfavourable risk environment marked by geopolitical uncertainty, the waning US Federal Reserve (Fed) rate cut expectations and China&#039;s lack of definitive stimulus measures.</p><p>Kenanga Research said, nevertheless, the ringgit may benefit from a potential hawkish shift in the Bank of Japan&#039;s monetary policy direction, and if the US fourth-quarter 2023 (4Q 2023) gross domestic product (GDP) data unfo",Economy,,https://assets.nst.com.my/images/articles/reget21_NSTfield_image_listing_featured_v2.var_1705816548.jpg,https://assets.nst.com.my/images/articles/walletringgit_1705816541.jpg,81,NST,https://www.nst.com.my/business/economy
HP Smart Tank for fast-growing microbusinesses,https://www.klsescreener.com/v2/news/view/1266165,2024-01-21 12:20:41,2024-01-21 12:20:41,2024-01-21 12:17:15,"KUALA LUMPUR: In light of today&#039;s business owner priorities, the ability to provide seamless, smart and sustainable printing on the go with high capacity and performance, can be critical to the smooth running of fast-growing microbusinesses everywhere.Hence, HP ...","<div itemprop=""articleBody"" class=""dable-content-wrapper""><p>KUALA LUMPUR: In light of today&#039;s business owner priorities, the ability to provide seamless, smart and sustainable printing on the go with high capacity and performance, can be critical to the smooth running of fast-growing microbusinesses everywhere.</p><p>Hence, HP Malaysia managing director Alex Tan said technologies like the HP Smart Tank and HP Smart App can help remove complexity by providing a smart print experience that works from anywhere, anytime and on any device. </p><p>""The HP Smart Tank 580 all-in-one printer offe",Corporate,,https://assets.nst.com.my/images/articles/hprint21_NSTfield_image_listing_featured_v2.var_1705810632.jpg,https://assets.nst.com.my/images/articles/smart_tank_1705810625.jpg,79,NST,https://www.nst.com.my/business/corporate
PM: Not easy to investigate high-profile individuals,https://www.klsescreener.com/v2/news/view/1266163,2024-01-21 12:20:22,2024-01-22 13:17:18,2024-01-21 12:14:10,"KLANG (Jan 21): It is not easy to conduct investigations on high-profile figures, Prime Minister Datuk Seri Anwar Ibrahim said.","<div class=newsTextDataWrapInner><p>KLANG (Jan 21): It is not easy to conduct investigations on high-profile figures, Prime Minister Datuk Seri Anwar Ibrahim said.&nbsp;</p></div>

<div class=newsTextDataWrapInner><p>As such, he urged the public to support the government's efforts to investigate top individuals, including those with the title of Tun, in connection with the misappropriation of government funds.</p></div>

<div class=newsTextDataWrapInner><p>“We will go after the crooks, I don’t care… When we want to take action (against these individuals), the people get angry, saying that ",新闻,,https://assets.theedgemarkets.com/20231108-PM-DS-Anwar-Ib-PIPOC2023-KLCC-SB5-CROP_20240121120304_theedgemalaysia.jpg,,52,TheEdge,http://www.theedgemarkets.com/categories/malaysia
Plantation and Commodities Ministry discusses ways to help rubber glove sector,https://www.klsescreener.com/v2/news/view/1266159,2024-01-21 11:20:32,2024-01-21 11:20:32,2024-01-21 11:17:54,"KUALA LUMPUR: Malaysian rubber glove industry is now operating amid a challenging export environment, according to Plantation and Commodities Minister Datuk Seri Johari Abdul Ghani.Local companies were facing stiff competition, especially from countries that have access to cheaper energy, ...","<div itemprop=""articleBody"" class=""dable-content-wrapper""><p>KUALA LUMPUR: Malaysian rubber glove industry is now operating amid a challenging export environment, according to Plantation and Commodities Minister Datuk Seri Johari Abdul Ghani.</p><p>Local companies were facing stiff competition, especially from countries that have access to cheaper energy, Johari added.</p><p>He disclosed this in his post on X after a meeting with the Malaysian Rubber Glove Manufacturers Association on measures to resolve critical issues towards ensuring the industry&#039;s ability to meet global challenges las",Economy,,https://assets.nst.com.my/images/articles/plante21_NSTfield_image_listing_featured_v2.var_1705807071.jpg,https://assets.nst.com.my/images/articles/z0501johari02_1705807064.jpg,81,NST,https://www.nst.com.my/business/economy
"UDA continues to strengthen digitisation, sustainability of cities",https://www.klsescreener.com/v2/news/view/1266157,2024-01-21 11:16:46,2024-01-22 13:17:15,2024-01-21 11:03:44,"KUALA LUMPUR (Jan 20): Real estate developer, asset management, facility and hospitality company UDA Holdings Bhd took proactive steps to strengthen digitisation and sustainability through the organisation of the GreenCity Augmented Reality (AR) iPad Challenge: Shaping Sustainable Urban Cities.","<div class=newsTextDataWrapInner><p>KUALA LUMPUR (Jan 21): Real estate developer, asset management, facility and hospitality company UDA Holdings Bhd took proactive steps to strengthen digitisation and sustainability through the organisation of the GreenCity Augmented Reality (AR) iPad Challenge: Shaping Sustainable Urban Cities.</p></div>

<div class=newsTextDataWrapInner><p>The challenge is a sustainable urban design competition in AR aimed at giving new exposure and experience to participants to take advantage of interactive technology in the field of design.</p></div>

<div class=newsT",新闻,,https://assets.theedgemarkets.com/Uda-Holdings-Bhd-latest-logo-Thurs09032023-email_20240121105405_udaholdingsbhd.jpg,,52,TheEdge,http://www.theedgemarkets.com/categories/malaysia
Exports of kimchi hit record high in 2023 amid global k-content popularity,https://www.klsescreener.com/v2/news/view/1266155,2024-01-21 11:00:41,2024-01-21 11:00:41,2024-01-21 10:53:53,"SEOUL: South Korea&#039;s exports of kimchi set a new record in 2023 amid the rising popularity of Korean entertainment content around the globe, data showed Sunday.Outbound shipments of kimchi, a traditional Korean side dish typically made from fermented cabbage, ...","<div itemprop=""articleBody"" class=""dable-content-wrapper""><p>SEOUL: South Korea&#039;s exports of kimchi set a new record in 2023 amid the rising popularity of Korean entertainment content around the globe, data showed Sunday.</p><p>Outbound shipments of kimchi, a traditional Korean side dish typically made from fermented cabbage, shot up 7.1 percent to 44,041 tonnes, according to the data compiled by the Korea Customs Service.</p><p>The latest figure hovers above the previous record set in 2021, when the export volume reached 42,544 tonnes.</p><p>In terms of value, exports came to US$155.6 mi",Corporate,,https://assets.nst.com.my/images/articles/kimci21_NSTfield_image_listing_featured_v2.var_1705805630.jpg,https://assets.nst.com.my/images/articles/south_korea_flag_1705805623.jpg,79,NST,https://www.nst.com.my/business/corporate
oneworld alliance opens first premium lounge at Incheon airport,https://www.klsescreener.com/v2/news/view/1266153,2024-01-21 10:16:45,2024-01-22 13:04:16,2024-01-21 10:12:53,"SEOUL (Jan 21): oneworld, a global alliance of 13 member airlines including Malaysia Airlines Bhd, unveiled its first branded airport lounge in Incheon International Airport here on Saturday (Jan 20).","<div class=newsTextDataWrapInner><p>SEOUL (Jan 21): oneworld, a global alliance of 13 member airlines including Malaysia Airlines Bhd, unveiled its first branded airport lounge in Incheon International Airport here on Saturday (Jan 20).</p></div>

<div class=newsTextDataWrapInner><p>The opening coincides with the alliance's 25th anniversary celebration this year. Swiss ground services provider Swissport International AG has been appointed to manage the oneworld lounge.</p></div>

<div class=newsTextDataWrapInner><p>""With oneworld celebrating its 25th anniversary this year, we are proud to ",新闻,,https://assets.theedgemarkets.com/20240120-oneworld-unveils-1st-branded-airport-lounge-Incheon-Intl-Airport-Seoul-px-SiewLi-crp_20240121100300_theedgemalaysia.jpg,,52,TheEdge,http://www.theedgemarkets.com/categories/malaysia
Horological renaissance,https://www.klsescreener.com/v2/news/view/1266151,2024-01-21 09:35:21,2024-01-22 13:01:33,2024-01-21 09:30:00,"KUALA LUMPUR (Jan 21): Bernard R Fleury, the CEO of Edouard Koehn, successfully acquired the watch company in 2015 and breathed new life into it by 2020. Navigating the challenges faced by the 133-year-old brand, he has somehow found a formula to captivate a diverse audience by rolling out watches that appeal to both young collectors and seasoned connoisseurs. Drawing on his experience in revitalising the Vulcain brand during his tenure as its former CEO, where he achieved unprecedented success, Fleury leverages this expertise to build Edouard Koehn’s portfolio, clout and connections. Alongside his two children, Axel and Allissia, they methodically contribute to the brand’s growth.","<div class=newsTextDataWrapInner><p>KUALA LUMPUR (Jan 21): Bernard R Fleury, the CEO of Edouard Koehn, successfully acquired the watch company in 2015 and breathed new life into it by 2020. Navigating the challenges faced by the 133-year-old brand, he has somehow found a formula to captivate a diverse audience by rolling out watches that appeal to both young collectors and seasoned connoisseurs. Drawing on his experience in revitalising the Vulcain brand during his tenure as its former CEO, where he achieved unprecedented success, Fleury leverages this expertise to build Edouard Koehn’s portfo",Edge,,https://assets.theedgemarkets.com/TEM_Options_Highlights_1507.jpg,,54,TheEdge,http://www.theedgemarkets.com/options/edge
Embarking on a new journey,https://www.klsescreener.com/v2/news/view/1266149,2024-01-21 09:16:45,2024-01-22 12:49:07,2024-01-21 09:00:00,"KUALA LUMPUR (Jan 21): In the early days, while JRK Group’s core business was still growing, the founder and managing director Datuk Seri Jerry Kwan was already actively growing its land bank. The first plot of land in Semenyih was purchased in 2017. Then, between 2017 and 2019, the company bought four plots of land in Bukit Jalil, PJ South, Puchong and Damansara Kuala Lumpur, with a combined land size of 20 acres.","<div class=newsTextDataWrapInner><p>KUALA LUMPUR (Jan 21): In the early days, while JRK Group’s core business was still growing, the founder and managing director Datuk Seri Jerry Kwan was already actively growing its land bank. The first plot of land in Semenyih was purchased in 2017. Then, between 2017 and 2019, the company bought four plots of land in Bukit Jalil, PJ South, Puchong and Damansara Kuala Lumpur, with a combined land size of 20 acres.&nbsp;</p></div>

<div class=newsTextDataWrapInner><p>With plans to fully transform JRK Group from a construction player into a property develop",,,https://assets.theedgemarkets.com/TEM_CC_Highlights_1507.jpg,,54,TheEdge,http://www.theedgemarkets.com/options/edge
