title,url,created_at,updated_at,published_date,summary,content,category,author,thumbnail_url,image_url,publisher_id,publisher_name,publisher_url
Education Ministry to discuss with Communications Ministry on TikTok acct ownership by children under 13,https://www.klsescreener.com/v2/news/view/1273085,2024-02-04 23:05:40,2024-02-05 16:00:39,2024-02-04 22:56:34,GEORGE TOWN (Feb 4): The Ministry of Education (MOE) will discuss with the Ministry of Communications on the issue of TikTok account ownership by children under 13.,"<div class=newsTextDataWrapInner><p>GEORGE TOWN (Feb 4): The Ministry of Education (MOE) will discuss with the Ministry of Communications on the issue of TikTok account ownership by children under 13.</p></div>

<div class=newsTextDataWrapInner><p>Minister Fadhlina Sidek said the ministry needs&nbsp;to get complete information before issuing any guidelines on the matter.</p></div>

<div class=newsTextDataWrapInner><p>""We will seek opinions and coordination from the Communications Minister (Fahmi Fadzil) because I need to get complete information and guidance from him to assess its potentia",Edge,,https://assets.theedgemarkets.com/20230309-Min-Edu-Fadhlina-Sidek-Parliament-ZHD-2031_20240204224117_theedgemalaysia.jpg,https://assets.theedgemarkets.com/20230309-Min-Edu-Fadhlina-Sidek-Parliament-ZHD-2031_20240204224117_theedgemalaysia.jpg,52,TheEdge,http://www.theedgemarkets.com/categories/malaysia
Vincent Tan-linked HR Owen the latest UK retailer for Lotus,https://www.klsescreener.com/v2/news/view/1273083,2024-02-04 22:22:21,2024-02-04 22:22:21,2024-02-04 22:08:00,"KUALA LUMPUR: H.R. Owen, the United Kingdom's (UK) leading luxury automotive dealer group, has added Lotus to its line-up of the world's most iconic luxury and performance car brands. ","<div class=""inline-img""><div class=""story-image""><p class=""caption"">Photo courtesy of HR Owen Lotus</p></div></div><div id=""story-body"" class=""story bot-15 relative""><p>KUALA LUMPUR: H.R. Owen, the United Kingdom's (UK) leading luxury automotive dealer group, has added Lotus to its line-up of the world's most iconic luxury and performance car brands.</p><p>This partnership marks a significant milestone, as H.R. Owen becomes the newest retailer for Lotus in the UK, introducing models like Evija, Emira, Eletre, and the newly unveiled Emeya to its discerning clientele.</p><p>""At H.R. Owen, it’s t",,,https://apicms.thestar.com.my/uploads/images/2024/02/04/2527762.jpg,https://apicms.thestar.com.my/uploads/images/2024/02/04/2527762.jpg,28,TheStar,http://www.thestar.com.my/news/latest/?tag=Business
"IGP: Low salaries, individual attitudes among factors for graft among police officers and personnel",https://www.klsescreener.com/v2/news/view/1273073,2024-02-04 20:46:46,2024-02-05 15:49:18,2024-02-04 20:38:35,SHAH ALAM (Feb 4): The Inspector General of Police (IGP) Tan Sri Razaruddin Husain does not deny that low salaries and individual attitudes are among contributing factors to police officers and personnel being involved in corruption.,"<div class=newsTextDataWrapInner><p>SHAH ALAM (Feb 4): The Inspector General of Police (IGP)&nbsp;Tan Sri Razaruddin Husain&nbsp;does&nbsp;not deny&nbsp;that low salaries and individual attitudes are among contributing factors to police officers and personnel being involved in corruption.</p></div>

<div class=newsTextDataWrapInner><p>Apart from those factors, several other factors need to be looked at, in order to produce police officers and members who are clean and have integrity.</p></div>

<div class=newsTextDataWrapInner><p>""I acknowledge that salary is one of the factors. I take thi",,,https://assets.theedgemarkets.com/12102023-Georgetown-IGP-Tan Sri Razarudin-Husain-Batu-Uban-Penang_20240204202321_bernama.jpg,https://assets.theedgemarkets.com/12102023-Georgetown-IGP-Tan Sri Razarudin-Husain-Batu-Uban-Penang_20240204202321_bernama.jpg,52,TheEdge,http://www.theedgemarkets.com/categories/malaysia
Bukit Aman to record Tony Pua’s statement on Monday on his Facebook comment allegedly insulting the royal institution,https://www.klsescreener.com/v2/news/view/1273067,2024-02-04 20:03:46,2024-02-05 15:49:15,2024-02-04 19:54:39,"KUALA LUMPUR (Feb 4): Social activist Tony Pua has been summoned by the police to Bukit Aman at 1pm on Monday (Feb 5) to record his statement in connection with an alleged comment that he had posted on his Facebook account with regard to the reduction of sentence for former prime minister Datuk Seri Najib Tun Razak, which has been deemed as an insult to the royal institution.","<div class=newsTextDataWrapInner><p>KUALA LUMPUR (Feb 4): Social activist Tony Pua has been summoned by the police to Bukit Aman at 1pm on Monday (Feb 5) to record his statement in connection with an alleged comment that he had posted on his Facebook account with regard to the reduction of sentence for former prime minister Datuk Seri Najib Tun Razak, which has been deemed as an insult to the royal institution.</p></div>

<div class=newsTextDataWrapInner><p>Inspector-General of Police (IGP) Tan Sri Razarudin Husain said police have received reports related to Tony Pua's comments, which is al",,,https://assets.theedgemarkets.com/tony-pua-2_20240204195314_theedgemalaysia.jpg,https://assets.theedgemarkets.com/tony-pua-2_20240204195314_theedgemalaysia.jpg,52,TheEdge,http://www.theedgemarkets.com/categories/malaysia
TNB and Japan&#039;s IHI in co-firing project joint study to advance energy transition agenda,https://www.klsescreener.com/v2/news/view/1273053,2024-02-04 16:50:06,2024-02-04 16:50:06,2024-02-04 16:48:24,"KUALA LUMPUR: Tenaga Nasional Bhd (TNB) has embarked on a joint study with Japan&#039;s IHI Corporation (IHI) to pioneer a small-scale co-firing project at its two thermal power plants in Lumut, Perak, and Port Dickson, Negeri Sembilan.The utility ...","<div itemprop=""articleBody"" class=""dable-content-wrapper""><p>KUALA LUMPUR: Tenaga Nasional Bhd (TNB) has embarked on a joint study with Japan&#039;s IHI Corporation (IHI) to pioneer a small-scale co-firing project at its two thermal power plants in Lumut, Perak, and Port Dickson, Negeri Sembilan.</p><p>The utility firm said it is undertaking the project through wholly owned subsidiaries TNB Power Generation Sdn Bhd and TNB Fuel Services Sdn Bhd.</p><p>IHI has extensive experience in converting conventional fuel to carbon neutral fuel, including biomass and ammonia at several plants of its clie",Economy,,https://assets.nst.com.my/images/articles/tnb04_NSTfield_image_listing_featured_v2.var_1707036501.jpg,https://assets.nst.com.my/images/articles/HQ031022EZ101_%282%29_1707036492.jpg,81,NST,https://www.nst.com.my/business/economy
Fahmi: PKR open to criticism but party members must also be ready to be reprimanded,https://www.klsescreener.com/v2/news/view/1273051,2024-02-04 16:48:33,2024-02-05 14:45:26,2024-02-04 16:34:10,"KUALA LUMPUR (Feb 4): Parti Keadilan Rakyat (PKR) is open to accepting criticism from its members, but those who make a criticism should also be ready to be reprimanded by the party, said PKR information chief Fahmi Fadzil.","<div class=newsTextDataWrapInner><p>KUALA LUMPUR (Feb 4): Parti Keadilan Rakyat (PKR) is open to accepting criticism from its members, but those who make a criticism should also be ready to be reprimanded by the party, said PKR information chief Fahmi Fadzil.</p></div>

<div class=newsTextDataWrapInner><p>Citing the example of PKR's reprimand against Pasir Gudang Member of Parliament&nbsp;Hassan Karim, who was seen as meddling in the affairs of other parties in the Unity Government recently, Fahmi insisted that reprimanding is normal and is a practice in the party.</p></div>

<div class=ne",新闻,,https://assets.theedgemarkets.com/Comm-Min-Fahmi-Fadzil-KLCC-Sun04022024-Youth-Empowemt-Fair-2024-officiation_20240204161523_bernama.jpg,https://assets.theedgemarkets.com/Comm-Min-Fahmi-Fadzil-KLCC-Sun04022024-Youth-Empowemt-Fair-2024-officiation_20240204161523_bernama.jpg,52,TheEdge,http://www.theedgemarkets.com/categories/malaysia
Fahmi reminds influencers to self-regulate when handling podcasts,https://www.klsescreener.com/v2/news/view/1273045,2024-02-04 16:18:34,2024-02-05 15:02:41,2024-02-04 15:58:33,"KUALA LUMPUR (Feb 4): Communications Minister Fahmi Fadzil has reminded influencers to self-regulate and be careful when handling podcasts or uploading content on social media, so as not to have a negative impact on the community.","<div class=newsTextDataWrapInner><p>KUALA LUMPUR (Feb 4): Communications Minister Fahmi Fadzil has reminded influencers to self-regulate and be careful when handling podcasts or uploading content on social media, so as not to have a negative impact on the community.</p></div>

<div class=newsTextDataWrapInner><p>He said the government would also carry out monitoring from time to time and study any action that needs to be taken against those who upload non-constructive content.</p></div>

<div class=newsTextDataWrapInner><p>“For now, we do not see any need (to take action). I agree with Kha",新闻,,https://assets.theedgemarkets.com/20230216-Min-of-Comm-n-Digital-Fahmi-Fadzil-Parliament-ZHD-9370_20240204154610_theedgemalaysia.jpg,https://assets.theedgemarkets.com/20230216-Min-of-Comm-n-Digital-Fahmi-Fadzil-Parliament-ZHD-9370_20240204154610_theedgemalaysia.jpg,52,TheEdge,http://www.theedgemarkets.com/categories/malaysia
TNB embarks on co-firing project joint study with Japan's IHI to advance energy transition agenda,https://www.klsescreener.com/v2/news/view/1273041,2024-02-04 15:31:51,2024-02-05 14:45:23,2024-02-04 15:27:02,"KUALA LUMPUR (Feb 4): Tenaga Nasional Bhd (TNB) has embarked on a joint study with Japan’s IHI Corporation (IHI) to pioneer a small-scale co-firing project at its two thermal power plants in Lumut, Perak, and Port Dickson, Negeri Sembilan.","<div class=newsTextDataWrapInner><p>KUALA LUMPUR (Feb 4): Tenaga Nasional Bhd (TNB) has embarked on a joint study with Japan’s IHI Corporation (IHI) to pioneer a small-scale co-firing project&nbsp;at its two thermal power plants in Lumut, Perak, and Port Dickson, Negeri Sembilan.</p></div>

<div class=newsTextDataWrapInner><p>The utility firm said it is undertaking the project through wholly owned subsidiaries TNB Power Generation Sdn Bhd and TNB Fuel Services Sdn Bhd.</p></div>

<div class=newsTextDataWrapInner><p>IHI has extensive experience in converting conventional fuel to carbon neut",新闻,,https://assets.theedgemarkets.com/TNB-2_20240204151827_tnb.com_.my_.jpg,https://assets.theedgemarkets.com/TNB-2_20240204151827_tnb.com_.my_.jpg,52,TheEdge,http://www.theedgemarkets.com/categories/malaysia
18 years ago the ringgit was trading at a high of 2.1772 against the Singapore dollar,https://www.klsescreener.com/v2/news/view/1273037,2024-02-04 15:00:15,2024-02-04 15:00:15,2024-02-04 14:50:43,"KUALA LUMPUR: The ringgit which has recently hit new lows against the Singapore dollar, was trading at 2.1772 against the Singapore dollar about 18 years ago.On Friday, it hit an all-time low of 3.5418 against the Singapore dollar.According to Google Finance, ...","<div itemprop=""articleBody"" class=""dable-content-wrapper""><p>KUALA LUMPUR: The ringgit which has recently hit new lows against the Singapore dollar, was trading at 2.1772 against the Singapore dollar about 18 years ago.</p><p>On Friday, it hit an <a href=""https://www.nst.com.my/business/economy/2024/02/1009228/ringgit-hits-new-all-time-low-35418-against-singapore-dollar"">all-time low</a> of 3.5418 against the Singapore dollar.</p><p>According to Google Finance, the ringgit hit a high of 2.1772 against the Singapore dollar on April 14, 2006.</p><p>This was against a backdrop of 5.9 per cent gro",Economy,,https://assets.nst.com.my/images/articles/au04_NSTfield_image_listing_featured_v2.var_1707029439.jpg,https://assets.nst.com.my/images/articles/sg_dollar_1707029431.jpg,81,NST,https://www.nst.com.my/business/economy
China&#039;s Country Garden says over 30 projects have local government support,https://www.klsescreener.com/v2/news/view/1273031,2024-02-04 14:20:33,2024-02-04 14:20:33,2024-02-04 14:18:42,"HONG KONG - Cash-strapped developer Country Garden said on Saturday more than 30 of its projects had been listed by Chinese local governments as suitable for financing support, as authorities aim to inject liquidity into the crisis-hit sector.China&#039;s largest ...","<div itemprop=""articleBody"" class=""dable-content-wrapper""><p>HONG KONG - Cash-strapped developer Country Garden said on Saturday more than 30 of its projects had been listed by Chinese local governments as suitable for financing support, as authorities aim to inject liquidity into the crisis-hit sector.</p><p>China&#039;s largest private property developer said in a statement to Reuters that its projects were included on the so-called ""white lists"" of the provinces of Heinan, Hubei, Sichuan, Shandong and the municipality Chongqing. The developer, which defaulted on its offshore debt late last ",Economy,,https://assets.nst.com.my/images/articles/cg04_NSTfield_image_listing_featured_v2.var_1707027519.jpg,https://assets.nst.com.my/images/articles/CHINA-PROPERTY_DEBT-COUNTRY_GARDEN_1707027508.jpg,81,NST,https://www.nst.com.my/business/economy
"Bidor depot breakout: 41 escapees recaptured so far, says police",https://www.klsescreener.com/v2/news/view/1273029,2024-02-04 14:20:22,2024-02-05 14:18:56,2024-02-04 14:10:17,"IPOH (Feb 4): Two more illegal immigrants who fled from the Bidor temporary Immigration depot last Thursday (Feb 1) have successfully been recaptured, bringing the total number of arrests to 41 as of 7am on Sunday.","<div class=newsTextDataWrapInner><p>IPOH (Feb 4): Two more illegal immigrants who fled from the Bidor temporary Immigration depot last Thursday (Feb 1) have successfully been recaptured, bringing the total number of arrests to 41 as of 7am on Sunday.</p></div>

<div class=newsTextDataWrapInner><p>Perak police chief Datuk Seri Mohd Yusri Hassan Basri confirmed the matter and said the two escapees were detained early Sunday morning.</p></div>

<div class=newsTextDataWrapInner><p>He said all those detained were Rohingya escapees and had been sent to the Tapah district police headquarters for ",新闻,,https://assets.theedgemarkets.com/Prison-Jail-Arrest_20240204140653_theedgemalaysia.jpg,https://assets.theedgemarkets.com/Prison-Jail-Arrest_20240204140653_theedgemalaysia.jpg,52,TheEdge,http://www.theedgemarkets.com/categories/malaysia
Vincent Tan-linked HR Owen latest UK retailer for Lotus cars,https://www.klsescreener.com/v2/news/view/1273027,2024-02-04 14:20:21,2024-02-05 14:15:25,2024-02-04 13:57:59,"KUALA LUMPUR (Feb 4): HR Owen, the United Kingdom's leading luxury automotive dealer group, has added Lotus to its line-up of the world's most iconic luxury and performance car brands.","<div class=newsTextDataWrapInner><p>KUALA LUMPUR (Feb 4): HR Owen, the United Kingdom's&nbsp;leading luxury automotive dealer group, has added Lotus to its line-up of the world's most iconic luxury and performance car brands.&nbsp;</p></div>

<div class=newsTextDataWrapInner><p>This partnership marks a significant milestone, as HR Owen becomes the newest retailer for Lotus in the UK, introducing models like Evija, Emira, Eletre, and the newly unveiled Emeya to its discerning clientele.</p></div>

<div class=newsTextDataWrapInner><p>""At HR&nbsp;Owen, it’s the vision of Berjaya Group founder",,,https://assets.theedgemarkets.com/Vincent-Tan-linked-HR-Owen-UK-retailer-Lotus-cars-svdoff-Bernama_20240204134926_hr-owen.jpg,https://assets.theedgemarkets.com/Vincent-Tan-linked-HR-Owen-UK-retailer-Lotus-cars-svdoff-Bernama_20240204134926_hr-owen.jpg,52,TheEdge,http://www.theedgemarkets.com/categories/malaysia
Govt completing LT-LEDS document to ensure net zero carbon emission by 2050,https://www.klsescreener.com/v2/news/view/1273019,2024-02-04 13:10:35,2024-02-04 13:10:35,2024-02-04 13:05:08,"KUALA LUMPUR: The government is in the process of completing the Long-Term Low Emission Development Strategies (LT-LEDS) document to ensure a net zero carbon emission can be achieved as targetted by 2050,  said Minister of Natural Resources and Environmental Sustainability Nik ...","<div itemprop=""articleBody"" class=""dable-content-wrapper""><p>KUALA LUMPUR: The government is in the process of completing the Long-Term Low Emission Development Strategies (LT-LEDS) document to ensure a net zero carbon emission can be achieved as targetted by 2050,  said Minister of Natural Resources and Environmental Sustainability Nik Nazmi Nik Ahmad.</p><p>He said the preparation of the document is important to assess the country&#039;s performance in achieving the goal in addition to helping draw up appropriate and effective plans.</p><p>""There is an improvement in terms of our journey tow",Corporate,,https://assets.nst.com.my/images/articles/nn04_NSTfield_image_listing_featured_v2.var_1707023103.jpg,https://assets.nst.com.my/images/articles/Nik_Nazmi_Nik_Ahmad_280124_1707023095.jpg,79,NST,https://www.nst.com.my/business/corporate
"Over 1,000 new cooperatives registered last year - Ewon",https://www.klsescreener.com/v2/news/view/1273017,2024-02-04 13:10:34,2024-02-04 13:10:34,2024-02-04 13:01:45,"SIPITANG: The Cooperatives Commission of Malaysia (SKM) recorded a total of 1,001 new cooperatives nationwide last year, Entrepreneur Development and Cooperatives Minister Datuk Ewon Benedick said.He said this number reflects the community&#039;s awareness of the importance of cooperatives because, ...","<div itemprop=""articleBody"" class=""dable-content-wrapper""><p>SIPITANG: The Cooperatives Commission of Malaysia (SKM) recorded a total of 1,001 new cooperatives nationwide last year, Entrepreneur Development and Cooperatives Minister Datuk Ewon Benedick said.</p><p>He said this number reflects the community&#039;s awareness of the importance of cooperatives because, in previous years, only about 600 to 700 new cooperatives were registered annually.</p><p>""The Entrepreneur Development and Cooperatives Ministry (KUSKOP), through SKM and the Cooperative Institute of Malaysia (IKMa), organised coop",Corporate,,https://assets.nst.com.my/images/articles/coop04_NSTfield_image_listing_featured_v2.var_1707022902.jpg,https://assets.nst.com.my/images/articles/30224ben_1707022895.jpg,79,NST,https://www.nst.com.my/business/corporate
Singapore banking tycoon UOB&#039;s Wee Cho Yaw dead at 95,https://www.klsescreener.com/v2/news/view/1273015,2024-02-04 13:00:34,2024-02-04 13:00:34,2024-02-04 12:58:58,"KUALA LUMPUR: Singapore banking tycoon and chairman emeritus and adviser of United Overseas Bank (UOB) Group, Wee Cho Yaw, has passed away at the age of 95.In a statement, UOB said during his leadership spanning over five decades, Wee played ...","<div itemprop=""articleBody"" class=""dable-content-wrapper""><p>KUALA LUMPUR: Singapore banking tycoon and chairman emeritus and adviser of United Overseas Bank (UOB) Group, Wee Cho Yaw, has passed away at the age of 95.</p><p>In a statement, UOB said during his leadership spanning over five decades, Wee played a pivotal role in the transformative growth of UOB, propelling it from a single-branch bank to a formidable regional entity, with a presence in 19 countries and territories.</p><p>The bank witnessed a substantial growth in assets, soaring from $2.8 billion to over US$253 billion by the tim",Corporate,,https://assets.nst.com.my/images/articles/uob04_NSTfield_image_listing_featured_v2.var_1707022734.jpg,https://assets.nst.com.my/images/articles/UOB_1707022727.jpg,79,NST,https://www.nst.com.my/business/corporate
Malaysia on track to reduce dependency on imported red onions,https://www.klsescreener.com/v2/news/view/1273057,2024-02-04 17:05:21,2024-02-05 14:15:22,2024-02-04 12:25:28,KUALA LUMPUR (Feb 4): Agriculture and Food Securities Minister Datuk Seri Mohamad Sabu said that the country is on the right track to reduce its dependence on imported red onions.,"<div class=newsTextDataWrapInner><p>KUALA LUMPUR (Feb 4): Agriculture and Food Securities Minister Datuk Seri Mohamad Sabu said that the country is on the right track to reduce its dependence on imported red onions.&nbsp;</p></div>

<div class=newsTextDataWrapInner><p>This follows the success of the Malaysian Agricultural Research and Development Institute (Mardi) in producing three varieties of Mardi red onion, namely BAW-1, BAW-2 and BAW-3 last year, he said.</p></div>

<div class=newsTextDataWrapInner><p>“The year 2024 is the time for us to take steps toward&nbsp;large-scale cultivation",,,https://assets.theedgemarkets.com/workers-onion-wholesale-mkt-KawranBazar-Dhaka-Bangladesh-July24.2019px-MohammadPonirHossain_20240204121549_reuters.jpg,https://assets.theedgemarkets.com/workers-onion-wholesale-mkt-KawranBazar-Dhaka-Bangladesh-July24.2019px-MohammadPonirHossain_20240204121549_reuters.jpg,52,TheEdge,http://www.theedgemarkets.com/categories/malaysia
Govt completing Long-Term Low Emission Development Strategies document for net zero carbon emission by 2050,https://www.klsescreener.com/v2/news/view/1273007,2024-02-04 11:18:32,2024-02-05 14:04:17,2024-02-04 11:11:20,"KUALA LUMPUR (Feb 4): The government is in the process of completing the Long-Term Low Emission Development Strategies (LT-LEDS) document to ensure the net zero carbon emission goal can be achieved as targetted by 2050, said Minister of Natural Resources and Environmental Sustainability Nik Nazmi Nik Ahmad.","<div class=newsTextDataWrapInner><p>KUALA LUMPUR (Feb 4): The government is in the process of completing the Long-Term Low Emission Development Strategies (LT-LEDS) document to ensure the net zero carbon emission goal can be achieved as targetted by 2050,&nbsp;said Minister of Natural Resources and Environmental Sustainability Nik Nazmi Nik Ahmad.</p></div>

<div class=newsTextDataWrapInner><p>He said the preparation of the document is important to assess the country's performance in achieving the goal, in addition to helping draw up appropriate and effective plans.</p></div>

<div class=n",Edge,,https://assets.theedgemarkets.com/climate-energy-carbon-Fri08102021-coal-burning-power-plant-behd-fact-cityBaotou-ChinasInnr-MongoliaAutonomsReg_20240204110150_reuters.jpg,https://assets.theedgemarkets.com/climate-energy-carbon-Fri08102021-coal-burning-power-plant-behd-fact-cityBaotou-ChinasInnr-MongoliaAutonomsReg_20240204110150_reuters.jpg,52,TheEdge,http://www.theedgemarkets.com/categories/malaysia
House affected due to Bangsar landslide,https://www.klsescreener.com/v2/news/view/1273005,2024-02-04 10:50:17,2024-02-05 13:49:03,2024-02-04 10:33:23,"KUALA LUMPUR (Feb 4): A landslide occurred on Saturday (Feb 3) morning at Jalan Taman Pantai, Taman Bukit Pantai, Bangsar, affecting a house.","<div class=newsTextDataWrapInner><p>KUALA LUMPUR (Feb 4):&nbsp;A landslide occurred on Saturday (Feb 3) morning at Jalan Taman Pantai, Taman Bukit Pantai, Bangsar, affecting a house.</p></div>

<div class=newsTextDataWrapInner><p>The Kuala Lumpur Fire and Rescue Department (JBPM) operations centre, in a statement on Saturday said they received a distress call about the incident at 10.45am and promptly dispatched its machinery to the scene.</p></div>

<div class=newsTextDataWrapInner><p>""The Pantai and Seputeh Fire and Rescue stations deployed two fire engines, [and] a vehicle with a team o",新闻,,//images.weserv.nl/?url=https://assets.theedgemarkets.com/House-affected-Bangsar-landslide-Sat03022025-AM-svdoff-Bernama_20240204104937_bombakl@facebook.jpg&w=300,https://assets.theedgemarkets.com/House-affected-Bangsar-landslide-Sat03022025-AM-svdoff-Bernama_20240204104937_bombakl@facebook.jpg,52,TheEdge,http://www.theedgemarkets.com/categories/malaysia
Ringgit likely to trade range-bound with slight appreciation versus US dollar next week,https://www.klsescreener.com/v2/news/view/1272999,2024-02-04 10:20:22,2024-02-04 10:20:22,2024-02-04 10:14:55,"KUALA LUMPUR: The ringgit is expected to trade range-bound with a slight appreciation against the US dollar next week, said an analyst.Bank Muamalat Malaysia Bhd chief economist Dr Mohd Afzanizam Abdul Rashid said the ringgit is anticipated to trade ...","<div itemprop=""articleBody"" class=""dable-content-wrapper""><p>KUALA LUMPUR: The ringgit is expected to trade range-bound with a slight appreciation against the US dollar next week, said an analyst.</p><p>Bank Muamalat Malaysia Bhd chief economist Dr Mohd Afzanizam Abdul Rashid said the ringgit is anticipated to trade between RM4.71 and RM4.72 per US dollar as investors digest the United States (US) nonfarm payroll data on Friday. </p><p>In the meantime, he said the International Monetary Fund (IMF) has revised its 2024 global growth forecast from 2.9 per cent to 3.1 per cent. </p><p>""This would",Economy,,https://assets.nst.com.my/images/articles/RINGGIT04_NSTfield_image_listing_featured_v2.var_1707012891.jpg,https://assets.nst.com.my/images/articles/Ringgit-USD_1707012884.jpg,81,NST,https://www.nst.com.my/business/economy
