title,url,created_at,updated_at,published_date,summary,content,category,author,thumbnail_url,image_url,publisher_id,publisher_name,publisher_url
World Bank upgrades Malaysia&#039;s growth forecast to 4.9 pct in 2024 [BTTV],https://www.klsescreener.com/v2/news/view/1404567,2024-10-08 17:31:03,2024-10-08 17:31:03,2024-10-08 12:49:55,"KUALA LUMPUR: The World Bank Group has upgraded Malaysia’s economic growth forecast to 4.9 per cent in 2024 from its initial 4.3 per cent forecast set in April, according to Apurva Sanghi, its lead economist for Malaysia.","<div itemprop=""articleBody"" class=""dable-content-wrapper""><p>KUALA LUMPUR: The World Bank Group has upgraded Malaysia&#039;s economic growth forecast to 4.9 per cent in 2024 from its initial 4.3 per cent forecast set in April, according to Apurva Sanghi, its lead economist for Malaysia.</p><p>He said both domestic and external factors back the upgraded growth forecast as the global economy is doing much better than expected six months ago.</p><p>On the domestic front, he said the positive economic momentum, rising political stability, and an increasingly conducive policy environment that boost",Economy,,https://assets.nst.com.my/images/articles/Bank08_NSTfield_image_listing_featured_v2.var_1728363026.jpg,https://assets.nst.com.my/images/articles/apurva_sanghi_1728379226.jpg,81,NST,https://www.nst.com.my/business/economy
World Bank upgrades Malaysia&#039;s growth forecast to 4.9 pct in 2024,https://www.klsescreener.com/v2/news/view/1404365,2024-10-08 12:50:40,2024-10-08 12:50:40,2024-10-08 12:49:55,"KUALA LUMPUR: The World Bank Group has upgraded Malaysia's economic growth forecast to 4.9 per cent in 2024, an increase of 14 per cent from its initial 4.3 per cent forecast set in April, according to Apurva Sanghi, its lead economist for Malaysia,","<div itemprop=""articleBody"" class=""dable-content-wrapper""><p>KUALA LUMPUR: The World Bank Group has upgraded Malaysia&#039;s economic growth forecast to 4.9 per cent in 2024, an increase of 14 per cent from its initial 4.3 per cent forecast set in April, according to Apurva Sanghi, its lead economist for Malaysia,</p><p>He said both domestic and external factors back the upgraded growth forecast as the global economy is doing much better than expected six months ago.</p><p>On the domestic front, he said the positive economic momentum, rising political stability, and an increasingly conducive p",Economy,,https://assets.nst.com.my/images/articles/Bank08_NSTfield_image_listing_featured_v2.var_1728362991.jpg,https://assets.nst.com.my/images/articles/apurva_sanghi_1728362984.jpg,81,NST,https://www.nst.com.my/business/economy
Bursa Malaysia remains in the red as China's rally takes centrestage,https://www.klsescreener.com/v2/news/view/1404367,2024-10-08 12:55:25,2024-10-08 12:55:25,2024-10-08 12:48:00,KUALA LUMPUR: Bursa Malaysia stayed negative over the early session with 585 stocks in the red as China's market rally sapped vitality from other regional markets.,"<div class=""inline-img""><div class=""story-image""></div></div><div id=""story-body"" class=""story bot-15 relative""><p>KUALA LUMPUR: Bursa Malaysia stayed negative over the early session with 585 stocks in the red as China's market rally sapped vitality from other regional markets.</p><p>Chinese markets have surged to a two-year high on the back of anticipation that Beijing will announce more stimulus measures to spur the nation's economy and ailing stock market.</p><p>The Shanghai composite index rose 4.81% to 3,496, a level last seen in January 2022, after reopening from a week-long national hol",,,https://apicms.thestar.com.my/uploads/images/2024/10/08/2952778.jpg,https://apicms.thestar.com.my/uploads/images/2024/10/08/2952778.jpg,28,TheStar,http://www.thestar.com.my/news/latest/?tag=Business
Sosilawati murderers to face death sentence as Federal Court dismisses review attempt,https://www.klsescreener.com/v2/news/view/1404373,2024-10-08 13:03:21,2024-10-08 20:49:45,2024-10-08 12:42:23,The Federal Court on Tuesday upheld the death sentence imposed on lawyer N Pathmanabhan and farmhand T Thilaiyalagan for the murder of cosmetics millionaire Datuk Sosilawati Lawiya and her three aides.,"<div class=newsTextDataWrapInner><p>KUALA LUMPUR (Oct 8): The Federal Court on Tuesday upheld the death sentence imposed on lawyer N Pathmanabhan and farmhand T Thilaiyalagan for the murder of cosmetics millionaire Datuk Sosilawati Lawiya and her three aides.</p></div>

<div class=newsTextDataWrapInner><p>The three-member bench, led by Chief Justice Tun Tengku Maimun Tuan Mat, dismissed their review application and unanimously upheld the death sentences of Pathmanabhan, 56, and Thilaiyalagan, 32.</p></div>

<div class=newsTextDataWrapInner><p>Another appellant, R Kathavarayan, 44, had earl",新闻,,https://assets.theedgemarkets.com/gavel_10.png,https://assets.theedgemarkets.com/gavel_10.png,52,TheEdge,http://www.theedgemarkets.com/categories/malaysia
"Yenher's earnings may accelerate, HLIB flags in starting coverage",https://www.klsescreener.com/v2/news/view/1404361,2024-10-08 12:47:08,2024-10-08 19:35:03,2024-10-08 12:34:58,"Yenher Holdings Bhd (KL:YENHER) is now entering a multi-year growth phase that could potentially see the animal health products maker’s earnings double or triple in the coming years, said Hong Leong Investment Bank (HLIB).","<div class=newsTextDataWrapInner><p>KUALA LUMPUR (Oct 8): Yenher Holdings Bhd (KL:<a href=""/askedge/klse/5300"" class=""ce-stock"" target=""_blank"">YENHER</a>) is now entering a multi-year growth phase that could potentially see the animal health products maker’s earnings double or triple in the coming years, said Hong Leong Investment Bank (HLIB).</p></div>

<div class=newsTextDataWrapInner><p>Earnings in the second half ending Dec 31, 2024 (2HFY2024) would pick up slightly, thanks to a gradual recovery in the swine segment, while sales for the poultry segment are also expected to increase, the",,,https://assets.theedgemarkets.com/yenher_holdings_bhd_20210715131916_yenheragro.com__0.jpg,https://assets.theedgemarkets.com/yenher_holdings_bhd_20210715131916_yenheragro.com__0.jpg,52,TheEdge,http://www.theedgemarkets.com/categories/malaysia
Unscheduled water disruption in 29 areas in KL following pipe burst,https://www.klsescreener.com/v2/news/view/1404359,2024-10-08 12:32:14,2024-10-08 19:35:00,2024-10-08 12:12:28,"A total of 29 areas around the federal capital were set to experience unscheduled water supply disruptions beginning at 6am on Tuesday, due to emergency repairs on a burst pipe at Hub Pasar Seni here.","<div class=newsTextDataWrapInner><p>KUALA LUMPUR (Oct 8):&nbsp;A total of 29 areas around the federal&nbsp;capital were set to experience unscheduled water supply disruptions beginning at 6am on Tuesday, due to emergency repairs on a burst pipe at Hub Pasar Seni here.</p></div>

<div class=newsTextDataWrapInner><p>Pengurusan Air Selangor Sdn Bhd (Air Selangor), in a statement, said that&nbsp;the affected areas include Apartment Putra Ria, Brickfields, Bukit Bandaraya, Bukit Bangsar, Bukit Damansara, Bukit Persekutuan, Bukit Tunku, Damansara Heights, Damansara Town Centre, Idamansara&nbsp;and",,,https://assets.theedgemarkets.com/AIR-SELANGOR-1_20241008121141_theedgemalaysia.jpg,https://assets.theedgemarkets.com/AIR-SELANGOR-1_20241008121141_theedgemalaysia.jpg,52,TheEdge,http://www.theedgemarkets.com/categories/malaysia
Chang: Don&#039;t penalise property owners with inheritance tax [BTTV],https://www.klsescreener.com/v2/news/view/1404507,2024-10-08 16:20:12,2024-10-08 16:20:12,2024-10-08 12:07:41,"KUALA LUMPUR: The National House Buyers Association (HBA) is opposing the proposed reintroduction of an inheritance tax in the 2025 Budget, which is among several measures aimed at broadening the tax base and boosting government revenue.","<div itemprop=""articleBody"" class=""dable-content-wrapper""><p>KUALA LUMPUR: The National House Buyers Association (HBA) is opposing the proposed reintroduction of an inheritance tax in the 2025 Budget, which is among several measures aimed at broadening the tax base and boosting government revenue.</p><p>HBA secretary-general Datuk Chang Kim Loong argued that this tax amounts to double taxation and penalises ""years of hard work.""</p><p>Chang pointed out that middle-class families and small business owners would be disproportionately impacted by the reintroduction of the tax, which was abolished",Property,,https://assets.nst.com.my/images/articles/TAX8_NSTfield_image_listing_featured_v2.var_1728360458.jpg,https://assets.nst.com.my/images/articles/IMG-20220302-WA0012_1728375120.jpg,87,NST,https://www.nst.com.my/property
Chang: Don&#039;t penalise property owners with inheritance tax,https://www.klsescreener.com/v2/news/view/1404341,2024-10-08 12:10:22,2024-10-08 12:10:22,2024-10-08 12:07:41,"KUALA LUMPUR: The National House Buyers Association (HBA) is opposing the proposed reintroduction of an inheritance tax in the 2025 Budget, which is among several measures aimed at broadening the tax base and boosting government revenue.","<div itemprop=""articleBody"" class=""dable-content-wrapper""><p>KUALA LUMPUR: The National House Buyers Association (HBA) is opposing the proposed reintroduction of an inheritance tax in the 2025 Budget, which is among several measures aimed at broadening the tax base and boosting government revenue.</p><p>HBA secretary-general Datuk Chang Kim Loong argued that this tax amounts to double taxation and penalises ""years of hard work.""</p><p>Chang pointed out that middle-class families and small business owners would be disproportionately impacted by the reintroduction of the tax, which was abolished",Property,,https://assets.nst.com.my/images/articles/TAX8_NSTfield_image_listing_featured_v2.var_1728360458.jpg,https://assets.nst.com.my/images/articles/IMG-20220302-WA0012_1728360451.jpg,87,NST,https://www.nst.com.my/property
"Chinese high-tech company ISVision eyeing Malaysian market entry, says Zaliha",https://www.klsescreener.com/v2/news/view/1404349,2024-10-08 12:17:18,2024-10-08 19:19:52,2024-10-08 12:02:38,"Chinese high-tech company ISVision (Hangzhou) Technology Co Ltd has expressed interest in entering the Malaysian market, Minister in the Prime Minister's Department (Federal Territories) Dr Zaliha Mustafa said.","<div class=newsTextDataWrapInner><p>PUTRAJAYA (Oct 8): Chinese high-tech company ISVision (Hangzhou) Technology Co&nbsp;Ltd&nbsp;has expressed&nbsp;interest in entering the Malaysian market, Minister in the Prime Minister's Department (Federal Territories) Dr Zaliha Mustafa said.</p></div>

<div class=newsTextDataWrapInner><p>Zaliha said ISVision’s intentions were&nbsp;revealed during her visit to two leading global companies, ISVision (Hangzhou) Technology Co&nbsp;Ltd&nbsp;and Dahua Technology, in Hangzhou on Tuesday.</p></div>

<div class=newsTextDataWrapInner><p>""ISVision is a high-tech",Edge,,https://assets.theedgemarkets.com/Zaliha_20241008120149_bernama.jpg,https://assets.theedgemarkets.com/Zaliha_20241008120149_bernama.jpg,52,TheEdge,http://www.theedgemarkets.com/categories/malaysia
Dayang's latest contract win affirms positive outlook,https://www.klsescreener.com/v2/news/view/1404339,2024-10-08 12:00:39,2024-10-08 12:00:39,2024-10-08 11:54:00,"PETALING JAYA: Dayang Enterprise Holdings Bhd’s latest contract win for the provision of six accommodation workboat vessels (AWBs) to PETRONAS Carigali Sdn Bhd (PCSB) is projected to add up to RM17mil in net profit for its financial year ending Dec 31, 2025 (FY25).","<div class=""inline-img""><div class=""story-image""></div></div><div id=""story-body"" class=""story bot-15 relative""><p>PETALING JAYA: <a href=""/business/marketwatch/stocks/?qcounter=DAYANG"" target=""_blank"">Dayang Enterprise Holdings Bhd</a><a href=""http://charts.thestar.com.my/?s=DAYANG"" target=""_blank""><img class=""go-chart"" src=""https://cdn.thestar.com.my/Themes/img/chart.png""></a>’s latest contract win for the provision of six accommodation workboat vessels (AWBs) to PETRONAS Carigali Sdn Bhd (PCSB) is projected to add up to RM17mil in net profit for its financial year ending Dec 31, 2025 (FY25)",,,https://apicms.thestar.com.my/uploads/images/2024/10/08/2952733.jpeg,https://apicms.thestar.com.my/uploads/images/2024/10/08/2952733.jpeg,28,TheStar,http://www.thestar.com.my/news/latest/?tag=Business
Gamuda Land pioneers digital transformation in property development,https://www.klsescreener.com/v2/news/view/1404335,2024-10-08 11:40:40,2024-10-08 11:40:40,2024-10-08 11:38:40,"WHEN it comes to buying a landed property in Malaysia, homebuyers are spoiled with options, from new developments to sub-sale properties.","<div itemprop=""articleBody"" class=""dable-content-wrapper""><p><span style=""font-weight: 400;"">WHEN it comes to buying a landed property in Malaysia, homebuyers are spoiled with options, from new developments to sub-sale properties.</span></p><p><span style=""font-weight: 400;"">However, the search for a dream home is still elusive for many — while there are lots of units on the market, few come close to checking all the boxes of modern homebuyers.</span></p><p><span style=""font-weight: 400;"">In an effort to better understand what Malaysian homebuyers are looking for, leading property developer Ga",Property,,https://assets.nst.com.my/images/listing-featured/NST%20Listing%20Featured%20V2%20-%20800%20x%20496%20-%202024-10-08T113602.074.png,https://assets.nst.com.my/images/articles/NST%20Cover%20-%20900%20x%20646%20-%202024-10-08T113543.010.png,87,NST,https://www.nst.com.my/property
Alternative Views: Why the ringgit’s appreciation is losing its momentum for now,https://www.klsescreener.com/v2/news/view/1404329,2024-10-08 11:34:47,2024-10-09 15:51:12,2024-10-08 11:30:00,"For the first time since 2007, the deposit level in Malaysia’s foreign currency account (FCA) saw a significant drop in the month of August.

Based on Bank Negara Malaysia’s data, the deposits declined by RM11 billion to RM246 billion in that month. Prior to August, deposits in the FCA, ...","<div class=newsTextDataWrapInner><p><span style=""font-style: italics;"">This article first appeared in Forum, The Edge Malaysia Weekly on October 7, 2024 - October 13, 2024</span></p></div><div class=newsTextDataWrapInner><p>For the first time since 2007, the deposit level in Malaysia’s foreign currency account (FCA) saw a significant drop in the month of August.</p></div>

<div class=newsTextDataWrapInner><p>Based on Bank Negara Malaysia’s data, the deposits declined by RM11 billion to RM246 billion in that month. Prior to August, deposits in the FCA, which are primarily the proceeds brought",Edge,,https://assets.theedgemarkets.com/P58-RINGGIT MALAYSIA_SB-TEM1544_Forum_20241007141356_theedgemalaysia.jpg,https://assets.theedgemarkets.com/P58-RINGGIT MALAYSIA_SB-TEM1544_Forum_20241007141356_theedgemalaysia.jpg,54,TheEdge,http://www.theedgemarkets.com/options/edge
Foxconn building world's largest Nvidia superchip factory,https://www.klsescreener.com/v2/news/view/1404327,2024-10-08 11:33:28,2024-10-08 11:33:28,2024-10-08 11:26:00,"TAIPEI: Foxconn is building the world's largest Nvidia GB200 chip manufacturing facility to help meet ""awfully huge"" demand for the AI darling's Blackwell platform, a senior executive at the Taiwanese company said on Tuesday.","<div class=""inline-img""><div class=""story-image""><p class=""caption"">FILE PHOTO: Foxconn logo is seen in this illustration taken, May 2, 2023. REUTERS/Dado Ruvic/Illustration</p></div></div><div id=""story-body"" class=""story bot-15 relative""><p>TAIPEI: Foxconn is building the world's largest Nvidia GB200 chip manufacturing facility to help meet ""awfully huge"" demand for the AI darling's Blackwell platform, a senior executive at the Taiwanese company said on Tuesday.</p><p>Foxconn, the world's largest contract electronics manufacturer and better know as Apple's biggest iPhone assembler, has been ",,,https://apicms.thestar.com.my/uploads/images/2024/10/08/2952693.JPG,https://apicms.thestar.com.my/uploads/images/2024/10/08/2952693.JPG,28,TheStar,http://www.thestar.com.my/news/latest/?tag=Business
Demand for industrial properties gaining momentum in Iskandar Malaysia,https://www.klsescreener.com/v2/news/view/1404323,2024-10-08 11:31:04,2024-10-08 11:31:04,2024-10-08 11:25:35,"KUALA LUMPUR: Iskandar Malaysia's ongoing infrastructure developments have sparked renewed demand, especially for industrial properties and land for data centre (DC) developments, said CIMB Securities Research. ","<div itemprop=""articleBody"" class=""dable-content-wrapper""><p>KUALA LUMPUR: Iskandar Malaysia&#039;s ongoing infrastructure developments have sparked renewed demand, especially for industrial properties and land for data centre (DC) developments, said CIMB Securities Research. </p><p>The research house said that developers with strategic landbanks in Iskandar Puteri have enjoyed brisk sales for their recent launches as connectivity improves.</p><p>""We came away from the visits feeling more assured that the &#039;feel-good&#039; factor generated from Johor&#039;s transformative landscape would e",Property,,https://assets.nst.com.my/images/articles/ISKA_NSTfield_image_listing_featured_v2.var_1728357932.jpg,https://assets.nst.com.my/images/articles/iskandar_malaysia_1728357925.jpg,87,NST,https://www.nst.com.my/property
"China is 'fully confident' of achieving 2024 economic goals, NDRC chair says",https://www.klsescreener.com/v2/news/view/1404325,2024-10-08 11:33:27,2024-10-08 11:33:27,2024-10-08 11:25:00,"BEIJING: China is ""fully confident"" of achieving its full-year economic and social development targets, the chairman of the country's economic planner Zheng Shanjie said on Tuesday, adding some of 2025's budget will be issued this year to support projects.","<div class=""inline-img""><div class=""story-image""></div></div><div id=""story-body"" class=""story bot-15 relative""><p>BEIJING: China is ""fully confident"" of achieving its full-year economic and social development targets, the chairman of the country's economic planner Zheng Shanjie said on Tuesday, adding some of 2025's budget will be issued this year to support projects.</p><p>A package of economic stimulus measures unveiled by the authorities since late September sent Chinese shares soaring on Tuesday to two-year highs, extending a rally after markets reopened from a week-long National Day holi",,,https://apicms.thestar.com.my/uploads/images/2024/10/08/2952692.jpg,https://apicms.thestar.com.my/uploads/images/2024/10/08/2952692.jpg,28,TheStar,http://www.thestar.com.my/news/latest/?tag=Business
"Strong FFB output, lower production costs to propel Sarawak Oil Palms&#039; growth",https://www.klsescreener.com/v2/news/view/1404321,2024-10-08 11:30:54,2024-10-08 11:30:54,2024-10-08 11:13:12,"KUALA LUMPUR: Sarawak Oil Palms Bhd’s earnings outlook remains bright, backed by its solid fresh fruit bunch (FFB) growth and lower production cost, albeit offset by lower margins from the downstream segment.","<div itemprop=""articleBody"" class=""dable-content-wrapper""><p>KUALA LUMPUR: Sarawak Oil Palms Bhd&#039;s earnings outlook remains bright, backed by its solid fresh fruit bunch (FFB) growth and lower production cost, albeit offset by lower margins from the downstream segment.</p><p>RHB Research said Sarawak Oil Palms recorded a solid year-to-date August FFB growth of 8.0 per cent year on year (YoY), in line with the firm assumptions, thanks to its relatively young age profile. </p><p>Although Miri saw heavy rains over the past month, the firm said management gave its reassurance that it has norm",Corporate,,https://assets.nst.com.my/images/articles/OIL8_NSTfield_image_listing_featured_v2.var_1728357189.jpg,https://assets.nst.com.my/images/articles/sop_1728357182.jpg,79,NST,https://www.nst.com.my/business/corporate
"Malaysia Airlines to reinstate flights to Kolkata, India from Dec 2",https://www.klsescreener.com/v2/news/view/1404319,2024-10-08 11:30:50,2024-10-08 11:30:50,2024-10-08 11:12:00,"KUALA LUMPUR: Malaysia Airlines today said it will reinstate flights to Kolkata, India on Dec 2, 2024.","<div itemprop=""articleBody"" class=""dable-content-wrapper""><p>KUALA LUMPUR: Malaysia Airlines today said it will reinstate flights to Kolkata, India on Dec 2, 2024.</p><p>Malaysia Aviation Group (MAG), the parent of Malaysia Airlines, Firefly and Amal, <a href=""https://www.nst.com.my/business/corporate/2024/09/1106177/mag-warns-potential-drop-2024-performance-due-flight-cuts"">announced plans to cut 20 per cent of network capacity</a> in August this year.</p><p>The new route is an addition to nine other destinations in India, including New Delhi, Mumbai and Chennai.</p><p>The airline will operat",Corporate,,https://assets.nst.com.my/images/articles/mas08_NSTfield_image_listing_featured_v2.var_1728357117.jpg,https://assets.nst.com.my/images/articles/29nt03mas_1728357110.jpg,79,NST,https://www.nst.com.my/business/corporate
"MARKET PULSE AM OCT 8, 2024 [WATCH]",https://www.klsescreener.com/v2/news/view/1404311,2024-10-08 11:10:19,2024-10-08 11:10:19,2024-10-08 11:00:31,KUALA LUMPUR: News on the latest moves on the stock and crypto markets.,"<div itemprop=""articleBody"" class=""dable-content-wrapper""><p>KUALA LUMPUR: News on the latest moves on the stock and crypto markets.</p><p>Investors pushed Pertama Digital&#039;s share price to a new 52 week low as they dumped shares in the company.</p><p>Its share price was down 38 per cent to 48.5 sen a share today.</p><p>It was the market&#039;s top loser in early trade.</p><p> The 30-stock key index was in negative territory tracking Wall Street&#039;s weakness as investor sentiment turned cautious amid rising treasury yields and crude oil prices.</p><p>The FBM KLCI Index will likely move ",Corporate,,https://assets.nst.com.my/images/articles/palsam08_NSTfield_image_listing_featured_v2.var_1728356691.jpg,https://assets.nst.com.my/images/articles/Bursa-1024x705_1728356683.jpg,79,NST,https://www.nst.com.my/business/corporate
Selangor Dredging launches Senai landed homes in Puchong,https://www.klsescreener.com/v2/news/view/1404305,2024-10-08 11:04:49,2024-10-08 18:50:00,2024-10-08 10:54:48,"Selangor Dredging Bhd (KL:SDRED) has launched its latest lakeside landed residential development named Senai, located in Taman Putra Perdana, Puchong.

According to a press statement on Monday, the first phase of the development will offer 200 units of three-storey strata-titled landed homes that come in built-up sizes of 1,900 to 3,600 sq ft, with selling prices of over RM1 million. Further details of the upcoming phases are forthcoming.","<div class=newsTextDataWrapInner><p>KUALA LUMPUR (Oct 8): Selangor Dredging Bhd (KL:<a href=""/askedge/klse/2224"" class=""ce-stock"" target=""_blank"">SDRED</a>) has launched its latest lakeside&nbsp;landed residential development named Senai, located in Taman Putra Perdana, Puchong.</p></div>

<div class=newsTextDataWrapInner><p>According to a press statement on Monday, the first phase of the development will offer 200 units of three-storey strata-titled landed homes that come in built-up sizes of 1,900 to 3,600 sq ft, with selling prices of over RM1 million. Further details of the upcoming phas",,,https://assets.theedgemarkets.com/Senai Perspective Aerial View_20241008105343_selangor dredging bhd.jpg,https://assets.theedgemarkets.com/Senai Perspective Aerial View_20241008105343_selangor dredging bhd.jpg,52,TheEdge,http://www.theedgemarkets.com/categories/malaysia
"Dayang Enterprise shares climb as investors, analysts stay buoyant on outlook",https://www.klsescreener.com/v2/news/view/1404303,2024-10-08 11:04:48,2024-10-08 18:49:57,2024-10-08 10:51:20,"KUALA LUMPUR (Oct 8): Shares of Dayang Enterprise Holdings Bhd (KL:DAYANG) rose on Tuesday as investors cheered the latest contracts win, while analysts stayed optimistic on the oil-and-gas services firm’s outlook.","<div class=newsTextDataWrapInner><p>KUALA LUMPUR (Oct 8): Shares of Dayang Enterprise Holdings Bhd (KL:<a href=""/askedge/klse/5141"" class=""ce-stock"" target=""_blank"">DAYANG</a>) rose on Tuesday as investors cheered the latest contracts win, while analysts stayed optimistic on the oil-and-gas services firm’s outlook.</p></div>

<div class=newsTextDataWrapInner><p>Dayang Enterprise rose as much as 6.3% or 15 sen to RM2.55. The stock was trading at RM2.53 at 10am, giving the company a market capitalisation of a little over RM2.9 billion. Trading volume totalled 3.38 million shares so far.</p></d",,,https://assets.theedgemarkets.com/Dayang-Enterprise-AR-svd-off-TEM-weekly-March29-April4.2021-online_20241008105041_dayangenterpriseholdingsbhd.jpg,https://assets.theedgemarkets.com/Dayang-Enterprise-AR-svd-off-TEM-weekly-March29-April4.2021-online_20241008105041_dayangenterpriseholdingsbhd.jpg,52,TheEdge,http://www.theedgemarkets.com/categories/malaysia
