title,url,created_at,updated_at,published_date,summary,content,category,author,thumbnail_url,image_url,publisher_id,publisher_name,publisher_url
"Cybersecurity firm Wiz calls off US$23b deal with Google, memo says",https://www.klsescreener.com/v2/news/view/1362669,2024-07-23 11:51:36,2024-07-23 11:51:36,2024-07-23 11:49:46,"BENGALURU: Cybersecurity startup Wiz has walked away from a reported US$23 billion deal to be acquired by Google-parent Alphabet and has chosen to pursue an initial public offering, according to a Wiz memo seen by Reuters.""While we are flattered ...","<div itemprop=""articleBody"" class=""dable-content-wrapper""><p>BENGALURU: Cybersecurity startup Wiz has walked away from a reported US$23 billion deal to be acquired by Google-parent Alphabet and has chosen to pursue an initial public offering, according to a Wiz memo seen by Reuters.</p><p>""While we are flattered by offers we have received, we have chosen to continue on our path to building Wiz,"" CEO Assaf Rappaport said in the memo, without naming Google.</p><p>""Let me cut to the chase: our next milestones are US$1 billion in ARR and an IPO,"" he added.</p><p>Reuters reported earlier in July th",Corporate,,https://assets.nst.com.my/images/articles/wiz23_NSTfield_image_listing_featured_v2.var_1721706583.jpg,https://assets.nst.com.my/images/articles/ALPHABET-GOOGLE_PRIVACY-LAWSUIT_1721706576.jpg,79,NST,https://www.nst.com.my/business/corporate
"Don't let any issues politicise, harm Malaysia-Singapore relations, says Lee Hsien Loong",https://www.klsescreener.com/v2/news/view/1362679,2024-07-23 12:06:45,2024-07-23 20:02:47,2024-07-23 11:48:59,"Malaysia and Singapore must not inadvertently let an issue get politicised and played up, or poison the overall relationship between the two nations, said the city state's Senior Minister Lee Hsien Loong.","<div class=newsTextDataWrapInner><p>SINGAPORE (July 22): Malaysia and Singapore must not inadvertently let an issue get politicised and played up, or poison the overall relationship between the two nations, said the city state's Senior Minister Lee Hsien Loong.</p></div>

<div class=newsTextDataWrapInner><p>According to the minister, this could make things even more difficult and be very damaging to both sides.</p></div>

<div class=newsTextDataWrapInner><p>He&nbsp;said over the years, Singapore and Malaysia have had to deal with more difficult and sensitive issues, such as&nbsp;water supp",,,https://assets.theedgemarkets.com/Lee Hsien Loong_20230330115802_bloomberg_1.jpg,https://assets.theedgemarkets.com/Lee Hsien Loong_20230330115802_bloomberg_1.jpg,52,TheEdge,http://www.theedgemarkets.com/categories/malaysia
Banks won&#039;t be main winners from data centre boom,https://www.klsescreener.com/v2/news/view/1362667,2024-07-23 11:51:35,2024-07-23 11:51:35,2024-07-23 11:46:35,"KUALA LUMPUR: The banking sector will not be prime beneficiaries of the country&#039;s current hot data centre (DC) boom, said Hong Leong Investment Bank Bhd (HLIB Research).While HLIB acknowledged the potential economic benefits that DC investments have to ...","<div itemprop=""articleBody"" class=""dable-content-wrapper""><p>KUALA LUMPUR: The banking sector will not be prime beneficiaries of the country&#039;s current hot data centre (DC) boom, said Hong Leong Investment Bank Bhd (HLIB Research).</p><p>While HLIB acknowledged the potential economic benefits that DC investments have to offer, the bank did not see that Malaysia&#039;s total approved investments (TI) spike in the past translated to sharper growth in overall business, small and medium enterprises (SME), and house and home (HH) loans.</p><p>Meanwhile, HLIB Research said large construction awa",Corporate,,https://assets.nst.com.my/images/articles/BANK23_NSTfield_image_listing_featured_v2.var_1721706391.jpg,https://assets.nst.com.my/images/articles/research_1721706384.jpg,79,NST,https://www.nst.com.my/business/corporate
Uptick in sales volume for Kossan in 2H: PublicInvest,https://www.klsescreener.com/v2/news/view/1362665,2024-07-23 11:51:35,2024-07-23 11:51:35,2024-07-23 11:44:00,"KUALA LUMPUR: Kossan Rubber Industries Bhd is expected to see a sequential uptick in its sales volume for the second half of 2024 (2H 2024), as demand for gloves continues to increase due to customers replenishing their depleting inventories.Public Investment Bank ...","<div itemprop=""articleBody"" class=""dable-content-wrapper""><p>KUALA LUMPUR: Kossan Rubber Industries Bhd is expected to see a sequential uptick in its sales volume for the second half of 2024 (2H 2024), as demand for gloves continues to increase due to customers replenishing their depleting inventories.</p><p>Public Investment Bank Research (PublicInvest) said Kossan is currently running at a 60 per cent utilisation rate based on 24.5 billion pcs/annual installed capacity, up from 50 per cent in the fourth quarter (Q4) of 2023.</p><p>To recap, Kossan had impaired four old plants with a total ca",Corporate,,https://assets.nst.com.my/images/articles/KOSSAN23_NSTfield_image_listing_featured_v2.var_1721706236.jpg,https://assets.nst.com.my/images/articles/kossan_1721706230.jpg,79,NST,https://www.nst.com.my/business/corporate
Consolidating small rubber plantations could help reduce rubber import bill by 50pct - Johari,https://www.klsescreener.com/v2/news/view/1362657,2024-07-23 11:40:57,2024-07-23 11:40:57,2024-07-23 11:38:44,"KUALA LUMPUR: Small rubber plantations should be consolidated to increase productivity to help reduce the country&#039;s reliance on imported rubber, said Plantation and Commodities Minister Datuk Seri Johari Abdul Ghani.He said the issue of scarce labour has been ...","<div itemprop=""articleBody"" class=""dable-content-wrapper""><p>KUALA LUMPUR: Small rubber plantations should be consolidated to increase productivity to help reduce the country&#039;s reliance on imported rubber, said Plantation and Commodities Minister Datuk Seri Johari Abdul Ghani.</p><p>He said the issue of scarce labour has been impacting the productivity of small rubber plantations, and a consolidation of these plantations would help raise productivity.</p><p>Johari said Malaysia imported 6.5 billion rubber in 2022 and 5.7 billion in 2023.</p><p>""Over the next 10 to 15 years, we will see gr",Corporate,,https://assets.nst.com.my/images/articles/jo23_NSTfield_image_listing_featured_v2.var_1721705920.jpg,https://assets.nst.com.my/images/articles/joga_1721705913.jpg,79,NST,https://www.nst.com.my/business/corporate
My Say: From digital democracy to anarchy,https://www.klsescreener.com/v2/news/view/1362661,2024-07-23 11:47:09,2024-07-24 16:48:42,2024-07-23 11:30:00,"Proponents of freedom of expression and the press believe that they can be self-regulated and be responsible enough to ensure that what they say, write, critique and post on the internet is always right. It is also within their democratic rights. After all, this is the age of digital democracy.","<div class=newsTextDataWrapInner><p><span style=""font-style: italics;"">This article first appeared in Forum, The Edge Malaysia Weekly on July 22, 2024 - July 28, 2024</span></p></div><div class=newsTextDataWrapInner><p>Proponents of freedom of expression and the press believe that they can be self-regulated and be responsible enough to ensure that what they say, write, critique and post on the internet is always right. It is also within their democratic rights. After all, this is the age of digital democracy.</p></div>

<div class=newsTextDataWrapInner><p>But this world of digital democracy ",Edge,,https://assets.theedgemarkets.com/P45-People-Computer-TEM1533_Forum_20240722115054_freepik.jpg,https://assets.theedgemarkets.com/P45-People-Computer-TEM1533_Forum_20240722115054_freepik.jpg,54,TheEdge,http://www.theedgemarkets.com/options/edge
SoftBank’s chief pitches a new path for self-driving cars,https://www.klsescreener.com/v2/news/view/1362659,2024-07-23 11:44:26,2024-07-23 11:44:26,2024-07-23 11:30:00,"Masayoshi Son has long prided himself on his ability to detect big shifts in technology early on. During his four decades leading SoftBank, a free-spending Japanese investment group, the billionaire has made some spectacularly successful investments. And some epic flops.","<div class=""inline-img""><div class=""story-image""><p class=""caption"">A Baidu Apollo driverless taxi, left, in Wuhan, China, on May 15, 2024. In China, carmakers and technology companies are testing more driverless cars on public roads than their counterparts in other countries. — The New York Times</p></div></div><div id=""story-body"" class=""story bot-15 relative""><p><b>TOKYO:</b> Masayoshi Son has long prided himself on his ability to detect big shifts in technology early on. During his four decades leading SoftBank, a free-spending Japanese investment group, the billionaire has made some spect",,,https://apicms.thestar.com.my/uploads/images/2024/07/23/2817090.jpeg,https://apicms.thestar.com.my/uploads/images/2024/07/23/2817090.jpeg,28,TheStar,http://www.thestar.com.my/news/latest/?tag=Business
"Data centre firm Equinix enters the Philippines, eyes on Southeast Asia",https://www.klsescreener.com/v2/news/view/1362651,2024-07-23 11:31:19,2024-07-23 11:31:19,2024-07-23 11:26:02,"BENGALURU: Equinix has acquired three data centres in the Philippines from Total Information Management to expand its presence in the high growth potential region of Southeast Asia, the global data centre firm said on Tuesday.The U.S.-based company, ...","<div itemprop=""articleBody"" class=""dable-content-wrapper""><p>BENGALURU: Equinix has acquired three data centres in the Philippines from Total Information Management to expand its presence in the high growth potential region of Southeast Asia, the global data centre firm said on Tuesday.</p><p>The U.S.-based company, which has already established its presence in countries in the region such as Indonesia and Malaysia, also intends to expand its footprint in Singapore as the compact city-state opens the door to building more facilities.</p><p>""This strategic acquisition, combined with our recent ",Corporate,,https://assets.nst.com.my/images/articles/dce23_NSTfield_image_listing_featured_v2.var_1721705159.jpg,https://assets.nst.com.my/images/articles/equinix_1721705152.jpg,79,NST,https://www.nst.com.my/business/corporate
Robert Kuok’s Allgreen Properties submits top bid for prime site near Singapore’s Orchard Road — Forbes,https://www.klsescreener.com/v2/news/view/1362655,2024-07-23 11:32:13,2024-07-23 19:45:30,2024-07-23 11:25:25,"KUALA LUMPUR (July 23): Billionaire Robert Kuok-controlled developer Allgreen Properties Ltd has submitted the top bid for a prime residential site near Singapore’s Orchard Road shopping precinct, as the developer expands its portfolio in the city-state, despite softening housing demand.","<div class=newsTextDataWrapInner><p>KUALA LUMPUR (July 23): Billionaire Robert Kuok-controlled developer Allgreen Properties Ltd has submitted the top bid for a prime residential site near Singapore’s Orchard Road shopping precinct, as the developer expands its portfolio in the city-state, despite softening housing demand.</p></div>

<div class=newsTextDataWrapInner><p>In a report last week, <em>Forbes</em> said Allgreen’s Valerian Residential placed the highest bid of S$730 million (US$544 million) for the 99-year leasehold site on Zion Road, about three kilometres south of Orchard Road, ac",Edge,,https://assets.theedgemarkets.com/Billionaire-Robert-Kuok-controlled-developer-Allgreen-Properties-Ltd-CROP_20240723112003_allgreenpropertieslimited@facebook.jpg,https://assets.theedgemarkets.com/Billionaire-Robert-Kuok-controlled-developer-Allgreen-Properties-Ltd-CROP_20240723112003_allgreenpropertieslimited@facebook.jpg,52,TheEdge,http://www.theedgemarkets.com/categories/malaysia
JCorp’s FY2023 profit up 9% to RM2.4b on revenue of RM6.2b,https://www.klsescreener.com/v2/news/view/1362653,2024-07-23 11:32:12,2024-07-23 19:30:33,2024-07-23 11:13:29,KUALA LUMPUR (July 23): Johor Corporation (JCorp) posted a 9% growth in gross profit of RM2.4 billion on the back of an 8% rise in revenue to RM6.2 billion for the fiscal year ended 2023 (FY2023).,"<div class=newsTextDataWrapInner><p>KUALA LUMPUR (July 23): Johor Corporation (JCorp) posted a 9% growth in gross profit of RM2.4 billion on the back of an 8% rise in revenue to RM6.2 billion for the fiscal year ended 2023 (FY2023).</p></div>

<div class=newsTextDataWrapInner><p>In a statement on Tuesday, the group said its total net assets surpassed RM10.8 billion.</p></div>

<div class=newsTextDataWrapInner><p>JCorp said its wellness &amp; healthcare segment posted a 17% revenue jump to RM3.4 billion and a record net profit of RM270 million.</p></div><div class=inPageAd id=div-gpt-ad-inp",,,https://assets.theedgemarkets.com/Johor-Corporation-Bhd-JCorp-logo-svd-Tues17012023_20240723111258_facebook@johorcorporationofficial.jpg,https://assets.theedgemarkets.com/Johor-Corporation-Bhd-JCorp-logo-svd-Tues17012023_20240723111258_facebook@johorcorporationofficial.jpg,52,TheEdge,http://www.theedgemarkets.com/categories/malaysia
"RM3.7b penalties, additional tax levied on 525,000 taxpayers as at end-June 2024",https://www.klsescreener.com/v2/news/view/1362647,2024-07-23 11:10:31,2024-07-23 11:10:31,2024-07-23 11:05:35,"KUALA LUMPUR: About 525,000 taxpayers were audited and investigated for various compliance issues as of June 30, 2024, resulting in penalties and additional taxes totaling RM3.7 billion.The Inland Revenue Board (LHDN) chief executive officer Datuk  Abu Tariq Jamaluddin urged taxpayers to meet ...","<div itemprop=""articleBody"" class=""dable-content-wrapper""><p>KUALA LUMPUR: About 525,000 taxpayers were audited and investigated for various compliance issues as of June 30, 2024, resulting in penalties and additional taxes totaling RM3.7 billion.</p><p>The Inland Revenue Board (LHDN) chief executive officer Datuk  Abu Tariq Jamaluddin urged taxpayers to meet with LHDN officials for guidance if they have concerns regarding the penalties or additonal taxes levied.</p><p>He said this is important to avoid penalties due to audits or investigations.</p><p>""With Tax Administration 3.0 guiding our s",Corporate,,https://assets.nst.com.my/images/articles/tax23_NSTfield_image_listing_featured_v2.var_1721703931.jpg,https://assets.nst.com.my/images/articles/z2004millionaire02_1721703924.jpg,79,NST,https://www.nst.com.my/business/corporate
"MARKET PULSE AM JULY 23,2024 [WATCH]",https://www.klsescreener.com/v2/news/view/1362645,2024-07-23 11:10:31,2024-07-23 11:10:31,2024-07-23 11:00:31,KUALA LUMPUR: News on the latest moves on the stock and crypto markets.Pawnbroking company Well Chip was trading more than 50 per cent higher after its debut on the Main Market.Eversendai was up more than 7 per cent after it ...,"<div itemprop=""articleBody"" class=""dable-content-wrapper""><p>KUALA LUMPUR: News on the latest moves on the stock and crypto markets.</p><p>Pawnbroking company Well Chip was trading more than 50 per cent higher after its debut on the Main Market.</p><p>Eversendai was up more than 7 per cent after it said it was part of the team building Trojena Ski Village in Saudi Arabia, a venue for the 2029 Asian Winter Games.</p><p>The benchmark FBM KLCI index opened higher, and will likely trend within the 1,625 to 1,635 range on bargain-hunting.</p><p>In the crypto market, both Bitcoin and Solana were low",Corporate,,https://assets.nst.com.my/images/articles/mp23am_NSTfield_image_listing_featured_v2.var_1721703628.jpg,https://assets.nst.com.my/images/articles/HQ190324AZ006bursa_1721703618.jpg,79,NST,https://www.nst.com.my/business/corporate
Govt committed to reducing debt-to-gdp ratio to 60pct within 5 years -  Treasury Sec-Gen,https://www.klsescreener.com/v2/news/view/1362639,2024-07-23 11:00:46,2024-07-23 11:00:46,2024-07-23 10:57:54,"KUALA LUMPUR: In line with the Public Finance and Fiscal Responsibility Act, the government is committed to reducing its borrowings in terms of the debt-to-gross domestic product (GDP) ratio to 60 per cent within a five-year timeframe from the current 64 per ...","<div itemprop=""articleBody"" class=""dable-content-wrapper""><p>KUALA LUMPUR: In line with the Public Finance and Fiscal Responsibility Act, the government is committed to reducing its borrowings in terms of the debt-to-gross domestic product (GDP) ratio to 60 per cent within a five-year timeframe from the current 64 per cent to ensure a stronger and more sustainable fiscal position for the nation, said Treasury Secretary-General Datuk Johan Mahmood Merican.</p><p>He said the government has already started reducing the annual net borrowings gradually, from about RM100 billion for both 2021 and 20",Economy,,https://assets.nst.com.my/images/articles/gd23_NSTfield_image_listing_featured_v2.var_1721703471.jpg,https://assets.nst.com.my/images/articles/datuk_johan_1721703464.jpg,81,NST,https://www.nst.com.my/business/economy
"Firefly launches jet ops with flights to Penang, Kota Kinabalu",https://www.klsescreener.com/v2/news/view/1362641,2024-07-23 11:04:40,2024-07-23 19:19:41,2024-07-23 10:52:23,"Firefly, a subsidiary of Malaysia Aviation Group, announced the launch of its jet operations at the Sultan Abdul Aziz Shah Airport (SZB) in Subang, with flights to Penang and to Kota Kinabalu.","<div class=newsTextDataWrapInner><p>KUALA LUMPUR (July 23): Firefly, a subsidiary of Malaysia Aviation Group, announced the launch of its jet operations at the Sultan Abdul Aziz Shah Airport (SZB) in Subang, with flights to Penang and to Kota Kinabalu.</p></div>

<div class=newsTextDataWrapInner><p>Ticket sales began on Monday, Firefly said in a statement. The routes will be served with Firefly’s retrofitted Boeing 737-800 aircraft, equipped with 189 seats in economy class featuring a personal device holder, and USB type A and C power outlets.</p></div>

<div class=newsTextDataWrapInner><p",新闻,,https://assets.theedgemarkets.com/Boeing 737-800.jpg,https://assets.theedgemarkets.com/Boeing 737-800.jpg,52,TheEdge,http://www.theedgemarkets.com/categories/malaysia
Govt committed to reducing debt-to-GDP ratio to 60% within five years — Treasury sec-gen,https://www.klsescreener.com/v2/news/view/1362637,2024-07-23 10:49:17,2024-07-23 18:49:36,2024-07-23 10:41:35,"KUALA LUMPUR (July 23): In line with the Public Finance and Fiscal Responsibility Act, the government is committed to reducing its borrowings in terms of the debt-to-gross domestic product (GDP) ratio to 60% within a five-year timeframe, from the current 64%, to ensure a stronger and more sustainable fiscal position for the nation, said Treasury secretary general Datuk Johan Mahmood Merican.","<div class=newsTextDataWrapInner><p>KUALA LUMPUR (July 23): In line with the Public Finance and Fiscal Responsibility Act, the government is committed to reducing its&nbsp;borrowings in terms of the debt-to-gross domestic product (GDP) ratio to 60% within a five-year timeframe, from the current 64%,&nbsp;to ensure a stronger and more sustainable fiscal position for the nation, said Treasury secretary general Datuk Johan Mahmood Merican.</p></div>

<div class=newsTextDataWrapInner><p>He said&nbsp;the government has already started reducing the annual net borrowings gradually, from about&nbsp;",新闻,,https://assets.theedgemarkets.com/MOF-Treasury-sec-gen-Dtk-Johan-Mahmood-Merican-CROPPED-EDGEMARKETS-WATERMARK_20240723103500_theedgemalaysia.jpg,https://assets.theedgemarkets.com/MOF-Treasury-sec-gen-Dtk-Johan-Mahmood-Merican-CROPPED-EDGEMARKETS-WATERMARK_20240723103500_theedgemalaysia.jpg,52,TheEdge,http://www.theedgemarkets.com/categories/malaysia
"Jaecoo launches J7 SUV with prices starting from RM138,800",https://www.klsescreener.com/v2/news/view/1362635,2024-07-23 10:49:16,2024-07-23 18:34:46,2024-07-23 10:38:13,"Chinese vehicle manufacturer Chery's Jaecoo has launched its J7 sport utility vehicle (SUV), with a price tag starting from RM138,800.

The company said the J7 All-Wheel Drive (AWD) variant is priced at RM148,800, while the Two-Wheel Drive variant is priced at RM138,800.","<div class=newsTextDataWrapInner><p>KUALA LUMPUR (July 23): Chinese vehicle manufacturer Chery's Jaecoo has launched its J7 sport utility vehicle (SUV), with a price tag starting from RM138,800.</p></div>

<div class=newsTextDataWrapInner><p>The company said the J7 All-Wheel Drive (AWD) variant is priced at RM148,800, while the Two-Wheel Drive variant is priced at RM138,800.</p></div>

<div class=newsTextDataWrapInner><p>In a recent statement, Jaecoo Malaysia said the premium off-road SUV brand had received overwhelming interest from the market, following months of building a solid network",Edge,,https://assets.theedgemarkets.com/Photo 2_0.JPG,https://assets.theedgemarkets.com/Photo 2_0.JPG,52,TheEdge,http://www.theedgemarkets.com/categories/malaysia
Special flight departs to evacuate Malaysians from Bangladesh,https://www.klsescreener.com/v2/news/view/1362631,2024-07-23 10:36:45,2024-07-23 18:19:53,2024-07-23 10:13:36,"SEPANG (July 23): A special flight, under Prime Minister Datuk Seri Anwar Ibrahim’s directive to bring back Malaysians in strife-torn Bangladesh, departed from the Kuala Lumpur International Airport (KLIA) Terminal 2 at 7.30am on Tuesday.","<div class=newsTextDataWrapInner><p>SEPANG (July 23): A special flight, under Prime Minister Datuk Seri Anwar Ibrahim’s directive to bring back&nbsp;Malaysians in&nbsp;strife-torn Bangladesh, departed from the Kuala Lumpur International Airport&nbsp;(KLIA)&nbsp;Terminal 2 at 7.30am on Tuesday.</p></div>

<div class=newsTextDataWrapInner><p>The AirAsia flight, which utilises an Airbus A320 wide-body aircraft capable of accommodating 350 passengers, is expected to arrive at Hazrat Shahjalal International Airport in Dhaka at 9.20am (local time).</p></div>

<div class=newsTextDataWrapInner><p>",新闻,,https://assets.theedgemarkets.com/Aviation-1_20240723100913_theedgemalaysia.jpg,https://assets.theedgemarkets.com/Aviation-1_20240723100913_theedgemalaysia.jpg,52,TheEdge,http://www.theedgemarkets.com/categories/malaysia
Bursa Malaysia opens higher as bargain hunters swoop in,https://www.klsescreener.com/v2/news/view/1362625,2024-07-23 10:10:29,2024-07-23 10:10:29,2024-07-23 10:08:44,"KUALA LUMPUR: Bursa Malaysia opened higher today supported by bargain hunting activities.At the start of trading, the FBM KLCI rose 3.17 points to 1,625.23, recouping some of the 14-point loss recorded in the previous day.In the broader market, gainers outnumbered ...","<div itemprop=""articleBody"" class=""dable-content-wrapper""><p>KUALA LUMPUR: Bursa Malaysia opened higher today supported by bargain hunting activities.</p><p>At the start of trading, the FBM KLCI rose 3.17 points to 1,625.23, recouping some of the 14-point loss recorded in the previous day.</p><p>In the broader market, gainers outnumbered decliners 353 to 122, with 291 counters unchanged, 1,705 untraded and 16 suspended.</p><p>Turnover stood at 291.12 million units worth RM184.96 million.</p><p>Rakuten Trade Sdn Bhd&#039;s equity research vice-president Thong Pak Leng said the FBM KLCI declined",Corporate,,https://assets.nst.com.my/images/articles/op23_NSTfield_image_listing_featured_v2.var_1721700520.jpg,https://assets.nst.com.my/images/articles/2EAFFEA9-63AC-4916-8E06-36E64451B8F8bursa_1721700513.jpg,79,NST,https://www.nst.com.my/business/corporate
"Phillip Capital expects stronger 1Q for Pantech, raises target price to RM1.42",https://www.klsescreener.com/v2/news/view/1362627,2024-07-23 10:17:14,2024-07-23 18:05:13,2024-07-23 10:07:29,"Phillip Capital has maintained its 'buy' rating for Pantech Group Holdings Bhd (KL:PANTECH) at RM1.09, with a higher target price of RM1.42 (from RM1.35), and said it expects the company to report stronger earnings year-on-year for the first quarter ended May 31, 2024 (1QFY2025), with a core net profit forecast of RM24 million to RM27 million.","<div class=newsTextDataWrapInner><p>KUALA LUMPUR (July 23): Phillip Capital has maintained its 'buy'&nbsp;rating for Pantech Group Holdings Bhd (KL:PANTECH) at RM1.09, with a higher target price of RM1.42 (from RM1.35), and said it expects the company to report stronger earnings year-on-year for the first quarter ended May 31, 2024 (1QFY2025), with a core net profit forecast of RM24 million to RM27 million.</p></div>

<div class=newsTextDataWrapInner><p>In a results preview on Tuesday, the research house said the improvement can be attributed to higher export sales volume, bolstered by the r",Edge,,https://assets.theedgemarkets.com/Pantech-Group_20240408115555_pantech-group.com__1.jpg,https://assets.theedgemarkets.com/Pantech-Group_20240408115555_pantech-group.com__1.jpg,52,TheEdge,http://www.theedgemarkets.com/categories/malaysia
