title,url,created_at,updated_at,published_date,summary,content,category,author,thumbnail_url,image_url,publisher_id,publisher_name,publisher_url
MAG unveils new ground uniform; focuses on become Asia&#039;s leading travel & aviation services group.,https://www.klsescreener.com/v2/news/view/1260515,2024-01-10 13:50:53,2024-01-10 13:50:53,2024-01-10 13:41:12,SEPANG: Malaysia Aviation Group (MAG) will be focusing on three core principles in 2024 as it aspires to become Asia&#039;s leading travel and aviation services group. MAG group managing director Datuk Captain Izham Ismail said the group will elevate its ...,"<div itemprop=""articleBody"" class=""dable-content-wrapper""><p>SEPANG: Malaysia Aviation Group (MAG) will be focusing on three core principles in 2024 as it aspires to become Asia&#039;s leading travel and aviation services group. </p><p>MAG group managing director Datuk Captain Izham Ismail said the group will elevate its efforts to improve its cabin comfort as well as its in-flight dining experiences and refine its overall service delivery to its passengers. </p><p>""We&#039;re making significant investments including modernising our fleet with new aircraft and seats, improving our overall offe",Corporate,,https://assets.nst.com.my/images/articles/mag10_NSTfield_image_listing_featured_v2.var_1704865269.jpg,https://assets.nst.com.my/images/articles/mag_1_1704865256.jpg,79,NST,https://www.nst.com.my/business/corporate
Allianz Malaysia and its warrant lead top gainers after announcing record dividend payout,https://www.klsescreener.com/v2/news/view/1260513,2024-01-10 13:50:33,2024-01-10 19:32:23,2024-01-10 13:31:55,"KUALA LUMPUR (Jan 10): Allianz Malaysia Bhd and its warrant led the top gainers list on Wednesday, after the company announced a record dividend payout.","<div class=newsTextDataWrapInner><p>KUALA LUMPUR (Jan 10): Allianz Malaysia Bhd and its warrant led the top gainers&nbsp;list&nbsp;on Wednesday, after the company announced a record dividend payout.&nbsp;</p></div>

<div class=newsTextDataWrapInner><p>Allianz Malaysia’s share price jumped to a record high of RM19.24 at&nbsp;noon break — &nbsp;54 sen or 2.89% higher than the previous closing price of RM18.70 — valuing it at RM3.42 billion.&nbsp;</p></div>

<div class=newsTextDataWrapInner><p>It saw some 103,100 shares changed hands, more than double its 200-day average volume of 29,680. The",Edge,,https://assets.theedgemarkets.com/Allianz-Malaysia-Berhad_20240110132549_allianzmalaysiabhd.jpg,,52,TheEdge,http://www.theedgemarkets.com/categories/malaysia
Analysts neutral on KPS' stake sale in bedding business despite fair value gain,https://www.klsescreener.com/v2/news/view/1260511,2024-01-10 13:50:32,2024-01-10 19:04:31,2024-01-10 13:31:47,Kumpulan Perangsang Selangor Bhd’s (KPS)  divestment of a 50% stake in bedding product maker Kaiserkorp Corp Sdn Bhd to AI Dream (HK) Ltd for RM265.48 million cash is seen as a neutral deal by Kenanga Investment Bank Bhd (Kenanga IB).,"<div class=newsTextDataWrapInner><p>KUALA LUMPUR (Jan 10): Kumpulan Perangsang Selangor Bhd’s (KPS)&nbsp; divestment of a 50% stake in bedding product maker Kaiserkorp Corp Sdn Bhd to AI Dream (HK) Ltd for RM265.48 million cash is seen as a neutral deal by Kenanga Investment Bank Bhd (Kenanga IB).</p></div>

<div class=newsTextDataWrapInner><p>But the research house, in a note on Wednesday (Jan 10), said KPS should reinvest the cash proceeds from the sale in businesses with high returns.</p></div>

<div class=newsTextDataWrapInner><p>The disposal, which is expected to be completed by March",新闻,,https://assets.theedgemarkets.com/Kumpulan-Perangsang-Selangor-Berhad-1_20240110132248_kps.com_.my_.jpg,,52,TheEdge,http://www.theedgemarkets.com/categories/malaysia
"My Say: World Bank enables private capture of profits, public resources",https://www.klsescreener.com/v2/news/view/1260509,2024-01-10 13:48:42,2024-01-11 15:46:24,2024-01-10 13:30:00,"The World Bank insists commercial finance is necessary for achieving economic recovery and the United Nations Sustainable Development Goals (SDGs), but does little to ensure profit-hungry commercial finance serves the public interest.

By failing to address pressing challenges within the...","<div class=newsTextDataWrapInner><p><span style=""font-style: italics;"">This article first appeared in Forum, The Edge Malaysia Weekly on January 8, 2024 - January 14, 2024</span></p></div><div class=newsTextDataWrapInner><p>The World Bank insists commercial finance is necessary for achieving economic recovery and the United Nations Sustainable Development Goals (SDGs), but does little to ensure profit-hungry commercial finance serves the public interest.</p></div>

<div class=newsTextDataWrapInner><p>By failing to address pressing challenges within their purview, the second-ever Bretton Wood",Edge,,https://assets.theedgemarkets.com/P48-WorldBank-TEM1505_Forum_20240108145716_reuters.jpg,,54,TheEdge,http://www.theedgemarkets.com/options/edge
Govt will not arbitrarily impose progressive wage policy - Rafizi,https://www.klsescreener.com/v2/news/view/1260497,2024-01-10 13:27:27,2024-01-10 13:27:27,2024-01-10 13:21:00,"KUALA SELANGOR: The government will not arbitrarily allow the implementation of the progressive wage policy but will instead take into account the ability of employers and the current state of the country&#039;s economy, said Economy Minister Rafizi Ramli.He ...","<div itemprop=""articleBody"" class=""dable-content-wrapper""><p>KUALA SELANGOR: The government will not arbitrarily allow the implementation of the progressive wage policy but will instead take into account the ability of employers and the current state of the country&#039;s economy, said Economy Minister Rafizi Ramli.</p><p>He said that was because the implementation of the policy was voluntary and involved incentives from the government.</p><p>""We cannot impose arbitrarily, like a minimum wage order, because we also have to take into account the ability of companies, employers and the (national",Economy,,https://assets.nst.com.my/images/articles/pwp10_NSTfield_image_listing_featured_v2.var_1704864057.jpg,https://assets.nst.com.my/images/articles/09hm26raRAFIZI_RAMLI_1704864050.jpg,81,NST,https://www.nst.com.my/business/economy
Beruas MP’s residence hit by Molotov cocktail: Police tracking down suspect,https://www.klsescreener.com/v2/news/view/1260501,2024-01-10 13:35:45,2024-01-10 22:34:25,2024-01-10 13:15:04,"IPOH (Jan 10): Police are hunting for the individual suspected of hurling a molotov cocktail into the house of Beruas Member of Parliament (MP) Datuk Ngeh Koo Ham in Ayer Tawar, which damaged a car on Wednesday morning.","<div class=newsTextDataWrapInner><p>IPOH (Jan 10):&nbsp;Police are hunting for the individual suspected of hurling a Molotov cocktail into the house of Beruas Member of Parliament (MP)&nbsp;Datuk Ngeh Koo Ham in&nbsp;Ayer Tawar, which damaged a car on Wednesday morning.</p></div>

<div class=newsTextDataWrapInner><p>Perak police chief Datuk Seri Mohd Yusri Hassan Basri said Manjung police received a call from Ngeh himself to inform of the incident at 2.55am.&nbsp;</p></div>

<div class=newsTextDataWrapInner><p>“The incident damaged a Mercedes Benz, while two other vehicles sustained effect",,,https://assets.theedgemarkets.com/PDRM-Police-Di-Raja-Malaysia-logo-svd-off-24092020story_20240110123115_bernama.jpg,,52,TheEdge,http://www.theedgemarkets.com/categories/malaysia
"Molotov cocktail hurled at Ngeh’s house: Loke urges Home Ministry, police to give serious attention",https://www.klsescreener.com/v2/news/view/1260491,2024-01-10 13:18:44,2024-01-10 19:02:38,2024-01-10 13:07:29,"KUALA LUMPUR (Jan 10): DAP has called on the Ministry of Home Affairs and the Royal Malaysian Police to take serious note of the incident in which a ""Molotov cocktail"" was thrown into the residence of Beruas Member of Parliament (MP) Datuk Ngeh Koo Ham early Wednesday morning.","<div class=newsTextDataWrapInner><p>KUALA LUMPUR (Jan 10): DAP has called on the Ministry of Home Affairs&nbsp;and the Royal Malaysian Police to take serious note of the incident in which a ""Molotov cocktail"" was&nbsp;thrown into&nbsp;the residence of Beruas Member of Parliament (MP)&nbsp;Datuk Ngeh Koo Ham&nbsp;early&nbsp;Wednesday&nbsp;morning.</p></div>

<div class=newsTextDataWrapInner><p>DAP secretary-general Anthony Loke Siew Fook, in a statement on Wednesday said the incident caused a fire that destroyed Ngeh’s car.</p></div>

<div class=newsTextDataWrapInner><p>Loke, who is also th",,,https://assets.theedgemarkets.com/Bruas-MP-Ngeh-Koo-Ham-tknoff-theborneopost.com-Dec30.2023_20240110123048_bernama.jpg,,52,TheEdge,http://www.theedgemarkets.com/categories/malaysia
Bursa Malaysia closes midday in negative territory,https://www.klsescreener.com/v2/news/view/1260485,2024-01-10 13:10:25,2024-01-10 13:10:25,2024-01-10 13:05:56,"KUALA LUMPUR: Bursa Malaysia continued its downtrend to close in negative territory at midday break.At 12.30pm, FTSE Bursa Malaysia (FBM) KLCI closed 0.67 per cent or 10.08 points lower at 1,488.75 versus yesterday&#039;s closing of 1,498.83.The key index which opened at 1,497.80 ...","<div itemprop=""articleBody"" class=""dable-content-wrapper""><p>KUALA LUMPUR: Bursa Malaysia continued its downtrend to close in negative territory at midday break.</p><p>At 12.30pm, FTSE Bursa Malaysia (FBM) KLCI closed 0.67 per cent or 10.08 points lower at 1,488.75 versus yesterday&#039;s closing of 1,498.83.</p><p>The key index which opened at 1,497.80 hit a low of 1,487.90 during the morning trading session.</p><p>The index board was also a sea of red with FBM100 losing 0.56 per cent to 10,753.69, FBM Emas lost 0.53 per cent to 11,107.45 and FBM Ace dropped 1.02 per cent to 5,387.16.</p><p>O",Corporate,,https://assets.nst.com.my/images/articles/mid10_NSTfield_image_listing_featured_v2.var_1704863153.jpg,https://assets.nst.com.my/images/articles/HQ2310101258bursa_1704863146.jpg,79,NST,https://www.nst.com.my/business/corporate
Bursa stays lower at midday,https://www.klsescreener.com/v2/news/view/1260489,2024-01-10 13:18:43,2024-01-10 19:04:28,2024-01-10 13:03:59,"Bursa Malaysia stayed lower at midday on Wednesday, dragged down by persistent selling in selected heavyweights mainly in the financial services sector and staying in sync with the downbeat regional markets.","<div class=newsTextDataWrapInner><p>KUALA LUMPUR (Jan 10): Bursa Malaysia stayed lower at midday on Wednesday, dragged down by persistent selling in selected heavyweights mainly in the financial services sector and staying in sync with the downbeat regional markets.</p></div>

<div class=newsTextDataWrapInner><p>At 12.30pm, the FTSE Bursa Malaysia KLCI (FBM KLCI) decreased 0.67%, or 10.08 points, to 1,488.75 from Tuesday's close of 1,498.83.</p></div>

<div class=newsTextDataWrapInner><p>Public Bank Bhd fell seven sen to RM4.32, Malayan Banking Bhd dropped nine sen to RM9.01 and CIMB Group",新闻,,https://assets.theedgemarkets.com/noon-market-down_20240110125930_theedgemalaysia.jpg,,52,TheEdge,http://www.theedgemarkets.com/categories/malaysia
Datasonic Group’s earnings to jump with RM175m contract extensions from Home Ministry — analysts,https://www.klsescreener.com/v2/news/view/1260483,2024-01-10 13:05:55,2024-01-10 19:02:36,2024-01-10 12:58:11,"KUALA LUMPUR (Jan 10): Analysts anticipate a significant boost in Datasonic Group Bhd’s earnings, after the group received four contract extensions from the Ministry of Home Affairs (Moha) worth a total of RM175 million.","<div class=newsTextDataWrapInner><p>KUALA LUMPUR (Jan 10): Analysts anticipate a significant boost in Datasonic Group Bhd’s earnings, after the group received four contract extensions from the Ministry of Home Affairs (Moha) worth a total of RM175 million.&nbsp;</p></div>

<div class=newsTextDataWrapInner><p>In a note on Wednesday, RHB Research said the contract extension which involves the supply of national identity (ID) cards, comprehensive maintenance services, and e-Passports solutions for another six months ending May 31, 2024, may have an upward price revision that will further enhanc",,,https://assets.theedgemarkets.com/Datasonic-1_20240110124820_datasonic.com_.my_.jpg,,52,TheEdge,http://www.theedgemarkets.com/categories/malaysia
"Asia's vehicle sales growth to moderate in 2024 amid waning inflation, burgeoning EV market, says BMI",https://www.klsescreener.com/v2/news/view/1260481,2024-01-10 13:05:54,2024-01-10 18:34:21,2024-01-10 12:56:14,"BMI, a Fitch Solutions company, has projected a 2.3% year-on-year (y-o-y) increase in vehicle sales for the Asian region in 2024, moderating from the estimated 5.4% growth last year.","<div class=newsTextDataWrapInner><p>KUALA LUMPUR (Jan 10): BMI, a Fitch Solutions company, has projected a 2.3% year-on-year (y-o-y) increase in vehicle sales for the Asian region in 2024, moderating from the estimated 5.4% growth last year.</p></div>

<div class=newsTextDataWrapInner><p>In a statement on Jan 9, the firm said the moderated growth is driven by the peak in borrowing costs that would build confidence in the buyer market, during which the expense of vehicle financing would remain stable or increase insignificantly.</p></div>

<div class=newsTextDataWrapInner><p>It added that t",Edge,,https://assets.theedgemarkets.com/20230103_PEO_HEAVY-TRAFFIC-KL_ZHD_2231_20240110125527_theedgemalaysia.jpg,,52,TheEdge,http://www.theedgemarkets.com/categories/malaysia
FBM KLCI drops 10pts after 5-day winning streak,https://www.klsescreener.com/v2/news/view/1260479,2024-01-10 13:00:34,2024-01-10 13:00:34,2024-01-10 12:42:00,KUALA LUMPUR: The profit-taking activity on Bursa Malaysia intensified over the early session as investors cashed in on recent gains after buying up the market for five straight days.,"<div class=""inline-img""><div class=""story-image""></div></div><div id=""story-body"" class=""story bot-15 relative""><p>KUALA LUMPUR: The profit-taking activity on Bursa Malaysia intensified over the early session as investors cashed in on recent gains after buying up the market for five straight days.</p><p>At 12.30pm, the benchmark FBM KLCI had fallen 10.3 points to 1,488.53 while the number of decliners on the broader market dwarfed gainers 611 to 280.</p><p>Trading volume on the market, however, remained healthy with 3.02 billion shares done for RM1.37bil.</p><p>Bank shares were among the bigge",,,https://apicms.thestar.com.my/uploads/images/2024/01/10/2483427.jpg,https://apicms.thestar.com.my/uploads/images/2024/01/10/2483427.jpg,28,TheStar,http://www.thestar.com.my/news/latest/?tag=Business
"COA quashes unilateral conversion of single mum’s children, strikes out state enactment as unconstitutional",https://www.klsescreener.com/v2/news/view/1260469,2024-01-10 12:50:29,2024-01-10 19:49:11,2024-01-10 12:38:33,"PUTRAJAYA (Jan 10): In a unanimous decision, the appellate court has ruled the unilateral conversion to Islam of single mother Loh Siew Hong’s three minor children as unconstitutional. A three member panel also struck out a provision in the Perlis state Islamic enactment which allowed such conversions.","<div class=newsTextDataWrapInner><p>PUTRAJAYA (Jan 10): In a unanimous decision, the appellate court has ruled the unilateral conversion to Islam of single mother Loh Siew Hong’s three minor children as unconstitutional. A three member panel also struck out a provision in the Perlis state Islamic enactment which allowed such conversions.<br />
&nbsp;<br />
The panel led by Court of Appeal (COA) judge Datuk Hadhariah Syed Ismail said that the High Court judge had not addressed two pertinent issues in the judicial review proceedings previously brought by Loh, namely whether the unilateral conv",新闻,,https://assets.theedgemarkets.com/20230511-LOW-SIEW-HONG-KL-Court-ZHD-78-unilateral-conversion-3-kids-tr_20240110123304_theedgemalaysia.jpg,,52,TheEdge,http://www.theedgemarkets.com/categories/malaysia
"FGV makes significant strides in remediation plan, to appeal US withold order by end of 2Q2024",https://www.klsescreener.com/v2/news/view/1260461,2024-01-10 12:25:59,2024-01-10 12:25:59,2024-01-10 12:18:33,"KUALA LUMOUR: FGV Holdings Bhd (FGV) has made significant strides in implementing a remediation plan for its labour force, as part of its plan to submit a petition to modify the Withhold Release Order (WRO) issued by the United States ...","<div itemprop=""articleBody"" class=""dable-content-wrapper""><p>KUALA LUMOUR: FGV Holdings Bhd (FGV) has made significant strides in implementing a remediation plan for its labour force, as part of its plan to submit a petition to modify the Withhold Release Order (WRO) issued by the United States Customs and Border Protection (CBP) by the end of the second quarter of 2024.</p><p>The remediation plan seeks to uphold labour rights and address any gaps in its labour practices.</p><p>A key component of FGV&#039;s remediation programme is the reimbursement of recruitment fees imposed on its migrant w",Corporate,,https://assets.nst.com.my/images/articles/fgv10_NSTfield_image_listing_featured_v2.var_1704860310.jpg,https://assets.nst.com.my/images/articles/WISMA_FGV_1704860304.jpg,79,NST,https://www.nst.com.my/business/corporate
"RHB IB stays upbeat on Kelington’s prospects amid tailwinds in water fab industry, raises target price by 22%",https://www.klsescreener.com/v2/news/view/1260451,2024-01-10 12:02:12,2024-01-10 18:32:24,2024-01-10 11:48:39,"RHB Investment Bank Bhd (RHB IB) has raised its target price (TP) for Kelington Group Bhd by 22% to RM2.64 (from RM2.16), as the research house remains upbeat on the group’s prospects, supported by tailwinds in the water fab industry, improved earnings delivery and margin prospects.","<div class=newsTextDataWrapInner><p>KUALA LUMPUR (Jan 10): RHB Investment Bank Bhd (RHB IB) has raised its target price (TP) for Kelington Group Bhd by 22% to RM2.64 (from RM2.16), as the research house remains upbeat on the group’s prospects, supported by tailwinds in the water fab industry, improved earnings delivery and margin prospects.</p></div>

<div class=newsTextDataWrapInner><p>In a note, the research house said the integrated engineering services provider's exposure in the front-end of the chip value chain ostensibly shields it from the inventory correction or adjustments plaguing ",新闻,,https://assets.theedgemarkets.com/Kelington_20240110113824_kelington-group.com_.jpg,,52,TheEdge,http://www.theedgemarkets.com/categories/malaysia
Australia's sharp inflation slowdown reinforces view RBA hike-cycle is over,https://www.klsescreener.com/v2/news/view/1260445,2024-01-10 11:55:25,2024-01-10 11:55:25,2024-01-10 11:35:00,"SYDNEY: Australia's inflation slumped to a near two-year low in November and core inflation also eased sharply, a softer-than-expected result that reinforced market expectations interest rates would not need to rise any further.","<div class=""inline-img""><div class=""story-image""><p class=""caption"">Pedestrians walk past the Reserve Bank of Australia building in central Sydney.  — Reuters</p></div></div><div id=""story-body"" class=""story bot-15 relative""><p>SYDNEY: Australia's inflation slumped to a near two-year low in November and core inflation also eased sharply, a softer-than-expected result that reinforced market expectations interest rates would not need to rise any further.</p><p>Data from the Australian Bureau of Statistics on Wednesday showed its monthly consumer price index (CPI) rose at an annual pace of 4.3% i",,,https://apicms.thestar.com.my/uploads/images/2024/01/10/2483338.JPG,https://apicms.thestar.com.my/uploads/images/2024/01/10/2483338.JPG,28,TheStar,http://www.thestar.com.my/news/latest/?tag=Business
New retirement solutions enter the market,https://www.klsescreener.com/v2/news/view/1260443,2024-01-10 11:50:54,2024-01-11 15:18:25,2024-01-10 11:30:07,"Some quarters say the country is undergoing a “retirement crisis”, which may not be untrue. Half of the Employees Provident Fund (EPF) members aged 50 to 54 have less than RM50,000 for retirement. Adding in the nation’s household debt of 146% and that 47% of youth (both as at June this year) have high credit card debts, the future of the country’s retirement landscape looks rather bleak.","<div class=newsTextDataWrapInner><p><span style=""font-style: italics;"">This article first appeared in Wealth, The Edge Malaysia Weekly on December 25, 2023 - January 7, 2024</span></p></div><div class=newsTextDataWrapInner><p>Some quarters say the country is undergoing a “retirement crisis”, which may not be untrue. Half of the Employees Provident Fund (EPF) members aged 50 to 54 have less than RM50,000 for retirement. Adding in the nation’s household debt of 146% and that 47% of youth (both as at June this year) have high credit card debts, the future of the country’s retirement landscape loo",Edge,,https://assets.theedgemarkets.com/weatlh-pg-18-tem1504_thumb_20231229163706_123rf.jpg,,54,TheEdge,http://www.theedgemarkets.com/options/edge
My Say: A new investment cycle could produce upside to regional growth,https://www.klsescreener.com/v2/news/view/1260441,2024-01-10 11:50:53,2024-01-11 14:46:22,2024-01-10 11:30:00,"The most volatile segment of an economy is investment spending, so any surprise to expectations of economic growth would tend to come from how investment behaves. We believe that there is a good chance that a new investment cycle in the Asian region could emerge, which would produce better econom...","<div class=newsTextDataWrapInner><p><span style=""font-style: italics;"">This article first appeared in Forum, The Edge Malaysia Weekly on January 8, 2024 - January 14, 2024</span></p></div><div class=newsTextDataWrapInner><p>The most volatile segment of an economy is investment spending, so any surprise to expectations of economic growth would tend to come from how investment behaves. We believe that there is a good chance that a new investment cycle in the Asian region could emerge, which would produce better economic prospects than currently expected.</p></div>

<div class=newsTextDataWrapI",Edge,,https://assets.theedgemarkets.com/P46-Manu-TEM1505_Forum_20240108144828_bloomberg.jpg,,54,TheEdge,http://www.theedgemarkets.com/options/edge
Rafizi: Govt will not arbitrarily impose progressive wage policy,https://www.klsescreener.com/v2/news/view/1260433,2024-01-10 11:32:01,2024-01-10 18:19:16,2024-01-10 11:27:18,"KUALA SELANGOR (Jan 10): The government will not arbitrarily allow the implementation of the progressive wage policy but will instead take into account the ability of employers and the current state of the country's economy, said Economy Minister Rafizi Ramli.","<div class=newsTextDataWrapInner><p>KUALA SELANGOR (Jan 10): The government will not arbitrarily allow the implementation of the progressive wage policy but will instead take into account the ability of employers and the current state of the country's economy, said Economy Minister Rafizi Ramli.</p></div>

<div class=newsTextDataWrapInner><p>He said this is&nbsp;because the implementation of the policy is voluntary and involves incentives from the government.</p></div>

<div class=newsTextDataWrapInner><p>""We cannot impose arbitrarily, like a minimum wage order, because we also have to tak",,,https://assets.theedgemarkets.com/Econ-Min-Rafizi-Ramli-20230911-RMK-12MP-MTR-Parl-ZHD-161_20240110112051_theedgemalaysia.jpg,,52,TheEdge,http://www.theedgemarkets.com/categories/malaysia
"EPF distributes one-off RM500 incentive to 1.4m members with  savings of RM10,000 and less ",https://www.klsescreener.com/v2/news/view/1260419,2024-01-10 11:10:12,2024-01-10 11:10:12,2024-01-10 11:04:57,"KUALA LUMPUR: The Employees Provident Fund (EPF) today announced that it has disbursed RM500 one-off government additional contribution incentive to 1.4 million members with EPF savings of RM10,000 or less in their Account 1 as of Feb 24, 2023.The RM708 million payout are ...","<div itemprop=""articleBody"" class=""dable-content-wrapper""><p>KUALA LUMPUR: The Employees Provident Fund (EPF) today announced that it has disbursed RM500 one-off government additional contribution incentive to 1.4 million members with EPF savings of RM10,000 or less in their Account 1 as of Feb 24, 2023.</p><p>The RM708 million payout are specifically for members aged between 40 and under 55 years of age.</p><p>The contribution incentive was announced during the tabling of Budget 2023 on Feb 24, 2023.</p><p>According to the EPF, the incentive seeks to encourage EPF members with low savings and",Corporate,,https://assets.nst.com.my/images/articles/epf10_NSTfield_image_listing_featured_v2.var_1704855894.jpg,https://assets.nst.com.my/images/articles/epf_1704855887.jpg,79,NST,https://www.nst.com.my/business/corporate
