title,url,created_at,updated_at,published_date,summary,content,category,author,thumbnail_url,image_url,publisher_id,publisher_name,publisher_url
Shell awards contracts to Sabahan firms ,https://www.klsescreener.com/v2/news/view/1349273,2024-06-27 17:11:08,2024-06-27 17:11:08,2024-06-27 17:08:49,KUALA LUMPUR: Sabah Shell Petroleum Company Ltd (SSPC) has awarded two separate asset operations contracts to two companies based in Sabah namely Neopetro Sdn Bhd and SAZMA Aviation.SSPC&#039;s contract with Neopetro involves  provision of accommodation vessels to house ...,"<div itemprop=""articleBody"" class=""dable-content-wrapper""><p>KUALA LUMPUR: Sabah Shell Petroleum Company Ltd (SSPC) has awarded two separate asset operations contracts to two companies based in Sabah namely Neopetro Sdn Bhd and SAZMA Aviation.</p><p>SSPC&#039;s contract with Neopetro involves  provision of accommodation vessels to house over 500 personnel during Gumusut-Kakap platform&#039;s turnaround campaign this year. </p><p>With SAZMA Aviation, SSPC signed a contract for the provision of offshore helicopter services to transport personnel to and from offshore locations. </p><p>SAZMA Aviat",Corporate,,https://assets.nst.com.my/images/articles/shel27_NSTfield_image_listing_featured_v2.var_1719479326.jpg,https://assets.nst.com.my/images/articles/shell_mou_1719479319.jpg,79,NST,https://www.nst.com.my/business/corporate
"BNM refining takaful scheme for paddy crop, says minister",https://www.klsescreener.com/v2/news/view/1349277,2024-06-27 17:21:18,2024-06-27 23:02:39,2024-06-27 17:03:58,"The paddy crop takaful scheme (STTP) is currently being refined at the Bank Negara Malaysia level, through Bank Pertanian Malaysia (Agro Bank), before its introduction to farmers.","<div class=newsTextDataWrapInner><p>ALOR SETAR (June 27): The paddy crop takaful scheme (STTP) is currently being refined at the Bank Negara Malaysia level, through Bank Pertanian Malaysia (Agro Bank), before its introduction to farmers.</p></div>

<div class=newsTextDataWrapInner><p>Agriculture and Food Security Minister Datuk Seri Mohamad Sabu said that the scheme aims to alleviate the financial burden on farmers caused by natural disasters due to climate change.</p></div>

<div class=newsTextDataWrapInner><p>“We hope that all farmers will be insured through this scheme eventually. Previ",新闻,,https://assets.theedgemarkets.com/malaysia rice paddy field 20231122_20231122083514_reuters.jpg,https://assets.theedgemarkets.com/malaysia rice paddy field 20231122_20231122083514_reuters.jpg,52,TheEdge,http://www.theedgemarkets.com/categories/malaysia
Report on special committee’s review of state assemblies’ competency to enact Islamic laws ready by end-2024,https://www.klsescreener.com/v2/news/view/1349269,2024-06-27 17:04:33,2024-06-27 22:49:32,2024-06-27 17:00:11,KUALA LUMPUR (June 27): The study report by the Special Committee to Review the Competency of the State Legislative Assemblies to Enact Islamic Laws is expected to be completed before the end of the year.,<div class=newsTextDataWrapInner><p>KUALA LUMPUR (June 27): The study report by the Special Committee to Review the Competency of the State Legislative Assemblies to Enact Islamic Laws is expected to be completed before the end of the year.</p></div><div class=newsTextDataWrapInner><p>Deputy Minister in the Prime Minister’s Department (Religious Affairs)&nbsp;Dr&nbsp;Zulkifli Hasan said the report will be presented to the National Council for Islamic Religious Affairs (MKI) and the Council of Rulers upon completion.</p></div><div class=newsTextDataWrapInner><p>Zulkifli said the committee has b,新闻,,https://assets.theedgemarkets.com/27062024-Dep-Min-PMs-Dept-Religious-Affairs-Dr-Zulkifli-Hasan-Dewan-R-2nd-Meet-3rd-Session-15th-Parl_20240627165422_bernama.jpg,https://assets.theedgemarkets.com/27062024-Dep-Min-PMs-Dept-Religious-Affairs-Dr-Zulkifli-Hasan-Dewan-R-2nd-Meet-3rd-Session-15th-Parl_20240627165422_bernama.jpg,52,TheEdge,http://www.theedgemarkets.com/categories/malaysia
Chinese voters can be decisive factor for a comfortable win — Joohari,https://www.klsescreener.com/v2/news/view/1349267,2024-06-27 17:04:32,2024-06-27 22:49:29,2024-06-27 16:58:32,"The Pakatan Harapan (PH) candidate for the Sungai Bakap state by-election, Dr Joohari Ariffin, has admitted that the support of 22.5 per cent of Chinese voters can determine the comfortable victory of the Unity Government on the July 6 polling.","<div class=newsTextDataWrapInner><p>NIBONG TEBAL (June 27): The Pakatan Harapan (PH) candidate for the Sungai Bakap state by-election, Dr Joohari Ariffin, has admitted that the support of 22.5 per cent of Chinese voters can determine the comfortable victory of the Unity Government on the July 6 polling.</p></div><div class=newsTextDataWrapInner><p>Joohari, 60, affectionately known as Cikgu Joo, said he is confident he will receive solid support from the Chinese community based on their assurances during his campaign trail.</p></div><div class=newsTextDataWrapInner><p>“I hope that with the supp",新闻,,https://assets.theedgemarkets.com/Joohari Ariffin-Sg Bakap_20240627165202_bernama.jpg,https://assets.theedgemarkets.com/Joohari Ariffin-Sg Bakap_20240627165202_bernama.jpg,52,TheEdge,http://www.theedgemarkets.com/categories/malaysia
Jalan Bukit Panchor connecting road addresses Sg Bakap residents' safety concerns,https://www.klsescreener.com/v2/news/view/1349265,2024-06-27 17:04:31,2024-06-27 22:49:27,2024-06-27 16:50:19,"The construction of the road connecting Jalan Bukit Panchor to the federal route FT1 will address safety concerns for residents and spur development in the surrounding area, benefiting the people of Sungai Bakap.","<div class=newsTextDataWrapInner><p>NIBONG TEBAL (June 27): The construction of the road connecting Jalan Bukit Panchor to the federal route FT1 will address safety concerns for residents and spur development in the surrounding area, benefiting the people of Sungai Bakap.</p></div><div class=newsTextDataWrapInner><p>Deputy Works Minister Datuk Seri Ahmad Maslan said that the project, costing RM11.26 million and covering a 1.2km route, began in 2022. It has now reached 74.65% completion, 45 days ahead of schedule, and is expected to be fully completed by February next year.</p></div><div class=",新闻,,https://assets.theedgemarkets.com/Ahmad-Maslan-DEPUTY MINSTER OF FINANCE 1_OPR_20240627164552_theedgemalaysia.jpg,https://assets.theedgemarkets.com/Ahmad-Maslan-DEPUTY MINSTER OF FINANCE 1_OPR_20240627164552_theedgemalaysia.jpg,52,TheEdge,http://www.theedgemarkets.com/categories/malaysia
PBA Holdings expects better performance going forward,https://www.klsescreener.com/v2/news/view/1349261,2024-06-27 16:49:29,2024-06-27 22:34:43,2024-06-27 16:43:15,GEORGE TOWN (June 27): PBA Holdings Bhd (KL:PBA) said the rise in water tariff rates will put it in a better position to finance urgently needed water projects to meet Penang’s increasing water demand.,"<div class=newsTextDataWrapInner><p>GEORGE TOWN (June 27):&nbsp;PBA Holdings Bhd (KL:PBA) said the&nbsp;rise in water tariff rates will put it in a better position to finance urgently needed water projects to meet Penang’s increasing water demand.</p></div><div class=newsTextDataWrapInner><p>Its group chief executive officer (CEO) K&nbsp;Pathmanathan said the new rate of 0.86 sen per cubic metre (m3) for up to 35 m3 of monthly usage is positive for the company’s revenue, and will help raise funding to implement major water supply engineering projects.&nbsp;</p></div><div class=newsTextDataWrap",Edge,,https://assets.theedgemarkets.com/PBA-Holdings_20240627163629_www.pbahb_.com_.my_.jpg,https://assets.theedgemarkets.com/PBA-Holdings_20240627163629_www.pbahb_.com_.my_.jpg,52,TheEdge,http://www.theedgemarkets.com/categories/malaysia
"S&P affirms Malaysia’s sovereign ratings at A-, outlook ‘stable’",https://www.klsescreener.com/v2/news/view/1349259,2024-06-27 16:49:28,2024-06-27 23:34:35,2024-06-27 16:30:59,"KUALA LUMPUR (June 27): S&P Global Ratings on Thursday affirmed Malaysia’s sovereign ratings at A- and “stable” outlook, citing steady growth and potential modest fiscal improvements.","<div class=newsTextDataWrapInner><p>KUALA LUMPUR (June 27): S&amp;P Global Ratings on Thursday affirmed Malaysia’s sovereign ratings at A- and a “stable” outlook, citing steady growth and potential modest fiscal improvements.</p></div>

<div class=newsTextDataWrapInner><p>Malaysia is set to benefit from a strong global semiconductor recovery, reinforcing medium-term growth prospects, S&amp;P said in a statement.&nbsp;Political stability, meanwhile, is leading to a more conducive policymaking, allowing gradual stabilisation of government finances, it noted.</p></div>

<div class=newsTextDat",新闻,,https://assets.theedgemarkets.com/390289645-KL-KLCC-Malaysia-economy-GDP-px-Sun14082022_20240627163030_bloomberg.jpg,https://assets.theedgemarkets.com/390289645-KL-KLCC-Malaysia-economy-GDP-px-Sun14082022_20240627163030_bloomberg.jpg,52,TheEdge,http://www.theedgemarkets.com/categories/malaysia
"MPOB to introduce new innovative techs, services at launch of Transfer of Technology 2024",https://www.klsescreener.com/v2/news/view/1349247,2024-06-27 16:36:49,2024-06-27 22:34:40,2024-06-27 16:26:27,KUALA LUMPUR (June 27): The Malaysian Palm Oil Board (MPOB) will be introducing new innovative technologies and services due to research and development (R&D) encompassing the upstream and downstream sectors of the palm oil sector.,"<div class=newsTextDataWrapInner><p>KUALA LUMPUR (June 27): The Malaysian Palm Oil Board (MPOB) will be introducing&nbsp;new innovative technologies and services due to&nbsp;research and development (R&amp;D) encompassing the upstream and downstream sectors of the palm oil sector.</p></div><div class=newsTextDataWrapInner><p>In a statement on Thursday,&nbsp;MPOB director-general Datuk Dr Ahmad Parveez Ghulam Kadir said the&nbsp;technologies will be launched in conjunction with the Transfer of Technology (TOT) MPOB on&nbsp;July 4, 2024.</p></div><div class=newsTextDataWrapInner><p>He said that ",Edge,,https://assets.theedgemarkets.com/Malaysian-Palm-Oil-Board-MPOB_20240627162115_theedgemalaysia.jpg,https://assets.theedgemarkets.com/Malaysian-Palm-Oil-Board-MPOB_20240627162115_theedgemalaysia.jpg,52,TheEdge,http://www.theedgemarkets.com/categories/malaysia
Asia to emerge as equity deals hot spot as India activity surges,https://www.klsescreener.com/v2/news/view/1349243,2024-06-27 16:33:29,2024-06-27 16:33:29,2024-06-27 16:24:00,"SYDNEY: A possible revival in IPOs in Hong Kong after a pickup in Chinese regulatory approvals, and a string of mega deals in India are expected to make Asia a bright spot for equity deals in the second half of this year, bankers and analysts said.","<div class=""inline-img""><div class=""story-image""></div></div><div id=""story-body"" class=""story bot-15 relative""><p>SYDNEY: A possible revival in IPOs in Hong Kong after a pickup in Chinese regulatory approvals, and a string of mega deals in India are expected to make Asia a bright spot for equity deals in the second half of this year, bankers and analysts said.</p><p>Despite the extended downturn in Asia initial public offerings (IPOs), India's share in Asia equity capital market (ECM) deals is at record high now, and the surge in deals is expected to last for the foreseeable future, they adde",,,https://apicms.thestar.com.my/uploads/images/2024/06/27/2771475.JPG,https://apicms.thestar.com.my/uploads/images/2024/06/27/2771475.JPG,28,TheStar,http://www.thestar.com.my/news/latest/?tag=Business
BNM plans to have banks provide basic accounts at minimal costs,https://www.klsescreener.com/v2/news/view/1349245,2024-06-27 16:36:48,2024-06-27 22:32:36,2024-06-27 16:19:02,Malaysia’s central bank said on Thursday it plans to ask conventional and digital banks to provide basic savings accounts and basic current accounts at minimal costs to consumers.,"<div class=newsTextDataWrapInner><p>KUALA LUMPUR (June 27): Malaysia’s central bank said on Thursday it plans to ask conventional and digital banks to provide basic savings accounts and basic current accounts at minimal costs to consumers.</p></div><div class=newsTextDataWrapInner><p>The move aims to boost access to essential services, particularly for the “unserved and underserved” segments of the Malaysian population, Bank Negara Malaysia (BNM) said. Among the main challenges for these consumers include the relatively high barriers to open a current or savings account, it noted.</p></div><di",新闻,,https://assets.theedgemarkets.com/20220809_BLD_BANK NERGARA (OPR RAISEE)_ZHD_5612 BNM_20230731182351_theedgemalaysia_5.jpg,https://assets.theedgemarkets.com/20220809_BLD_BANK NERGARA (OPR RAISEE)_ZHD_5612 BNM_20230731182351_theedgemalaysia_5.jpg,52,TheEdge,http://www.theedgemarkets.com/categories/malaysia
Mah Sing hopes to meet its RM2.5bil minimum sales target and do better this year,https://www.klsescreener.com/v2/news/view/1349237,2024-06-27 16:10:40,2024-06-27 16:10:40,2024-06-27 16:09:55,"KUALA LUMPUR: Mah Sing is optimistic about having better performance this year and achieving its 2024 minimum sales target of RM2.5 billion.For 2023, the developer reported a 24 per cent increase in pre-tax profit to RM327.4 million compared to RM264.1 million in ...","<div itemprop=""articleBody"" class=""dable-content-wrapper""><p>KUALA LUMPUR: Mah Sing is optimistic about having better performance this year and achieving its 2024 minimum sales target of RM2.5 billion.</p><p>For 2023, the developer reported a 24 per cent increase in pre-tax profit to RM327.4 million compared to RM264.1 million in the fiscal year 2022. </p><p>Founder and group managing director, Tan Sri Leong Hoy Kum, said that 2023 has been a remarkable and successful year for the company and that 2024 has already started off great. </p><p>For the first quarter ended March 31, 2024, the compan",Property,,https://assets.nst.com.my/images/articles/SING27_NSTfield_image_listing_featured_v2.var_1719475793.jpg,https://assets.nst.com.my/images/articles/LEONG_HOY_KUM_1719475786.jpg,87,NST,https://www.nst.com.my/property
Accenture and Avanade recognised by Microsoft,https://www.klsescreener.com/v2/news/view/1349235,2024-06-27 16:10:20,2024-06-27 16:10:20,2024-06-27 16:05:58,"KUALA LUMPUR: Accenture and Avanade have been named Microsoft&#039;s Global System Integrator (SI) Partner of the Year for the 19th consecutive time. Additionally, they received the inaugural Global Business Transformation Partner of the Year award for Microsoft&#039;s Copilot....","<div itemprop=""articleBody"" class=""dable-content-wrapper""><p>KUALA LUMPUR: Accenture and Avanade have been named Microsoft&#039;s Global System Integrator (SI) Partner of the Year for the 19th consecutive time. </p><p>Additionally, they received the inaugural Global Business Transformation Partner of the Year award for Microsoft&#039;s Copilot.</p><p>Avanade said this highlighted their long-standing partnership and commitment to delivering innovative solutions and client value.</p><p>Avanade chief executive officer Pam Maynard said these achievements underscored the company&#039;s close alignm",Corporate,,https://assets.nst.com.my/images/articles/ava_NSTfield_image_listing_featured_v2.var_1719475555.jpg,https://assets.nst.com.my/images/articles/avanade_1719475546.jpg,79,NST,https://www.nst.com.my/business/corporate
Lynas allocates A$25mil capex for Malaysian facility to produce separated hre products,https://www.klsescreener.com/v2/news/view/1349241,2024-06-27 16:33:27,2024-06-27 16:33:27,2024-06-27 16:05:00,"KUALA LUMPUR: Lynas Malaysia, a wholly-owned unit of Lynas Rare Earths Ltd (Lynas), is targeting the first production of two separated heavy rare earths (HRE) products in 2025.","<div class=""inline-img""><div class=""story-image""></div></div><div id=""story-body"" class=""story bot-15 relative""><p>KUALA LUMPUR: Lynas Malaysia, a wholly-owned unit of Lynas Rare Earths Ltd (Lynas), is targeting the first production of two separated heavy rare earths (HRE) products in 2025.</p><p>Lynas said about A$25 million (A$1=RM3.15) in capital expenditure (capex) for this project will be accommodated within the previously disclosed Lynas Malaysia Industrial Plan.</p><p>""A new process will produce separated dysprosium (Dy) and terbium (Tb) at Lynas Malaysia for the first time, and will co",,,https://apicms.thestar.com.my/uploads/images/2024/06/27/2771402.jpeg,https://apicms.thestar.com.my/uploads/images/2024/06/27/2771402.jpeg,28,TheStar,http://www.thestar.com.my/news/latest/?tag=Business
Amendment to Medical Act 1971 for tabling on fourth week of Parliament,https://www.klsescreener.com/v2/news/view/1349239,2024-06-27 16:17:14,2024-06-27 22:32:33,2024-06-27 16:04:46,"KUALA LUMPUR (June 27): A bill on amendments to the Medical Act 1971 (Act 50) is scheduled to be tabled and debated in the fourth week of this Parliament session, the Dewan Rakyat was told on Thursday.","<div class=newsTextDataWrapInner><p>KUALA LUMPUR (June 27): A bill on amendments to the Medical Act 1971 (Act 50) is scheduled to be tabled and debated in the fourth week of this Parliament session, the Dewan Rakyat was told on Thursday.</p></div><div class=newsTextDataWrapInner><p>Health Minister Datuk Seri Dr Dzulkefly Ahmad said the bill would be tabled to resolve the issue of irregularity in&nbsp;medical specialist training in Malaysia, involving the Master of Medicine programme and the&nbsp;parallel pathway medical specialist training.</p></div><div class=newsTextDataWrapInner><p>He&nbsp;",新闻,,https://assets.theedgemarkets.com/368171054-doctor-medical-stethescope-Tues16022021_20240627155839_bloomberg.jpg,https://assets.theedgemarkets.com/368171054-doctor-medical-stethescope-Tues16022021_20240627155839_bloomberg.jpg,52,TheEdge,http://www.theedgemarkets.com/categories/malaysia
Streetscapes: Offerings aplenty on quiet Jalan SS15/5A,https://www.klsescreener.com/v2/news/view/1349233,2024-06-27 16:06:59,2024-07-01 13:20:32,2024-06-27 16:00:00,"SS15 in Subang Jaya is notorious for its traffic congestion. Finding a parking space can be challenging on most days. Just 10 to 12 minutes’ walk away, however, is the more quiet commercial stretch of Jalan SS15/5A, located between Jalan SS15/5 and Jalan SS15/5G, and across from the Subang Jaya M...","<div class=newsTextDataWrapInner><p><span style=""font-style: italics;"">This article first appeared in City & Country, The Edge Malaysia Weekly on June 17, 2024 - June 23, 2024</span></p></div><div class=newsTextDataWrapInner><p>SS15 in Subang Jaya is notorious for its traffic congestion. Finding a parking space can be challenging on most days. Just 10 to 12 minutes’ walk away, however, is the more quiet commercial stretch of Jalan SS15/5A, located between Jalan SS15/5 and Jalan SS15/5G, and across from the Subang Jaya Medical Centre (SJMC) and the SS16 neighbourhood.</p></div>

<div class=ne",Edge,,https://assets.theedgemarkets.com/CC8_-SubangJaya_TEM1528_20240614162045_theedgemalaysia.jpg,https://assets.theedgemarkets.com/CC8_-SubangJaya_TEM1528_20240614162045_theedgemalaysia.jpg,54,TheEdge,http://www.theedgemarkets.com/options/edge
"Higher investments, exports to support Malaysia's growth amid tepid consumer spending — ANZ",https://www.klsescreener.com/v2/news/view/1349231,2024-06-27 16:02:34,2024-06-27 22:02:42,2024-06-27 15:46:04,"Higher investments and exports will support Malaysia’s economic growth though consumer spending is likely to stay subdued, Australia and New Zealand Banking Group Ltd (ANZ) said.","<div class=newsTextDataWrapInner><p>KUALA LUMPUR (June 27): Higher investments and exports will support Malaysia’s economic growth though consumer spending is likely to stay subdued, Australia and New Zealand Banking Group Ltd (ANZ) said.</p></div><div class=newsTextDataWrapInner><p>Gross fixed capital formation, capital goods imports and rising manufacturing productions point to more robust investment activity in 2024, ANZ said in its quarterly outlook note. New export orders and intermediate goods imports have also risen, indicating that exports are likely to recover further, it said.</p></d",新闻,,https://assets.theedgemarkets.com/20230414_PEO_WESTPORT_SB_2-export generic_theedgemalaysia_7.JPG,https://assets.theedgemarkets.com/20230414_PEO_WESTPORT_SB_2-export generic_theedgemalaysia_7.JPG,52,TheEdge,http://www.theedgemarkets.com/categories/malaysia
Fitch maintains Malaysia's sovereign credit rating at BBB+ with ‘stable’ outlook,https://www.klsescreener.com/v2/news/view/1349223,2024-06-27 15:44:27,2024-06-27 15:44:27,2024-06-27 15:27:00,"KUALA LUMPUR: Fitch Ratings (Fitch) has maintained Malaysia’s sovereign credit ratings at BBB+ with a ‘stable’ outlook, underpinned by a diversified economy and export base.","<div class=""inline-img""><div class=""story-image""><p class=""caption"">The iconic skyline of Kuala Lumpur.</p></div></div><div id=""story-body"" class=""story bot-15 relative""><p>KUALA LUMPUR: Fitch Ratings (Fitch) has maintained Malaysia’s sovereign credit ratings at BBB+ with a ‘stable’ outlook, underpinned by a diversified economy and export base.</p><p>Its Asia-Pacific sovereigns associate director, Kathleen Chen, said strong medium-term growth prospects, as well as current account surpluses, also support the rating strength.</p><p>""We expect gross domestic product (GDP) to rebound in 2024. Resi",,,https://apicms.thestar.com.my/uploads/images/2024/06/27/2771287.jpg,https://apicms.thestar.com.my/uploads/images/2024/06/27/2771287.jpg,28,TheStar,http://www.thestar.com.my/news/latest/?tag=Business
Gobind sees Malaysia exceeding 25.5 pct digital GDP target by 2025 via 5G expansion,https://www.klsescreener.com/v2/news/view/1349215,2024-06-27 15:31:17,2024-06-27 15:31:17,2024-06-27 15:24:05,"KUALA LUMPUR: The government is confident that Malaysia can surpass its digital gross domestic product target of 25.5 per cent by 2025 through the expansion of 5G to services beyond telecommunications, said Digital Minister Gobind Singh Deo.He said Digital Nasional Bhd, ...","<div itemprop=""articleBody"" class=""dable-content-wrapper""><p>KUALA LUMPUR: The government is confident that Malaysia can surpass its digital gross domestic product target of 25.5 per cent by 2025 through the expansion of 5G to services beyond telecommunications, said Digital Minister Gobind Singh Deo.</p><p>He said Digital Nasional Bhd, in collaboration with the Malaysian Communications and Multimedia Commission, has planned an expansion to identify industries needing 5G access to prepare the country for Industrial Revolution 4.0 and future technologies.</p><p>""What is necessary is for us to p",Corporate,,https://assets.nst.com.my/images/articles/5GG_NSTfield_image_listing_featured_v2.var_1719473042.jpg,https://assets.nst.com.my/images/articles/GOB_1719473035.jpg,79,NST,https://www.nst.com.my/business/corporate
Fitch maintains Malaysia's sovereign credit rating at BBB+ with 'stable' outlook,https://www.klsescreener.com/v2/news/view/1349219,2024-06-27 15:36:49,2024-06-27 21:49:30,2024-06-27 15:21:51,"Fitch Ratings (Fitch) has maintained Malaysia’s sovereign credit ratings at BBB+ with a ""stable"" outlook, underpinned by a diversified economy and export base.","<div class=newsTextDataWrapInner><p>KUALA LUMPUR (June 27): Fitch Ratings (Fitch) has maintained Malaysia’s sovereign credit ratings at BBB+ with a ""stable"" outlook, underpinned by a diversified economy and export base.</p></div><div class=newsTextDataWrapInner><p>Its Asia-Pacific sovereigns associate director&nbsp;Kathleen Chen&nbsp;said strong medium-term growth prospects, as well as current account surpluses, also support the rating strength.</p></div><div class=newsTextDataWrapInner><p>“We expect gross domestic product (GDP) to rebound in 2024. Resilient domestic demand has been driving th",Edge,,https://assets.theedgemarkets.com/fitch_ratings_ltd_20211112140850_bloomberg_2_4.jpg,https://assets.theedgemarkets.com/fitch_ratings_ltd_20211112140850_bloomberg_2_4.jpg,52,TheEdge,http://www.theedgemarkets.com/categories/malaysia
Fitch maintains Malaysia&#039;s sovereign credit rating at BBB+ with &#039;stable&#039; outlook,https://www.klsescreener.com/v2/news/view/1349213,2024-06-27 15:31:14,2024-06-27 15:31:14,2024-06-27 15:21:49,"KUALA LUMPUR: Fitch Ratings (Fitch) has maintained Malaysia&#039;s sovereign credit ratings at BBB+ with a &#039;stable&#039; outlook, underpinned by a diversified economy and export base.Its Asia-Pacific sovereigns associate director, Kathleen Chen, said strong medium-term growth prospects, as well ...","<div itemprop=""articleBody"" class=""dable-content-wrapper""><p>KUALA LUMPUR: Fitch Ratings (Fitch) has maintained Malaysia&#039;s sovereign credit ratings at BBB+ with a &#039;stable&#039; outlook, underpinned by a diversified economy and export base.</p><p>Its Asia-Pacific sovereigns associate director, Kathleen Chen, said strong medium-term growth prospects, as well as current account surpluses, also support the rating strength.</p><p>""We expect gross domestic product (GDP) to rebound in 2024. Resilient domestic demand has been driving the recovery from the COVID-19 pandemic.</p><p>""Continued ",Corporate,,https://assets.nst.com.my/images/articles/FITCH27_NSTfield_image_listing_featured_v2.var_1719472905.jpg,https://assets.nst.com.my/images/articles/fitch_1719472897.jpg,79,NST,https://www.nst.com.my/business/corporate
