title,url,created_at,updated_at,published_date,summary,content,category,author,thumbnail_url,image_url,publisher_id,publisher_name,publisher_url
Ringgit ends flat against US dollar,https://www.klsescreener.com/v2/news/view/1265817,2024-01-19 19:20:49,2024-01-20 15:48:56,2024-01-19 19:04:18,The ringgit settled flat against the US dollar on Friday after a lower-than-expected fourth-quarter (4Q 2023) gross domestic product (GDP) projection released earlier.,"<div class=newsTextDataWrapInner><p>KUALA LUMPUR (Jan 19): The ringgit settled flat against the US dollar on Friday after a lower-than-expected fourth-quarter (4Q 2023) gross domestic product (GDP) projection released earlier.</p></div>

<div class=newsTextDataWrapInner><p>The Department of Statistics Malaysia (DOSM) on Friday said Malaysia’s economy is estimated to grow at 3.4% in 4Q2023 against 3.3% in the previous quarter.</p></div>

<div class=newsTextDataWrapInner><p>At 6pm, the ringgit stood at 4.7160/7210 versus the greenback from Thursday’s close of 4.7165/7215.</p></div><div class",,,https://assets.theedgemarkets.com/RInggit-4_reuters_23112021_54_24.jpg,,52,TheEdge,http://www.theedgemarkets.com/categories/malaysia
Penang urges PLUS to implement Juru-Sungai Dua elevated highway project for traffic dispersal,https://www.klsescreener.com/v2/news/view/1265803,2024-01-19 19:05:57,2024-01-20 14:18:56,2024-01-19 18:58:14,BATU KAWAN (Jan 19): The Penang state government has called on PLUS Malaysia Bhd (PLUS) to implement the Juru-Sungai Dua elevated highway project for the dispersal of the worsening traffic congestion in the area.,"<div class=newsTextDataWrapInner><p>BATU KAWAN (Jan 19): The Penang state government has called on PLUS Malaysia Bhd (PLUS) to implement the Juru-Sungai Dua elevated highway project for the dispersal of the worsening traffic congestion in the&nbsp;area.</p></div>

<div class=newsTextDataWrapInner><p>Chief Minister Chow Kon Yeow said the state government had raised&nbsp;the matter with&nbsp;the Public Private Partnership Unit (Ukas) of the Prime Minister's Department in a meeting here on Thursday (Jan 18).</p></div>

<div class=newsTextDataWrapInner><p>Chow said he was informed that Ukas&nb",Edge,,https://assets.theedgemarkets.com/(PLUS)-Highway-Traffic_20240119184532_theedgemalaysia.jpg,,52,TheEdge,http://www.theedgemarkets.com/categories/malaysia
Red Sea crisis: No negative feedback from industry players,https://www.klsescreener.com/v2/news/view/1265801,2024-01-19 19:05:56,2024-01-20 12:34:04,2024-01-19 18:53:44,"The Ministry of Transport (MOT) has so far not received any negative feedback from the import and export industry regarding the issue of increased shipping costs following the crisis in the Red Sea.

Its minister Anthony Loke said however MOT will continue to monitor the situation and communicate with industry players involved in the sector from time to time to see what kind of mitigation is needed to help them.","<div class=newsTextDataWrapInner><p>PORT KLANG (Jan 19): The Ministry of Transport (MOT) has so far not received any negative feedback from the import and export industry regarding the issue of increased shipping costs following the crisis in the Red Sea.</p></div>

<div class=newsTextDataWrapInner><p>Its minister Anthony Loke said however MOT will continue to monitor the situation and communicate with industry players involved in the sector from time to time to see what kind of mitigation is needed to help them.</p></div>

<div class=newsTextDataWrapInner><p>""So far we (Ministry of Transp",新闻,,https://assets.theedgemarkets.com/ship attacked red sea yemen_0.jpg,,52,TheEdge,http://www.theedgemarkets.com/categories/malaysia
LB Aluminium buys factories in Selangor for RM30 mil to boost warehousing space,https://www.klsescreener.com/v2/news/view/1265799,2024-01-19 19:05:55,2024-01-20 12:32:15,2024-01-19 18:53:39,"LB Aluminium Bhd is acquiring two factories and an office on a 4.56-acre freehold parcel of land in Beranang, Selangor, for RM30.42 million, cash, its Bursa Malaysia filing showed on Friday.","<div class=newsTextDataWrapInner><p>KUALA LUMPUR (Jan 19): LB Aluminium Bhd is acquiring two factories and an office on a 4.56-acre freehold parcel of land in Beranang, Selangor, for RM30.42 million, cash, its Bursa Malaysia filing showed on Friday.&nbsp;</p></div>

<div class=newsTextDataWrapInner><p>The group said it has entered into a sale and purchase agreement with Puspajaya Realty Sdn Bhd (PRSB) for the proposed land acquisition. PRSB is principally involved in the property development and management segments.&nbsp;</p></div>

<div class=newsTextDataWrapInner><p>According to the grou",Edge,,https://assets.theedgemarkets.com/LB-Aluminium _20221207105628_lbalum.com__1_0.jpg,,52,TheEdge,http://www.theedgemarkets.com/categories/malaysia
LB Aluminium buys industrial land in Beranang for RM30.41mil,https://www.klsescreener.com/v2/news/view/1265795,2024-01-19 18:55:28,2024-01-19 18:55:28,2024-01-19 18:44:00,"KUALA LUMPUR: LB Aluminium Bhd has proposed to acquire a parcel of freehold industrial land with buildings in Beranang, Selangor for RM30.41mil cash.","<div class=""inline-img""><div class=""story-image""></div></div><div id=""story-body"" class=""story bot-15 relative""><p>KUALA LUMPUR: <a href=""/business/marketwatch/stocks/?qcounter=LBALUM"" target=""_blank"">LB Aluminium Bhd</a><a href=""http://charts.thestar.com.my/?s=LBALUM"" target=""_blank""><img class=""go-chart"" src=""https://cdn.thestar.com.my/Themes/img/chart.png""></a> has proposed to acquire a parcel of freehold industrial land with buildings in Beranang, Selangor for RM30.41mil cash.</p><p>In a filing with Bursa Malaysia, LB said it entered into a sale and purchase agreement with Puspajaya Realty",,,https://apicms.thestar.com.my/uploads/images/2024/01/19/2500210.JPG,https://apicms.thestar.com.my/uploads/images/2024/01/19/2500210.JPG,28,TheStar,http://www.thestar.com.my/news/latest/?tag=Business
It is not ‘undemocratic’ to introduce Fixed-Term Parliament — Wan Junaidi,https://www.klsescreener.com/v2/news/view/1265797,2024-01-19 19:05:54,2024-01-20 11:00:34,2024-01-19 18:43:53,"It is not ""undemocratic"" if the country plans to introduce a Fixed-Term Parliament Act in the future.

Dewan Negara president Tan Sri Dr Wan Junaidi Tuanku Jaafar said this is because many countries in the world have implemented such a system that maintains the government within a specific term.","<div class=newsTextDataWrapInner><p>KAJANG (Jan 19): It is not ""undemocratic"" if the country plans to introduce a Fixed-Term Parliament Act in the future.</p></div>

<div class=newsTextDataWrapInner><p>Dewan Negara president Tan Sri Dr Wan Junaidi Tuanku Jaafar said this is because many countries in the world have implemented such a system that maintains the government within a specific term.</p></div>

<div class=newsTextDataWrapInner><p>""If we look at this (Fixed-Term Parliament) as undemocratic, many countries in the world are then undemocratic because their terms of government are fixe",新闻,,https://assets.theedgemarkets.com/Wan Junaidi Tuanku Jaafar.jpg,,52,TheEdge,http://www.theedgemarkets.com/categories/malaysia
"Ex-owner of construction firm fined RM48,000 for falsifying Penjana Kerjaya 2.0 claims",https://www.klsescreener.com/v2/news/view/1265789,2024-01-19 18:48:52,2024-01-20 10:47:09,2024-01-19 18:36:21,"KUALA LUMPUR (Jan 19): The Sessions Court here imposed a fine of RM48,000 on the former owner of a construction company on Friday, for submitting falsified Penjana Kerjaya 2.0 incentive claims to the Social Security Organisation (Socso) three years ago.","<div class=newsTextDataWrapInner><p>KUALA LUMPUR (Jan 19): The Sessions Court here imposed a fine of RM48,000 on the former owner of a construction company on Friday, for submitting falsified&nbsp;Penjana Kerjaya 2.0 incentive claims to the Social Security Organisation (Socso)&nbsp;three years ago.</p></div>

<div class=newsTextDataWrapInner><p>Judge Azura Alwi meted out the sentence on Muhammad Fauzi Abdul Latiff, 31, after he changed his plea to guilty on an alternative charge&nbsp;at Friday's case mention proceedings.&nbsp;</p></div>

<div class=newsTextDataWrapInner><p>The court also o",Edge,,https://assets.theedgemarkets.com/judge-mullet-px_20240119183012_reuters.jpg,,52,TheEdge,http://www.theedgemarkets.com/categories/malaysia
"EV sales set to grow rapidly in 2024, says Tengku Zafrul",https://www.klsescreener.com/v2/news/view/1265793,2024-01-19 18:55:27,2024-01-19 18:55:27,2024-01-19 18:33:00,"PORT KLANG: Electric vehicle (EV) sales in Malaysia are expected to grow exponentially this year, said Investment, Trade and Industry Minister Tengku Datuk Seri Zafrul Abdul Aziz.","<div class=""inline-img""><div class=""story-image""></div></div><div id=""story-body"" class=""story bot-15 relative""><p>PORT KLANG: Electric vehicle (EV) sales in Malaysia are expected to grow exponentially this year, said Investment, Trade and Industry Minister Tengku Datuk Seri Zafrul Abdul Aziz.</p><p>He said that the projection is in line with the rising number of EVs sold last year, which went up by 200 per cent compared to 2022, and based on industry players’ confidence in the rising interest in high-tech vehicles.</p><p>Malaysia recorded more than 100,000 registered EVs as of December last y",,,https://apicms.thestar.com.my/uploads/images/2024/01/19/2500182.jpg,https://apicms.thestar.com.my/uploads/images/2024/01/19/2500182.jpg,28,TheStar,http://www.thestar.com.my/news/latest/?tag=Business
Gear: Samsung unveils Galaxy AI features in new S24 flagship phones,https://www.klsescreener.com/v2/news/view/1265781,2024-01-19 18:34:02,2024-01-22 11:31:27,2024-01-19 18:23:31,"Samsung’s new suite of artificial intelligence-powered features in the upcoming Galaxy S24 series of phones will allow users to do away with third-party AI transcription tools and several other functions.

This was unveiled during a preview event for the media at GMBB in Kuala Lumpur on ...","<div class=newsTextDataWrapInner><p><span style=""font-style: italics;"">This article first appeared in Digital Edge, The Edge Malaysia Weekly on January 22, 2024 - January 28, 2024</span></p></div><div class=newsTextDataWrapInner><p>Samsung’s new suite of artificial intelligence-powered features in the upcoming Galaxy S24 series of phones will allow users to do away with third-party AI transcription tools and several other functions.</p></div>

<div class=newsTextDataWrapInner><p>This was unveiled during a preview event for the media at GMBB in Kuala Lumpur on Jan 10. The Galaxy AI’s features",Edge,,https://assets.theedgemarkets.com/DE11-Sumsung-TEM1507_20240119182133_theedgemalaysia.jpg,,54,TheEdge,http://www.theedgemarkets.com/options/edge
TSA Group’s IPO shares oversubscribed,https://www.klsescreener.com/v2/news/view/1265779,2024-01-19 18:33:26,2024-01-19 18:33:26,2024-01-19 18:10:00,"KUALA LUMPUR: TSA Group Bhd, which is slated for a listing on the ACE-Market of Bursa Malaysia on Feb 2, has seen its initial public offering (IPO) oversubscribed by 8.62 times.","<div class=""inline-img""><div class=""story-image""></div></div><div id=""story-body"" class=""story bot-15 relative""><p>KUALA LUMPUR: TSA Group Bhd, which is slated for a listing on the ACE-Market of Bursa Malaysia on Feb 2, has seen its initial public offering (IPO) oversubscribed by 8.62 times.</p><p>In a statement, it said a total of 4,304 applications for 148.78 million shares with a value of RM81.83mil were received from the Malaysian public, which represents an overall oversubscription rate of 8.62 times.</p><p>“For the Bumiputera portion, a total of 2,329 applications for 67.69 million share",,,https://apicms.thestar.com.my/uploads/images/2024/01/19/2500154.jpeg,https://apicms.thestar.com.my/uploads/images/2024/01/19/2500154.jpeg,28,TheStar,http://www.thestar.com.my/news/latest/?tag=Business
"Loke: Nine KTMB stations to be upgraded, a new one built in Seremban",https://www.klsescreener.com/v2/news/view/1265755,2024-01-19 18:04:12,2024-01-20 10:18:59,2024-01-19 18:00:16,"SEREMBAN (Jan 19): Nine Keretapi Tanah Melayu Bhd (KTMB) stations in the Klang Valley will be upgraded and a new station, to be known as Seremban Sentral station, will be built here.","<div class=newsTextDataWrapInner><p>SEREMBAN (Jan 19):&nbsp;Nine Keretapi Tanah Melayu Bhd (KTMB) stations in the Klang Valley will be upgraded and a new station,&nbsp;to be known as Seremban Sentral station, will&nbsp;be built here.</p></div>

<div class=newsTextDataWrapInner><p>Transport Minister Anthony Loke Siew Fook&nbsp;said the upgrading of the nine stations and the building of one new one are expected to cost RM280 million.</p></div>

<div class=newsTextDataWrapInner><p>He said the upgrading of the nine stations will be carried out under the Klang Valley Double Tracking&nbsp;Phase ",,,https://assets.theedgemarkets.com/Keretapi-Tanah-Melayu_KTMB_20240119174053_ktmb.com_.my_.jpg,,52,TheEdge,http://www.theedgemarkets.com/categories/malaysia
"Navy chief: LCS construction progressing smoothly, sea trials for first vessel expected by mid-2024",https://www.klsescreener.com/v2/news/view/1265745,2024-01-19 17:48:56,2024-01-20 02:00:29,2024-01-19 17:44:11,"The first littoral combat ship (LCS) is expected to undergo sea trials in May or June, said Royal Malaysian Navy (RMN) chief Admiral Tan Sri Abdul Rahman Ayob.","<div class=newsTextDataWrapInner><p>KUANTAN&nbsp;(Jan 19): The first littoral combat ship (LCS) is expected to undergo sea trials in May or June, said Royal Malaysian Navy (RMN) chief Admiral Tan Sri Abdul Rahman Ayob.</p></div>

<div class=newsTextDataWrapInner><p>He said the ship will then have 22 months to undergo installation of systems and equipment before it can be handed over to the RMN for operational tests, which is scheduled for the end of 2026.</p></div>

<div class=newsTextDataWrapInner><p>“That is the first ship and if the programme goes well, we will receive the second LCS ei",新闻,,https://assets.theedgemarkets.com/Abdul Rahman Ayob navy 20240119_20240119173420_bernama.jpg,,52,TheEdge,http://www.theedgemarkets.com/categories/malaysia
Bursa snaps three days of losses to end at intraday high,https://www.klsescreener.com/v2/news/view/1265743,2024-01-19 17:48:55,2024-01-20 10:33:59,2024-01-19 17:29:52,Bursa Malaysia snapped three consecutive days of losses to end at its intraday high on Friday on bargain hunting in selected heavyweights led by the financial services and utilities sectors.,"<div class=newsTextDataWrapInner><p>KUALA LUMPUR (Jan 19): Bursa Malaysia snapped three consecutive days of losses to end at its intraday high on Friday on bargain hunting in selected heavyweights led by the financial services and utilities sectors.</p></div>

<div class=newsTextDataWrapInner><p>This was in tandem with a few key Asian markets which rebounded on Friday while taking the cue from the strong performance of US stocks, buoyed by artificial intelligence optimism which drove gains in chipmakers and brightened the earnings outlook for technology stocks, a dealer said.</p></div>

<d",Edge,,https://assets.theedgemarkets.com/closing-market-up_theedgemalaysia_9.jpg,,52,TheEdge,http://www.theedgemarkets.com/categories/malaysia
The Edge Malaysia Property Management Virtual Talk 2024: Managing a stratified commercial property,https://www.klsescreener.com/v2/news/view/1265735,2024-01-19 17:32:07,2024-01-20 01:47:07,2024-01-19 17:23:08,"KUALA LUMPUR (Jan 19): A strong Management Corporation (MC), a healthy maintenance budget and simplified design are among crucial elements to ensure that a property’s condition would be tiptop. This was shared during the “Fireside Chat: Costly to Judge a Book by its Cover” at The Edge Malaysia Property Management Virtual Talk 2024, which was held at Common Ground, Wisma UOA Damansara II in Kuala Lumpur on Friday.","<div class=newsTextDataWrapInner><p>KUALA LUMPUR (Jan 19): A strong Management Corporation (MC), a healthy maintenance budget and simplified design are among crucial elements to ensure that a property’s condition would be tiptop. This was shared during the “Fireside Chat: Costly to Judge a Book by its Cover” at The Edge Malaysia Property Management Virtual Talk 2024, which was held at Common Ground, Wisma UOA Damansara II in Kuala Lumpur on Friday.&nbsp;</p></div>

<div class=newsTextDataWrapInner><p>Attended by 210 participants, The Edge Malaysia Property Management Virtual Talk 2024 is a t",,,https://assets.theedgemarkets.com/20240119-THE-EDGE-PROP-MGMT-virtual-talk-2024-ZHD-393_20240119172156_theedgemalaysia.jpg,,52,TheEdge,http://www.theedgemarkets.com/categories/malaysia
Bursa Malaysia snaps losing streak; multiple stocks hit limit-down again,https://www.klsescreener.com/v2/news/view/1265773,2024-01-19 18:22:23,2024-01-19 18:22:23,2024-01-19 17:20:00,"KUALA LUMPUR: Bursa Malaysia snapped a three-day losing streak to end higher on Friday, spurred by bargain-hunting activities.","<div class=""inline-img""><div class=""story-image""></div></div><div id=""story-body"" class=""story bot-15 relative""><p>KUALA LUMPUR: Bursa Malaysia snapped a three-day losing streak to end higher on Friday, spurred by bargain-hunting activities.</p><p>The FBM KLCI rose 7.19 points, or 0.49% to 1,486.37. For the week, the benchmark index fell marginally by 0.97 of a point.</p><p>There were 639 gainers, 359 losers and 423 counters traded unchanged on the Bursa Malaysia. Turnover stood at 5.39 billion shares valued at RM2.7bil.</p><p>A few counters including <a href=""/business/marketwatch/stocks/?qco",,,https://apicms.thestar.com.my/uploads/images/2024/01/19/2500066.JPG,https://apicms.thestar.com.my/uploads/images/2024/01/19/2500066.JPG,28,TheStar,http://www.thestar.com.my/news/latest/?tag=Business
UOB research: Ringgit to strengthen to 4.6 to the dollar in 1Q24,https://www.klsescreener.com/v2/news/view/1265693,2024-01-19 16:40:35,2024-01-19 16:40:35,2024-01-19 16:34:25,"KUALA LUMPUR: UOB Group Global economics &amp; markets research expects the ringgit to strengthen to 4.60 against the US dollar in the first quarter of 2024 (1Q24).As at noon today, the ringgit was trading at 4.712 against the US dollar.UOB Group ...","<div itemprop=""articleBody"" class=""dable-content-wrapper""><p>KUALA LUMPUR: UOB Group Global economics &amp; markets research expects the ringgit to strengthen to 4.60 against the US dollar in the first quarter of 2024 (1Q24).</p><p>As at noon today, the ringgit was trading at 4.712 against the US dollar.</p><p>UOB Group economics &amp; markets research chief economist Julia Goh, senior foreign exchange strategist,  Peter Chia and economist Loke Siew Ting said in their note today, the two-way volatility and choppy movements are likely to persist in the first quarter of 2024 given ongoing geopol",Economy,,https://assets.nst.com.my/images/articles/uob19_NSTfield_image_listing_featured_v2.var_1705653262.jpg,https://assets.nst.com.my/images/articles/Ringgit-vs-US-Dollar-Currency-Exchange_1705653254.jpg,81,NST,https://www.nst.com.my/business/economy
"Oil prices tick up as markets weigh Middle East tensions, supply forecasts",https://www.klsescreener.com/v2/news/view/1265687,2024-01-19 16:22:26,2024-01-19 16:22:26,2024-01-19 16:15:00,"TOKYO/BEIJING: Oil prices rose on Friday as geopolitical tensions and oil output disruptions in the U.S., the world's biggest producer, caused by cold weather overshadowed concerns about slow Chinese demand growth and forecasts for ample supply.","<div class=""inline-img""><div class=""story-image""></div></div><div id=""story-body"" class=""story bot-15 relative""><p>TOKYO/BEIJING: Oil prices rose on Friday as geopolitical tensions and oil output disruptions in the U.S., the world's biggest producer, caused by cold weather overshadowed concerns about slow Chinese demand growth and forecasts for ample supply.</p><p>Brent crude futures rose 2 cents to $79.12 a barrel by 0715 GMT, while U.S. West Texas Intermediate crude futures (WTI) were up 13 cents to $74.21.</p><p>Both benchmarks climbed about 2% on Thursday as the International Energy Agency",,,https://apicms.thestar.com.my/uploads/images/2024/01/19/2499747.jpeg,https://apicms.thestar.com.my/uploads/images/2024/01/19/2499747.jpeg,28,TheStar,http://www.thestar.com.my/news/latest/?tag=Business
Probe on arson attack at Beruas MP’s home ongoing — police,https://www.klsescreener.com/v2/news/view/1265679,2024-01-19 16:19:06,2024-01-20 01:19:39,2024-01-19 16:01:59,"IPOH (Jan 19): Police are still conducting investigations to track down the suspect involved in the arson attack on the residence of Beruas Member of Parliament (MP) Datuk Ngeh Koo Ham in Ayer Tawar, Manjung on Jan 10.","<div class=newsTextDataWrapInner><p>IPOH (Jan 19):&nbsp;Police are still conducting investigations to track down the suspect&nbsp;involved in the arson attack on the residence of Beruas Member of Parliament (MP)&nbsp;Datuk Ngeh Koo Ham in&nbsp;Ayer Tawar, Manjung on Jan 10.</p></div>

<div class=newsTextDataWrapInner><p>Perak police chief&nbsp;Datuk Seri Mohd Yusri Hassan Basri said there have been no new arrests made in connection with&nbsp;the case so far.</p></div>

<div class=newsTextDataWrapInner><p>“We are still investigating to trace the suspect.&nbsp;As of now, no new witnesses hav",,,https://assets.theedgemarkets.com/PDRM-Police-Di-Raja-Malaysia-logo-svd-off-24092020story_20240119154932_bernama.jpg,,52,TheEdge,http://www.theedgemarkets.com/categories/malaysia
Kinergy Advancement to develop solar power project with LCS Holdings in Philippines,https://www.klsescreener.com/v2/news/view/1265671,2024-01-19 16:10:24,2024-01-19 16:10:24,2024-01-19 16:01:06,"KUALA LUMPUR: Sustainable energy specialist Kinergy Advancement Bhd (KAB), is expanding into the Philippines, its fourth market in Southeast Asia via a solar power project with Philippine conglomerate, LCS Holdings Inc.The group&#039;s wholly-owned subsidiary, KAB Energy Holdings Sdn ...","<div itemprop=""articleBody"" class=""dable-content-wrapper""><p>KUALA LUMPUR: Sustainable energy specialist Kinergy Advancement Bhd (KAB), is expanding into the Philippines, its fourth market in Southeast Asia via a solar power project with Philippine conglomerate, LCS Holdings Inc.</p><p>The group&#039;s wholly-owned subsidiary, KAB Energy Holdings Sdn Bhd (Kabeh) has signed a Head of Agreement (HOA) with LCS Holding, which has extensive expertise in solar energy development. Under the agreement, Kabeh and LCS will jointly develop a 20 Megawatts-peak (MWp) solar farm project located at Santa Ilo",Corporate,,https://assets.nst.com.my/images/articles/kin19_NSTfield_image_listing_featured_v2.var_1705651263.jpg,https://assets.nst.com.my/images/articles/IMG_001_1705651252.jpg,79,NST,https://www.nst.com.my/business/corporate
UK retail sales slump points to new risk of recession,https://www.klsescreener.com/v2/news/view/1265675,2024-01-19 16:11:24,2024-01-19 16:11:24,2024-01-19 15:55:00,"LONDON: British retailers suffered the biggest drop in sales for almost three years during December, raising the risk that the economy entered recession in the fourth quarter, official data showed on Friday.","<div class=""inline-img""><div class=""story-image""></div></div><div id=""story-body"" class=""story bot-15 relative""><p>LONDON: British retailers suffered the biggest drop in sales for almost three years during December, raising the risk that the economy entered recession in the fourth quarter, official data showed on Friday.</p><p>The Office for National Statistics said retail sales volumes shrank 3.2% between December and November - the biggest drop since January 2021 and worse than all forecasts in a Reuters poll of economists that had pointed to a 0.5% drop.</p><p>Retail sales are likely to sub",,,https://apicms.thestar.com.my/uploads/images/2024/01/19/2499731.jpg,https://apicms.thestar.com.my/uploads/images/2024/01/19/2499731.jpg,28,TheStar,http://www.thestar.com.my/news/latest/?tag=Business
AirAsia to operate daily Jakarta-Kuching flights starting Feb 8,https://www.klsescreener.com/v2/news/view/1265669,2024-01-19 16:06:23,2024-01-20 01:05:05,2024-01-19 15:52:47,"JAKARTA (Jan 19): AirAsia will have daily Jakarta-Kuching flights from the current thrice a week, starting from Feb 8.","<div class=newsTextDataWrapInner><p>JAKARTA (Jan 19): AirAsia will have daily&nbsp;Jakarta-Kuching flights from the current thrice a week, starting from Feb 8.</p></div>

<div class=newsTextDataWrapInner><p>In a statement on Friday, the airline said the increase in&nbsp;frequency comes at the right time and marks a significant milestone in&nbsp;tourism&nbsp;recovery for both countries.</p></div>

<div class=newsTextDataWrapInner><p>With the added frequency, AirAsia&nbsp;will offer more convenient travel options at affordable fares.</p></div><div class=inPageAd id=div-gpt-ad-inpage></div>
",新闻,,https://assets.theedgemarkets.com/AirAsia5_20240119154911_theedgemalaysia.jpg,,52,TheEdge,http://www.theedgemarkets.com/categories/malaysia
