title,url,created_at,updated_at,published_date,summary,content,category,author,thumbnail_url,image_url,publisher_id,publisher_name,publisher_url
Idzham: Tech Medini to drive RM9b investment target in Johor&#039;s Medini,https://www.klsescreener.com/v2/news/view/1362865,2024-07-23 16:10:16,2024-07-23 16:10:16,2024-07-23 16:07:42,"KUALA LUMPUR: ISKANDAR Investment Berhad (IIB) has launched Tech Medini, aligning with the company&#039;s goal to attract RM9 billion in investments and create 65,000 jobs in Johor&#039;s Medini region.Tech Medini, a 160-acre clustered development zone, builds upon the ...","<div itemprop=""articleBody"" class=""dable-content-wrapper""><p>KUALA LUMPUR: ISKANDAR Investment Berhad (IIB) has launched Tech Medini, aligning with the company&#039;s goal to attract RM9 billion in investments and create 65,000 jobs in Johor&#039;s Medini region.</p><p>Tech Medini, a 160-acre clustered development zone, builds upon the success of other initiatives like Global Business Services (GBS) Iskandar@Medini, Drone and Robotics Zone (DRZ) Iskandar, and Blockchain Village@Medini (BV@M).</p><p>Besides solidifying Medini&#039;s position as Johor&#039;s premier digital and innovation hub, i",Corporate,,https://assets.nst.com.my/images/articles/TECH23_NSTfield_image_listing_featured_v2.var_1721722058.jpg,https://assets.nst.com.my/images/articles/echmedin_1721722051.jpg,79,NST,https://www.nst.com.my/business/corporate
Bursa Malaysia could pay out 9 sen  special dividend for FY24 with record high trading - analyst,https://www.klsescreener.com/v2/news/view/1362863,2024-07-23 16:10:15,2024-07-23 16:10:15,2024-07-23 16:06:32,"KUALA LUMPUR: Bursa Malaysia Bhd, which has a track record of paying out special dividends on record-high securities average daily value (SADV) years, could pay out as much as nine sen a share this year, RHB Investments Bank Research said....","<div itemprop=""articleBody"" class=""dable-content-wrapper""><p>KUALA LUMPUR: Bursa Malaysia Bhd, which has a track record of paying out special dividends on record-high securities average daily value (SADV) years, could pay out as much as nine sen a share this year, RHB Investments Bank Research said.</p><p>The payout of RM70 million translates to an additional 0.9 per cent yield.</p><p>RHB Research said Bursa Malaysia&#039;s SADV reached RM3.9 billion in the second quarter of 2024 (Q2 2024) which brought the average in the  first half of 2024 (1H24) to RM3.5 billion, an increase of 68 per cent ",Corporate,,https://assets.nst.com.my/images/articles/sav23_NSTfield_image_listing_featured_v2.var_1721721989.jpg,https://assets.nst.com.my/images/articles/HQ140524ES020_1721721981.jpg,79,NST,https://www.nst.com.my/business/corporate
"Advancecon bags Gunung Terundum, Perak mining works job ",https://www.klsescreener.com/v2/news/view/1362861,2024-07-23 16:10:15,2024-07-23 16:10:15,2024-07-23 16:00:54,"KUALA LUMPUR: Advancecon Holdings Bhd&#039;s subsidiary, Spring Energy Sdn Bhd has entered into a mining services agreement with Imerys Minerals Malaysia Sdn Bhd to carry out mining works at Gunung Terundum, Perak.In its filing with Bursa Malaysia today, ...","<div itemprop=""articleBody"" class=""dable-content-wrapper""><p>KUALA LUMPUR: Advancecon Holdings Bhd&#039;s subsidiary, Spring Energy Sdn Bhd has entered into a mining services agreement with Imerys Minerals Malaysia Sdn Bhd to carry out mining works at Gunung Terundum, Perak.</p><p>In its filing with Bursa Malaysia today, Advancecon said its subsidiary, Spring Energy has been appointed as contractor on a non-exclusive basis to carry out the mining works.</p><p>""The works includes supplying plant, labour, and equipment, operating and maintaining the quarry / stockpile management, transporting an",Corporate,,https://assets.nst.com.my/images/articles/adv23_NSTfield_image_listing_featured_v2.var_1721721650.jpg,https://assets.nst.com.my/images/articles/advcon_1721721637.jpg,79,NST,https://www.nst.com.my/business/corporate
Founder of South Korea's Kakao arrested for suspected stock manipulation,https://www.klsescreener.com/v2/news/view/1362867,2024-07-23 16:11:22,2024-07-23 16:11:22,2024-07-23 16:00:00,"SEOUL: South Korean authorities arrested Kim Beom-su, the billionaire founder of tech giant Kakao Corp on Tuesday, on accusations of manipulating stocks during the acquisition of a K-Pop agency last year.","<div class=""inline-img""><div class=""story-image""><p class=""caption"">An entrance of Kakao Corp.'s office building in the Pangyo district of Seongnam, South Korea, on Tuesday, July 23, 2024. Photographer: SeongJoon Cho/Bloomberg</p></div></div><div id=""story-body"" class=""story bot-15 relative""><p>SEOUL: South Korean authorities arrested Kim Beom-su, the billionaire founder of tech giant Kakao Corp on Tuesday, on accusations of manipulating stocks during the acquisition of a K-Pop agency last year.</p><p>It is the latest legal twist for Kakao, which runs South Korea's largest chat app, after the ",,,https://apicms.thestar.com.my/uploads/images/2024/07/23/2817607.jpg,https://apicms.thestar.com.my/uploads/images/2024/07/23/2817607.jpg,28,TheStar,http://www.thestar.com.my/news/latest/?tag=Business
"Retailers may achieve higher sales, but not necessarily better margins",https://www.klsescreener.com/v2/news/view/1362855,2024-07-23 16:04:39,2024-07-25 15:03:56,2024-07-23 16:00:00,"RETAILERS are still forecasting growth in sales this year, albeit at a slower pace than initially projected. However, they expect margins to be hit by reduced purchasing power and the higher cost of doing business.

In addition, any boost to retail sales from higher foreign tourist arriv...","<div class=newsTextDataWrapInner><p><span style=""font-style: italics;"">This article first appeared in The Edge Malaysia Weekly on July 15, 2024 - July 21, 2024</span></p></div><div class=newsTextDataWrapInner><p>RETAILERS are still forecasting growth in sales this year, albeit at a slower pace than initially projected. However, they expect margins to be hit by reduced purchasing power and the higher cost of doing business.</p></div>

<div class=newsTextDataWrapInner><p>In addition, any boost to retail sales from higher foreign tourist arrivals, withdrawals from the Employees Provident Fund (",Edge,,https://assets.theedgemarkets.com/Retail_TEM1532_20240717185213_theedgemalaysia.jpg,https://assets.theedgemarkets.com/Retail_TEM1532_20240717185213_theedgemalaysia.jpg,54,TheEdge,http://www.theedgemarkets.com/options/edge
The Edge Malaysia | Rahim & Co Kota Kinabalu Housing Property Monitor 1Q2024: Continued growth trend with a cautious outlook,https://www.klsescreener.com/v2/news/view/1362853,2024-07-23 16:04:38,2024-07-25 14:03:48,2024-07-23 16:00:00,"While the Sabah residential property market continued its upward trend in the first quarter of 2024, a cautious outlook is still needed, says Rahim & Co regional manager (Sabah) Max Sylver Sintia in presenting The Edge Malaysia | Rahim & Co Kota Kinabalu Housing Property Monitor ...","<div class=newsTextDataWrapInner><p><span style=""font-style: italics;"">This article first appeared in City & Country, The Edge Malaysia Weekly on July 15, 2024 - July 21, 2024</span></p></div><div class=newsTextDataWrapInner><p>While the Sabah residential property market continued its upward trend in the first quarter of 2024, a cautious outlook is still needed, says Rahim &amp; Co regional manager (Sabah) Max Sylver Sintia in presenting <em>The Edge Malaysia</em> | Rahim &amp; Co Kota Kinabalu Housing Property Monitor 1Q2024.</p></div>

<div class=newsTextDataWrapInner><p>“The outlook of th",Edge,,https://assets.theedgemarkets.com/CC8_KKMonitar_TEM1532_theedgemalaysia_0.jpg,https://assets.theedgemarkets.com/CC8_KKMonitar_TEM1532_theedgemalaysia_0.jpg,54,TheEdge,http://www.theedgemarkets.com/options/edge
Home Ministry to review Forbes report naming KL as fifth most dangerous city to visit in Southeast Asia,https://www.klsescreener.com/v2/news/view/1362859,2024-07-23 16:06:49,2024-07-23 22:17:36,2024-07-23 15:55:37,Home Minister Datuk Seri Saifuddin Nasution Ismail on Tuesday said that his ministry will be reviewing the Forbes Advisor report that listed Kuala Lumpur as the fifth most dangerous city to visit in Southeast Asia.,"<div class=newsTextDataWrapInner><p>PUTRAJAYA (July 23): Home Minister Datuk Seri Saifuddin Nasution Ismail on Tuesday said that his ministry will be reviewing the <em>Forbes Advisor&nbsp;</em>report that listed Kuala Lumpur as the fifth most dangerous city to visit in Southeast Asia.</p></div><div class=newsTextDataWrapInner><p>He said that&nbsp;the report contradicted the Global Peace Index (GPI) 2024 released by the Institute for Economics and Peace in June, which reported that Malaysia ranked 10th as one of the most peaceful countries in the world.</p></div><div class=newsTextDataWrapInner",Edge,,https://assets.theedgemarkets.com/20240221_PEO_PHOTOS OF FOREIGN TOURISTS_SY (3) (1)_20240723155258_theedgemalaysia.jpg,https://assets.theedgemarkets.com/20240221_PEO_PHOTOS OF FOREIGN TOURISTS_SY (3) (1)_20240723155258_theedgemalaysia.jpg,52,TheEdge,http://www.theedgemarkets.com/categories/malaysia
6.5 mil litres of diesel misappropriated daily before targeted subsidy — Amir Hamzah,https://www.klsescreener.com/v2/news/view/1362857,2024-07-23 16:06:48,2024-07-23 22:00:40,2024-07-23 15:51:22,The Ministry of Finance has concluded that at least 6.5 million litres of diesel were misappropriated by industries or smuggled into neighbouring countries daily before the targeted diesel subsidy was implemented.,"<div class=newsTextDataWrapInner><p>KUALA LUMPUR (July 23): The Ministry of Finance has concluded that at least 6.5 million litres of diesel were misappropriated by industries or smuggled into neighbouring countries daily before the targeted diesel subsidy was implemented.</p></div><div class=newsTextDataWrapInner><p>Finance Minister II Datuk Seri Amir Hamzah Azizan stated that the rationalisation of diesel subsidy has resulted in a 23% or 6.5 million litres reduction in daily sales, at petrol stations in Peninsular Malaysia.</p></div><div class=newsTextDataWrapInner><p>He noted that in early ",Edge,,https://assets.theedgemarkets.com/Amir Hamzah-technocrat-SY_20240723154223_theedgemalaysia.jpg,https://assets.theedgemarkets.com/Amir Hamzah-technocrat-SY_20240723154223_theedgemalaysia.jpg,52,TheEdge,http://www.theedgemarkets.com/categories/malaysia
"AirAsia expands operations to Subang Airport, fly to Borneo starting Aug 30",https://www.klsescreener.com/v2/news/view/1362845,2024-07-23 15:55:26,2024-07-23 15:55:26,2024-07-23 15:50:00,"SUBANG: AirAsia has expanded its operations in Malaysia to the Sultan Abdul Aziz Shah Airport (Subang Airport) with two domestic destinations namely Kuching, Sarawak and Kota Kinabalu, Sabah starting from Aug 30, 2024.","<div class=""inline-img""><div class=""story-image""></div></div><div id=""story-body"" class=""story bot-15 relative""><p>SUBANG: AirAsia has expanded its operations in Malaysia to the Sultan Abdul Aziz Shah Airport (Subang Airport) with two domestic destinations namely Kuching, Sarawak and Kota Kinabalu, Sabah starting from Aug 30, 2024.</p><p>It marks a significant milestone in the airline's history after AirAsia started operations 23 years ago at Subang Airport.</p><p>AirAsia Malaysia managing director Datuk Captain Fareh Mazputra said the expansion complements its operations at its main hub at th",,,https://apicms.thestar.com.my/uploads/images/2024/07/23/2817581.jpg,https://apicms.thestar.com.my/uploads/images/2024/07/23/2817581.jpg,28,TheStar,http://www.thestar.com.my/news/latest/?tag=Business
[Updated] Rupee settles at record closing low as equity tax hikes hurt sentiment,https://www.klsescreener.com/v2/news/view/1362979,2024-07-23 18:30:32,2024-07-23 18:30:32,2024-07-23 15:47:07,MUMBAI: The Indian rupee slipped to record lows on Tuesday as the government raising tax rates for capital gains from equity investments and on equity derivative trades hurt market sentiment.The rupee ended slightly lower against the U.S. dollar ...,"<div itemprop=""articleBody"" class=""dable-content-wrapper""><p>MUMBAI: The Indian rupee slipped to record lows on Tuesday as the government raising tax rates for capital gains from equity investments and on equity derivative trades hurt market sentiment.</p><p>The rupee ended slightly lower against the U.S. dollar at 83.6875, its weakest ever closing, after having slipped to a record low of 83.7150 earlier in the session.</p><p>Likely intervention from the Reserve Bank of India helped cap the currency&#039;s decline. The central bank likely sold dollars near 83.70-83.72 levels via state-run bank",Economy,,https://assets.nst.com.my/images/articles/rupe23_NSTfield_image_listing_featured_v2.var_1721730372.jpg,https://assets.nst.com.my/images/articles/rupee_1721730365.jpg,81,NST,https://www.nst.com.my/business/economy
Indian rupee declines to record low after government raises tax on capital gains,https://www.klsescreener.com/v2/news/view/1362843,2024-07-23 15:51:07,2024-07-23 15:51:07,2024-07-23 15:47:07,"MUMBAI: The Indian rupee dropped to a record low against the U.S. dollar on Tuesday, pressured by the drop in local equities after the government proposed raising the tax rate on capital gains.The rupee declined to 83.69 to the ...","<div itemprop=""articleBody"" class=""dable-content-wrapper""><p>MUMBAI: The Indian rupee dropped to a record low against the U.S. dollar on Tuesday, pressured by the drop in local equities after the government proposed raising the tax rate on capital gains.</p><p>The rupee declined to 83.69 to the dollar, inching past the previous lifetime low of 83.6775, and compared with 83.6275 before the budget announcement.</p></div>",Economy,,https://assets.nst.com.my/images/articles/rupe23_NSTfield_image_listing_featured_v2.var_1721720822.jpg,https://assets.nst.com.my/images/articles/rupee_1721720813.jpg,81,NST,https://www.nst.com.my/business/economy
Real estate sector: What is fuelling the rally?,https://www.klsescreener.com/v2/news/view/1362849,2024-07-23 16:00:47,2024-07-23 16:00:47,2024-07-23 15:46:03,"KUALA LUMPUR: A long-term uptrend has emerged in the real estate sector, driven by increased industrial developments, growth in second-tier cities, and rising land values. Decentralisation is also strengthening the market, according to Hong Leong Investment Bank (HLIB).HLIB noted ...","<div itemprop=""articleBody"" class=""dable-content-wrapper""><p>KUALA LUMPUR: A long-term uptrend has emerged in the real estate sector, driven by increased industrial developments, growth in second-tier cities, and rising land values. Decentralisation is also strengthening the market, according to Hong Leong Investment Bank (HLIB).</p><p>HLIB noted that the property sector was one of the top performers in 2023 and continues to do well this year. From the post-COVID period through 2022 to its recent peak on July 18, 2024, the Kuala Lumpur Property Index (KLPRP) surged by 93.5 per cent, significan",Property,,https://assets.nst.com.my/images/articles/PROP23_NSTfield_image_listing_featured_v2.var_1721720760.jpg,https://assets.nst.com.my/images/articles/HQ200224AF001_%282%29_%282%29_1721720749.jpg,87,NST,https://www.nst.com.my/property
T7 Global unit bags jack-up drilling rig contract from Petronas Carigali,https://www.klsescreener.com/v2/news/view/1362851,2024-07-23 16:01:16,2024-07-23 16:01:16,2024-07-23 15:40:06,"KUALA LUMPUR: T7 Global Bhd&#039;s subsidiary, Tanjung Offshore Services Sdn Bhd has received a contract from Petronas Carigali Sdn Bhd for the provision of low-cost jack-up drilling rig for Petronas Carigali Plug &amp; Abandonment programme for an undisclosed amount....","<div itemprop=""articleBody"" class=""dable-content-wrapper""><p>KUALA LUMPUR: T7 Global Bhd&#039;s subsidiary, Tanjung Offshore Services Sdn Bhd has received a contract from Petronas Carigali Sdn Bhd for the provision of low-cost jack-up drilling rig for Petronas Carigali Plug &amp; Abandonment programme for an undisclosed amount.</p><p>In a filing with Bursa Malaysia Securities, T7 Global said the contract runs from the effective date until completion of the 53 firm wells under the programme.</p><p>""In full consideration of Tanjung Offshore performing the works and the fulfilment of Tanjung Offs",Corporate,,https://assets.nst.com.my/images/articles/bm23_NSTfield_image_listing_featured_v2.var_1721720401.jpg,https://assets.nst.com.my/images/articles/t7_global_1721720394.jpg,79,NST,https://www.nst.com.my/business/corporate
HSBC forecasts Malaysia's 2024 GDP at 4.5%,https://www.klsescreener.com/v2/news/view/1362841,2024-07-23 15:44:25,2024-07-23 15:44:25,2024-07-23 15:33:00,"KUALA LUMPUR: HSBC has forecast Malaysia’s gross domestic product (GDP) growth at 4.5 per cent for 2024, slightly above consensus with an upside risk.","<div class=""inline-img""><div class=""story-image""></div></div><div id=""story-body"" class=""story bot-15 relative""><p>KUALA LUMPUR: HSBC has forecast Malaysia’s gross domestic product (GDP) growth at 4.5 per cent for 2024, slightly above consensus with an upside risk.</p><p>Its co-head of Global Research Asia and chief Asia economist, Frederic Neumann, said the forecast was supported by the country’s robust economic performance and the incoming inflows of foreign investments.</p><p>""We also expect a pickup in trade over the second half (2H) of this year, benefitting mainly from consumer electroni",,,https://apicms.thestar.com.my/uploads/images/2024/07/23/2817573.jpeg,https://apicms.thestar.com.my/uploads/images/2024/07/23/2817573.jpeg,28,TheStar,http://www.thestar.com.my/news/latest/?tag=Business
"Selangor, Terengganu most transparent with state budget, study shows",https://www.klsescreener.com/v2/news/view/1362837,2024-07-23 15:36:48,2024-07-23 21:32:44,2024-07-23 15:29:42,"Selangor and Terengganu are the most transparent states with their budgets in Malaysia, according to a study by the Institute for Democracy and Economic Affairs (Ideas).","<div class=newsTextDataWrapInner><p>KUALA LUMPUR (July 23): Selangor and Terengganu are the most transparent states with their budgets in Malaysia, according to a study by the Institute for Democracy and Economic Affairs (Ideas).</p></div><div class=newsTextDataWrapInner><p>Both states scored 76 out of 100 on the Malaysia Open Budget Index (MyOBI) 2024 surveyed by the think tank. The index evaluates the accessibility and timeliness of key budget documents, the oversight role of state legislative assemblies and opportunities for public participation in the budget process.</p></div><div class=ne",,,https://assets.theedgemarkets.com/20240220-RINGGIT-MALAYSIA-SB-2_20240723152830_theedgemalaysia.jpg,https://assets.theedgemarkets.com/20240220-RINGGIT-MALAYSIA-SB-2_20240723152830_theedgemalaysia.jpg,52,TheEdge,http://www.theedgemarkets.com/categories/malaysia
Improving carbon markets can help finance large-scale climate action; rejecting them outright means potential is lost,https://www.klsescreener.com/v2/news/view/1362835,2024-07-23 15:36:43,2024-07-23 21:19:45,2024-07-23 15:24:35,"KUALA LUMPUR (July 23): Supporters of forest-based carbon markets will point to the continual improvements made to methodologies as science advances, the increasing use of precision technologies to monitor impacts, and the opportunity they provide for transfering climate finance from the global north to the global south, as among reasons to use high quality credits as one of a package of tools to drive climate, biodiversity and local community gains.","<div class=newsTextDataWrapInner><p>KUALA LUMPUR (July 23): Supporters of forest-based carbon markets will point to the continual improvements made to methodologies as science advances, the increasing use of precision technologies to monitor impacts, and the opportunity they provide for transfering climate finance from the global north to the global south, as among reasons to use high quality credits as one of a package of tools to drive climate, biodiversity and local community gains.</p></div><div class=newsTextDataWrapInner><p>That last point is worth stressing. Climate action has no single",新闻,,https://assets.theedgemarkets.com/398972891-forest-greenery-trees-global-carbon-mkt-Tues06062023_20240723152402_bloomberg.jpg,https://assets.theedgemarkets.com/398972891-forest-greenery-trees-global-carbon-mkt-Tues06062023_20240723152402_bloomberg.jpg,52,TheEdge,http://www.theedgemarkets.com/categories/malaysia
"HSBC maintains 4.5% forecast for Malaysia’s economic growth, sees upside risk",https://www.klsescreener.com/v2/news/view/1362823,2024-07-23 15:19:26,2024-07-23 21:19:42,2024-07-23 15:13:18,"HSBC Global Research has maintained its gross domestic product (GDP) growth projection of 4.5% for Malaysia, though it sees potential upside risk from the influx of foreign investment and recovery in trade in the second half of this year (2H2024).","<div class=newsTextDataWrapInner><p>KUALA LUMPUR (July 23): HSBC Global Research has maintained its gross domestic product (GDP) growth projection of 4.5% for Malaysia, though it sees potential upside risk from the influx of foreign investment and recovery in trade in the second half of this year (2H2024).</p></div><div class=newsTextDataWrapInner><p>“We have forecast&nbsp;for this year a GDP growth of 4.5% in Malaysia, which is slightly above the consensus, and I think there is upside risk to this, if you look at how the economy has a form of late that does look very robust, with still a lot ",新闻,,https://assets.theedgemarkets.com/20240314_PLA_JALAN IMBI _BUKIT BINTANG 3_SAM_20240716114716_theedgemalaysia_1.jpg,https://assets.theedgemarkets.com/20240314_PLA_JALAN IMBI _BUKIT BINTANG 3_SAM_20240716114716_theedgemalaysia_1.jpg,52,TheEdge,http://www.theedgemarkets.com/categories/malaysia
Sarawak Petchem's RM7bil complex to reinforce Malaysia's status as top methanol producer in Asia-Pacific,https://www.klsescreener.com/v2/news/view/1362833,2024-07-23 15:33:27,2024-07-23 15:33:27,2024-07-23 15:10:00,"KUALA LUMPUR: The establishment of Sarawak Petchem Sdn Bhd's RM7 billion methanol complex is a defining milestone in helping to establish Malaysia as a leading methanol producer in the Asia-Pacific region, says Investment, Trade, and Industry Minister Tengku Datuk Seri Zafrul Abdul Aziz.","<div class=""inline-img""><div class=""story-image""><p class=""caption"">Investment, Trade and Industry Minister Tengku Datuk Seri Zafrul Abdul Aziz.- Kamarul Ariffin/TheStar</p></div></div><div id=""story-body"" class=""story bot-15 relative""><p>KUALA LUMPUR: The establishment of Sarawak Petchem Sdn Bhd's RM7 billion methanol complex is a defining milestone in helping to establish Malaysia as a leading methanol producer in the Asia-Pacific region, says Investment, Trade, and Industry Minister Tengku Datuk Seri Zafrul Abdul Aziz.</p><p>""This will not only advance Malaysia’s capabilities in the chemica",,,https://apicms.thestar.com.my/uploads/images/2024/07/23/2817564.jpg,https://apicms.thestar.com.my/uploads/images/2024/07/23/2817564.jpg,28,TheStar,http://www.thestar.com.my/news/latest/?tag=Business
Robert Kuok&#039;s Allgreen Properties makes winning RM2.53b bid for Singapore&#039;s Zion Road plot  - report,https://www.klsescreener.com/v2/news/view/1362813,2024-07-23 15:10:49,2024-07-23 15:10:49,2024-07-23 15:07:10,"KUALA LUMPUR: Tycoon Tan Sri Robert Kuok&#039;s Allgreen Properties Ltd submitted the winning bid of S$730 million (RM2.53 billion) for a 99-year leasehold plot in Zion Road, amid tepid bidding interest,Singapore&#039;s The Straits Times reported.It said ...","<div itemprop=""articleBody"" class=""dable-content-wrapper""><p>KUALA LUMPUR: Tycoon Tan Sri Robert Kuok&#039;s Allgreen Properties Ltd submitted the winning bid of S$730 million (RM2.53 billion) for a 99-year leasehold plot in Zion Road, amid tepid bidding interest,Singapore&#039;s The Straits Times reported.</p><p>It said the plot was the latest land on the government&#039;s reserve list which was released for sale after the Urban Redevelopment Authority received an application committing to a minimum bid of S$604.6 million.</p><p>The tender for the site closed on July 18, with Allgreen&#039;s ",Property,,https://assets.nst.com.my/images/articles/all23_NSTfield_image_listing_featured_v2.var_1721718428.jpg,https://assets.nst.com.my/images/articles/Allgreen_Properties_1721718421.jpg,87,NST,https://www.nst.com.my/property
KL prime office rental positive over next 12 months: Knight Frank,https://www.klsescreener.com/v2/news/view/1362811,2024-07-23 15:10:48,2024-07-23 15:10:48,2024-07-23 15:01:09,"KUALA LUMPUR: GLOBAL property consultancy Knight Frank has ""a positive forecast"" for Kuala Lumpur&#039;s prime office rent over the next 12 months, according to its Asia-Pacific (APAC) Prime Office Rental Index for the second quarter of 2024 (2Q 2024).In a statement ...","<div itemprop=""articleBody"" class=""dable-content-wrapper""><p>KUALA LUMPUR: GLOBAL property consultancy Knight Frank has ""a positive forecast"" for Kuala Lumpur&#039;s prime office rent over the next 12 months, according to its Asia-Pacific (APAC) Prime Office Rental Index for the second quarter of 2024 (2Q 2024).</p><p>In a statement today, it said the data shows a 2.6 per cent year-on-year (y-o-y) rise in rents, alongside a 0.2 per cent quarterly rise, which suggests ""a stable and healthy outlook for the market.""</p><p>""The forecast suggests that the office rental market in Kuala Lumpur is exp",Property,,https://assets.nst.com.my/images/articles/PROP233_NSTfield_image_listing_featured_v2.var_1721718066.jpg,https://assets.nst.com.my/images/articles/HQ270823AA004_%281%29_1721718059.jpg,87,NST,https://www.nst.com.my/property
