title,url,created_at,updated_at,published_date,summary,content,category,author,thumbnail_url,image_url,publisher_id,publisher_name,publisher_url
"Johor, MPC & federal agencies to enhance modern chicken farm development",https://www.klsescreener.com/v2/news/view/1343093,2024-06-16 14:10:37,2024-06-16 14:10:37,2024-06-16 14:08:03,"KUALA LUMPUR: The Johor state government, along with the Malaysia Productivity Corporation (MPC) and federal agencies, is collaborating to improve the efficiency of modern chicken farm development in Johor through regulatory reforms.MPC said Johor is the largest producer of ...","<div itemprop=""articleBody"" class=""dable-content-wrapper""><p>KUALA LUMPUR: The Johor state government, along with the Malaysia Productivity Corporation (MPC) and federal agencies, is collaborating to improve the efficiency of modern chicken farm development in Johor through regulatory reforms.</p><p>MPC said Johor is the largest producer of poultry meat in Malaysia, contributing 30 per cent of the nation&#039;s total production. </p><p>""Considering current developments, various emerging issues and challenges need to be addressed wisely and effectively.</p><p>""To date, 75 per cent of chicken fa",Economy,,https://assets.nst.com.my/images/articles/MPC16_NSTfield_image_listing_featured_v2.var_1718518079.jpg,https://assets.nst.com.my/images/articles/chicken_1718518073.jpg,81,NST,https://www.nst.com.my/business/economy
Prabowo adviser denies plans to raise Indonesia&#039;s debt to 50% of GDP,https://www.klsescreener.com/v2/news/view/1343091,2024-06-16 12:20:59,2024-06-16 12:20:59,2024-06-16 12:10:45,"JAKARTA: Indonesia&#039;s President-elect Prabowo Subianto has no plans to boost the country&#039;s public debt to 50% of gross domestic product (GDP), a senior aide said on Saturday, denying a report that had hit the nation&#039;s currency and bond ...","<div itemprop=""articleBody"" class=""dable-content-wrapper""><p>JAKARTA: Indonesia&#039;s President-elect Prabowo Subianto has no plans to boost the country&#039;s public debt to 50% of gross domestic product (GDP), a senior aide said on Saturday, denying a report that had hit the nation&#039;s currency and bond markets.</p><p>Thomas Djiwandono, who leads fiscal discussions between Prabowo&#039;s economic team and the outgoing government&#039;s finance ministry, told Reuters that Prabowo had not set any target for debt levels and would adhere to legal limits on fiscal metrics.</p><p>The rupiah fe",Economy,,https://assets.nst.com.my/images/articles/indo16_NSTfield_image_listing_featured_v2.var_1718511042.jpg,https://assets.nst.com.my/images/articles/14bh28lar_1718511036.jpg,81,NST,https://www.nst.com.my/business/economy
"DRB-HICOM to sell nearly 160,000 Proton, 80,000 Honda vehicles in 2024?",https://www.klsescreener.com/v2/news/view/1343089,2024-06-16 12:01:03,2024-06-16 12:01:03,2024-06-16 11:56:20,"KUALA LUMPUR: DRB-HICOM Bhd is expected to sell nearly 160,000 units of Proton vehicles, marking a 3.4 per cent year-over-year increase, and around 80,000 units of Honda vehicles in 2024.Kenanga Research said the sales for less popular brands under DRB-HICOM&#039;s portfolio like ...","<div itemprop=""articleBody"" class=""dable-content-wrapper""><p>KUALA LUMPUR: DRB-HICOM Bhd is expected to sell nearly 160,000 units of Proton vehicles, marking a 3.4 per cent year-over-year increase, and around 80,000 units of Honda vehicles in 2024.</p><p>Kenanga Research said the sales for less popular brands under DRB-HICOM&#039;s portfolio like Mitsubishi and Isuzu will likely be subdued due to limited availability of new models.</p><p>""Consequently, we maintained our estimates of 158,000 units and 80,000 units for Proton and Honda respectively in fiscal year 2024 (FY24), and 166,000 units a",Corporate,,https://assets.nst.com.my/images/articles/DRB16_NSTfield_image_listing_featured_v2.var_1718510176.jpg,https://assets.nst.com.my/images/articles/120624nstProton01_1718510170.jpg,79,NST,https://www.nst.com.my/business/corporate
CPO futures likely to trade higher next week,https://www.klsescreener.com/v2/news/view/1343087,2024-06-16 10:40:45,2024-06-16 10:40:45,2024-06-16 10:37:42,"KUALA LUMPUR: The crude palm oil (CPO) futures contract on Bursa Malaysia Derivatives is likely to trade higher next week, given the expected good weather and better production, said a dealer. Interband Group of Companies senior palm oil trader Jim ...","<div itemprop=""articleBody"" class=""dable-content-wrapper""><p>KUALA LUMPUR: The crude palm oil (CPO) futures contract on Bursa Malaysia Derivatives is likely to trade higher next week, given the expected good weather and better production, said a dealer. </p><p>Interband Group of Companies senior palm oil trader Jim Teh opined that CPO would trade between RM3,700 a tonne and RM3,800 a tonne next week due to heavy stock. </p><p>""It may also continue to trade higher, tracking on the prices of soybean oil and other markets,"" he told Bernama. </p><p>He also pointed out that the recent diesel subsid",Economy,,https://assets.nst.com.my/images/articles/CPO16_NSTfield_image_listing_featured_v2.var_1718505458.jpg,https://assets.nst.com.my/images/articles/28bt02sawti_1718505451.jpg,81,NST,https://www.nst.com.my/business/economy
Malaysia&#039;s Nuren Group to list shares in Australia&#039;s stock exchange,https://www.klsescreener.com/v2/news/view/1343085,2024-06-16 10:40:16,2024-06-16 10:40:16,2024-06-16 10:33:16,"KUALA LUMPUR: Malaysia&#039;s Nuren Group, which operates a digital platform for women in parenting, education and maternity wellness, is seeking to launch its initial public offering (IPO) on the National Stock Exchange of Australia.Set to debut at A$0.20 ...","<div itemprop=""articleBody"" class=""dable-content-wrapper""><p>KUALA LUMPUR: Malaysia&#039;s Nuren Group, which operates a digital platform for women in parenting, education and maternity wellness, is seeking to launch its initial public offering (IPO) on the National Stock Exchange of Australia.</p><p>Set to debut at A$0.20 per share, the company is looking at a mid-July 2024 listing.</p><p>""The capital raised through the IPO will fuel Nuren&#039;s commitment to expanding its market presence in the parenting, education, and maternity wellness sectors.</p><p>""It will also enhance the company&#03",Corporate,,https://assets.nst.com.my/images/articles/nuren16_NSTfield_image_listing_featured_v2.var_1718505193.jpg,https://assets.nst.com.my/images/articles/nuren_group_1718505187.jpg,79,NST,https://www.nst.com.my/business/corporate
Ringgit seen trading at 4.70 to 4.71 against US Dollar next week,https://www.klsescreener.com/v2/news/view/1343083,2024-06-16 10:00:12,2024-06-16 10:00:12,2024-06-16 09:52:22,"KUALA LUMPUR: The ringgit is likely to trade softer against the US dollar next week, moving between RM4.70 and RM4.71 with the Reserve Bank of Australia&#039;s interest rate decision in focus, said an analyst.Bank Muamalat Malaysia Bhd chief ...","<div itemprop=""articleBody"" class=""dable-content-wrapper""><p>KUALA LUMPUR: The ringgit is likely to trade softer against the US dollar next week, moving between RM4.70 and RM4.71 with the Reserve Bank of Australia&#039;s interest rate decision in focus, said an analyst.</p><p>Bank Muamalat Malaysia Bhd chief economist Dr Mohd Afzanizam Abdul Rashid said the US retail sales and purchasing managers&#039; indices, Europe&#039;s consumer price and economic data from China will be among the key focus for next week.</p><p>""The central bank decision (to watch)  would be the Reserve Bank of Australia ",Economy,,https://assets.nst.com.my/images/articles/reget16_NSTfield_image_listing_featured_v2.var_1718502879.jpg,https://assets.nst.com.my/images/articles/April24BT6Ringgittoo_1718502733.jpg,81,NST,https://www.nst.com.my/business/economy
Bursa Malaysia likely to trade range-bound next week,https://www.klsescreener.com/v2/news/view/1343081,2024-06-16 09:40:48,2024-06-16 09:40:48,2024-06-16 09:35:44,"BernamaKUALA LUMPUR: Bursa Malaysia&#039;s consolidation phase is set to continue next week with the barometer index trading in a narrow range between 1,600 and 1,620 amid the holiday-shortened trading week.Rakuten Trade Sdn Bhd equity research vice-president Thong Pak Leng said ...","<div itemprop=""articleBody"" class=""dable-content-wrapper""><p>Bernama</p><p>KUALA LUMPUR: Bursa Malaysia&#039;s consolidation phase is set to continue next week with the barometer index trading in a narrow range between 1,600 and 1,620 amid the holiday-shortened trading week.</p><p>Rakuten Trade Sdn Bhd equity research vice-president Thong Pak Leng said due to the Hari Raya Aidiladha holiday on Monday, investors may reduce their trading volume and keep funds on hand to invest once the market provides clear signals.</p><p>""Given that the index has dropped below the 20-day Exponential Moving Aver",Corporate,,https://assets.nst.com.my/images/articles/bosa16_NSTfield_image_listing_featured_v2.var_1718501741.jpg,https://assets.nst.com.my/images/articles/34-1-1024x682bursa_1718501734.jpg,79,NST,https://www.nst.com.my/business/corporate
"Japan could be energy-independent by 2060 thanks to renewables, Rystad Energy CEO says",https://www.klsescreener.com/v2/news/view/1343077,2024-06-16 09:30:34,2024-06-16 09:30:34,2024-06-16 09:21:25,"TOKYO: Japan, a major coal and liquefied natural gas (LNG) buyer, could be energy-independent by 2060 thanks to expansion of solar and wind power together with storage batteries, said Jarand Rystad, chief executive of the Rystad Energy consultancy.Japan imports most ...","<div itemprop=""articleBody"" class=""dable-content-wrapper""><p>TOKYO: Japan, a major coal and liquefied natural gas (LNG) buyer, could be energy-independent by 2060 thanks to expansion of solar and wind power together with storage batteries, said Jarand Rystad, chief executive of the Rystad Energy consultancy.</p><p>Japan imports most of its energy resources, with the Middle East, Australia and the United States being its top suppliers. The government&#039;s strategy calls for a reduction in LNG and coal to under 40% of the power generation mix by 2030 from more than 60% now. But analysts say Ja",Corporate,,https://assets.nst.com.my/images/articles/JAPAN14_NSTfield_image_listing_featured_v2.var_1718500883.jpg,https://assets.nst.com.my/images/articles/15bt06rys_1718500876.jpg,79,NST,https://www.nst.com.my/business/corporate
"Global nickel prices have probably hit a floor, says Macquarie",https://www.klsescreener.com/v2/news/view/1343075,2024-06-16 09:20:56,2024-06-16 09:20:56,2024-06-16 09:18:52,"JAKARTA:  Global nickel prices may have hit a floor, according to a Macquarie analyst who sees a market recovery driven by strong demand from the steel sector and as a surplus of ore supplies shrinks after Indonesia slowed production permits.""...","<div itemprop=""articleBody"" class=""dable-content-wrapper""><p>JAKARTA:  Global nickel prices may have hit a floor, according to a Macquarie analyst who sees a market recovery driven by strong demand from the steel sector and as a surplus of ore supplies shrinks after Indonesia slowed production permits.</p><p>""Our belief is that we&#039;ve seen the bottom, we&#039;ve seen the supply adjustments, we see the uncertainty in future supply, and that is giving us quite a lot of support where the prices are today,"" Macquarie analyst Jim Lennon told a conference organised by Shanghai Metals Market in J",Economy,,https://assets.nst.com.my/images/articles/NIK133_NSTfield_image_listing_featured_v2.var_1718500729.jpg,https://assets.nst.com.my/images/articles/15bt07miningop_1718500722.jpg,81,NST,https://www.nst.com.my/business/economy
Perikatan names Nibong Tebal PAS vice chairman Abidin Ismail as Sg Bakap candidate,https://www.klsescreener.com/v2/news/view/1343071,2024-06-16 09:03:58,2024-06-18 13:49:26,2024-06-16 08:58:35,"Perikatan Nasional (PN) has announced Nibong Tebal PAS vice chairman Abidin Ismail, 56, as its candidate for the July 6 Sungai Bakap state by-election.","<div class=newsTextDataWrapInner><p>NIBONG TEBAL (June 16): Perikatan Nasional (PN) has announced Nibong Tebal PAS vice chairman Abidin Ismail, 56, as its candidate for the July 6 Sungai Bakap state by-election.</p></div>

<div class=newsTextDataWrapInner><p>PAS deputy president Datuk Seri Tuan Ibrahim Tuan Man announced this at a PN function in Simpang Ampat here Saturday night.</p></div>

<div class=newsTextDataWrapInner><p>Tuan Ibrahim is confident that Abidin can carry out his responsibility.</p></div><div class=inPageAd id=div-gpt-ad-inpage></div>

<div class=newsTextDataWrapInner><",,,https://assets.theedgemarkets.com/abidin ismail 20240616_fb.jpg,https://assets.theedgemarkets.com/abidin ismail 20240616_fb.jpg,52,TheEdge,http://www.theedgemarkets.com/categories/malaysia
"Targeted diesel subsidy not expected to result in price hikes, says Mydin MD",https://www.klsescreener.com/v2/news/view/1343073,2024-06-16 09:20:42,2024-06-18 13:49:23,2024-06-16 08:57:55,"The targeted diesel subsidy should not result in an increase in the price of goods, said Mydin Mohamed Holdings Bhd managing director Datuk Dr Ameer Ali Mydin.","<div class=newsTextDataWrapInner><p>KUALA LUMPUR (June 16): The targeted diesel subsidy should not result in an increase in the price of goods, said Mydin Mohamed Holdings Bhd managing director Datuk Dr Ameer Ali Mydin.</p></div>

<div class=newsTextDataWrapInner><p>He said this because operators in the logistics sector are still enjoying the diesel subsidy at a rate of RM2.15 per litre.</p></div>

<div class=newsTextDataWrapInner><p>“The prices of goods should not increase. In Mydin itself, we ask for a fleet card as we are involved in the transport (logistics) sector. The goods arrive at",,,https://assets.theedgemarkets.com/CS_TEM1490_malaysia economy inflation shopper_theedgemalaysia.jpg,https://assets.theedgemarkets.com/CS_TEM1490_malaysia economy inflation shopper_theedgemalaysia.jpg,52,TheEdge,http://www.theedgemarkets.com/categories/malaysia
Taking the lead,https://www.klsescreener.com/v2/news/view/1343069,2024-06-16 09:02:07,2024-06-18 16:04:08,2024-06-16 08:31:00,"Kristie Lu Stout has had an illustrious career as a CNN anchor, news trailblazer and mentor since joining the Atlanta-headquartered network in 2001. Covering Hong Kong, China and Asia on the global stage, she reports from both the newsroom and the field on major news stories, including US-China relations, the rise of artificial intelligence and the aftermath of extreme climate events.","<div class=newsTextDataWrapInner><p>KUALA LUMPUR (June 16): Kristie Lu Stout has had an illustrious career as a <em>CNN </em>anchor, news trailblazer and mentor since joining the Atlanta-headquartered network in 2001. Covering Hong Kong, China and Asia on the global stage, she reports from both the newsroom and the field on major news stories, including US-China relations, the rise of artificial intelligence and the aftermath of extreme climate events.</p></div>

<div class=newsTextDataWrapInner><p>“I always tell people interested in journalism and being an on-air correspondent that you have",Edge,,https://assets.theedgemarkets.com/TEM_Options_Highlights_1528.jpg,https://assets.theedgemarkets.com/TEM_Options_Highlights_1528.jpg,54,TheEdge,http://www.theedgemarkets.com/options/edge
Aiming for sustainable growth,https://www.klsescreener.com/v2/news/view/1343067,2024-06-16 08:46:51,2024-06-18 15:01:51,2024-06-16 08:30:00,"After a major transformation and rebranding exercise last year, Avaland Bhd (KL:AVALAND) — formerly MCT Bhd — intends to expand by doubling its launches in the Klang Valley within the next three years. Its new CEO Apollo Bello Tanco said the company is in the process of stabilising the business and achieving sustainable growth. To do that, it will focus primarily on five locations in the Klang Valley — Bangi, Seputeh, Cyberjaya, Damansara and Subang Jaya.","<div class=newsTextDataWrapInner><p>KUALA LUMPUR (June 16): After a major transformation and rebranding exercise last year, Avaland Bhd (KL:AVALAND) — formerly MCT Bhd — intends to expand by doubling its launches in the Klang Valley within the next three years. Its new CEO Apollo Bello Tanco said the company is in the process of stabilising the business and achieving sustainable growth. To do that, it will focus primarily on five locations in the Klang Valley — Bangi, Seputeh, Cyberjaya, Damansara and Subang Jaya.</p></div>

<div class=newsTextDataWrapInner><p>“We have several projects in fi",Edge,,https://assets.theedgemarkets.com/TEM_CC_Highlights_1528.jpg,https://assets.theedgemarkets.com/TEM_CC_Highlights_1528.jpg,52,TheEdge,http://www.theedgemarkets.com/categories/malaysia
