title,url,created_at,updated_at,published_date,summary,content,category,author,thumbnail_url,image_url,publisher_id,publisher_name,publisher_url
Alternative Views: Daim’s legal suit will show the scope of his wealth,https://www.klsescreener.com/v2/news/view/1262825,2024-01-15 12:35:41,2024-01-16 13:48:07,2024-01-15 12:30:00,"Businessmen who have made their millions are often attracted to the world of politics, and they have every right to jump into it. If they succeed in politics, rarely do they go back to the corporate world.

Nevertheless, some politicians do return to the business world as politics is not...","<div class=newsTextDataWrapInner><p><span style=""font-style: italics;"">This article first appeared in Forum, The Edge Malaysia Weekly on January 15, 2024 - January 21, 2024</span></p></div><div class=newsTextDataWrapInner><p>Businessmen who have made their millions are often attracted to the world of politics, and they have every right to jump into it. If they succeed in politics, rarely do they go back to the corporate world.</p></div>

<div class=newsTextDataWrapInner><p>Nevertheless, some politicians do return to the business world as politics is not everyone’s cup of tea.</p></div><div c",Edge,,https://assets.theedgemarkets.com/P49-Daim-TEM1506_Forum_20240115120246_theedgemalaysia.jpg,,54,TheEdge,http://www.theedgemarkets.com/options/edge
Apex Securities keeps 'neutral' call on plantation sector as CPO recovery seen priced in,https://www.klsescreener.com/v2/news/view/1262823,2024-01-15 12:33:51,2024-01-15 20:04:24,2024-01-15 12:23:40,"Apex Securities has kept its ""neutral"" call on the plantation sector as the market is believed to have factored in the recovery of crude palm oil (CPO) prices to around the RM4,000 per tonne projected by the research house.","<div class=newsTextDataWrapInner><p>KUALA LUMPUR (Jan 15): Apex Securities has kept its ""neutral"" call on the plantation sector as the market is believed to have factored in the recovery of crude palm oil (CPO) prices to around the RM4,000 per tonne projected by the research house.</p></div>

<div class=newsTextDataWrapInner><p>In a note, Apex Securities said the plantation sector is trading at forward price-to-earnings ratios (PERs) of 23.6 times for 2023 and 17.3 times for 2024 and is currently above its historical three-year average of 14.3 times, implying the sector is overvalued at the ",,,https://assets.theedgemarkets.com/20170911_PEO_KLK BERHAD KEKAYAAN OIL PALM PLANTATION KLUANG JOHOR_3_KY_20240115120208_theedgemalaysia.jpg,,52,TheEdge,http://www.theedgemarkets.com/categories/malaysia
CJ: Judiciary wrongly vilified for allowing public prosecutor’s withdrawal of charges in high profile cases,https://www.klsescreener.com/v2/news/view/1262821,2024-01-15 12:33:50,2024-01-15 21:04:28,2024-01-15 12:18:31,Chief Justice Tun Tengku Maimun Tuan Mat said that the judiciary was incorrectly labelled as “corrupt” and “incompetent” by the public after the public prosecutor had withdrawn criminal charges against certain high-profile individuals last year.,"<div class=newsTextDataWrapInner><p>PUTRAJAYA (Jan 15): Chief Justice Tun Tengku Maimun Tuan Mat said that the judiciary was incorrectly labelled as “corrupt” and “incompetent” by the public after the public prosecutor had withdrawn criminal charges against certain high-profile individuals last year.&nbsp;</p></div>

<div class=newsTextDataWrapInner><p>In her keynote speech at the Opening of the Legal Year 2024 here, Tengku Maimun highlighted these “high profile” cases in 2023 without naming the cases, where the public prosecutor as part of the Attorney-General’s Chambers (AGC) had withdrawn",,,https://assets.theedgemarkets.com/Chief-Justice-Tun-Tengku-Maimun-Tuan-Mat-3-SY-crop_20240115121454_theedgemalaysia.jpg,,52,TheEdge,http://www.theedgemarkets.com/categories/malaysia
IJM Corp to gain from acquiring 25 pct of Global Vision Logistics,https://www.klsescreener.com/v2/news/view/1262811,2024-01-15 12:10:37,2024-01-15 12:10:37,2024-01-15 12:07:16,"KUALA LUMPUR: IJM Corp Bhd&#039;s acquisition of a 25 per cent share in Global Vision Logistics (GVL) will increase its expertise in industrial buildings and give it a new source of recurring revenue.The RM89 million deal, according to RHB ...","<div itemprop=""articleBody"" class=""dable-content-wrapper""><p>KUALA LUMPUR: IJM Corp Bhd&#039;s acquisition of a 25 per cent share in Global Vision Logistics (GVL) will increase its expertise in industrial buildings and give it a new source of recurring revenue.</p><p>The RM89 million deal, according to RHB Research, equates to RM110 per square foot (psf) for IJM Corp.</p><p>""Our observations on online listings reveal that asking prices for industrial land near the logistics hub range between RM105 psf and RM140 psf.</p><p>""Independent valuer Knight Frank Malaysia has valued the whole 71-acre l",Corporate,,https://assets.nst.com.my/images/articles/IJM15_NSTfield_image_listing_featured_v2.var_1705291633.jpg,https://assets.nst.com.my/images/articles/ijm_1705291626.jpg,79,NST,https://www.nst.com.my/business/corporate
Frankly speaking: MYAirline needs to improve transparency,https://www.klsescreener.com/v2/news/view/1262805,2024-01-15 12:04:09,2024-01-16 13:16:23,2024-01-15 12:00:00,"Last Friday, MYAirline Sdn Bhd was reported to have found a white knight “from the Middle East” to revive the low-cost carrier, just days before its 90-day suspension is set to expire on Tuesday, Jan 16. The Bernama report, citing sources, said MYAirline had signed a sale and purchase agreement with a new investor in late December 2023.","<div class=newsTextDataWrapInner><p><span style=""font-style: italics;"">This article first appeared in The Edge Malaysia Weekly on January 15, 2024 - January 21, 2024</span></p></div><div class=newsTextDataWrapInner><p>Last Friday, MYAirline Sdn Bhd was reported to have found a white knight “from the Middle East” to revive the low-cost carrier, just days before its 90-day suspension is set to expire on Tuesday, Jan 16. The Bernama report, citing sources, said MYAirline had signed a sale and purchase agreement with a new investor in late December 2023.</p></div>

<div class=newsTextDataWrapInn",Edge,,https://assets.theedgemarkets.com/MYAirline_FS_20240115100930_theedgemalaysia.jpg,,54,TheEdge,http://www.theedgemarkets.com/options/edge
FMM urges Malaysian shippers to enhance readiness amid Red Sea crisis,https://www.klsescreener.com/v2/news/view/1262809,2024-01-15 12:06:04,2024-01-15 19:49:16,2024-01-15 11:57:34,"Malaysian importers and exporters are advised to brace for potential challenges, such as limited supplies of empty containers, due to the escalating security crisis in the Red Sea, according to the Federation of Malaysian Manufacturers (FMM).","<div class=newsTextDataWrapInner><p>KUALA LUMPUR (Jan 15): The Federation of Malaysian Manufacturers (FMM) advised Malaysian importers and exporters to brace for potential challenges, such as limited supplies of empty containers, due to the escalating security crisis in the Red Sea.</p></div>

<div class=newsTextDataWrapInner><p>FMM president Tan Sri Soh Thian Lai, in a statement issued on Monday, expressed deep concern over the Red Sea situation that led major shipping firms to reroute vessels around the southern tip of Africa.</p></div>

<div class=newsTextDataWrapInner><p>Soh said this ",新闻,,https://assets.theedgemarkets.com/Federation-of-Malaysian-Manufacturers-FMM_google_5.jpg,,52,TheEdge,http://www.theedgemarkets.com/categories/malaysia
Bursa trends higher at mid-morning,https://www.klsescreener.com/v2/news/view/1262807,2024-01-15 12:06:03,2024-01-15 19:34:21,2024-01-15 11:48:27,"Bursa Malaysia moved higher at mid-morning on Monday, tracking its regional peers amid positive sentiment. 

At 11.11am, the FTSE Bursa Malaysia KLCI (FBM KLCI) rose 7.78 points to 1,495.12 from last Friday's close of 1,487.34.","<div class=newsTextDataWrapInner><p>KUALA LUMPUR (Jan 15): Bursa Malaysia moved higher at mid-morning on Monday, tracking its regional peers amid positive sentiment.&nbsp;</p></div>

<div class=newsTextDataWrapInner><p>At 11.11am, the FTSE Bursa Malaysia KLCI (FBM KLCI) rose 7.78 points to 1,495.12 from last Friday's close of 1,487.34.</p></div>

<div class=newsTextDataWrapInner><p>The KLCI opened 0.94 of apoint better at 1,488.28.</p></div><div class=inPageAd id=div-gpt-ad-inpage></div>

<div class=newsTextDataWrapInner><p>However, on the broader market, losers led gainers are neck and ",Edge,,https://assets.theedgemarkets.com/midmorning-market-up_20240115114634_theedgemalaysia.jpg,,52,TheEdge,http://www.theedgemarkets.com/categories/malaysia
Foreign investors turned net sellers last week,https://www.klsescreener.com/v2/news/view/1262795,2024-01-15 11:50:40,2024-01-15 11:50:40,2024-01-15 11:41:31,"KUALA LUMPUR: Foreign investors became net sellers on Bursa Malaysia, selling RM93.1 million worth of stocks after four weeks of net inflows, said MIDF Research.According to its fund flow report for the week ending January 12, the firm noted that ...","<div itemprop=""articleBody"" class=""dable-content-wrapper""><p>KUALA LUMPUR: Foreign investors became net sellers on Bursa Malaysia, selling RM93.1 million worth of stocks after four weeks of net inflows, said MIDF Research.</p><p>According to its fund flow report for the week ending January 12, the firm noted that each trading day witnessed net selling, except for Monday, during which foreign investors purchased stocks worth RM29.8 million.</p><p>""Inflows were observed in stocks like Public Bank (RM42.2 million), Sime Darby (RM29.4 million), and YTL Power (RM28.6 million),"" it added.</p><p>MIDF",Corporate,,https://assets.nst.com.my/images/articles/fun15_NSTfield_image_listing_featured_v2.var_1705290087.jpg,https://assets.nst.com.my/images/articles/bursa-menung2_1627388105_1692615771_1705290080.jpg,79,NST,https://www.nst.com.my/business/corporate
"RHB research initiates coverage on Synergy House with a ""Buy""",https://www.klsescreener.com/v2/news/view/1262789,2024-01-15 11:41:03,2024-01-15 11:41:03,2024-01-15 11:37:37,"KUALA LUMPUR: RHB research has initiated a ""Buy"" coverage on Malaysia&#039;s only cross-border e-commerce furniture distributor, Synergy House Bhd, for its assetlight model – focusing on design and primarily selling online.About 80 per cent of its sales for the nine-month ...","<div itemprop=""articleBody"" class=""dable-content-wrapper""><p>KUALA LUMPUR: RHB research has initiated a ""Buy"" coverage on Malaysia&#039;s only cross-border e-commerce furniture distributor, Synergy House Bhd, for its assetlight model – focusing on design and primarily selling online.</p><p>About 80 per cent of its sales for the nine-month period in financial year 2023 was from online.</p><p>This spares it from high overhead costs and allows it to be versatile and quick in adapting to market changes.</p><p>""With a financial year 2024 forecast (FY24F) return on equity (ROE) of 32 per cent, we be",Corporate,,https://assets.nst.com.my/images/articles/syn15_NSTfield_image_listing_featured_v2.var_1705289853.jpg,https://assets.nst.com.my/images/articles/synergy_house_1705289847.jpg,79,NST,https://www.nst.com.my/business/corporate
FMM urges Malaysian shippers to refine strategies due to Red Sea crisis,https://www.klsescreener.com/v2/news/view/1262791,2024-01-15 11:44:23,2024-01-15 11:44:23,2024-01-15 11:32:00,"KUALA LUMPUR: The Federation of Malaysian Manufacturers (FMM) has called upon Malaysian shippers to brace for prolonged disruptions in the Red Sea, following the escalating security crisis unfolding in the region which has forced shipping firms to divert vessels to a much longer route.","<div class=""inline-img""><div class=""story-image""><p class=""caption"">The Maersk Sentosa container ship sails southbound to exit the Suez Canal in Suez, Egypt, on Thursday, Dec. 21, 2023. Photographer: Stringer/Bloomberg</p></div></div><div id=""story-body"" class=""story bot-15 relative""><p>KUALA LUMPUR: The Federation of Malaysian Manufacturers (FMM) has called upon Malaysian shippers to brace for prolonged disruptions in the Red Sea, following the escalating security crisis unfolding in the region which has forced shipping firms to divert vessels to a much longer route.</p><p>Its president, Tan ",,,https://apicms.thestar.com.my/uploads/images/2024/01/15/2491418.jpg,https://apicms.thestar.com.my/uploads/images/2024/01/15/2491418.jpg,28,TheStar,http://www.thestar.com.my/news/latest/?tag=Business
My Say: Malaysia’s second chance,https://www.klsescreener.com/v2/news/view/1262803,2024-01-15 12:04:08,2024-01-16 11:20:21,2024-01-15 11:30:00,"Very few countries get a second chance; fewer still get a potential massive upswing thanks to the confluence of very major generational global shifts. If Malaysia gets its strategies and policies right this time, and builds a new broad-based political, social and economic consensus that has elude...","<div class=newsTextDataWrapInner><p><span style=""font-style: italics;"">This article first appeared in Forum, The Edge Malaysia Weekly on January 15, 2024 - January 21, 2024</span></p></div><div class=newsTextDataWrapInner><p>Very few countries get a second chance; fewer still get a potential massive upswing thanks to the confluence of very major generational global shifts. If Malaysia gets its strategies and policies right this time, and builds a new broad-based political, social and economic consensus that has eluded the nation before, its resurgence as an economic powerhouse and an important",Edge,,https://assets.theedgemarkets.com/P48-KL-Views-TEM1506_Forum_20240115115850_123rf.jpg,,54,TheEdge,http://www.theedgemarkets.com/options/edge
Foreign investors end four-week net buying streak last week — MIDF,https://www.klsescreener.com/v2/news/view/1262785,2024-01-15 11:34:10,2024-01-15 19:19:19,2024-01-15 11:16:49,"Foreign investors ended their four-week long buying streak on Bursa Malaysia last week, disposing of RM93.1 million worth of equities, said MIDF Research.

In its weekly fund flow report released on Monday (Jan 15), the research house said net selling occurred every trading day of the week, except last Monday (Jan 8) when foreigners net bought RM29.8 million, with buying observed in stocks like Public Bank Bhd (RM42.2 million), Sime Darby Bhd (RM29.4 million), and YTL Power International Bhd (RM28.6 million).","<div class=newsTextDataWrapInner><p>KUALA LUMPUR (Jan 15): Foreign investors ended their four-week long buying streak on Bursa Malaysia last week, disposing of RM93.1 million worth of equities, said MIDF Research.</p></div>

<div class=newsTextDataWrapInner><p>In its weekly fund flow report released on Monday (Jan 15), the research house said net selling occurred every trading day of the week, except last Monday (Jan 8) when foreigners net bought RM29.8 million, with buying observed in stocks like Public Bank Bhd (RM42.2 million), Sime Darby Bhd (RM29.4 million), and YTL Power International ",新闻,,https://assets.theedgemarkets.com/Fund-Flow-1_1812174521654987_20240115111010_theedgemalaysia.jpg,,52,TheEdge,http://www.theedgemarkets.com/categories/malaysia
HLIB: Press Metal&#039;s Q4 2023 earnings to improve on higher LME aluminium spot prices,https://www.klsescreener.com/v2/news/view/1262765,2024-01-15 11:10:19,2024-01-15 11:10:19,2024-01-15 11:07:56,"KUALA LUMPUR: Press Metal Aluminium Bhd&#039;s fourth quarter of 2023 (Q4 2023) earnings are anticipated to be between RM305 million and RM325 million, representing an 18 per cent year-on-year (YoY) increase, said Hong Leong Investment Bank (HLIB Research).According to the research ...","<div itemprop=""articleBody"" class=""dable-content-wrapper""><p>KUALA LUMPUR: Press Metal Aluminium Bhd&#039;s fourth quarter of 2023 (Q4 2023) earnings are anticipated to be between RM305 million and RM325 million, representing an 18 per cent year-on-year (YoY) increase, said Hong Leong Investment Bank (HLIB Research).</p><p>According to the research firm, this was calculated using Q4 2023 LME aluminum spot prices of US$2,193 per tonne. </p><p>""In turn, FY23 core net profit would range from RM1.19 billion to RM1.21 billion (down 16 per cent to -15 per cent YoY), representing 98 per cent to 99 pe",Corporate,,https://assets.nst.com.my/images/articles/METAL15_NSTfield_image_listing_featured_v2.var_1705288073.jpg,https://assets.nst.com.my/images/articles/press_metal_1705288066.jpg,79,NST,https://www.nst.com.my/business/corporate
"Vietnam-Malaysia to forge stronger defence, security ties after golden anniversary — envoy",https://www.klsescreener.com/v2/news/view/1262777,2024-01-15 11:20:58,2024-01-15 19:02:37,2024-01-15 11:04:35,Vietnam and Malaysia are intensifying their collaboration in defence and security in fostering regional peace and stability — a commitment which emphasises the significance of the 50th anniversary celebrations observed in 2023.,"<div class=newsTextDataWrapInner><p>KUALA LUMPUR (Jan 15): Vietnam and Malaysia are intensifying their collaboration in defence and security in fostering regional peace and stability — a commitment which emphasises the significance of the 50th anniversary celebrations observed in 2023.</p></div>

<div class=newsTextDataWrapInner><p>Vietnam’s ambassador to Malaysia, Dinh Ngoc Linh, said that the commitment is timely and underscores an important manifestation of the close cooperation between the two nations in today’s complex geopolitical dynamics.</p></div>

<div class=newsTextDataWrapInner",新闻,,https://assets.theedgemarkets.com/Vietnam ambassador Dinh Ngoc Linh_20240115110046_bernama.jpg,,52,TheEdge,http://www.theedgemarkets.com/categories/malaysia
Frankly speaking: EPF’s RM500 incentive should stay one-off,https://www.klsescreener.com/v2/news/view/1262773,2024-01-15 11:18:59,2024-01-15 16:03:50,2024-01-15 11:00:00,"As promised in Budget 2023, the government has disbursed a sum of RM500 to 1.4 million members of the Employees Provident Fund (EPF) aged between 40 and 54 with less than RM10,000 balance in their accounts.","<div class=newsTextDataWrapInner><p><span style=""font-style: italics;"">This article first appeared in The Edge Malaysia Weekly on January 15, 2024 - January 21, 2024</span></p></div><div class=newsTextDataWrapInner><p>As promised in Budget 2023, the government has disbursed a sum of RM500 to 1.4 million members of the Employees Provident Fund (EPF) aged between 40 and 54 with less than RM10,000 balance in their accounts.</p></div>

<div class=newsTextDataWrapInner><p>This exercise will cost the government RM708 million. But the objective is to encourage members with low savings and nearing r",Edge,,https://assets.theedgemarkets.com/KWSP_FS_20240115100800_theedgemalaysia.jpg,,54,TheEdge,http://www.theedgemarkets.com/options/edge
HLIB upgrades Press Metal to 'hold' with target price of RM4.38,https://www.klsescreener.com/v2/news/view/1262763,2024-01-15 10:51:00,2024-01-15 18:49:21,2024-01-15 10:42:03,"Hong Leong Investment Bank (HLIB) Research has upgraded its rating on Press Metal Aluminium Holdings Bhd to ""hold"" from ""sell"", and raised its target price (TP) to RM4.38 from RM4.20.","<div class=newsTextDataWrapInner><p>KUALA LUMPUR (Jan 15): Hong Leong Investment Bank (HLIB) Research has upgraded its rating on Press Metal Aluminium Holdings Bhd to ""hold"" from ""sell"", and raised its target price (TP) to RM4.38 from RM4.20.</p></div>

<div class=newsTextDataWrapInner><p>This adjustment is based on a price-to-earnings (PE) multiple of 22.5 times after considering a revised FY2024 forecast profits, the research house said in a note on Monday.</p></div>

<div class=newsTextDataWrapInner><p>HLIB anticipates Press Metal's core earnings in the fourth quarter of 2023 (4QFY2023)",Edge,,https://assets.theedgemarkets.com/Press-Metal-2-HLIB_pressmetal.com_.jpg,,52,TheEdge,http://www.theedgemarkets.com/categories/malaysia
"PublicInvest upgrades Malakoff to 'outperform', raises target price to 80 sen",https://www.klsescreener.com/v2/news/view/1262761,2024-01-15 10:50:59,2024-01-15 18:49:18,2024-01-15 10:34:28,"PublicInvest Research has revised upwards its earnings forecasts for Malakoff Corp Bhd by 4.4% for the financial year 2024 (FY2024) and by 9.8% for FY2025, due to growth in its environmental solutions segment, subsequently upgrading its call to ""outperform"" from ""trading buy"" and lifting its target price from 70 sen to 80 sen.","<div class=newsTextDataWrapInner><p>KUALA LUMPUR (Jan 15): PublicInvest&nbsp;Research has revised upwards its earnings forecasts for Malakoff Corp Bhd by 4.4% for the financial year 2024 (FY2024) and by 9.8% for FY2025, due to growth in its environmental solutions segment, subsequently upgrading its call to ""outperform"" from ""trading buy"" and lifting its target price from 70 sen to 80 sen.</p></div>

<div class=newsTextDataWrapInner><p>""We came away from a meeting with management feeling positive on Malakoff’s earnings recovery and its prospect on cashflow generation. The setback on negative",Edge,,https://assets.theedgemarkets.com/malakoff_3.jpg,,52,TheEdge,http://www.theedgemarkets.com/categories/malaysia
Ringgit opens lower against US dollar,https://www.klsescreener.com/v2/news/view/1262757,2024-01-15 10:40:31,2024-01-15 10:40:31,2024-01-15 10:32:30,"KUALA LUMPUR - The ringgit opened lower against the US dollar on Monday as foreign exchange markets focused on geopolitical tensions in light of the United States (US) and its allies&#039; recent military attack in Yemen.At 9.07 am, the ringgit ...","<div itemprop=""articleBody"" class=""dable-content-wrapper""><p>KUALA LUMPUR - The ringgit opened lower against the US dollar on Monday as foreign exchange markets focused on geopolitical tensions in light of the United States (US) and its allies&#039; recent military attack in Yemen.</p><p>At 9.07 am, the ringgit depreciated to 4.6470/6570 versus the greenback from Friday&#039;s close of 4.6455/6500.</p><p>Bank Muamalat Malaysia Bhd chief economist Dr Mohd Afzanizam Abdul Rashid said the attack has resulted in crude oil prices being at elevated levels, with Brent crude rising to US$78.17 per bar",Economy,,https://assets.nst.com.my/images/articles/low15_NSTfield_image_listing_featured_v2.var_1705285946.jpg,https://assets.nst.com.my/images/articles/ringgit_dollar_1705285940.jpg,81,NST,https://www.nst.com.my/business/economy
AI to impact 60pc of advanced economy jobs: IMF&#039;s Georgieva,https://www.klsescreener.com/v2/news/view/1262755,2024-01-15 10:31:03,2024-01-15 10:31:03,2024-01-15 10:26:13,"Washington - Artificial intelligence (AI) will impact 60 percent of jobs in advanced economies, IMF Managing Director Kristalina Georgieva told AFP, shortly before departing for the World Economic Forum in Davos, Switzerland.""Advanced economies, some emerging markets, are going to see 60 ...","<div itemprop=""articleBody"" class=""dable-content-wrapper""><p>Washington - Artificial intelligence (AI) will impact 60 percent of jobs in advanced economies, IMF Managing Director Kristalina Georgieva told AFP, shortly before departing for the World Economic Forum in Davos, Switzerland.</p><p>""Advanced economies, some emerging markets, are going to see 60 percent of their jobs impacted,"" she said in an interview in Washington, citing an International Monetary Fund report published Sunday on the topic. </p><p>""And then it goes down to 40 percent, for emerging markets, 26 percent for low-income c",Economy,,https://assets.nst.com.my/images/articles/imf15_NSTfield_image_listing_featured_v2.var_1705285570.jpg,https://assets.nst.com.my/images/articles/US-ECONOMY-IMF-GEORGIEVA_1705285563.jpg,81,NST,https://www.nst.com.my/business/economy
Oil slips; investors eye Mideast developments,https://www.klsescreener.com/v2/news/view/1262749,2024-01-15 10:22:23,2024-01-15 10:22:23,2024-01-15 10:14:00,SINGAPORE: Oil prices slipped on Monday with traders watching out for supply disruption risk in the Middle East following strikes by U.S. and British forces to stop Houthi militia in Yemen from attacking ships in the Red Sea.,"<div class=""inline-img""><div class=""story-image""></div></div><div id=""story-body"" class=""story bot-15 relative""><p>SINGAPORE: Oil prices slipped on Monday with traders watching out for supply disruption risk in the Middle East following strikes by U.S. and British forces to stop Houthi militia in Yemen from attacking ships in the Red Sea.</p><p>Brent crude futures fell 31 cents, or 0.4%, to $77.98 a barrel by 0124 GMT after settling up 1.1% on Friday. U.S. West Texas Intermediate crude was at $72.36 a barrel, down 32 cents, or 0.4%, following a near 1% gain in the previous session.</p><p>The b",,,https://apicms.thestar.com.my/uploads/images/2024/01/15/2491335.jpeg,https://apicms.thestar.com.my/uploads/images/2024/01/15/2491335.jpeg,28,TheStar,http://www.thestar.com.my/news/latest/?tag=Business
