title,url,created_at,updated_at,published_date,summary,content,category,author,thumbnail_url,image_url,publisher_id,publisher_name,publisher_url
Consolidation the key,https://www.klsescreener.com/v2/news/view/1363279,2024-07-24 08:00:32,2024-07-24 08:00:32,2024-07-24 07:55:09,"KUALA LUMPUR: Small rubber plantations should be consolidated to increase productivity to help reduce the country&#039;s reliance on imported rubber, said Plantation and Commodities Minister Datuk Seri Johari Abdul Ghani.The issues of scarce labour have been affecting small ...","<div itemprop=""articleBody"" class=""dable-content-wrapper""><p>KUALA LUMPUR: Small rubber plantations should be consolidated to increase productivity to help reduce the country&#039;s reliance on imported rubber, said Plantation and Commodities Minister Datuk Seri Johari Abdul Ghani.</p><p>The issues of scarce labour have been affecting small rubber plantations&#039; productivity, and that a consolidation of the plantations would help raise productivity, he added.</p><p>Johari said Malaysia imported RM6.5 billion of rubber in 2022 and RM5.7 billion in 2023.</p><p>""Over the next 10 to 15 years, w",Economy,,https://assets.nst.com.my/images/articles/raber23_NSTfield_image_listing_featured_v2.var_1721778905.jpg,https://assets.nst.com.my/images/articles/20nt06jogun_1721778898.jpg,81,NST,https://www.nst.com.my/business/economy
Madani economic framework starts bearing fruit,https://www.klsescreener.com/v2/news/view/1363277,2024-07-24 08:00:19,2024-07-24 08:00:19,2024-07-24 07:53:00,"On May 17, the Finance Ministry announced that Malaysia&#039;s economic growth for the first quarter of 2024 (Q1 2024) was 4.2 per cent (Q4 2023: 2.9 per cent), surpassing Bloomberg&#039;s consensus forecast of 3.9 per cent.This was driven by a recovery in export performance ...","<div itemprop=""articleBody"" class=""dable-content-wrapper""><p>On May 17, the Finance Ministry announced that Malaysia&#039;s economic growth for the first quarter of 2024 (Q1 2024) was 4.2 per cent (Q4 2023: 2.9 per cent), surpassing Bloomberg&#039;s consensus forecast of 3.9 per cent.</p><p>This was driven by a recovery in export performance and robust domestic demand.</p><p>As emphasised by Prime Minister Datuk Seri Anwar Ibrahim, the encouraging economic performance in Q1 2024 demonstrates that effective government policies and sound economic management have catalysed this growth.</p><p>""Des",Feature,,https://assets.nst.com.my/images/articles/dani23_NSTfield_image_listing_featured_v2.var_1721778777.jpg,https://assets.nst.com.my/images/articles/Id_obj53323187_1721778770.jpg,85,NST,https://www.nst.com.my/business/insight
Oil falls 2% to six-week low on demand concerns,https://www.klsescreener.com/v2/news/view/1363275,2024-07-24 07:22:22,2024-07-24 07:22:22,2024-07-24 07:12:00,Oil prices fell about 2% to a six-week low on Tuesday on rising expectations of a ceasefire in Gaza and growing concerns about demand in China.,"<div class=""inline-img""><div class=""story-image""><p class=""caption"">Brent futures fell US$1.39, or 1.7%, to settle at US$81.01 a barrel, while US West Texas Intermediate crude (WTI) closed US$1.44, or 1.8%, lower at US$76.96.</p></div></div><div id=""story-body"" class=""story bot-15 relative""><p>NEW YORK: Oil prices fell about 2% to a six-week low on Tuesday on rising expectations of a ceasefire in Gaza and growing concerns about demand in China.</p><p>Brent futures fell US$1.39, or 1.7%, to settle at US$81.01 a barrel, while US West Texas Intermediate crude (WTI) closed US$1.44, or 1.8%, lower ",,,https://apicms.thestar.com.my/uploads/images/2024/07/24/2818996.jpeg,https://apicms.thestar.com.my/uploads/images/2024/07/24/2818996.jpeg,28,TheStar,http://www.thestar.com.my/news/latest/?tag=Business
Wall St ends lower with Big Tech earnings on deck,https://www.klsescreener.com/v2/news/view/1363273,2024-07-24 07:22:22,2024-07-24 07:22:22,2024-07-24 07:06:00,"Wall Street's main indices ended slightly lower on Tuesday, having given up meager intraday gains in the final minutes of trading, as investors switched their focus to the latest earnings from Alphabet and Tesla.","<div class=""inline-img""><div class=""story-image""><p class=""caption"">The S&amp;P 500 lost 8.67 points, or 0.16%, to 5,555.74 points, while the Nasdaq lost 10.22 points, or 0.06%, to 17,997.35. The Dow fell 57.35 points, or 0.14%, to 40,358.09.</p></div></div><div id=""story-body"" class=""story bot-15 relative""><p>NEW YORK: Wall Street's main indices ended slightly lower on Tuesday, having given up meager intraday gains in the final minutes of trading, as investors switched their focus to the latest earnings from Alphabet and Tesla.</p><p>The duo kicked off results from the so-called Magnificent S",,,https://apicms.thestar.com.my/uploads/images/2024/07/24/2818990.JPG,https://apicms.thestar.com.my/uploads/images/2024/07/24/2818990.JPG,28,TheStar,http://www.thestar.com.my/news/latest/?tag=Business
Overview of data centre boom in Malaysia,https://www.klsescreener.com/v2/news/view/1363197,2024-07-24 07:06:02,2024-07-26 11:20:52,2024-07-24 13:00:00,"Between 2021 and 2023, Malaysia approved a total of RM114.7 billion in investments related to data centres, which constituted most of the country’s digital investments totalling RM144.7 billion, according to Knight Frank Malaysia’s 1H2024 Real Estate Highlights report.","<div class=newsTextDataWrapInner><p><span style=""font-style: italics;"">This article first appeared in The Edge Malaysia Weekly on July 22, 2024 - July 28, 2024</span></p></div><div><img alt="""" class=""gallery-items"" data-high-res-src=""//myassets.theedgemalaysia.com/pics/2024/TEM1533-infographic_theedgemalaysia.jpg"" src="""" /></div>

<div class=""imgw-800 mx-auto d-block image-gallery""><a class=""mobx embedimg-icon"" data-rel=""ceolightbox"" href=""//myassets.theedgemalaysia.com/pics/2024/TEM1533-infographic_theedgemalaysia.jpg""><img alt="""" class=""gallery-items"" src=""//myassets.theedgemalaysia.com/pi",Edge,,https://assets.theedgemarkets.com/TEM1533-infographic_20240723142411_jcomp-freepik.jpg,https://assets.theedgemarkets.com/TEM1533-infographic_20240723142411_jcomp-freepik.jpg,52,TheEdge,http://www.theedgemarkets.com/categories/malaysia
"Tesla reports profit drop on price cuts, lower vehicle sales",https://www.klsescreener.com/v2/news/view/1363195,2024-07-24 07:00:41,2024-07-24 07:00:41,2024-07-24 06:51:31,"NEW YORK: Tesla reported a hefty drop in second-quarter profits Tuesday due to the effect of price cuts while spending aggressively on autonomous driving and other technology.Elon Musk&#039;s electric vehicle company reported profits of US$1.5 billion, down 45 percent, ...","<div itemprop=""articleBody"" class=""dable-content-wrapper""><p>NEW YORK: Tesla reported a hefty drop in second-quarter profits Tuesday due to the effect of price cuts while spending aggressively on autonomous driving and other technology.</p><p>Elon Musk&#039;s electric vehicle company reported profits of US$1.5 billion, down 45 percent, on revenues of US$25.5 billion, which were up two percent behind an increase in its energy generation and storage business.</p><p>Tesla&#039;s earnings per share missed analyst expectations, while revenues exceeded them.</p><p>The results are the latest in a rou",Corporate,,https://assets.nst.com.my/images/articles/tope3_NSTfield_image_listing_featured_v2.var_1721775088.jpg,https://assets.nst.com.my/images/articles/gweprijewrf_1721775082.jpg,79,NST,https://www.nst.com.my/business/corporate
"US strikes deal with Jasmine Loo to recover Picasso artwork, Swiss account's funds linked to 1MDB",https://www.klsescreener.com/v2/news/view/1363193,2024-07-24 06:20:46,2024-07-24 20:34:46,2024-07-24 06:06:20,"The US Department of Justice (DOJ) has reached a deal with former 1Malaysia Development Bhd (1MDB) general counsel Jasmine Loo Ai Swan to recover artwork by Pablo Picasso, and a financial account in Switzerland traced to funds allegedly embezzled from 1MDB.","<div class=newsTextDataWrapInner><p>KUALA LUMPUR (July 24): The US Department of Justice (DOJ) has reached a deal with former 1Malaysia Development Bhd (1MDB) general counsel Jasmine Loo Ai Swan to recover artwork by Pablo Picasso, and a financial account in Switzerland traced to funds allegedly embezzled from 1MDB.</p></div>

<div class=newsTextDataWrapInner><p>In a statement on Tuesday, the DOJ said that additionally, it had obtained forfeiture orders on other assets allegedly purchased with 1MDB funds by fugitive Low Taek Jho (Jho Low), including diamond jewellery and artwork by Vincent V",新闻,,//images.weserv.nl/?url=https://assets.theedgemarkets.com/1mdb-1_20240614140231_reuters_0.jpg&w=300,https://assets.theedgemarkets.com/1mdb-1_20240614140231_reuters_0.jpg,52,TheEdge,http://www.theedgemarkets.com/categories/malaysia
H'ng Bok San ceases to be substantial shareholder in Sarawak Cable,https://www.klsescreener.com/v2/news/view/1363179,2024-07-24 00:47:16,2024-07-24 16:05:19,2024-07-24 00:28:12,Tan Sri H'ng Bok San has ceased to be a substantial shareholder in Sarawak Cable Bhd (KL:SCABLE) after the disposal of shares by the H'ng family-controlled HNG Capital Sdn Bhd.,"<div class=newsTextDataWrapInner><p>KUALA LUMPUR (July 24): Tan Sri H'ng Bok San has ceased to be a substantial shareholder in Sarawak Cable Bhd (KL:SCABLE) after the disposal of shares by the H'ng family-controlled HNG Capital Sdn Bhd.&nbsp;</p></div>

<div class=newsTextDataWrapInner><p>HNG Capital disposed of 856,000 shares in the loss-making cable manufacturer, leaving the company with 19.37 million shares or a 4.85% stake, according to a bourse filing.&nbsp;</p></div>

<div class=newsTextDataWrapInner><p>H'ng was a non-independent and non-executive director of Sarawak Cable, before he",新闻,,https://assets.theedgemarkets.com/sarawak-cable-logo_20240509133227_20240716143333_annual report_0_0.jpg,https://assets.theedgemarkets.com/sarawak-cable-logo_20240509133227_20240716143333_annual report_0_0.jpg,52,TheEdge,http://www.theedgemarkets.com/categories/malaysia
Lessons from a global information technology outage,https://www.klsescreener.com/v2/news/view/1363271,2024-07-24 07:12:16,2024-07-24 07:12:16,2024-07-24 00:00:00,"If you’re a child of the ’90s like I am, you’ll remember all the doomsday prophecies and collective anxiety surrounding the year 2000.","<div class=""inline-img""><div class=""story-image""><p class=""caption"">As organisations worldwide found themselves paralysed last week, it highlighted the need for a more balanced approach to IT infrastructure versus a system with a single point of failure. — Philippine Daily Inquirer</p></div></div><div id=""story-body"" class=""story bot-15 relative""><p>IF you’re a child of the ’90s like I am, you’ll remember all the doomsday prophecies and collective anxiety surrounding the year 2000.</p><p>Famously known as the Y2K problem, many computer programmes used only the last two digits of the year makin",,,https://apicms.thestar.com.my/uploads/images/2024/07/24/2818983.jpeg,https://apicms.thestar.com.my/uploads/images/2024/07/24/2818983.jpeg,28,TheStar,http://www.thestar.com.my/news/latest/?tag=Business
CrowdStrike outage nets short sellers US$978mil,https://www.klsescreener.com/v2/news/view/1363269,2024-07-24 07:12:14,2024-07-24 07:12:14,2024-07-24 00:00:00,Short sellers piling into bets against CrowdStrike Holdings Inc have been rewarded after a botched software update from the firm sparked a global information technology (IT) outage and sent shares plunging to their worst two-day stretch on record.,"<div class=""inline-img""><div class=""story-image""><p class=""caption"">Total short interest in the systems software sector has increased by nearly US$12bil so far this year. — Bloomberg</p></div></div><div id=""story-body"" class=""story bot-15 relative""><p>NEW YORK: Short sellers piling into bets against CrowdStrike Holdings Inc have been rewarded after a botched software update from the firm sparked a global information technology (IT) outage and sent shares plunging to their worst two-day stretch on record.</p><p>The contrarian group reaped paper profits of US$978mil on the cybersecurity software",,,https://apicms.thestar.com.my/uploads/images/2024/07/24/2818979.jpg,https://apicms.thestar.com.my/uploads/images/2024/07/24/2818979.jpg,28,TheStar,http://www.thestar.com.my/news/latest/?tag=Business
Petros’ new role likely to affect PETRONAS capex,https://www.klsescreener.com/v2/news/view/1363267,2024-07-24 07:12:14,2024-07-24 07:12:14,2024-07-24 00:00:00,Petroleum Sarawak Bhd (Petros) move to take over the role of sole gas aggregator of Sarawak’s natural gas trading business locally and overseas from Petroliam Nasional Bhd (PETRONAS) may have a significant effect on capital expenditure (capex) spending activity by the latter.,"<div class=""inline-img""><div class=""story-image""><p class=""caption"">UOBKH Research stated the paradigm shift in Sarawak is a key reason behind PETRONAS move to focus on its overseas projects in Canada and Argentina.</p></div></div><div id=""story-body"" class=""story bot-15 relative""><p>PETALING JAYA: Petroleum Sarawak Bhd (Petros) move to take over the role of sole gas aggregator of Sarawak’s natural gas trading business locally and overseas from Petroliam Nasional Bhd (PETRONAS) may have a significant effect on capital expenditure (capex) spending activity by the latter.</p><p>UOB Kay Hian (UOB",,,https://apicms.thestar.com.my/uploads/images/2024/07/24/2818957.jpeg,https://apicms.thestar.com.my/uploads/images/2024/07/24/2818957.jpeg,28,TheStar,http://www.thestar.com.my/news/latest/?tag=Business
Delta Air warns cancellations to stretch for days after IT outage,https://www.klsescreener.com/v2/news/view/1363265,2024-07-24 07:12:12,2024-07-24 07:12:12,2024-07-24 00:00:00,Delta Air Lines Inc expects to cancel more flights this week as the carrier tries to recover from a crippling technology outage.,"<div class=""inline-img""><div class=""story-image""><p class=""caption"">The airline grounded nearly 900 flights as of Monday afternoon, bringing its total since Friday’s meltdown to almost 4,700. — AP</p></div></div><div id=""story-body"" class=""story bot-15 relative""><p>ATLANTA: Delta Air Lines Inc expects to cancel more flights this week as the carrier tries to recover from a crippling technology outage.</p><p>The airline grounded nearly 900 flights as of Monday afternoon, bringing its total since Friday’s meltdown to almost 4,700.</p><p>Delta said it was working “around the clock” to restore oper",,,https://apicms.thestar.com.my/uploads/images/2024/07/24/2818981.jpeg,https://apicms.thestar.com.my/uploads/images/2024/07/24/2818981.jpeg,28,TheStar,http://www.thestar.com.my/news/latest/?tag=Business
Golub leads US$1bil credit deal for TA carveout,https://www.klsescreener.com/v2/news/view/1363263,2024-07-24 07:12:11,2024-07-24 07:12:11,2024-07-24 00:00:00,"Golub Capital led a roughly US$1bil private debt facility to support TA Associates acquisition of Momentive Software, a carveout from Community Brands, according to people with knowledge of the matter.","<div class=""inline-img""><div class=""story-image""><p class=""caption"">Lawrence Golub, chief executive officer of Golub Capital. — Bloomberg</p></div></div><div id=""story-body"" class=""story bot-15 relative""><p>NEW YORK: Golub Capital led a roughly US$1bil private debt facility to support TA Associates acquisition of Momentive Software, a carveout from Community Brands, according to people with knowledge of the matter.</p><p>The deal, which some market participants viewed as aggressively structured, included a roughly US$700mil term loan that equates to about a 70% loan-to-value (LTV), a risk asse",,,https://apicms.thestar.com.my/uploads/images/2024/07/24/2818980.jpeg,https://apicms.thestar.com.my/uploads/images/2024/07/24/2818980.jpeg,28,TheStar,http://www.thestar.com.my/news/latest/?tag=Business
‘Multi-year upcycle set in motion’,https://www.klsescreener.com/v2/news/view/1363261,2024-07-24 07:12:11,2024-07-24 07:12:11,2024-07-24 00:00:00,Property has been one of the outperforming sectors and stocks within the circle are still attracting investor interest year-to-date.,"<div class=""inline-img""><div class=""story-image""><p class=""caption"">HLIB Research expects a long-term uptrend for the property sector, driven by three themes.</p></div></div><div id=""story-body"" class=""story bot-15 relative""><p>PETALING JAYA: Property has been one of the outperforming sectors and stocks within the circle are still attracting investor interest year-to-date.</p><p>Hong Leong Investment Bank (HLIB) Research expects a long-term uptrend for the sector, driven by three themes.</p><p>“We think that a multi-year property upcycle is now set in motion, driven by the rise in industrial d",,,https://apicms.thestar.com.my/uploads/images/2024/07/24/2818968.jpeg,https://apicms.thestar.com.my/uploads/images/2024/07/24/2818968.jpeg,28,TheStar,http://www.thestar.com.my/news/latest/?tag=Business
"Porsche lowers outlook, warns of impairments",https://www.klsescreener.com/v2/news/view/1363259,2024-07-24 07:12:09,2024-07-24 07:12:09,2024-07-24 00:00:00,Porsche lowered its sales forecast for the year and warned of impairments in production spurred by a supply shortage of aluminium alloys impacting various suppliers.,"<div class=""inline-img""><div class=""story-image""><p class=""caption"">The automaker said it now expects sales between €39bil and €40bil amid flooding in one of the aluminium suppliers’ production facilities. — Reuters</p></div></div><div id=""story-body"" class=""story bot-15 relative""><p>BERLIN: Porsche lowered its sales forecast for the year and warned of impairments in production spurred by a supply shortage of aluminium alloys impacting various suppliers.</p><p>The automaker said it now expects sales between €39bil and €40bil amid flooding in one of the aluminium suppliers’ production facilitie",,,https://apicms.thestar.com.my/uploads/images/2024/07/24/2818977.jpeg,https://apicms.thestar.com.my/uploads/images/2024/07/24/2818977.jpeg,28,TheStar,http://www.thestar.com.my/news/latest/?tag=Business
Dark fleet caper exposes risks around crowded Malacca Strait,https://www.klsescreener.com/v2/news/view/1363257,2024-07-24 07:12:08,2024-07-24 07:12:08,2024-07-24 00:00:00,"A collision that set two vessels ablaze off Singapore has underlined the growing risks around the crowded Strait of Malacca, as the dark fleet expands and lacklustre Chinese demand leaves dozens of the tankers idling.","<div class=""inline-img""><div class=""story-image""><p class=""caption"">The area around Singapore and Malaysia has been hub of shadow vessel activity. — Bloomberg</p></div></div><div id=""story-body"" class=""story bot-15 relative""><p>SINGAPORE: A collision that set two vessels ablaze off Singapore has underlined the growing risks around the crowded Strait of Malacca, as the dark fleet expands and lacklustre Chinese demand leaves dozens of the tankers idling.</p><p>The Ceres I, a 23-year-old crude oil tanker sailing under the flag of Sao Tome &amp; Principe, and the Hafnia Nile, a Singapore-flagged r",,,https://apicms.thestar.com.my/uploads/images/2024/07/24/2818976.jpeg,https://apicms.thestar.com.my/uploads/images/2024/07/24/2818976.jpeg,28,TheStar,http://www.thestar.com.my/news/latest/?tag=Business
Allianz offer for Income sparks public concerns,https://www.klsescreener.com/v2/news/view/1363255,2024-07-24 07:12:07,2024-07-24 07:12:07,2024-07-24 00:00:00,"Allianz’s plans to buy a majority stake in Income Insurance have sparked concerns among some Singaporeans over their health insurance plans tied to Income, despite the German insurer’s assurances that there will be no change to national insurance programmes.","<div class=""inline-img""><div class=""story-image""><p class=""caption"">Allianz has given assurances that it intends for Income to continue participation in national insurance programmes, including the IP plans. — The Straits Times</p></div></div><div id=""story-body"" class=""story bot-15 relative""><p>SINGAPORE: Allianz’s plans to buy a majority stake in Income Insurance have sparked concerns among some Singaporeans over their health insurance plans tied to Income, despite the German insurer’s assurances that there will be no change to national insurance programmes.</p><p>They also fear that Income’",,,https://apicms.thestar.com.my/uploads/images/2024/07/24/2818974.jpeg,https://apicms.thestar.com.my/uploads/images/2024/07/24/2818974.jpeg,28,TheStar,http://www.thestar.com.my/news/latest/?tag=Business
Sarawak Petchem plant to make M’sia major player,https://www.klsescreener.com/v2/news/view/1363253,2024-07-24 07:12:06,2024-07-24 07:12:06,2024-07-24 00:00:00,"The commissioning of Sarawak Petchem Sdn Bhd’s methanol plant in Bintulu, Sarawak, will provide the impetus for Malaysia to emerge as a leading methanol producer in the Asia-Pacific.","<div class=""inline-img""><div class=""story-image""><p class=""caption"">Investment, Trade and Industry Minister Tengku Datuk Seri Zafrul Abdul Aziz.</p></div></div><div id=""story-body"" class=""story bot-15 relative""><p>PETALING JAYA: The commissioning of Sarawak Petchem Sdn Bhd’s methanol plant in Bintulu, Sarawak, will provide the impetus for Malaysia to emerge as a leading methanol producer in the Asia-Pacific.</p><p>The Malaysian Investment Development Authority (Mida) said the availability of methanol in Malaysia, particularly in Sarawak, is expected to drive further investments and stimulate t",,,https://apicms.thestar.com.my/uploads/images/2024/07/24/2818975.jpg,https://apicms.thestar.com.my/uploads/images/2024/07/24/2818975.jpg,28,TheStar,http://www.thestar.com.my/news/latest/?tag=Business
Push for green products in construction,https://www.klsescreener.com/v2/news/view/1363251,2024-07-24 07:12:06,2024-07-24 07:12:06,2024-07-24 00:00:00,"Speeding up the use of certain types of construction materials will bring many benefits, including reducing carbon dioxide emissions and loss of agricultural land while taking advantage of industrial waste during production, says Phan Huu Duy Quoc, deputy secretary-general of the Vietnam Concrete Association.","<div class=""inline-img""><div class=""story-image""><p class=""caption"">The government has drawn up many incentive mechanisms and policies to facilitate the use of unburnt construction materials. — VNA/VNS</p></div></div><div id=""story-body"" class=""story bot-15 relative""><p>Hanoi: Speeding up the use of certain types of construction materials will bring many benefits, including reducing carbon dioxide emissions and loss of agricultural land while taking advantage of industrial waste during production, says Phan Huu Duy Quoc, deputy secretary-general of the Vietnam Concrete Association.</p><p>This ",,,https://apicms.thestar.com.my/uploads/images/2024/07/24/2818973.jpg,https://apicms.thestar.com.my/uploads/images/2024/07/24/2818973.jpg,28,TheStar,http://www.thestar.com.my/news/latest/?tag=Business
Monetary policy likely to be unchanged,https://www.klsescreener.com/v2/news/view/1363249,2024-07-24 07:12:04,2024-07-24 07:12:04,2024-07-24 00:00:00,Singapore’s central bank is widely expected to keep monetary policy unchanged this week and hold off easing settings amid lingering risks to the inflation outlook caused by geopolitical tensions.,"<div class=""inline-img""><div class=""story-image""><p class=""caption"">Sticky issue: People walking past a mural by artist Sean Dunston in the Chinatown district of Singapore. Core inflation in the city-state will return to the 2% level in early 2025, according to an analyst. — AFP</p></div></div><div id=""story-body"" class=""story bot-15 relative""><p>SINGAPORE: Singapore’s central bank is widely expected to keep monetary policy unchanged this week and hold off easing settings amid lingering risks to the inflation outlook caused by geopolitical tensions.</p><p>Of the 10 analysts polled by Reuters, ",,,https://apicms.thestar.com.my/uploads/images/2024/07/24/2818633.jpg,https://apicms.thestar.com.my/uploads/images/2024/07/24/2818633.jpg,28,TheStar,http://www.thestar.com.my/news/latest/?tag=Business
"IOI Properties, Tropicana, YTL Cement, Axis REIT, GHL Systems, Uzma, Advancecon, T7 Global, Varia, Well Chip",https://www.klsescreener.com/v2/news/view/1363167,2024-07-23 23:49:03,2024-07-24 16:05:16,2024-07-23 23:40:46,Here is a brief recap of some business news and corporate announcements that made the headlines on Tuesday.,"<div class=newsTextDataWrapInner><p>KUALA LUMPUR (July 23): Here is a brief recap of some business news and corporate announcements that made the headlines on Tuesday:</p></div>

<div class=newsTextDataWrapInner><p><b>IOI Properties Group Bhd</b> (KL:IOIPG) is acquiring Tropicana Gardens Mall, located in Petaling Jaya, from <b>Tropicana Corp Bhd</b> (KL:TROP) for RM680 million, cash. IOI said the property will provide a strong recurring income as it follows the successful model of IOI malls and leveraging on its brand in providing a vibrant lifestyle experience filled with dynamic offerings.",新闻,,https://assets.theedgemarkets.com/Companies-in-the-news_theedgemalaysia_112.jpg,https://assets.theedgemarkets.com/Companies-in-the-news_theedgemalaysia_112.jpg,52,TheEdge,http://www.theedgemarkets.com/categories/malaysia
