title,url,created_at,updated_at,published_date,summary,content,category,author,thumbnail_url,image_url,publisher_id,publisher_name,publisher_url
Oil settles up on crude supply disruption worries,https://www.klsescreener.com/v2/news/view/1349679,2024-06-28 07:22:40,2024-06-28 07:22:40,2024-06-28 07:09:00,"Oil futures settled higher on Thursday on worries about global crude supply disruptions as geopolitical pressure in the Middle East and Europe mounted, while a surprise increase in US crude and gasoline inventories gave prices a ceiling.","<div class=""inline-img""><div class=""story-image""><p class=""caption"">Brent crude oil futures settled up US$1.14, or 1.34%, to US$86.39 a barrel. US West Texas Intermediate crude futures settled up by 84 cents, or 1.04%, at US$81.74.</p></div></div><div id=""story-body"" class=""story bot-15 relative""><p>HOUSTON: Oil futures settled higher on Thursday on worries about global crude supply disruptions as geopolitical pressure in the Middle East and Europe mounted, while a surprise increase in US crude and gasoline inventories gave prices a ceiling.</p><p>Brent crude oil futures settled up US$1.14, or",,,https://apicms.thestar.com.my/uploads/images/2024/06/28/2772738.jpeg,https://apicms.thestar.com.my/uploads/images/2024/06/28/2772738.jpeg,28,TheStar,http://www.thestar.com.my/news/latest/?tag=Business
Wall St ends subdued as investors await inflation data,https://www.klsescreener.com/v2/news/view/1349677,2024-06-28 07:22:38,2024-06-28 07:22:38,2024-06-28 07:03:00,"US stocks ended Thursday around the unchanged mark as investors awaited fresh inflation data, with the Nasdaq able to eke out a slight gain after data showed a continued slowdown in economic activity, raising investors' hope for rate cuts.","<div class=""inline-img""><div class=""story-image""><p class=""caption"">The Dow rose 36.53 points, or 0.09%, to 39,164.33, the S&amp;P 500 gained 5.16 points, or 0.09%, to 5,483.06 and the Nasdaq gained 53.53 points, or 0.30%, to 17,858.68.</p></div></div><div id=""story-body"" class=""story bot-15 relative""><p>BENGALURU: US stocks ended Thursday around the unchanged mark as investors awaited fresh inflation data, with the Nasdaq able to eke out a slight gain after data showed a continued slowdown in economic activity, raising investors' hope for rate cuts.</p><p>""The market is in a bit of a holding ",,,https://apicms.thestar.com.my/uploads/images/2024/06/28/2772736.JPG,https://apicms.thestar.com.my/uploads/images/2024/06/28/2772736.JPG,28,TheStar,http://www.thestar.com.my/news/latest/?tag=Business
"Sapura, Crescendo, United Malacca, YNH Property,  Dataprep, EA Technique and MyEG",https://www.klsescreener.com/v2/news/view/1349591,2024-06-28 01:32:00,2024-06-28 17:19:33,2024-06-28 01:21:29,"KUALA LUMPUR (June 27): Here is a brief recap of some business news and corporate announcements that made the headlines on Thursday:

Sapura Energy Bhd’s (KL:SAPNRG) net profit shrank nearly 44% to RM82.13 million for 1QFY2025 from RM146.09 million the year before, no th...","<div class=newsTextDataWrapInner><p>KUALA LUMPUR (June 27): Here is a brief recap of some business news and corporate announcements that made the headlines on Thursday:</p></div>

<div class=newsTextDataWrapInner><p><strong>Sapura Energy Bhd</strong>’s (KL:SAPNRG) net profit shrank nearly 44% to RM82.13 million for 1QFY2025 from RM146.09 million the year before, no thanks to a RM117.76 million loss resulting from the liquidation of a subsidiary. The group’s foreign exchange gains came in much lower at RM52.4 million in 1QFY2025, compared with RM217.6 million a year ago. Earnings per share co",Edge,,https://assets.theedgemarkets.com/companies_134.jpg,https://assets.theedgemarkets.com/companies_134.jpg,52,TheEdge,http://www.theedgemarkets.com/categories/malaysia
"MARC downgrades YNH's sukuk to BBIS, with negative outlook",https://www.klsescreener.com/v2/news/view/1349589,2024-06-28 00:34:02,2024-06-28 17:17:33,2024-06-28 00:19:30,"MARC Ratings Bhd has downgraded YNH Property Bhd's (KL:YNHPROP) Islamic Medium-Term Notes Programme (Sukuk Wakalah) to BBIS with a negative outlook in a move that it says reflects heightening concerns over the group's business and financial prospects.

The downgrade was made as MARC removed the programme from its negative watch, in which it has been placed since Jan 18 due to YNH's weak financial position, delayed asset disposals and material issues concerning its key shareholder that have compounded the challenges that the group faces to address its weakening credit profile, MARC said in a statement.","<div class=newsTextDataWrapInner><p>KUALA LUMPUR (June 27): MARC Ratings Bhd has downgraded YNH Property Bhd's (KL:YNHPROP) Islamic Medium-Term Notes Programme (Sukuk Wakalah) to BBIS with a negative outlook in a move that it says reflects heightening concerns over the group's business and financial prospects.</p></div>

<div class=newsTextDataWrapInner><p>The downgrade was made as MARC removed the programme from its negative watch, in which it has been placed since Jan 18 due to YNH's weak financial position, delayed asset disposals and material issues concerning its key shareholder that ha",,,https://assets.theedgemarkets.com/YNH-Property_ynhb.com_.my__14.jpg,https://assets.theedgemarkets.com/YNH-Property_ynhb.com_.my__14.jpg,52,TheEdge,http://www.theedgemarkets.com/categories/malaysia
Elmina Business Park Poised for Exponential Growth with Unveiling of Stage 2,https://www.klsescreener.com/v2/news/view/1349585,2024-06-28 00:18:50,2024-06-28 17:02:53,2024-06-28 00:00:00,"Elmina Business Park has raised the bar for industrial and business projects in the country. Spanning 1,500 acres of prime freehold land, it is the largest freehold industrial park in the Klang Valley and part of Sime Darby Property’s 6,500-acre award-winning City of Elmina. Thoughtfully curated with world-class infrastructure, wellness-driven facilities and practical design, Elmina Business Park has attracted a dynamic range of local and multinational businesses to set up operations here.","<div class=""ceonothumb pb-5 imgw-800 mx-auto d-block""><a class=""mobx embedimg-icon"" data-desc=""Stage 1 of Elmina Business Park has been fully sold, and is the base of Google’s recently announced hyperscale data centre."" data-rel=""ceolightbox"" href=""//myassets.theedgemalaysia.com/pics/2024/SDP-EBP-BC28062024_img1v2_tem.jpg""><img alt="""" src=""//myassets.theedgemalaysia.com/pics/2024/SDP-EBP-BC28062024_img1v2_tem.jpg"" /></a>
<div class=""thumb-cap"">Stage 1 of Elmina Business Park has been fully sold, and is the base of Google’s recently announced hyperscale data centre.</div>
</div>

<div class",,,https://assets.theedgemarkets.com/SDP-EBP-BC28062024_thumbv2_tem.jpg,https://assets.theedgemarkets.com/SDP-EBP-BC28062024_thumbv2_tem.jpg,52,TheEdge,http://www.theedgemarkets.com/categories/malaysia
TM says it has reached settlement with MYTV in two-year-long arbitration dispute,https://www.klsescreener.com/v2/news/view/1349587,2024-06-28 00:18:54,2024-06-28 17:04:58,2024-06-28 00:06:28,"Telekom Malaysia Bhd (KL:TM) said it has executed an agreement with MYTV Broadcasting Sdn Bhd to settle all their disputes related to non-payment for the provision of digital terrestrial television (DTT), broadcasting infrastructure and network facilities.

It said in a bourse filing on Thursday that both parties will jointly inform the arbitral tribunal of the settlement of the disputes.","<div class=newsTextDataWrapInner><p>KUALA LUMPUR (June 27): Telekom Malaysia Bhd (KL:TM) said it has executed an agreement with MYTV Broadcasting Sdn Bhd to settle all their disputes related to non-payment for the provision of digital terrestrial television (DTT), broadcasting infrastructure and network facilities.</p></div>

<div class=newsTextDataWrapInner><p>It said in a bourse filing on Thursday that both parties will jointly inform the arbitral tribunal of the settlement of the disputes.</p></div>

<div class=newsTextDataWrapInner><p>However, it has yet to reveal the terms of the sett",新闻,,https://assets.theedgemarkets.com/tm-tower-2_tm.com_.my__16.jpg,https://assets.theedgemarkets.com/tm-tower-2_tm.com_.my__16.jpg,52,TheEdge,http://www.theedgemarkets.com/categories/malaysia
IJM likely to win more data centre jobs,https://www.klsescreener.com/v2/news/view/1349675,2024-06-28 07:22:38,2024-06-28 07:22:38,2024-06-28 00:00:00,"IJM Corp Bhd is the latest construction outfit to win a data centre job and it may play catch up to other contractors such as Sunway Construction Group Bhd (SunCon) and Gamuda Bhd, which have been winning more jobs in the data centre space.","<div class=""inline-img""><div class=""story-image""><p class=""caption"">CGSI Research said IJM appears to be on track to achieve its RM5bil new order target for the financial year ending March 31, 2025.</p></div></div><div id=""story-body"" class=""story bot-15 relative""><p>PETALING JAYA: <a href=""/business/marketwatch/stocks/?qcounter=IJM"" target=""_blank"">IJM Corp Bhd</a><a href=""http://charts.thestar.com.my/?s=IJM"" target=""_blank""><img class=""go-chart"" src=""https://cdn.thestar.com.my/Themes/img/chart.png""></a> is the latest construction outfit to win a data centre job and it may play catch up to ot",,,https://apicms.thestar.com.my/uploads/images/2024/06/28/2772712.jpeg,https://apicms.thestar.com.my/uploads/images/2024/06/28/2772712.jpeg,28,TheStar,http://www.thestar.com.my/news/latest/?tag=Business
Banks uphold conservative targets,https://www.klsescreener.com/v2/news/view/1349673,2024-06-28 07:22:36,2024-06-28 07:22:36,2024-06-28 00:00:00,"Amid mixed prospects in the broader macro economic climate, banks appear to be upholding conservative targets in spite of strong earnings deliveries in the first quarter of calendar year 2024 (1Q24), says Kenanga Research.","<div class=""inline-img""><div class=""story-image""><p class=""caption"">Kenanga Research said it was maintaining an “overweight” call on the banking sector.</p></div></div><div id=""story-body"" class=""story bot-15 relative""><p>PETALING JAYA: Amid mixed prospects in the broader macro economic climate, banks appear to be upholding conservative targets in spite of strong earnings deliveries in the first quarter of calendar year 2024 (1Q24), says Kenanga Research.</p><p>However, the research firm said it was maintaining an “overweight” call on the banking sector, as net interest margins are recovering,",,,https://apicms.thestar.com.my/uploads/images/2024/06/28/2772725.jpeg,https://apicms.thestar.com.my/uploads/images/2024/06/28/2772725.jpeg,28,TheStar,http://www.thestar.com.my/news/latest/?tag=Business
Data centre land sales propel Crescendo’s earnings,https://www.klsescreener.com/v2/news/view/1349671,2024-06-28 07:22:34,2024-06-28 07:22:34,2024-06-28 00:00:00,Land sales to data centre developers lifted Crescendo Corp Bhd’s first-quarter revenue to a record-high of RM527mil.,"<div class=""inline-img""><div class=""story-image""></div></div><div id=""story-body"" class=""story bot-15 relative""><p>PETALING JAYA: Land sales to data centre developers lifted <a href=""/business/marketwatch/stocks/?qcounter=CRESNDO"" target=""_blank"">Crescendo Corp Bhd</a><a href=""http://charts.thestar.com.my/?s=CRESNDO"" target=""_blank""><img class=""go-chart"" src=""https://cdn.thestar.com.my/Themes/img/chart.png""></a>’s first-quarter revenue to a record-high of RM527mil.</p><p>In a filing with Bursa Malaysia, the property developer noted its revenue for the first quarter ended April 30, 2024 (1Q25) ",,,https://apicms.thestar.com.my/uploads/images/2024/06/28/2772700.JPG,https://apicms.thestar.com.my/uploads/images/2024/06/28/2772700.JPG,28,TheStar,http://www.thestar.com.my/news/latest/?tag=Business
S’pore needs reforms to revive its REIT sector,https://www.klsescreener.com/v2/news/view/1349665,2024-06-28 07:12:47,2024-06-28 07:12:47,2024-06-28 00:00:00,The hottest part of Singapore’s otherwise humdrum stock market used to be institutional landlords.,"<div class=""inline-img""><div class=""story-image""><p class=""caption"">Bearish market: Buildings in Singapore. The twin post-pandemic shocks – elevated interest rates and a worldwide shift toward work from home – have dampened investor sentiment towards REITs in the island-state. — Bloomberg</p></div></div><div id=""story-body"" class=""story bot-15 relative""><p>THE hottest part of Singapore’s otherwise humdrum stock market used to be institutional landlords.</p><p>Now the city’s real estate investment trusts (REITS) are begging for a revival in investor interest – and some much-needed reform.</p><p",,,https://apicms.thestar.com.my/uploads/images/2024/06/28/2772350.jpg,https://apicms.thestar.com.my/uploads/images/2024/06/28/2772350.jpg,28,TheStar,http://www.thestar.com.my/news/latest/?tag=Business
Canada’s largest pension fund souring on emerging markets,https://www.klsescreener.com/v2/news/view/1349663,2024-06-28 07:12:46,2024-06-28 07:12:46,2024-06-28 00:00:00,"Canada Pension Plan Investment Board (CPPIB), one of the largest investment firms globally, is seeing fewer opportunities to put money to work in emerging markets.","<div class=""inline-img""><div class=""story-image""><p class=""caption"">CPPIB chief executive officer John Graham. — Bloomberg</p></div></div><div id=""story-body"" class=""story bot-15 relative""><p>LONDON: Canada Pension Plan Investment Board (CPPIB), one of the largest investment firms globally, is seeing fewer opportunities to put money to work in emerging markets.</p><p>“Our emerging markets investments have evolved over time,” CPPIB chief executive officer John Graham said in a Bloomberg interview in London, adding that the firm has reduced its exposure to the region.</p><p>“The opportunity set ",,,https://apicms.thestar.com.my/uploads/images/2024/06/28/2772727.jpeg,https://apicms.thestar.com.my/uploads/images/2024/06/28/2772727.jpeg,28,TheStar,http://www.thestar.com.my/news/latest/?tag=Business
"EV success built on price wars, Tesla",https://www.klsescreener.com/v2/news/view/1349661,2024-06-28 07:12:46,2024-06-28 07:12:46,2024-06-28 00:00:00,"China became a world leader in electric vehicles (EVs) by showering companies with public cash. It’s a charge increasingly heard in the United States and Europe, and a refrain that’s central to the escalating trade war.","<div class=""inline-img""><div class=""story-image""><p class=""caption"">Going green: BYD EVs are seen at the port of Lianyungang in Jiangsu province. China’s need to bring down heavy pollution in cities played a crucial role in its EV policy. — China Daily</p></div></div><div id=""story-body"" class=""story bot-15 relative""><p>SHANGHAI: China became a world leader in electric vehicles (EVs) by showering companies with public cash. It’s a charge increasingly heard in the United States and Europe, and a refrain that’s central to the escalating trade war.</p><p>If it were only that simple, China would h",,,https://apicms.thestar.com.my/uploads/images/2024/06/28/2772352.JPG,https://apicms.thestar.com.my/uploads/images/2024/06/28/2772352.JPG,28,TheStar,http://www.thestar.com.my/news/latest/?tag=Business
"AI’s green benefits will outweigh its emissions, says Bill Gates",https://www.klsescreener.com/v2/news/view/1349659,2024-06-28 07:12:44,2024-06-28 07:12:44,2024-06-28 00:00:00,"Billionaire climate tech investor Bill Gates says artificial intelligence (AI) will “pay for itself” when it comes to its associated greenhouse gas emissions, as the technology will help push forward the energy transition.","<div class=""inline-img""><div class=""story-image""><p class=""caption"">Billionaire climate tech investor Bill Gates. — Bloomberg</p></div></div><div id=""story-body"" class=""story bot-15 relative""><p>LONDON: Billionaire climate tech investor Bill Gates says artificial intelligence (AI) will “pay for itself” when it comes to its associated greenhouse gas emissions, as the technology will help push forward the energy transition.</p><p>AI will make data centres more efficient, helping them represent a smaller share of future power demand, he said in a Bloomberg TV interview.</p><p>Gates said the techn",,,https://apicms.thestar.com.my/uploads/images/2024/06/28/2772729.jpeg,https://apicms.thestar.com.my/uploads/images/2024/06/28/2772729.jpeg,28,TheStar,http://www.thestar.com.my/news/latest/?tag=Business
L&G investment unit to sell Glencore stake,https://www.klsescreener.com/v2/news/view/1349657,2024-06-28 07:12:43,2024-06-28 07:12:43,2024-06-28 00:00:00,Legal &amp; General’s (L&amp;G) investment management unit says it is selling its stake in global commodities trader Glencore this year on concerns over its production of thermal coal.,"<div class=""inline-img""><div class=""story-image""><p class=""caption"">Legal &amp; General Investment Management said it is also selling its stake in New York-listed retailer TJX. — Reuters</p></div></div><div id=""story-body"" class=""story bot-15 relative""><p>NEW YORK: Legal &amp; General’s (L&amp;G) investment management unit says it is selling its stake in global commodities trader Glencore this year on concerns over its production of thermal coal.</p><p>Legal &amp; General Investment Management (LGIM) is also selling its stake in New York-listed retailer TJX, it said, raising the number of dive",,,https://apicms.thestar.com.my/uploads/images/2024/06/28/2772728.jpeg,https://apicms.thestar.com.my/uploads/images/2024/06/28/2772728.jpeg,28,TheStar,http://www.thestar.com.my/news/latest/?tag=Business
Tesla about to lose its EV market majority in US,https://www.klsescreener.com/v2/news/view/1349655,2024-06-28 07:12:43,2024-06-28 07:12:43,2024-06-28 00:00:00,Tesla Inc is on the verge of losing a key bragging right it’s held for the past six years: outselling all electric vehicle (EV) competitors in the United States combined.,"<div class=""inline-img""><div class=""story-image""><p class=""caption"">EV leader: A Tesla showroom in Beijing, China. The company’s sales in the United States dropped 13% year-on-year in the first quarter. — Reuters</p></div></div><div id=""story-body"" class=""story bot-15 relative""><p>NEW YORK: Tesla Inc is on the verge of losing a key bragging right it’s held for the past six years: outselling all electric vehicle (EV) competitors in the United States combined.</p><p>In the 12 months through May, Tesla sold approximately 618,000 electric cars in the United States, compared with about 597,000 full",,,https://apicms.thestar.com.my/uploads/images/2024/06/28/2772356.JPG,https://apicms.thestar.com.my/uploads/images/2024/06/28/2772356.JPG,28,TheStar,http://www.thestar.com.my/news/latest/?tag=Business
M’sia on track for stronger growth in second half,https://www.klsescreener.com/v2/news/view/1349653,2024-06-28 07:12:43,2024-06-28 07:12:43,2024-06-28 00:00:00,Malaysia is on track to register stronger economic growth in the second half of this year (2H24).,"<div class=""inline-img""><div class=""story-image""><p class=""caption"">HLIB Research reaffirmed its view that Malaysia’s gross domestic product growth in 2024 would come in at 4.8%.</p></div></div><div id=""story-body"" class=""story bot-15 relative""><p>PETALING JAYA: Malaysia is on track to register stronger economic growth in the second half of this year (2H24).</p><p>This optimistic projection is underpinned by the country’s stable job market, supportive measures from the government, rising inbound investments, continued recovery in the tourism sector and a rebound in the external sector, Hong Le",,,https://apicms.thestar.com.my/uploads/images/2024/06/28/2772711.jpg,https://apicms.thestar.com.my/uploads/images/2024/06/28/2772711.jpg,28,TheStar,http://www.thestar.com.my/news/latest/?tag=Business
Boeing-Lockheed rocket venture swaps payloads,https://www.klsescreener.com/v2/news/view/1349651,2024-06-28 07:12:37,2024-06-28 07:12:37,2024-06-28 00:00:00,Boeing Co and Lockheed Martin Corp’s rocket venture will fly a dummy payload instead of Sierra Space’s tardy Dream Chaser plane during its key Vulcan rocket certification flight in September.,"<div class=""inline-img""><div class=""story-image""><p class=""caption"">Vulcan is meant to be ULA’s primary rocket moving forward and is critical for the company’s ability to compete against Elon Musk’s SpaceX. — Bloomberg</p></div></div><div id=""story-body"" class=""story bot-15 relative""><p>AUSTIN: Boeing Co and Lockheed Martin Corp’s rocket venture will fly a dummy payload instead of Sierra Space’s tardy Dream Chaser plane during its key Vulcan rocket certification flight in September.</p><p>Sierra Space “have told us that they will step aside in order to support our critical national-security sp",,,https://apicms.thestar.com.my/uploads/images/2024/06/28/2772726.jpeg,https://apicms.thestar.com.my/uploads/images/2024/06/28/2772726.jpeg,28,TheStar,http://www.thestar.com.my/news/latest/?tag=Business
US banks sail through annual Fed health check,https://www.klsescreener.com/v2/news/view/1349649,2024-06-28 07:12:36,2024-06-28 07:12:36,2024-06-28 00:00:00,"The biggest US banks will have enough capital to withstand severe economic and market turmoil, the US Federal Reserve’s (Fed) annual “stress test” exercise has showed, but firms face steeper hypothetical losses this year due to riskier portfolios.","<div class=""inline-img""><div class=""story-image""><p class=""caption"">Solid footing: People walk inside the JPMorgan headquarters in New York. The bank’s capital ratio of 12.5% was the highest among global lenders. — Reuters</p></div></div><div id=""story-body"" class=""story bot-15 relative""><p>WASHINGTON: The biggest US banks will have enough capital to withstand severe economic and market turmoil, the US Federal Reserve’s (Fed) annual “stress test” exercise has showed, but firms face steeper hypothetical losses this year due to riskier portfolios.</p><p>The exercise found 31 big banks would weat",,,https://apicms.thestar.com.my/uploads/images/2024/06/28/2772360.JPG,https://apicms.thestar.com.my/uploads/images/2024/06/28/2772360.JPG,28,TheStar,http://www.thestar.com.my/news/latest/?tag=Business
Strong earnings visibility forecast for Velesto,https://www.klsescreener.com/v2/news/view/1349647,2024-06-28 07:12:28,2024-06-28 07:12:28,2024-06-28 00:00:00,"Velesto Energy Bhd is building strong earnings visibility for its financial year ending Dec 31, 2025 (FY25) and FY26, says CGS International (CGSI) Research.","<div class=""inline-img""><div class=""story-image""><p class=""caption"">CGSI Research said Velesto’s rig schedule suggests that it could hit over 90% utilisation in FY25.</p></div></div><div id=""story-body"" class=""story bot-15 relative""><p>PETALING JAYA: <a href=""/business/marketwatch/stocks/?qcounter=VELESTO"" target=""_blank"">Velesto Energy Bhd</a><a href=""http://charts.thestar.com.my/?s=VELESTO"" target=""_blank""><img class=""go-chart"" src=""https://cdn.thestar.com.my/Themes/img/chart.png""></a> is building strong earnings visibility for its financial year ending Dec 31, 2025 (FY25) and FY26, says CGS",,,https://apicms.thestar.com.my/uploads/images/2024/06/28/2772710.jpeg,https://apicms.thestar.com.my/uploads/images/2024/06/28/2772710.jpeg,28,TheStar,http://www.thestar.com.my/news/latest/?tag=Business
Ajinomoto declares higher dividend of 38.4 sen for FY2024,https://www.klsescreener.com/v2/news/view/1349567,2024-06-28 00:02:12,2024-06-28 16:45:28,2024-06-27 23:57:41,"Ajinomoto (Malaysia) Bhd (KL:AJI) has declared a first and final dividend of 38.4 sen per share for the financial year ended March 31, 2024 (FY2024).

The dividend will be paid on Sept 25, with the ex-date fixed for Aug 29, according to the group's exchange filing on Thursday.","<div class=newsTextDataWrapInner><p>KUALA LUMPUR (June 27): Ajinomoto (Malaysia) Bhd (KL:AJI) has declared a first and final dividend of 38.4 sen per share for the financial year ended March 31, 2024 (FY2024).</p></div>

<div class=newsTextDataWrapInner><p>The dividend will be paid on Sept 25, with the ex-date fixed for Aug 29, according to the group's exchange filing on Thursday.</p></div>

<div class=newsTextDataWrapInner><p>This dividend is significantly higher than the 9.1 sen per share paid for FY2023.</p></div><div class=inPageAd id=div-gpt-ad-inpage></div>

<div class=newsTextData",新闻,,https://assets.theedgemarkets.com/ajinomoto_3.jpg,https://assets.theedgemarkets.com/ajinomoto_3.jpg,52,TheEdge,http://www.theedgemarkets.com/categories/malaysia
