title,url,created_at,updated_at,published_date,summary,content,category,author,thumbnail_url,image_url,publisher_id,publisher_name,publisher_url
Bursa Malaysia to continue upbeat momentum next week,https://www.klsescreener.com/v2/news/view/1273001,2024-02-04 10:20:29,2024-02-04 10:20:29,2024-02-04 10:11:20,"KUALA LUMPUR: Bursa Malaysia is expected to continue its positive momentum next week, amid cautious sentiment on the regional and global market, dealers said.Rakuten Trade Sdn Bhd equity research vice-president Thong Pak Leng said the valuation of the FBM ...","<div itemprop=""articleBody"" class=""dable-content-wrapper""><p>KUALA LUMPUR: Bursa Malaysia is expected to continue its positive momentum next week, amid cautious sentiment on the regional and global market, dealers said.</p><p>Rakuten Trade Sdn Bhd equity research vice-president Thong Pak Leng said the valuation of the FBM KLCI remains attractive, with the benchmark index having successfully maintained above the 1,500-mark after surpassing this resistance level last week.</p><p>""Additionally, it has continued to trend upwards and moving away from all Exponential Moving Average (EMA) lines. We a",Corporate,,https://assets.nst.com.my/images/articles/BUR04_NSTfield_image_listing_featured_v2.var_1707012677.jpg,https://assets.nst.com.my/images/articles/HQ20231207HQ747bursa_1707012670.jpg,79,NST,https://www.nst.com.my/business/corporate
Indonesia wealth fund recruits BlackRock exec Ganis as MD,https://www.klsescreener.com/v2/news/view/1272997,2024-02-04 10:10:16,2024-02-04 10:10:16,2024-02-04 10:05:15,"JAKARTA: Sovereign wealth fund the Indonesia Investment Authority (INA) has recruited as its managing director Christopher Ganis, an executive at the world&#039;s largest asset manager BlackRock, INA chief Ridha Wirakusumah said on Friday.Ridha confirmed to Reuters reports that ...","<div itemprop=""articleBody"" class=""dable-content-wrapper""><p>JAKARTA: Sovereign wealth fund the Indonesia Investment Authority (INA) has recruited as its managing director Christopher Ganis, an executive at the world&#039;s largest asset manager BlackRock, INA chief Ridha Wirakusumah said on Friday.</p><p>Ridha confirmed to Reuters reports that Ganis will be in charge of investments in hybrid capital solutions, which will includes private credit.</p><p>BlackRock did not immediately respond to a request for confirmation.</p><p>On BlackRock&#039;s website, Ganis is listed as head of Indonesia wi",Corporate,,https://assets.nst.com.my/images/articles/nesia02_NSTfield_image_listing_featured_v2.var_1707012312.jpg,https://assets.nst.com.my/images/articles/Indonesia_Investment_Authority_%28INA%29_1707012303.jpg,79,NST,https://www.nst.com.my/business/corporate
"Red Sea crisis strands thousands of Australian sheep, cows",https://www.klsescreener.com/v2/news/view/1272993,2024-02-04 10:00:35,2024-02-04 10:00:35,2024-02-04 09:59:52,SYDNEY: Australian welfare groups are demanding the release of thousands of sheep and cattle stuck aboard a ship after their trip to the Middle East was diverted by Yemen&#039;s Huthi rebel attacks in the Red Sea.The livestock – reportedly ...,"<div itemprop=""articleBody"" class=""dable-content-wrapper""><p>SYDNEY: Australian welfare groups are demanding the release of thousands of sheep and cattle stuck aboard a ship after their trip to the Middle East was diverted by Yemen&#039;s Huthi rebel attacks in the Red Sea.</p><p>The livestock – reportedly more than 15,000 animals, mostly sheep – have spent about four weeks aboard the MV Bahijah since setting sail from Fremantle, Perth in Western Australia on January 5.</p><p>The ship abandoned its plan to voyage through the Red Sea because of the ""worsening security situation"" there and was d",Economy,,https://assets.nst.com.my/images/articles/ketel02_NSTfield_image_listing_featured_v2.var_1707011989.jpg,https://assets.nst.com.my/images/articles/sheep_1707011982.jpg,81,NST,https://www.nst.com.my/business/economy
Concerns grow over mounting margin calls as China&#039;s stock market slides,https://www.klsescreener.com/v2/news/view/1272995,2024-02-04 10:01:19,2024-02-04 10:01:19,2024-02-04 09:54:27,"SHANGHAI: China&#039;s stock market slump in January led to a wave of calls for investors to top up cash in their margin trading accounts, triggering fears that a further slide in share prices could spur forced selling of tens ...","<div itemprop=""articleBody"" class=""dable-content-wrapper""><p>SHANGHAI: China&#039;s stock market slump in January led to a wave of calls for investors to top up cash in their margin trading accounts, triggering fears that a further slide in share prices could spur forced selling of tens of billions of dollars worth of stocks.</p><p>The country&#039;s blue-chip CSI300 Index tumbled 6.3 per cent last month, plumbing five-year lows, as a raft of government support measures failed to revive confidence dented by an ailing economy.</p><p>With stock prices falling, major shareholders in China-listed ",Corporate,,https://assets.nst.com.my/images/articles/cina02_NSTfield_image_listing_featured_v2.var_1707011664.jpg,https://assets.nst.com.my/images/articles/03bt06shanghai_1707011649.jpg,79,NST,https://www.nst.com.my/business/corporate
Felcra targets three million broiler chickens yearly,https://www.klsescreener.com/v2/news/view/1272991,2024-02-04 09:50:19,2024-02-04 09:50:19,2024-02-04 09:49:54,"MACHANG: Felcra Bhd aims to double its production of broiler chickens to three million a year after the expected December completion of its (broiler chicken) complex project in Tanjung Seratus, Pahang.Its chairman, Datuk Ahmad Jazlan Yaakub said in the ...","<div itemprop=""articleBody"" class=""dable-content-wrapper""><p>MACHANG: Felcra Bhd aims to double its production of broiler chickens to three million a year after the expected December completion of its (broiler chicken) complex project in Tanjung Seratus, Pahang.</p><p>Its chairman, Datuk Ahmad Jazlan Yaakub said in the first phase of the project, the production of broiler chickens was only 1.5 million a year before.</p><p>""Currently, the development of the pilot project in Tanjung Seratus has exceeded 80 per cent and is progressing well even though completion has been delayed for several month",Corporate,,https://assets.nst.com.my/images/articles/kera02_NSTfield_image_listing_featured_v2.var_1707011391.jpg,https://assets.nst.com.my/images/articles/felcra_1707011384.jpg,79,NST,https://www.nst.com.my/business/corporate
East of Eden,https://www.klsescreener.com/v2/news/view/1272989,2024-02-04 09:35:18,2024-02-05 16:01:39,2024-02-04 09:30:00,"KUALA LUMPUR (Feb 4): In the Options cover story this week, the ambassador of Brazil to Malaysia and Brunei Darussalam, Ary Norton de Murat Quintella, pays tribute to fellow countryman Roberto Burle Marx, arguably the greatest landscape architect in modern history, in a new self-published book titled A Brazilian in Kuala Lumpur.","<div class=newsTextDataWrapInner><p>KUALA LUMPUR (Feb 4): In the <em>Options</em> cover story this week, the ambassador of Brazil to Malaysia and Brunei Darussalam, Ary Norton de Murat Quintella, pays tribute to fellow countryman Roberto Burle Marx, arguably the greatest landscape architect in modern history, in a new self-published book titled <em>A Brazilian in Kuala Lumpur</em>.</p></div>

<div class=newsTextDataWrapInner><p>Many Malaysians remain unaware of the treasure — that is a touch of Burle Marx’s legacy — right under their noses at KLCC Park.</p></div>

<div class=newsTextDataWr",Edge,,https://assets.theedgemarkets.com/TEM_Options_Highlights_1509.jpg,https://assets.theedgemarkets.com/TEM_Options_Highlights_1509.jpg,54,TheEdge,http://www.theedgemarkets.com/options/edge
Upping its game,https://www.klsescreener.com/v2/news/view/1272985,2024-02-04 09:16:46,2024-02-05 16:01:37,2024-02-04 09:00:00,"KUALA LUMPUR (Feb 4): Paramount Property Development Sdn Bhd is gearing up to launch its first project of the year via a wholly owned subsidiary of its parent company, Paramount Corp Bhd, named Paramount Property (Cityview) Sdn Bhd. According to Paramount Property Development chief executive officer Chee Siew Pin, the developer is kicking off the year with its first luxury high-rise residential development named The Ashwood.","<div class=newsTextDataWrapInner><p>KUALA LUMPUR (Feb 4): Paramount Property Development Sdn Bhd is gearing up to launch its first project of the year via a wholly owned subsidiary of its parent company, Paramount Corp Bhd, named Paramount Property (Cityview) Sdn Bhd. According to Paramount Property Development chief executive officer Chee Siew Pin, the developer is kicking off the year with its first luxury high-rise residential development named The Ashwood.&nbsp;</p></div>

<div class=newsTextDataWrapInner><p>Nestled within the neighbourhood of Taman U-Thant in Kuala Lumpur, The Ashwood w",Edge,,https://assets.theedgemarkets.com/TEM_CC_Highlights_1509.jpg,https://assets.theedgemarkets.com/TEM_CC_Highlights_1509.jpg,52,TheEdge,http://www.theedgemarkets.com/categories/malaysia
