title,url,created_at,updated_at,published_date,summary,content,category,author,thumbnail_url,image_url,publisher_id,publisher_name,publisher_url
S&P 500 notches first record high close in 2 years,https://www.klsescreener.com/v2/news/view/1265967,2024-01-20 07:11:32,2024-01-20 07:11:32,2024-01-20 06:57:00,"The S&amp;P 500 posted a record high close on Friday for the first time in two years, fuelled by a rally in chipmakers and other heavyweight technology stocks on optimism around artificial intelligence.","<div class=""inline-img""><div class=""story-image""><p class=""caption"">The S&amp;P 500 jumped 1.23% to end the session at 4,839.81 points. The Nasdaq jumped 1.70% to 15,310.97 points, while Dow rose 1.05% to 37,863.80 points.</p></div></div><div id=""story-body"" class=""story bot-15 relative""><div class=""premium-sign-overlay absolute""></div><p>NEW YORK: The S&amp;P 500 posted a record high close on Friday for the first time in two years, fuelled by a rally in chipmakers and other heavyweight technology stocks on optimism around artificial intelligence.</p><p>The benchmark's close confirmed that the",,,https://apicms.thestar.com.my/uploads/images/2024/01/20/2501015.JPG,https://apicms.thestar.com.my/uploads/images/2024/01/20/2501015.JPG,28,TheStar,http://www.thestar.com.my/news/latest/?tag=Business
Wall St Week Ahead: Maligned US real estate sector draws buyers,https://www.klsescreener.com/v2/news/view/1265965,2024-01-20 07:11:32,2024-01-20 07:11:32,2024-01-20 06:50:00,"Falling inflation and expectations of an economic soft landing are buoying hopes for US real estate stocks in 2024, even as the sector continues to lag the broader market.","<div class=""inline-img""><div class=""story-image""><p class=""caption"">Global fund managers increased their exposure to REITs by 15 percentage points in December, pushing allocations to 12-month highs. — Reuters</p></div></div><div id=""story-body"" class=""story bot-15 relative""><div class=""premium-sign-overlay absolute""></div><p>NEW YORK: Falling inflation and expectations of an economic soft landing are buoying hopes for US real estate stocks in 2024, even as the sector continues to lag the broader market.</p><p>Real estate investment trusts (REITs) were among the worst performing sectors over th",,,https://apicms.thestar.com.my/uploads/images/2024/01/20/2501014.JPG,https://apicms.thestar.com.my/uploads/images/2024/01/20/2501014.JPG,28,TheStar,http://www.thestar.com.my/news/latest/?tag=Business
Oil drops slightly on China demand concerns,https://www.klsescreener.com/v2/news/view/1265961,2024-01-20 06:55:23,2024-01-20 06:55:23,2024-01-20 06:45:00,Oil prices settled slightly lower on Friday but recorded a weekly gain as Middle East tensions and disruptions to oil output offset concerns about the Chinese and global economies.,"<div class=""inline-img""><div class=""story-image""><p class=""caption"">Brent futures settled 54 cents lower at US$78.56 a barrel. US West Texas Intermediate crude fell 67 cents to settle at US$73.41.</p></div></div><div id=""story-body"" class=""story bot-15 relative""><div class=""premium-sign-overlay absolute""></div><p>NEW YORK: Oil prices settled slightly lower on Friday but recorded a weekly gain as Middle East tensions and disruptions to oil output offset concerns about the Chinese and global economies.</p><p>Brent futures settled 54 cents lower at US$78.56 a barrel. US West Texas Intermediate cr",,,https://apicms.thestar.com.my/uploads/images/2024/01/20/2501013.jpeg,https://apicms.thestar.com.my/uploads/images/2024/01/20/2501013.jpeg,28,TheStar,http://www.thestar.com.my/news/latest/?tag=Business
"SARA 2024: Five-fold rise in allocations to benefit 700,000 recipients",https://www.klsescreener.com/v2/news/view/1265959,2024-01-20 02:05:25,2024-01-22 10:19:35,2024-01-20 02:00:37,"The Sumbangan Asas Rahmah (SARA) programme this year is expected to benefit over 700,000 recipients with RM700 million in allocations, a five-fold increase, compared to 210,000 recipients with an expenditure of RM130 million last year.","<div class=newsTextDataWrapInner><p>KUALA LUMPUR (Jan 19): The Sumbangan Asas Rahmah (SARA) programme this year is expected to benefit over 700,000 recipients with RM700 million in allocations, a five-fold increase, compared to 210,000 recipients with an expenditure of RM130 million last year.</p></div>

<div class=newsTextDataWrapInner><p>Prime Minister Datuk Seri Anwar Ibrahim said that it was to improve SARA as a targeted subsidy aid to those who are most affected by rising costs of living.</p></div>

<div class=newsTextDataWrapInner><p>“The Malaysian economy’s transformation begins wit",Edge,,https://assets.theedgemarkets.com/anwar_6.jpg,,52,TheEdge,http://www.theedgemarkets.com/categories/malaysia
"YNH reveals 2022 turnkey construction details, applies internal controls to address land deal disclosure oversight",https://www.klsescreener.com/v2/news/view/1265957,2024-01-20 01:48:27,2024-01-22 10:19:32,2024-01-20 01:46:05,"YNH Property Bhd, in which prominent investor Datuk Dr Yu Kuan Chon is the largest shareholder with a 32.6% stake, shared details of a turnkey construction contract (TCA) in relation to a RM150 million land deal in Desa Sri Hartamas in response to a query from Bursa Malaysia.","<div class=newsTextDataWrapInner><p>KUALA LUMPUR (Jan 19): YNH Property Bhd, in which prominent investor Datuk Dr Yu Kuan Chon is the largest shareholder with a 32.6% stake, shared details of a turnkey construction contract (TCA) in relation to a RM150 million land deal in Desa Sri Hartamas in response to a query from Bursa Malaysia.</p></div>

<div class=newsTextDataWrapInner><p>According to YNH's bourse filing on Friday, the TCA was entered into by YNH's wholly-owned subsidiary Kar Sin Bhd (KSB) and the landowner Great Wall Park Sdn Bhd (GWP) on June 20, 2016, to build a mixed residential ",Edge,,https://assets.theedgemarkets.com/YNH-Property_ynhb.com_.my__11.jpg,,52,TheEdge,http://www.theedgemarkets.com/categories/malaysia
"Business associations, restaurant operators object to actions by Fomema",https://www.klsescreener.com/v2/news/view/1265955,2024-01-20 01:48:27,2024-01-22 09:49:32,2024-01-20 01:33:22,"Several business associations, including restaurant operators, are protesting against Fomema Sdn Bhd's move to increase the fee rate and the frequency of medical examinations for foreign workers as the decisions were made without any discussion with stakeholders.","<div class=newsTextDataWrapInner><p>KUALA LUMPUR (Jan 19): Several business associations, including restaurant operators, are protesting against Fomema Sdn Bhd's move to increase the fee rate and the frequency of medical examinations for foreign workers as the decisions were made without any discussion with stakeholders.</p></div>

<div class=newsTextDataWrapInner><p>Malaysian Muslim Restaurant Owners’ Association, Malaysian Indian Restaurant Owners’ Association, Federation Of Malaysian Business Associations and Malaysian Indian Muslim Chamber Of Commerce And Industry in a joint statement sa",,,https://assets.theedgemarkets.com/fomema.jpg,,52,TheEdge,http://www.theedgemarkets.com/categories/malaysia
Cuepacs president urges stern action against slander of Chief Secretary,https://www.klsescreener.com/v2/news/view/1265953,2024-01-20 01:48:26,2024-01-22 09:34:38,2024-01-20 01:26:16,The Congress of Unions of Employees in the Public and Civil Services (Cuepacs) president Datuk Dr Adnan Mat called for stern action against the mastermind spreading allegations about the Chief Secretary to the Government (KSN) Tan Sri Mohd Zuki Ali being investigated by the Malaysian Anti-Corruption Commission (MACC).,"<div class=newsTextDataWrapInner><p>KUALA LUMPUR (Jan 19): The Congress of Unions of Employees in the Public and Civil Services (Cuepacs) president Datuk Dr Adnan Mat called for stern action against the mastermind spreading allegations about the Chief Secretary to the Government (KSN) Tan Sri Mohd Zuki Ali being investigated by the Malaysian Anti-Corruption Commission (MACC).</p></div>

<div class=newsTextDataWrapInner><p>Adnan emphasised the spread of such slander on social media has potentially negative consequences on public service institutions and government trust.</p></div>

<div cla",Edge,,https://assets.theedgemarkets.com/cuepacs_1.jpg,,52,TheEdge,http://www.theedgemarkets.com/categories/malaysia
Plantation and Commodities Ministry discusses ways to help rubber glove industry,https://www.klsescreener.com/v2/news/view/1265951,2024-01-20 01:31:52,2024-01-22 09:32:32,2024-01-20 01:22:58,The Plantation and Commodities Ministry held a discussion on Friday with the Malaysian Rubber Glove Manufacturers Association (MARGMA) on measures to resolve critical issues towards ensuring the industry’s ability to meet global challenges.,"<div class=newsTextDataWrapInner><p>KUALA LUMPUR (Jan 19): The Plantation and Commodities Ministry held a discussion on Friday with the Malaysian Rubber Glove Manufacturers Association (MARGMA) on measures to resolve critical issues towards ensuring the industry’s ability to meet global challenges.</p></div>

<div class=newsTextDataWrapInner><p>Its minister Datuk Seri Johari Abdul Ghani said the Malaysian rubber glove industry is now operating amid a challenging export environment, with local companies facing stiff competition, especially from countries that have access to cheaper energy.</p",新闻,,https://assets.theedgemarkets.com/Glove_theedgemalaysia_0.jpg,,52,TheEdge,http://www.theedgemarkets.com/categories/malaysia
"Capital A, Eupe Corp, Silver Ridge, Jentayu Sustainables, Betamek, Edelteq, TSA Group, LB Aluminium, Tanco Holdings, Kinergy Advancement, Heitech Padu and YNH Property",https://www.klsescreener.com/v2/news/view/1265949,2024-01-20 01:21:17,2024-01-22 09:19:32,2024-01-20 01:10:48,"KUALA LUMPUR (Jan 19): Here is a brief recap of some corporate announcements that made news on Friday:

Capital A Bhd now has up till June 30, 2024 to submit its proposal to regularise its Practice Note 17 (PN17) condition after getting Bursa Malaysia's approval for anot...","<div class=newsTextDataWrapInner><p>KUALA LUMPUR (Jan 19): Here is a brief recap of some corporate announcements that made news on Friday:</p></div>

<div class=newsTextDataWrapInner><p><strong>Capital A Bhd</strong> now has up till June 30, 2024 to submit its proposal to regularise its Practice Note 17 (PN17) condition after getting Bursa Malaysia's approval for another six-month extension — its fourth extension in a row. The group was placed in Bursa's PN17 list of financially-distressed entities in January 2022. It was initially supposed to submit the plan by Jan 7, 2023, but the deadline",新闻,,https://assets.theedgemarkets.com/companies_120.jpg,,52,TheEdge,http://www.theedgemarkets.com/categories/malaysia
Let’s take scammers to the cleaners,https://www.klsescreener.com/v2/news/view/1266013,2024-01-20 07:12:11,2024-01-20 07:12:11,2024-01-20 00:00:00,"Every day, without fail, we have seen reports about how individuals are scammed by all sorts of methods and strategies. The victims are innocent but simply trapped in a situation, thinking that they will get rich quickly.","<div class=""inline-img""><div class=""story-image""><p class=""caption"">Financial education is key to limiting the likelihood of someone falling into a scam. </p></div></div><div id=""story-body"" class=""story bot-15 relative""><div class=""premium-sign-overlay absolute""></div><p>EVERY day, without fail, we have seen reports about how individuals are scammed by all sorts of methods and strategies. The victims are innocent but simply trapped in a situation, thinking that they will get rich quickly.</p><p>Scams itself are now a pandemic as they are so widespread to the extent that what is reported is on",,,https://apicms.thestar.com.my/uploads/images/2024/01/20/2500989.jpeg,https://apicms.thestar.com.my/uploads/images/2024/01/20/2500989.jpeg,28,TheStar,http://www.thestar.com.my/news/latest/?tag=Business
Incite aims to speed up digitalisation of SMEs,https://www.klsescreener.com/v2/news/view/1266011,2024-01-20 07:12:08,2024-01-20 07:12:08,2024-01-20 00:00:00,"While various measures have been put in place to elevate the small and medium enterprise (SME) sector to a higher level, it still trails behind in digitalisation.","<div class=""inline-img""><div class=""story-image""><p class=""caption"">Incite Innovations Group chief executive officer Tham Lih Chung.</p></div></div><div id=""story-body"" class=""story bot-15 relative""><div class=""premium-sign-overlay absolute""></div><p>While various measures have been put in place to elevate the small and medium enterprise (SME) sector to a higher level, it still trails behind in digitalisation.</p><p>A recent report, Malaysia Economic Monitor February 2023: Expanding Malaysia’s Digital Frontier, unveils a significant digital divide among businesses in Malaysia, indicating that ",,,https://apicms.thestar.com.my/uploads/images/2024/01/20/2501001.jpg,https://apicms.thestar.com.my/uploads/images/2024/01/20/2501001.jpg,28,TheStar,http://www.thestar.com.my/news/latest/?tag=Business
Slowing inflation supports case for BoJ to wait longer,https://www.klsescreener.com/v2/news/view/1266009,2024-01-20 07:12:07,2024-01-20 07:12:07,2024-01-20 00:00:00,"Japan's latest inflation report gives the Bank of Japan (BoJ) another reason to wait beyond next week’s meeting before ending the negative rate policy, while also adding to the case for a hike in coming months.","<div class=""inline-img""><div class=""story-image""><p class=""caption"">Ueda: Inflation will pick up again after a temporary lull, and a key focus will be annual wage talks culminating in March. — Bloomberg</p></div></div><div id=""story-body"" class=""story bot-15 relative""><div class=""premium-sign-overlay absolute""></div><p>JAPAN’S latest inflation report gives the Bank of Japan (BoJ) another reason to wait beyond next week’s meeting before ending the negative rate policy, while also adding to the case for a hike in coming months.</p><p>Growth in consumer prices excluding fresh food slowed to 2.3% ",,,https://apicms.thestar.com.my/uploads/images/2024/01/20/2500784.jpg,https://apicms.thestar.com.my/uploads/images/2024/01/20/2500784.jpg,28,TheStar,http://www.thestar.com.my/news/latest/?tag=Business
"FedEx Express revamp hangs on fate of USPS, pilot talks",https://www.klsescreener.com/v2/news/view/1266007,2024-01-20 07:12:05,2024-01-20 07:12:05,2024-01-20 00:00:00,FedEx Corp is waging financial battles on two fronts.,"<div class=""inline-img""><div class=""story-image""><p class=""caption"">Crucial talks: A file photo of a FedEx plane approaching San Diego. Investors want the company to slash costs. — Reuters</p></div></div><div id=""story-body"" class=""story bot-15 relative""><div class=""premium-sign-overlay absolute""></div><p>FEDEX Corp is waging financial battles on two fronts.</p><p>The delivery giant wants a more profitable contract with the US Postal Service (USPS) and is seeking an elusive labour deal with its pilots. How both efforts shake out will be key to improving profit at its largest business, overnigh",,,https://apicms.thestar.com.my/uploads/images/2024/01/20/2500788.JPG,https://apicms.thestar.com.my/uploads/images/2024/01/20/2500788.JPG,28,TheStar,http://www.thestar.com.my/news/latest/?tag=Business
"Fundamentals intact, say Bursa and SC",https://www.klsescreener.com/v2/news/view/1266005,2024-01-20 07:12:05,2024-01-20 07:12:05,2024-01-20 00:00:00,The Securities Commission (SC) and Bursa Malaysia have assured investors that the fundamentals of the Malaysian stock market remain strong despite the heightened volatility in certain stocks of late.,"<div class=""inline-img""><div class=""story-image""><p class=""caption"">The SC and Bursa Malaysia said the recent significant decline in share prices was limited to a few small-cap stocks, and was not widespread.</p></div></div><div id=""story-body"" class=""story bot-15 relative""><div class=""premium-sign-overlay absolute""></div><p>PETALING JAYA: The Securities Commission (SC) and Bursa Malaysia have assured investors that the fundamentals of the Malaysian stock market remain strong despite the heightened volatility in certain stocks of late.</p><p>In a joint statement yesterday, the SC and Bursa Mal",,,https://apicms.thestar.com.my/uploads/images/2024/01/20/2501012.jpeg,https://apicms.thestar.com.my/uploads/images/2024/01/20/2501012.jpeg,28,TheStar,http://www.thestar.com.my/news/latest/?tag=Business
An alliance to tackle business costs sought for 2024,https://www.klsescreener.com/v2/news/view/1266003,2024-01-20 07:12:04,2024-01-20 07:12:04,2024-01-20 00:00:00,"The Singapore Business Federation (SBF) wants to bring firms and policymakers together to put a damper on costs in 2024, with a new grouping it has named Alliance for Action (AfA) on Business Competitiveness.","<div class=""inline-img""><div class=""story-image""><p class=""caption"">At a dinner it hosted for journalists, Kok delivered the report card for 2023 and outlined its plans for this year. — The Straits Times</p></div></div><div id=""story-body"" class=""story bot-15 relative""><div class=""premium-sign-overlay absolute""></div><p>SINGAPORE: The Singapore Business Federation (SBF) wants to bring firms and policymakers together to put a damper on costs in 2024, with a new grouping it has named Alliance for Action (AfA) on Business Competitiveness.</p><p>New green taxes, rising utilities rates, a shrinking",,,https://apicms.thestar.com.my/uploads/images/2024/01/20/2501011.jpeg,https://apicms.thestar.com.my/uploads/images/2024/01/20/2501011.jpeg,28,TheStar,http://www.thestar.com.my/news/latest/?tag=Business
"State land plots in Marina Gardens Crescent, Media Circle draw tepid bids",https://www.klsescreener.com/v2/news/view/1266001,2024-01-20 07:12:02,2024-01-20 07:12:02,2024-01-20 00:00:00,"Two 99-year leasehold government land sites in Marina Gardens Crescent and Media Circle in one-north drew fewer-than-expected bids and land rates that were below those of recent state land tenders, reflecting greater caution among developers stung by several rounds of cooling measures and higher financing costs.","<div class=""inline-img""><div class=""story-image""><p class=""caption"">The Marina Gardens Crescent site drew just one bid of S$770.5 million, or S$984 per square foot per plot ratio. — The Straits Times</p></div></div><div id=""story-body"" class=""story bot-15 relative""><div class=""premium-sign-overlay absolute""></div><p>SINGAPORE: Two 99-year leasehold government land sites in Marina Gardens Crescent and Media Circle in one-north drew fewer-than-expected bids and land rates that were below those of recent state land tenders, reflecting greater caution among developers stung by several rounds of co",,,https://apicms.thestar.com.my/uploads/images/2024/01/20/2501009.jpeg,https://apicms.thestar.com.my/uploads/images/2024/01/20/2501009.jpeg,28,TheStar,http://www.thestar.com.my/news/latest/?tag=Business
Economy likely expands in 4Q but outlook cloudy,https://www.klsescreener.com/v2/news/view/1265999,2024-01-20 07:12:00,2024-01-20 07:12:00,2024-01-20 00:00:00,"Malaysia’s economy in the fourth quarter of 2023 (4Q23) likely expanded 3.4% from a year earlier, marginally faster than the previous three-month period, though a slump in exports and easing activity signalled weakening momentum.","<div class=""inline-img""><div class=""story-image""><p class=""caption"">Malaysia's full-year economic growth is expected to come in at 3.8% in 2023, the statistics department said. — Reuters</p></div></div><div id=""story-body"" class=""story bot-15 relative""><div class=""premium-sign-overlay absolute""></div><p>KUALA LUMPUR: Malaysia’s economy in the fourth quarter of 2023 (4Q23) likely expanded 3.4% from a year earlier, marginally faster than the previous three-month period, though a slump in exports and easing activity signalled weakening momentum.</p><p>While all major sectors registered an expansi",,,https://apicms.thestar.com.my/uploads/images/2024/01/20/2501008.jpeg,https://apicms.thestar.com.my/uploads/images/2024/01/20/2501008.jpeg,28,TheStar,http://www.thestar.com.my/news/latest/?tag=Business
KAB continues expansion into solar power,https://www.klsescreener.com/v2/news/view/1265997,2024-01-20 07:11:58,2024-01-20 07:11:58,2024-01-20 00:00:00,Kinergy Advancement Bhd (KAB) is optimistic about its prospects for 2024 and aims to secure more renewable-energy (RE) projects from clients in the near term.,"<div class=""inline-img""><div class=""story-image""><p class=""caption"">Lai said the group is looking forward to securing projects in solar-energy sector and venturing into the solar farms.</p></div></div><div id=""story-body"" class=""story bot-15 relative""><div class=""premium-sign-overlay absolute""></div><p>PETALING JAYA: Kinergy Advancement Bhd (KAB) is optimistic about its prospects for 2024 and aims to secure more renewable-energy (RE) projects from clients in the near term.</p><p>“We’re seeing an outcome from our energy segment, our bottom line has also seen an improvement and our fourth quarte",,,https://apicms.thestar.com.my/uploads/images/2024/01/20/2501007.jpeg,https://apicms.thestar.com.my/uploads/images/2024/01/20/2501007.jpeg,28,TheStar,http://www.thestar.com.my/news/latest/?tag=Business
LB Aluminium to buy Beranang land for RM30.4mil,https://www.klsescreener.com/v2/news/view/1265995,2024-01-20 07:11:56,2024-01-20 07:11:56,2024-01-20 00:00:00,"LB Aluminium Bhd has proposed to acquire a parcel of freehold industrial land with buildings in Beranang, Selangor for RM30.41mil cash.","<div class=""inline-img""><div class=""story-image""></div></div><div id=""story-body"" class=""story bot-15 relative""><div class=""premium-sign-overlay absolute""></div><p>PETALING JAYA: <a href=""/business/marketwatch/stocks/?qcounter=LBALUM"" target=""_blank"">LB Aluminium Bhd</a><a href=""http://charts.thestar.com.my/?s=LBALUM"" target=""_blank""><img class=""go-chart"" src=""https://cdn.thestar.com.my/Themes/img/chart.png""></a> has proposed to acquire a parcel of freehold industrial land with buildings in Beranang, Selangor for RM30.41mil cash.</p><p>In a filing with Bursa Malaysia, LB Aluminium stated it ha",,,https://apicms.thestar.com.my/uploads/images/2024/01/20/2501004.JPG,https://apicms.thestar.com.my/uploads/images/2024/01/20/2501004.JPG,28,TheStar,http://www.thestar.com.my/news/latest/?tag=Business
Edelteq signs two semiconductor agreements,https://www.klsescreener.com/v2/news/view/1265993,2024-01-20 07:11:54,2024-01-20 07:11:54,2024-01-20 00:00:00,"Edelteq Holdings Bhd has entered into two memorandums of understanding (MoUs) in relation to semiconductor design, manufacturing and sale of automatic optical inspection (AOI) systems and insulated-gate bipolar transistor (IGBT) module packaging machines.","<div class=""inline-img""><div class=""story-image""></div></div><div id=""story-body"" class=""story bot-15 relative""><div class=""premium-sign-overlay absolute""></div><p>PETALING JAYA: Edelteq Holdings Bhd has entered into two memorandums of understanding (MoUs) in relation to semiconductor design, manufacturing and sale of automatic optical inspection (AOI) systems and insulated-gate bipolar transistor (IGBT) module packaging machines.</p><p>The company has inked an agreement with Halo Technologies Sdn Bhd for a proposed joint venture (JV) to undertake semiconductor design, manufacturing and sale o",,,https://apicms.thestar.com.my/uploads/images/2024/01/20/2501002.JPG,https://apicms.thestar.com.my/uploads/images/2024/01/20/2501002.JPG,28,TheStar,http://www.thestar.com.my/news/latest/?tag=Business
KPJ sues 11 former board members over alleged breach of duty in Lablink stake sale,https://www.klsescreener.com/v2/news/view/1265939,2024-01-19 23:49:50,2024-01-22 08:18:59,2024-01-19 23:39:00,KPJ Healthcare Bhd has filed a lawsuit against 11 former board directors over the sale of a 49% stake in its pathology and laboratory unit Lablink (M) Sdn Bhd to KL Kappa Sdn Bhd for RM119.92 million in March 2018.,"<div class=newsTextDataWrapInner><p>KUALA LUMPUR (Jan 19): KPJ Healthcare Bhd has filed a lawsuit against 11 former board directors over the sale of a 49% stake in its pathology and laboratory unit Lablink (M) Sdn Bhd to KL Kappa Sdn Bhd for RM119.92 million in March 2018.</p></div>

<div class=newsTextDataWrapInner><p>KPJ, which still owns a 51% stake in Lablink, claimed that these individuals who sat on its board at the time had allegedly breached their fiduciary and/or statutory duties to the group, and failed to exercise reasonable care and diligence in the transaction with KL Kappa, whi",,,https://assets.theedgemarkets.com/KPJ-6_theedgemarkets_1.jpg,,52,TheEdge,http://www.theedgemarkets.com/categories/malaysia
