title,url,created_at,updated_at,published_date,summary,content,category,author,thumbnail_url,image_url,publisher_id,publisher_name,publisher_url
AI pioneer Kai-Fu Lee aims to bring China its ChatGPT moment,https://www.klsescreener.com/v2/news/view/1323909,2024-05-13 12:11:21,2024-05-13 12:11:21,2024-05-13 12:00:00,"The Beijing startup founded by technology pioneer Kai-Fu Lee is introducing its first artificial-intelligence application for consumers, a step aimed at helping China capitalise on the promising technology.","<div class=""inline-img""><div class=""story-image""><p class=""caption"">While US firms such as OpenAI, Meta Platforms Inc and Alphabet Inc have taken the lead in generative AI, Chinese players are pressing hard to catch up. In addition to 01.AI, tech players including Baidu Inc and TikTok-parent ByteDance Ltd are pouring funds into developing their own AI models and chatbot services. — Bloomberg</p></div></div><div id=""story-body"" class=""story bot-15 relative""><p>The Beijing startup founded by technology pioneer Kai-Fu Lee is introducing its first artificial-intelligence application for consumers,",,,https://apicms.thestar.com.my/uploads/images/2024/05/13/2691754.jpg,https://apicms.thestar.com.my/uploads/images/2024/05/13/2691754.jpg,28,TheStar,http://www.thestar.com.my/news/latest/?tag=Business
Frankly Speaking: Air of caution hanging over Pharmaniaga,https://www.klsescreener.com/v2/news/view/1323905,2024-05-13 12:06:25,2024-05-14 16:46:31,2024-05-13 12:00:00,"Pharmaniaga Bhd (KL:PHARMA), the company that holds a dominant position in the supply of pharmaceutical products to government hospitals, is confident it will be nursed back to health by the end of this year.","<div class=newsTextDataWrapInner><p><span style=""font-style: italics;"">This article first appeared in The Edge Malaysia Weekly on May 13, 2024 - May 19, 2024</span></p></div><div class=newsTextDataWrapInner><p>Pharmaniaga Bhd (KL:PHARMA), the company that holds a dominant position in the supply of pharmaceutical products to government hospitals, is confident it will be nursed back to health by the end of this year.</p></div>

<div class=newsTextDataWrapInner><p>But the external auditors remain cautious. In the latest audited report, they highlighted the group’s net loss of RM79 million for t",Edge,,https://assets.theedgemarkets.com/TEM1523-3_FS-2_20240513100543_theedgemalaysia.jpg,https://assets.theedgemarkets.com/TEM1523-3_FS-2_20240513100543_theedgemalaysia.jpg,54,TheEdge,http://www.theedgemarkets.com/options/edge
"US investigating sale of ferrosilicon from Malaysia, other countries",https://www.klsescreener.com/v2/news/view/1323903,2024-05-13 12:04:19,2024-05-13 17:34:43,2024-05-13 11:57:18,"The US International Trade Commission (USITC) has determined that there is a reasonable indication that an industry in the US is threatened by the import of ferrosilicon from Brazil, Kazakhstan, Malaysia, and Russia.","<div class=newsTextDataWrapInner><p>KUALA LUMPUR (May 13): The US International Trade Commission (USITC) has determined that there is a reasonable indication that an industry in the US is threatened by the import of ferrosilicon from Brazil, Kazakhstan, Malaysia, and Russia.</p></div><div class=newsTextDataWrapInner><p>Ferrosilicon is an alloy of iron and silicon with a typical silicon content by weight of 15%–90%. It contains a high proportion of iron silicides.</p></div><div class=newsTextDataWrapInner><p>In a statement last Saturday (May 11), the USITC said the products are allegedly sold i",Edge,,https://assets.theedgemarkets.com/usitc_20230325438100053_reuters_0.jpg,https://assets.theedgemarkets.com/usitc_20230325438100053_reuters_0.jpg,52,TheEdge,http://www.theedgemarkets.com/categories/malaysia
"Sungei Bagan Rubber, related companies extend rally to near two-decade high",https://www.klsescreener.com/v2/news/view/1323893,2024-05-13 11:47:09,2024-05-14 16:00:38,2024-05-13 11:42:04,"KUALA LUMPUR (May 13): Shares of Sungei Bagan Rubber Co (Malaya) Bhd (KL:SBAGAN) and its related companies extended their gains on Monday, as investors continued to bid up the stocks on news of buyout of Singapore’s Great Eastern Holdings Ltd.","<div class=newsTextDataWrapInner><p>KUALA LUMPUR (May 13): Shares of Sungei Bagan Rubber Co (Malaya) Bhd (KL:SBAGAN) and its related companies extended their gains on Monday, as investors continued to bid up the stocks on news of the buyout of Singapore’s Great Eastern Holdings Ltd.</p></div>

<div class=newsTextDataWrapInner><p>Sungei Bagan rose over 20% to an intraday high of RM6.76. Sister company Kuchai Development Bhd (KL:KUCHAI) climbed over 9% to RM2.34, while parent Kluang Rubber Company (Malaya) Bhd (KL:KLUANG) added over 14% to RM6.06. At those intraday highs, all three stocks were",,,https://assets.theedgemarkets.com/Hot-Stocks_20240513114128_theedgemalaysia.jpg,https://assets.theedgemarkets.com/Sungei-Bagan-Rubber-Company-(MALAYA)-Berhad_20240513135030_sungeibagan.com_.jpg,52,TheEdge,http://www.theedgemarkets.com/categories/malaysia
"Asia stocks brace for US inflation test, China data",https://www.klsescreener.com/v2/news/view/1323887,2024-05-13 11:31:00,2024-05-13 11:31:00,2024-05-13 11:30:22,"SYDNEY: Asian share markets made a cautious start on Monday in a week where inflation figures could make or break hopes for earlier U.S. rate cuts, while Chinese activity data will test optimism about a sustained recovery in the ...","<div itemprop=""articleBody"" class=""dable-content-wrapper""><p>SYDNEY: Asian share markets made a cautious start on Monday in a week where inflation figures could make or break hopes for earlier U.S. rate cuts, while Chinese activity data will test optimism about a sustained recovery in the world&#039;s No. 2 economy.</p><p>Beijing has already reported a welcome pickup in inflation to an annual 0.3% in April, helping to soothe worries about a slide into prolonged deflation. Forecasts favour further gains in April retail sales and industrial output due on Friday.</p><p>There are also reports Chin",Corporate,,https://assets.nst.com.my/images/articles/asian13_NSTfield_image_listing_featured_v2.var_1715571019.jpg,https://assets.nst.com.my/images/articles/stock_1715571012.jpg,79,NST,https://www.nst.com.my/business/corporate
Alternative Views: Malaysian Bar gives hope to court of public opinion,https://www.klsescreener.com/v2/news/view/1323885,2024-05-13 11:21:25,2024-05-14 15:46:31,2024-05-13 11:07:57,The Malaysian Bar’s bid to seek a judicial review of the Federal Territories Pardons Board’s decision to cut former prime minister Datuk Seri Najib Razak’s jail term and fine for his conviction in the SRC International case gives hope to the court of public opinion.,"<div class=newsTextDataWrapInner><p><span style=""font-style: italics;"">This article first appeared in Forum, The Edge Malaysia Weekly on May 13, 2024 - May 19, 2024</span></p></div><div class=newsTextDataWrapInner><p>The Malaysian Bar’s bid to seek a judicial review of the Federal Territories Pardons Board’s decision to cut former prime minister Datuk Seri Najib Razak’s jail term and fine for his conviction in the SRC International case gives hope to the court of public opinion.</p></div>

<div class=newsTextDataWrapInner><p>The grounds listed in the Malaysian Bar’s affidavit to support its ",Edge,,https://assets.theedgemarkets.com/TEM1523-1_Forum_20240513110653_theedgemalaysia.jpg,https://assets.theedgemarkets.com/TEM1523-1_Forum_20240513110653_theedgemalaysia.jpg,54,TheEdge,http://www.theedgemarkets.com/options/edge
Frankly Speaking: Contract doctor issue continues to plague public healthcare,https://www.klsescreener.com/v2/news/view/1323875,2024-05-13 11:04:33,2024-05-14 15:46:28,2024-05-13 11:00:00,The public healthcare sector continues to be plagued by issues ranging from unclear career development and non-competitive wages to long work hours and bullying by senior doctors.,"<div class=newsTextDataWrapInner><p><span style=""font-style: italics;"">This article first appeared in The Edge Malaysia Weekly on May 13, 2024 - May 19, 2024</span></p></div><div class=newsTextDataWrapInner><p>The public healthcare sector continues to be plagued by issues ranging from unclear career development and non-competitive wages to long work hours and bullying by senior doctors.</p></div>

<div class=newsTextDataWrapInner><p>According to an article in The Star, the number of housemen at the health ministry has dwindled by 50% since 2019, following a drop in the number of medical grad",Edge,,https://assets.theedgemarkets.com/TEM1523-2_FS-2_20240513100139_theedgemalaysia.jpg,https://assets.theedgemarkets.com/TEM1523-2_FS-2_20240513100139_theedgemalaysia.jpg,54,TheEdge,http://www.theedgemarkets.com/options/edge
Genting stocks rally after Singapore unit's earnings hit 10-year high,https://www.klsescreener.com/v2/news/view/1323873,2024-05-13 11:00:33,2024-05-13 11:00:33,2024-05-13 10:51:00,"KUALA LUMPUR: Genting Bhd and its subsidiary, Genting Malaysia Bhd’s shares rallied in early trade on Monday, becoming the top mover of Bursa Malaysia's barometer index.","<div class=""inline-img""><div class=""story-image""></div></div><div id=""story-body"" class=""story bot-15 relative""><p>KUALA LUMPUR: <a href=""/business/marketwatch/stocks/?qcounter=GENTING"" target=""_blank"">Genting Bhd</a><a href=""http://charts.thestar.com.my/?s=GENTING"" target=""_blank""><img class=""go-chart"" src=""https://cdn.thestar.com.my/Themes/img/chart.png""></a> and its subsidiary, <a href=""/business/marketwatch/stocks/?qcounter=GENM"" target=""_blank"">Genting Malaysia Bhd</a><a href=""http://charts.thestar.com.my/?s=GENM"" target=""_blank""><img class=""go-chart"" src=""https://cdn.thestar.com.my/Theme",,,https://apicms.thestar.com.my/uploads/images/2024/05/13/2691717.jpeg,https://apicms.thestar.com.my/uploads/images/2024/05/13/2691717.jpeg,28,TheStar,http://www.thestar.com.my/news/latest/?tag=Business
Al Rajhi Bank Malaysia names former CIMB exec Mohd Syahrul Ishak as CEO,https://www.klsescreener.com/v2/news/view/1323865,2024-05-13 10:51:23,2024-05-13 17:49:32,2024-05-13 10:46:36,Al Rajhi Banking & Investment Corporation (Malaysia) Bhd has named Mohd Syahrul Ishak as chief executive officer effective Monday.,"<div class=newsTextDataWrapInner><p>KUALA LUMPUR (May 13): Al Rajhi Banking &amp; Investment Corporation (Malaysia) Bhd has named Mohd Syahrul Ishak as chief executive officer effective Monday.</p></div><div class=newsTextDataWrapInner><p>Mohd Syahrul, a former executive of CIMB Bank, will take over the lead from Muhammed Uzman Muhammed Faleel, its chief risk officer who stepped up as interim chief executive officer following the resignation of Arsalaan Ahmed, Al Rajhi Malaysia said in a statement.</p></div><div class=newsTextDataWrapInner><p>“Al Rajhi Bank Malaysia has undergone a remarkable ",新闻,,https://assets.theedgemarkets.com/Al-rajhi-bank_20240513104556_theedgemalaysia.jpg,https://assets.theedgemarkets.com/Mohd Syahrul Ishak alrajhi bank Malaysia.jpg,52,TheEdge,http://www.theedgemarkets.com/categories/malaysia
Trading of securities in AME Elite suspended ahead of material announcement,https://www.klsescreener.com/v2/news/view/1323863,2024-05-13 10:51:19,2024-05-13 17:30:28,2024-05-13 10:41:38,"KUALA LUMPUR (May 13): Trading of securities in AME Elite Consortium Bhd (KL:AME) has been suspended on Monday, ahead of a material announcement.","<div class=newsTextDataWrapInner><p>KUALA LUMPUR (May 13): Trading of securities in AME Elite Consortium Bhd (KL:AME) has been suspended on Monday, ahead of a material announcement.&nbsp;</p></div><div class=newsTextDataWrapInner><p>“The board of directors of the company wishes to announce that Bursa Malaysia Securities has approved the company’s request for suspension in the trading of its securities from 9am to 5pm on Monday, May 13, 2024, pending the release of a material announcement,” according to its bourse filing.&nbsp;</p></div><div class=newsTextDataWrapInner><p>Shares of AME Elite we",新闻,,https://assets.theedgemarkets.com/AME-HQ-px-rcvd-Mon29052024-crop_20240513104109_ame-elite-consortium-bhd.jpg,https://assets.theedgemarkets.com/AME-HQ-px-rcvd-Mon29052024-crop_20240513104109_ame-elite-consortium-bhd.jpg,52,TheEdge,http://www.theedgemarkets.com/categories/malaysia
Tech giants start to treat South-East Asia like next big thing,https://www.klsescreener.com/v2/news/view/1323857,2024-05-13 10:44:23,2024-05-13 10:44:23,2024-05-13 10:35:00,"Long considered a tech hinterland, South-East Asia is fast emerging as a centre of gravity for the industry.","<div class=""inline-img""><div class=""story-image""><p class=""caption"">Malaysia’s Prime Minister Anwar Ibrahim (right) poses for a photo with Microsoft CEO Satya Nadella in Putrajaya, Malaysia, on May 2, 2024. The CEOs of Apple Inc, Microsoft Corp and Nvidia Corp are among the industry chieftains who’ve swung through the region in past months, committing billions of dollars in investment and holding forth with heads of state from Indonesia to Malaysia. — Prime Minister's Office of Malaysia via AP</p></div></div><div id=""story-body"" class=""story bot-15 relative""><p>Long considered a tech hinterlan",,,https://apicms.thestar.com.my/uploads/images/2024/05/13/2691671.jpg,https://apicms.thestar.com.my/uploads/images/2024/05/13/2691671.jpg,28,TheStar,http://www.thestar.com.my/news/latest/?tag=Business
"Foreign buying of local equities moderated to RM961m last week, says MIDF",https://www.klsescreener.com/v2/news/view/1323861,2024-05-13 10:51:18,2024-05-13 17:19:32,2024-05-13 10:33:35,"Foreign buying of Malaysian equities extended for the third consecutive week, albeit at a slight moderation of 9.3% to RM961.1 million last week from RM1.06 billion the prior week.","<div class=newsTextDataWrapInner><p>KUALA LUMPUR (May 13): Foreign buying of Malaysian equities extended for the third consecutive week, albeit at a slight moderation of 9.3% to RM961.1 million last week from RM1.06 billion the prior week.</p></div><div class=newsTextDataWrapInner><p>In its weekly fund flow report on Monday (May 13), MIDF Research noted that net buying activity was observed every trading day of last week, except for last Thursday (May 9). The trend of foreign investors as net buyers resumed last Friday, possibly influenced by Bank Negara Malaysia’s decision to keep the overnig",Edge,,https://assets.theedgemarkets.com/Fund-Flow-1_1812174521654987_20240513102054_theedgemalaysia.jpg,https://assets.theedgemarkets.com/Fund-Flow-1_1812174521654987_20240513102054_theedgemalaysia.jpg,52,TheEdge,http://www.theedgemarkets.com/categories/malaysia
Press Metal&#039;s 2024-2025 earnings forecasts raised by HLIB,https://www.klsescreener.com/v2/news/view/1323851,2024-05-13 10:31:12,2024-05-13 10:31:12,2024-05-13 10:26:29,KUALA LUMPUR: Hong Leong Investment Bank Bhd (HLIB) has raised its earnings forecast for Press Metal Aluminium Bhd by seven per cant and four per cent for financial years 2024 (FY24) and FY25 respectively on account of higher assumed aluminium spot ...,"<div itemprop=""articleBody"" class=""dable-content-wrapper""><p>KUALA LUMPUR: Hong Leong Investment Bank Bhd (HLIB) has raised its earnings forecast for Press Metal Aluminium Bhd by seven per cant and four per cent for financial years 2024 (FY24) and FY25 respectively on account of higher assumed aluminium spot price. </p><p>It also introduced FY26 forecasts at RM1.8 billion. </p><p>The firm upgraded the stock to a ""Buy"" rating with a higher target price of RM6 from RM4.65 previously. </p><p>IAlthough demand has been somewhat dragged by the property slump in China and muted demand in Europe, HLIB",Corporate,,https://assets.nst.com.my/images/articles/om13_NSTfield_image_listing_featured_v2.var_1715567186.jpg,https://assets.nst.com.my/images/articles/press_metal_1715567179.jpg,79,NST,https://www.nst.com.my/business/corporate
"Mi Technovations&#039; Q1 earnings surge is expected, full-year forecast cut",https://www.klsescreener.com/v2/news/view/1323849,2024-05-13 10:31:12,2024-05-13 10:31:12,2024-05-13 10:21:44,"KUALA LUMPUR: Mi Technovation Bhd&#039;s first quarter ended March 31, 2024 (1Q24) core earnings were in line with Public Investment Bank Bhd (PublicInvest) and consensus full-year expectations, making up 22.6 per cent and 23.4 per cent respectively.The company saw its 1Q24 core ...","<div itemprop=""articleBody"" class=""dable-content-wrapper""><p>KUALA LUMPUR: Mi Technovation Bhd&#039;s first quarter ended March 31, 2024 (1Q24) core earnings were in line with Public Investment Bank Bhd (PublicInvest) and consensus full-year expectations, making up 22.6 per cent and 23.4 per cent respectively.</p><p>The company saw its 1Q24 core earnings surge 117.5 per cent year-on-year (YoY) to RM17.4 million, excluding the impact of foreign exchange (FX) gain (RM10.5 million) and losses from minority interest in 90 per cent-owned Mi Equipment Korea (RM0.4 million).</p><p>""Losses from the Ko",Corporate,,https://assets.nst.com.my/images/articles/mi13_NSTfield_image_listing_featured_v2.var_1715566901.jpg,https://assets.nst.com.my/images/articles/mitech_1715566894.jpg,79,NST,https://www.nst.com.my/business/corporate
Ringgit easier vs US$ amid expectations of tight US monetary policy,https://www.klsescreener.com/v2/news/view/1323845,2024-05-13 10:22:23,2024-05-13 10:22:23,2024-05-13 10:10:00,"KUALA LUMPUR: The ringgit opened lower against the US dollar today due to expectations that the United States (US) Federal Reserve (Fed) will maintain its tight monetary policy stance, thus supporting the dollar, said Bank Muamalat Malaysia Bhd chief economist Dr Mohd Afzanizam Abdul Rashid. ","<div class=""inline-img""><div class=""story-image""></div></div><div id=""story-body"" class=""story bot-15 relative""><p>KUALA LUMPUR: The ringgit opened lower against the US dollar today due to expectations that the United States (US) Federal Reserve (Fed) will maintain its tight monetary policy stance, thus supporting the dollar, said Bank Muamalat Malaysia Bhd chief economist Dr Mohd Afzanizam Abdul Rashid.</p><p>At 9.01 am, the ringgit declined to 4.7420/7465 versus the greenback from last Friday’s close of 4.7385/7410.</p><p>Mohd Afzanizam said this week, market players would focus on the US in",,,https://apicms.thestar.com.my/uploads/images/2024/05/13/2691666.jpg,https://apicms.thestar.com.my/uploads/images/2024/05/13/2691666.jpg,28,TheStar,http://www.thestar.com.my/news/latest/?tag=Business
"Sunway will be eligible for inclusion as KLCI component stock at AMMB's expense, says RHB IB",https://www.klsescreener.com/v2/news/view/1323841,2024-05-13 10:19:20,2024-05-13 17:02:43,2024-05-13 10:06:18,"RHB Investment Bank (RHB IB) Research said that based on the latest market capitalisation rankings of eligible stocks, Sunway Bhd (KL:SUNWAY) is ranked at 24 and will be eligible for inclusion into the list of component stocks of the FBM KLCI if the ranking remains at the cut-off date.","<div class=newsTextDataWrapInner><p>KUALA LUMPUR (May 13): RHB Investment Bank (RHB IB) Research said that based on the latest market capitalisation rankings of eligible stocks, Sunway Bhd (KL:SUNWAY) is ranked at 24 and will be eligible for inclusion into the list of component stocks of the FBM KLCI if the ranking remains at the cut-off date.</p></div><div class=newsTextDataWrapInner><p>In a strategy note on Monday, the research house said this will be at the expense of AMMB Holdings Bhd (KL:AMBANK) — the lowest ranked composite index stock in terms of market cap.</p></div><div class=newsText",新闻,,https://assets.theedgemarkets.com/Sunway-2_20240513095633_sunway.com_.my_.jpg,https://assets.theedgemarkets.com/Sunway-2_20240513095633_sunway.com_.my_.jpg,52,TheEdge,http://www.theedgemarkets.com/categories/malaysia
Foreign buying of Malaysian stocks moderates to RM961.1mil net,https://www.klsescreener.com/v2/news/view/1323839,2024-05-13 10:11:22,2024-05-13 10:11:22,2024-05-13 10:02:00,"KUALA LUMPUR: The inflow of foreign funds into Bursa Malaysia continued with a net sum of RM961.1mil, which was slightly lower than RM1.06bil registered in the previous week.","<div class=""inline-img""><div class=""story-image""></div></div><div id=""story-body"" class=""story bot-15 relative""><p>KUALA LUMPUR: The inflow of foreign funds into Bursa Malaysia continued with a net sum of RM961.1mil, which was slightly lower than RM1.06bil registered in the previous week.</p><p>The continued buying interest in local equities could be attributed to the increased risk appetite of investors for equities as they ramped up bets that the US Federal Reserve will begin cutting rates this year.</p><p>This is despite caution from US policymakers that interest rates may remain higher for",,,https://apicms.thestar.com.my/uploads/images/2024/05/13/2691655.jpg,https://apicms.thestar.com.my/uploads/images/2024/05/13/2691655.jpg,28,TheStar,http://www.thestar.com.my/news/latest/?tag=Business
"Anwar to meet captains of industries, state leaders in Doha",https://www.klsescreener.com/v2/news/view/1323835,2024-05-13 10:06:35,2024-05-14 00:04:30,2024-05-13 09:54:59,Prime Minister Datuk Seri Anwar Ibrahim is kicking off his latest mission to woo new investments from West Asia with his first official visit to the capital city of Qatar.,"<div class=newsTextDataWrapInner><p>DOHA (May 13): Prime Minister Datuk Seri Anwar Ibrahim is kicking off his latest mission to woo new investments from West Asia with his first official visit to the capital city of Qatar.</p></div>

<div class=newsTextDataWrapInner><p>A busy schedule awaits him on Monday, starting with an official welcoming ceremony at about 10.30am Qatar time (3.30pm Malaysia time) by the Qatari government at the Amiri Diwan here.</p></div>

<div class=newsTextDataWrapInner><p>He will be received by Qatari Amir Sheikh Tamim bin Hamad Al Thani, who will later host a lunch",,,https://assets.theedgemarkets.com/FW1386060_QAT01_12052024_PM-lpr_20240513095358_bernama.jpg,https://assets.theedgemarkets.com/FW1386060_QAT01_12052024_PM-lpr_20240513095358_bernama.jpg,52,TheEdge,http://www.theedgemarkets.com/categories/malaysia
Ringgit easier vs US dollar amid expectations of tight US monetary policy ,https://www.klsescreener.com/v2/news/view/1323823,2024-05-13 10:00:38,2024-05-13 10:00:38,2024-05-13 09:53:57,"KUALA LUMPUR: The ringgit opened lower against the US dollar today due to expectations that the United States (US) Federal Reserve (Fed) will maintain its tight monetary policy stance, thus supporting the dollar, said Bank Muamalat Malaysia Bhd chief economist ...","<div itemprop=""articleBody"" class=""dable-content-wrapper""><p>KUALA LUMPUR: The ringgit opened lower against the US dollar today due to expectations that the United States (US) Federal Reserve (Fed) will maintain its tight monetary policy stance, thus supporting the dollar, said Bank Muamalat Malaysia Bhd chief economist Dr Mohd Afzanizam Abdul Rashid. </p><p>At 9.01 am, the ringgit declined to 4.7420/7465 versus the greenback from last Friday&#039;s close of 4.7385/7410.</p><p>Mohd Afzanizam said this week, market players would focus on the US inflation data with the Producer Price Index and t",Economy,,https://assets.nst.com.my/images/articles/ri13_NSTfield_image_listing_featured_v2.var_1715565234.jpg,https://assets.nst.com.my/images/articles/ringgitflags_1715565227.jpg,81,NST,https://www.nst.com.my/business/economy
"Frankly Speaking: More details of these 14 contracts, please",https://www.klsescreener.com/v2/news/view/1323827,2024-05-13 10:02:25,2024-05-14 14:48:29,2024-05-13 09:53:06,"On May 8, the Ministry of Home Affairs (KDN) inked 14 contracts worth RM2.156 billion with local companies in conjunction with the Defence Services Asia (DSA) Exhibition & Conference 2024 and National Security (NATSEC) Asia 2024. The contracts signed include those for information technology, logistics as well as asset upgrade, Home Minister Datuk Seri Saifuddin Nasution Ismail reportedly said.","<div class=newsTextDataWrapInner><p><span style=""font-style: italics;"">This article first appeared in The Edge Malaysia Weekly on May 13, 2024 - May 19, 2024</span></p></div><div class=newsTextDataWrapInner><p>On May 8, the Ministry of Home Affairs (KDN) inked 14 contracts worth RM2.156 billion with local companies in conjunction with the Defence Services Asia (DSA) Exhibition &amp; Conference 2024 and National Security (NATSEC) Asia 2024. The contracts signed include those for information technology, logistics as well as asset upgrade, Home Minister Datuk Seri Saifuddin Nasution Ismail report",Edge,,https://assets.theedgemarkets.com/TEM1523-1_FS-2_20240513095241_theedgemalaysia.jpg,https://assets.theedgemarkets.com/TEM1523-1_FS-2_20240513095241_theedgemalaysia.jpg,54,TheEdge,http://www.theedgemarkets.com/options/edge
