title,url,created_at,updated_at,published_date,summary,content,category,author,thumbnail_url,image_url,publisher_id,publisher_name,publisher_url
Malaysia seeks UAE’s expertise to boost cooperation in AI,https://www.klsescreener.com/v2/news/view/1277179,2024-02-14 11:20:46,2024-02-14 18:34:16,2024-02-14 11:10:38,Malaysian ambassador to the United Arab Emirates (UAE) Datuk Seri Ahmad Fadil Shamsuddin expressed Malaysia’s interest in learning from the UAE's advanced artificial intelligence (AI) capabilities.,"<div class=newsTextDataWrapInner><p>DUBAI (Feb 14): Malaysian ambassador to the United Arab Emirates (UAE) Datuk Seri Ahmad Fadil Shamsuddin expressed Malaysia’s interest in learning from the UAE's advanced artificial intelligence (AI) capabilities.</p></div>

<div class=newsTextDataWrapInner><p>The envoy said the potential to collaborate for mutual benefits could be further established and strengthened. Ahmad Fadil was speaking to Bernama on the sidelines of the World Government Summit (WGS 2024) held here on Tuesday.</p></div>

<div class=newsTextDataWrapInner><p>Citing the global gather",Edge,,https://assets.theedgemarkets.com/Datuk Seri Ahmad Fadil Shamsuddin-UAE-AI_20240214110437_bernama.jpg,https://assets.theedgemarkets.com/Datuk Seri Ahmad Fadil Shamsuddin-UAE-AI_20240214110437_bernama.jpg,52,TheEdge,http://www.theedgemarkets.com/categories/malaysia
"FIMM reprimands and bars 12 former unit trust, private retirement scheme consultants for rule violations",https://www.klsescreener.com/v2/news/view/1277173,2024-02-14 11:10:07,2024-02-14 11:10:07,2024-02-14 11:02:30,"KUALA LUMPUR: The Federation of Investment Managers Malaysia (FIMM) has reprimanded and barred 12 former Unit Trust Schemes (UTS) and Private Retirement Schemes (PRS) consultants for violating FIMM&#039;s rules and codes of ethics.According to FIMM, eight former consultants of ...","<div itemprop=""articleBody"" class=""dable-content-wrapper""><p>KUALA LUMPUR: The Federation of Investment Managers Malaysia (FIMM) has reprimanded and barred 12 former Unit Trust Schemes (UTS) and Private Retirement Schemes (PRS) consultants for violating FIMM&#039;s rules and codes of ethics.</p><p>According to FIMM, eight former consultants of UTS and PRS were discovered to have submitted false academic certificates during their registration process as consultants to three companies financial institutions namely Kenanga Investors Bhd, Malayan Banking Bhd and Eastsprings Investment Bhd.</p><p>T",Corporate,,https://assets.nst.com.my/images/articles/ft14_NSTfield_image_listing_featured_v2.var_1707879747.jpg,https://assets.nst.com.my/images/articles/fimm_1707879740.jpg,79,NST,https://www.nst.com.my/business/corporate
"Malaysia’s palm oil stocks to dip below 2 mil tonnes next month and push prices up, analysts say",https://www.klsescreener.com/v2/news/view/1277177,2024-02-14 11:20:45,2024-02-14 18:34:14,2024-02-14 10:56:41,"The expected decrease in palm oil production in the upcoming months, coupled with a surge in demand from the export market, has the potential to push Malaysian palm oil stocks below the two million-tonne mark by next month, which could contribute to an upswing in crude palm oil (CPO) prices.","<div class=newsTextDataWrapInner><p>KUALA LUMPUR (Feb 14): The expected decrease in palm oil production in the upcoming months, coupled with a surge in demand from the export market, has the potential to push Malaysian palm oil stocks below the two million-tonne mark by next month, which could contribute to an upswing in crude palm oil (CPO) prices.</p></div>

<div class=newsTextDataWrapInner><p>According to data from the Malaysian Palm Oil Board, Malaysia's palm oil stocks for January reached a six-month low of 2.02 million tonnes, which is below the market's estimated 2.09 million tonnes, ",Edge,,https://assets.theedgemarkets.com/Plantations-sawit-oil.JPG,https://assets.theedgemarkets.com/Plantations-sawit-oil.jpg,52,TheEdge,http://www.theedgemarkets.com/categories/malaysia
Casino Operator MGM beats fourth-quarter estimates on China travel rebound,https://www.klsescreener.com/v2/news/view/1277169,2024-02-14 11:00:28,2024-02-14 11:00:28,2024-02-14 10:41:35,"MGM Resorts International beat market expectations for fourth-quarter on Tuesday, as its China business benefited from the removal of certain pandemic-related restrictions in gambling hub Macau.Travel rebound in China and Macau has been a tailwind for casino operators such ...","<div itemprop=""articleBody"" class=""dable-content-wrapper""><p>MGM Resorts International beat market expectations for fourth-quarter on Tuesday, as its China business benefited from the removal of certain pandemic-related restrictions in gambling hub Macau.</p><p>Travel rebound in China and Macau has been a tailwind for casino operators such as MGM and Wynn Resorts.</p><p>""Premium positioning and offerings in Las Vegas enable us to capture incremental profit during major events such as the inaugural Formula 1 race and our first Super Bowl,"" chief executive officer Bill Hornbuckle said in a state",Corporate,,https://assets.nst.com.my/images/articles/CHIN14_NSTfield_image_listing_featured_v2.var_1707878492.jpg,https://assets.nst.com.my/images/articles/macau_1707878483.jpg,79,NST,https://www.nst.com.my/business/corporate
Australian office owner Dexus reports half-year loss as property slide continues,https://www.klsescreener.com/v2/news/view/1277171,2024-02-14 11:00:53,2024-02-14 11:00:53,2024-02-14 10:39:53,"Australian property firm Dexus reported its second-steepest half-year loss since 2008 as higher rates slashed roughly A$600 million (US$387.24 million) off its large portfolio of office towers, although its chief executive officer (CEO) said the worst could soon be over.The ...","<div itemprop=""articleBody"" class=""dable-content-wrapper""><p>Australian property firm Dexus reported its second-steepest half-year loss since 2008 as higher rates slashed roughly A$600 million (US$387.24 million) off its large portfolio of office towers, although its chief executive officer (CEO) said the worst could soon be over.</p><p>The result on Wednesday from one of the country&#039;s largest landlords with an A$11 billion office portfolio comes six months after its first annual loss since 2009 and highlights how higher interest rates and the shift to home working continue to weigh on of",Property,,https://assets.nst.com.my/images/articles/AUS144_NSTfield_image_listing_featured_v2.var_1707878391.jpg,https://assets.nst.com.my/images/articles/AUSTRALIA-PROPERTY__1707878384.jpg,87,NST,https://www.nst.com.my/property
"Ringgit opens lower vs US dollar, stronger against other major currencies ",https://www.klsescreener.com/v2/news/view/1277163,2024-02-14 10:10:10,2024-02-14 10:10:10,2024-02-14 09:54:28,"KUALA LUMPUR: The ringgit continued to open lower against the US dollar today amid higher-than-expected US inflation data which suggested the Federal Reserve (Fed) might keep the interest rate steady at current level.At 9 am, the ringgit weakened to 4.7820/7880 against ...","<div itemprop=""articleBody"" class=""dable-content-wrapper""><p>KUALA LUMPUR: The ringgit continued to open lower against the US dollar today amid higher-than-expected US inflation data which suggested the Federal Reserve (Fed) might keep the interest rate steady at current level.</p><p>At 9 am, the ringgit weakened to 4.7820/7880 against the greenback compared to Tuesday&#039;s close of 4.7600/7665. </p><p>Bank Muamalat Malaysia Bhd chief economist Mohd Afzanizam Abdul Rashid said the latest development has boosted the US Dollar Index (DXY) by 0.68 per cent to 104.879 points.</p><p>The US Bureau",Economy,,https://assets.nst.com.my/images/articles/ri14_NSTfield_image_listing_featured_v2.var_1707875665.jpg,https://assets.nst.com.my/images/articles/2191898ringgit_1707875657.jpg,81,NST,https://www.nst.com.my/business/economy
Bursa Malaysia opens lower trailing US markets,https://www.klsescreener.com/v2/news/view/1277157,2024-02-14 09:50:41,2024-02-14 09:50:41,2024-02-14 09:44:21,"KUALA LUMPUR: Bursa Malaysia opened lower trailing Wall Street&#039;s tumble after higher than expected US inflation pushed back market expectations for US rate cuts.At 9.15am, FTSE Bursa Malaysia (FBM) KLCI was down 0.17 per cent or 2.63 points to 1,528.74 versus ...","<div itemprop=""articleBody"" class=""dable-content-wrapper""><p>KUALA LUMPUR: Bursa Malaysia opened lower trailing Wall Street&#039;s tumble after higher than expected US inflation pushed back market expectations for US rate cuts.</p><p>At 9.15am, FTSE Bursa Malaysia (FBM) KLCI was down 0.17 per cent or 2.63 points to 1,528.74 versus Tuesday&#039;s close of 1,531.37.</p><p>The benchmark index opened 0.2 per cent or 3.58 points lower at 1,527.79.</p><p>The broader market saw losers led gainers 266 to 126 while 263 counters remained unchanged.</p><p>Malacca Securities Sdn Bhd said the FBM KLCI has ",Corporate,,https://assets.nst.com.my/images/articles/op14_NSTfield_image_listing_featured_v2.var_1707875058.jpg,https://assets.nst.com.my/images/articles/p9s1_Bursa-Trading_TMRAMN-1024x674_1707875051.jpg,79,NST,https://www.nst.com.my/business/corporate
Bursa opens easier following Wall St sell-off,https://www.klsescreener.com/v2/news/view/1277153,2024-02-14 09:46:51,2024-02-14 18:00:40,2024-02-14 09:40:15,"Bursa Malaysia pared Tuesyday’s gains in early trade on Wednesday, mirroring the overnight performance on Wall Street, which tumbled in the wake of a US consumer inflation reading that exceeded expectations, and increased the uncertainty over early rate cuts.","<div class=newsTextDataWrapInner><p>KUALA LUMPUR (Feb 14): Bursa Malaysia pared Tuesyday’s gains in early trade on Wednesday, mirroring the overnight performance on Wall Street, which tumbled in the wake of a US consumer inflation reading that exceeded expectations, and increased the uncertainty over&nbsp;early rate cuts.</p></div>

<div class=newsTextDataWrapInner><p>At 9.05am, the FBM KLCI had declined 3.46 points to 1,527.91, from Tuesday's close at 1,531.37.</p></div>

<div class=newsTextDataWrapInner><p>The barometer index opened 3.58 points easier at 1,527.79.&nbsp;</p></div><div cla",Edge,,https://assets.theedgemarkets.com/opening-market-down_theedgemarkets_160.jpg,https://assets.theedgemarkets.com/opening-market-down_theedgemarkets_160.jpg,52,TheEdge,http://www.theedgemarkets.com/categories/malaysia
Ringgit opens higher against major currencies except US dollar,https://www.klsescreener.com/v2/news/view/1277151,2024-02-14 09:46:50,2024-02-14 18:32:22,2024-02-14 09:29:44,"The ringgit continued to open lower against the US dollar on Wednesday, amid a higher-than-expected US inflation report, which suggested that the US Federal Reserve might keep interest rates steady at current levels.","<div class=newsTextDataWrapInner><p>KUALA LUMPUR (Feb 14): The ringgit continued to open lower against the US dollar on Wednesday, amid a higher-than-expected US inflation report, which suggested that the US Federal Reserve&nbsp;might keep interest rates steady at current levels.</p></div>

<div class=newsTextDataWrapInner><p>At 9am, the ringgit had weakened to 4.7820/7880 against the greenback, compared with&nbsp;Tuesday's close at 4.7600/7665.&nbsp;</p></div>

<div class=newsTextDataWrapInner><p>Bank Muamalat Malaysia Bhd chief economist Mohd Afzanizam Abdul Rashid said the latest develo",新闻,,https://assets.theedgemarkets.com/RInggit-4_reuters_23112021_63.jpg,https://assets.theedgemarkets.com/RInggit-4_reuters_23112021_63.jpg,52,TheEdge,http://www.theedgemarkets.com/categories/malaysia
"Australia, NZ dlrs tumble as hot US inflation forces rate cut rethink",https://www.klsescreener.com/v2/news/view/1277149,2024-02-14 09:40:31,2024-02-14 09:40:31,2024-02-14 09:23:37,"SYDNEY: The Australian and New Zealand dollars took a beating on Wednesday and bonds were hammered after U.S. inflation surprised on the high side, upending market expectations for early interest rate cuts.The Aussie was stumbling at US$0.6453, the ...","<div itemprop=""articleBody"" class=""dable-content-wrapper""><p>SYDNEY: The Australian and New Zealand dollars took a beating on Wednesday and bonds were hammered after U.S. inflation surprised on the high side, upending market expectations for early interest rate cuts.</p><p>The Aussie was stumbling at US$0.6453, the lowest level in three months, having tumbled 1.2 per cent overnight to break key support at US$0.6469. It has found a tentative floor at US$0.6452, a level that if broken would open the door to November&#039;s low of US$0.6340 and October&#039;s trough of US$0.6271.</p><p>The kiwi d",Corporate,,https://assets.nst.com.my/images/articles/rc14_NSTfield_image_listing_featured_v2.var_1707873814.jpg,https://assets.nst.com.my/images/articles/AUSTRALIA-PROPERTY__1707873807.jpg,79,NST,https://www.nst.com.my/business/corporate
SC adds one potential clone entity to Investor Alert List,https://www.klsescreener.com/v2/news/view/1277147,2024-02-14 09:18:50,2024-02-14 17:49:13,2024-02-14 09:12:37,The Securities Commission Malaysia (SC) has updated its Investor Alert List.,"<div class=newsTextDataWrapInner><p>KUALA LUMPUR (Feb 14):&nbsp;The Securities Commission Malaysia (SC) has updated its Investor Alert List.</p></div><div class=newsTextDataWrapInner><p>In an alert on Tuesday, the commission said the following person/entity was added to the list:</p></div><ul><li>Potential clone entity — LFM Global</li></ul><div class=newsTextDataWrapInner><p>The Investor Alert List contains a list of unauthorised websites, investment products, companies and individuals, including:</p></div><div class=inPageAd id=div-gpt-ad-inpage></div><ul><li>Persons carrying on or holding t",Edge,,https://assets.theedgemarkets.com/Securities-Commission-Malaysia -1_20230814115301_theedgemalaysia_10.jpg,https://assets.theedgemarkets.com/Securities-Commission-Malaysia -1_20230814115301_theedgemalaysia_10.jpg,52,TheEdge,http://www.theedgemarkets.com/categories/malaysia
Palm oil stockpile expected to dip further in February  to below 2mil tonnes,https://www.klsescreener.com/v2/news/view/1277143,2024-02-14 09:10:09,2024-02-14 09:10:09,2024-02-14 09:02:19,KUALA LUMPUR: Palm oil stockpile is expected to dip below two million tonnes in February as palm oil production is likely to decline further following a downtrend for the third consecutive month in January.Hong Leong Investment Bank (HLIB) research ...,"<div itemprop=""articleBody"" class=""dable-content-wrapper""><p>KUALA LUMPUR: Palm oil stockpile is expected to dip below two million tonnes in February as palm oil production is likely to decline further following a downtrend for the third consecutive month in January.</p><p>Hong Leong Investment Bank (HLIB) research said palm oil&#039;s stock levels dropped 11.8 per cent month-on-month to 2.02 million tonnes in January, as lower exports were more than offset by lower opening stocks, imports, and production. The stock level came in lower than Bloomberg&#039;s survey&#039;s estimate of 2.09 milli",Corporate,,https://assets.nst.com.my/images/articles/pof14_NSTfield_image_listing_featured_v2.var_1707872536.jpg,https://assets.nst.com.my/images/articles/04bt03palmoil_1707872529.jpg,79,NST,https://www.nst.com.my/business/corporate
"So, what do we know about this Wood Dragon year?",https://www.klsescreener.com/v2/news/view/1277145,2024-02-14 09:18:49,2024-02-14 17:49:10,2024-02-14 08:59:00,"There may be some trepidation among those who follow the Lunar calendar about the 2024 Wood Dragon year, as the entire 2024 does not have an actual Lap Chun — which marks the arrival of spring that heralds the start of the new year.","<div class=newsTextDataWrapInner><p>THERE may be some trepidation among those who follow the Lunar calendar about the 2024 Wood Dragon year, as the entire 2024 does not have an actual <em>Lap Chun</em> — which marks the arrival of spring that heralds the start of the new year.</p></div><div class=newsTextDataWrapInner><p>This is because <em>Lap Chun</em> fell on Feb 4 at 4.37pm, earlier than the actual first day of the 2024 Lunar New Year on Feb 10. The next one comes on Feb 3, 2025, a few days after the start of the 2025 Lunar New Year on Jan 29. This absence of <em>Lap Chun</em> throughout t",Edge,,https://assets.theedgemarkets.com/20240213_PLA_CNY_TEMPLE_DRAGON DANCE_4_LYY_20240214083057_theedgemalaysia.jpg,https://assets.theedgemarkets.com/20240213_PLA_CNY_TEMPLE_DRAGON DANCE_4_LYY_20240214083057_theedgemalaysia.jpg,52,TheEdge,http://www.theedgemarkets.com/categories/malaysia
RHB Bank sues Ireka Corp for RM6.53 million loan repayment,https://www.klsescreener.com/v2/news/view/1277141,2024-02-14 09:10:08,2024-02-14 09:10:08,2024-02-14 08:55:16,KUALA LUMPUR: Ireka Corp Bhd (ICB) was served with a writ of summons and statement of claim by RHB Bank Bhd following its default in repayment to the bank.The bank is also claiming a total amount of RM6.53 million ...,"<div itemprop=""articleBody"" class=""dable-content-wrapper""><p>KUALA LUMPUR: Ireka Corp Bhd (ICB) was served with a writ of summons and statement of claim by RHB Bank Bhd following its default in repayment to the bank.</p><p>The bank is also claiming a total amount of RM6.53 million from ICB.</p><p>The bank had granted Ireka ENgineering &amp; Construction Sdn Bhd (IEC) a revolving credit facility on Jan 6, 2015 and April 18, 2017 that amounted to RM6.50 million with a corporate guarantee executed on Sep 12, 2000 as security for the repayment of the banking facility offer.</p><p>Both parties ente",Corporate,,https://assets.nst.com.my/images/articles/ire14_NSTfield_image_listing_featured_v2.var_1707872113.jpg,https://assets.nst.com.my/images/articles/rhbben_1707872103.jpg,79,NST,https://www.nst.com.my/business/corporate
Introducing the 2024 tech trends to watch,https://www.klsescreener.com/v2/news/view/1277137,2024-02-14 08:40:20,2024-02-14 08:40:20,2024-02-14 08:24:10,"Just recently, the rapid onset of AI and GenAI has enacted truly seismic change, with the potential to transform how we live and work for good. For business owners and entrepreneurs, the ubiquity of emergent technology means there&#039;s a ...","<div itemprop=""articleBody"" class=""dable-content-wrapper""><p>Just recently, the rapid onset of AI and GenAI has enacted truly seismic change, with the potential to transform how we live and work for good. For business owners and entrepreneurs, the ubiquity of emergent technology means there&#039;s a constant need for fast decision-making on the right course of action.</p><p>And it&#039;s not just businesses. We all experience some level of tech anxiety, personally or professionally, day-to-day. Even digital natives like Gen Z, who have grown up knowing nothing else, are driving trends that har",Feature,,https://assets.nst.com.my/images/articles/VIEW13_NSTfield_image_listing_featured_v2.var_1707870247.jpg,https://assets.nst.com.my/images/articles/AI_1707870241.jpg,85,NST,https://www.nst.com.my/business/insight
"Malaysian ringgit debt capital market to continue growing in 2024, says Fitch Ratings",https://www.klsescreener.com/v2/news/view/1277135,2024-02-14 08:31:57,2024-02-14 17:45:26,2024-02-14 08:23:12,"The Malaysian debt capital market (DCM) is well developed compared to its emerging-market peers and other core Islamic finance markets, with 2024 issuance set to rise due to issuers’ funding diversification and refinancing needs, according to Fitch Ratings.","<div class=newsTextDataWrapInner><p>KUALA LUMPUR (Feb 14): The Malaysian debt capital market (DCM) is well developed compared to its emerging-market peers and other core Islamic finance markets, with 2024 issuance set to rise due to issuers’ funding diversification and refinancing needs, according to Fitch Ratings.</p></div>

<div class=newsTextDataWrapInner><p>In a statement on Tuesday, the rating agency said sukuk and Malaysian ringgit debt will continue to dominate issuance.</p></div>

<div class=newsTextDataWrapInner><p>All Fitch-rated Malaysian sukuk are investment-grade and on a stab",新闻,,//images.weserv.nl/?url=https://assets.theedgemarkets.com/Ringgit_20240214090313_123rf.jpg&w=300,https://assets.theedgemarkets.com/Ringgit_20240214090313_123rf.jpg,52,TheEdge,http://www.theedgemarkets.com/categories/malaysia
Disprz keen to transform Malaysia&#039;s labour market,https://www.klsescreener.com/v2/news/view/1277129,2024-02-14 08:20:09,2024-02-14 08:20:09,2024-02-14 08:16:11,KUALA LUMPUR: India-based Disprz aims to transform Malaysia&#039;s labour market because it is confident in the skill-building and talent-development prospects the country offers.  It intends to achieve this by using AI algorithms to identify the precise abilities needed for ...,"<div itemprop=""articleBody"" class=""dable-content-wrapper""><p>KUALA LUMPUR: India-based Disprz aims to transform Malaysia&#039;s labour market because it is confident in the skill-building and talent-development prospects the country offers.</p><p>  It intends to achieve this by using AI algorithms to identify the precise abilities needed for every position inside an organisation.</p><p>  According to Subbu Viswanathan, co-founder and chief executive officer of Disprz, this would open the door for specialised training programs designed to equip staff to fulfill changing market expectations.</p>",Corporate,,https://assets.nst.com.my/images/articles/DIP13_NSTfield_image_listing_featured_v2.var_1707869768.jpg,https://assets.nst.com.my/images/articles/diDisprz_keen_to_transform_Malaysia%E2%80%99s_labour_market_1707869761.jpg,79,NST,https://www.nst.com.my/business/corporate
"YTL Corp, YTL power now in MSCI Malaysia index",https://www.klsescreener.com/v2/news/view/1277127,2024-02-14 08:20:09,2024-02-14 08:20:09,2024-02-14 08:12:45,"KUALA LUMPUR: YTL Corp Bhd and YTL Power International Bhd have made it to the MSCI Malaysia Index, while Dialog Group Bhd has been removed from the list, with effect from February 29.  According to Assoc Prof Dr Ahmed Razman Abdul ...","<div itemprop=""articleBody"" class=""dable-content-wrapper""><p>KUALA LUMPUR: YTL Corp Bhd and YTL Power International Bhd have made it to the MSCI Malaysia Index, while Dialog Group Bhd has been removed from the list, with effect from February 29.</p><p>  According to Assoc Prof Dr Ahmed Razman Abdul Latiff, an economic analyst at Putra Business School, the inclusion of YTL Corp and YTL Power in the index indicates that the utility sector would be given more weight or representation in the list.</p><p>  MSCI provided a list of the additions and deletions in a statement on Monday.</p><p>  The MSC",Corporate,,https://assets.nst.com.my/images/articles/YTL1333_NSTfield_image_listing_featured_v2.var_1707869560.jpg,https://assets.nst.com.my/images/articles/14FebBT2YTL_1707869554.jpg,79,NST,https://www.nst.com.my/business/corporate
Top Glove included in S&P Global Sustainability Yearbook 2024,https://www.klsescreener.com/v2/news/view/1277125,2024-02-14 08:16:44,2024-02-14 17:32:23,2024-02-14 08:12:38,"Top Glove Corp Bhd has been included in the S&P Global Sustainability Yearbook 2024 for the third year in a row.

In a statement on Wednesday, the glove maker said the inclusion underscores its commitment to sustainable practices and responsible corporate citizenship.","<div class=newsTextDataWrapInner><p>KUALA LUMPUR (Feb 14): Top Glove Corp&nbsp;Bhd has been included in the S&amp;P Global Sustainability Yearbook 2024 for the third year in a row.</p></div>

<div class=newsTextDataWrapInner><p>In a statement on Wednesday, the glove maker said the inclusion underscores its commitment to sustainable practices and responsible corporate citizenship.</p></div>

<div class=newsTextDataWrapInner><p>The S&amp;P Global Sustainability honour is accorded exclusively to companies within the top 15% of their respective industries, based on the number of achievements a",新闻,,//images.weserv.nl/?url=https://assets.theedgemarkets.com/Top-Glove-6_20240214084343_topglove.com_.jpg&w=300,https://assets.theedgemarkets.com/Top-Glove-6_20240214084343_topglove.com_.jpg,52,TheEdge,http://www.theedgemarkets.com/categories/malaysia
"Stocks fall, dollar and yields gain after hot US inflation data",https://www.klsescreener.com/v2/news/view/1277117,2024-02-14 08:10:15,2024-02-14 08:10:15,2024-02-14 08:09:55,"NEW YORK: Global stock market indexes dropped, the 10-year U.S. Treasury yield hit a 2-1/2-month high and the dollar touched a three-month peak against the yen on Tuesday after data showed U.S. inflation slowed less than expected ...","<div itemprop=""articleBody"" class=""dable-content-wrapper""><p>NEW YORK: Global stock market indexes dropped, the 10-year U.S. Treasury yield hit a 2-1/2-month high and the dollar touched a three-month peak against the yen on Tuesday after data showed U.S. inflation slowed less than expected in January.</p><p>The U.S. consumer price index report pushed back market expectations that any interest rate cuts by the Federal Reserve were imminent.</p><p>All three major U.S. stock indexes fell more than 1 per cent each, and the Dow Jones industrial average posted its biggest daily percentage drop in al",Corporate,,https://assets.nst.com.my/images/articles/glo14_NSTfield_image_listing_featured_v2.var_1707869392.jpg,https://assets.nst.com.my/images/articles/us_stocks_1707869386.jpg,79,NST,https://www.nst.com.my/business/corporate
