title,url,created_at,updated_at,published_date,summary,content,category,author,thumbnail_url,image_url,publisher_id,publisher_name,publisher_url
"MPOB says it developed 714 technologies for oil palm industry, 32.7% commercialised",https://www.klsescreener.com/v2/news/view/1277325,2024-02-14 16:31:59,2024-02-15 08:04:06,2024-02-14 16:18:48,"The Malaysian Palm Oil Board (MPOB) said it had successfully developed 714 technologies covering all sectors of the oil palm industry, including formulations of palm-based food and non-food products.","<div class=newsTextDataWrapInner><p>KUALA LUMPUR (Feb 14): The Malaysian Palm Oil Board (MPOB) said it had successfully developed 714 technologies covering all sectors of the oil palm industry, including formulations of palm-based food and non-food products.</p></div>

<div class=newsTextDataWrapInner><p>A total of 233 technologies, or 32.7% of these technologies, had been commercialised and adopted by local industries and entrepreneurs, said the MPOB in a statement following Plantation and Commodities Minister Datuk Seri Johari Abdul Ghani’s visit to the board’s research and development fac",,,https://assets.theedgemarkets.com/Malaysian-Palm-Oil-Board-MPOB_20230613112837_theedgemalaysia_2.jpg,https://assets.theedgemarkets.com/Malaysian-Palm-Oil-Board-MPOB_20230613112837_theedgemalaysia_2.jpg,52,TheEdge,http://www.theedgemarkets.com/categories/malaysia
The Edge Malaysia Property Management Virtual Talk 2024 : Building with aim of achieving sustainable property management,https://www.klsescreener.com/v2/news/view/1277315,2024-02-14 16:04:04,2024-02-18 09:19:43,2024-02-14 16:00:00,...,"<div class=newsTextDataWrapInner><p><span style=""font-style: italics;"">This article first appeared in City & Country, The Edge Malaysia Weekly on February 5, 2024 - February 11, 2024</span></p></div>
<div class=""mt-3 imgw-800 embed-left""><a class=""mobx embedimg-icon"" data-rel=""ceolightbox"" href=""//myassets.theedgemalaysia.com/pics/2024/CC6_VirtualTalk_logo_TEM1509_theedgemalaysia.jpg""><img alt="""" src=""//myassets.theedgemalaysia.com/pics/2024/CC6_VirtualTalk_logo_TEM1509_theedgemalaysia.jpg"" /></a></div>

<div class=newsTextDataWrapInner><p>Developers play a crucial role in ensuring that pro",Edge,,https://assets.theedgemarkets.com/CC6_VirtualTalk_TEM1509_20240202183115_theedgemalaysia.jpg,https://assets.theedgemarkets.com/CC6_VirtualTalk_TEM1509_20240202183115_theedgemalaysia.jpg,54,TheEdge,http://www.theedgemarkets.com/options/edge
Court: Daim charged with failure to declare assets; essentially asked to account for vast fortune,https://www.klsescreener.com/v2/news/view/1277313,2024-02-14 16:04:02,2024-02-18 08:46:12,2024-02-14 16:00:00,"HE cut a forlorn figure, bent over in his wheelchair, only partially sighted and looking frail and ill.

Many who saw Tun Daim Zainuddin in court last week said they were moved by the sight of the country’s once-powerful economic czar being hauled to court to essentially account for his ...","<div class=newsTextDataWrapInner><p><span style=""font-style: italics;"">This article first appeared in The Edge Malaysia Weekly on February 5, 2024 - February 11, 2024</span></p></div><div class=newsTextDataWrapInner><p>HE cut a forlorn figure, bent over in his wheelchair, only partially sighted and looking frail and ill.</p></div>

<div class=newsTextDataWrapInner><p>Many who saw Tun Daim Zainuddin in court last week said they were moved by the sight of the country’s once-powerful economic czar being hauled to court to essentially account for his vast fortune.</p></div><div class=inPageAd id",Edge,,https://assets.theedgemarkets.com/Court_TEM1509_20240206172814_theedgemalaysia.jpg,https://assets.theedgemarkets.com/Court_TEM1509_20240206172814_theedgemalaysia.jpg,54,TheEdge,http://www.theedgemarkets.com/options/edge
UMW shares to be delisted on Feb 19 as Sime Darby completes privatisation,https://www.klsescreener.com/v2/news/view/1277307,2024-02-14 15:33:59,2024-02-15 08:02:18,2024-02-14 15:14:53,"UMW Holdings Bhd will be delisted from Bursa Malaysia on Feb 19, 2024 to mark the completion of its privatisation by Sime Darby Bhd.

Shares of UMW were already suspended from trading by Bursa Malaysia on Feb 9, after the expiration of five trading days from the extended closing date of the takeover offer by Sime Darby.","<div class=newsTextDataWrapInner><p>KUALA LUMPUR (Feb 14): UMW Holdings Bhd will be delisted from Bursa Malaysia on Feb 19, 2024 to mark the completion of its privatisation by Sime Darby Bhd.</p></div>

<div class=newsTextDataWrapInner><p>Shares of UMW were already suspended from trading by Bursa Malaysia on Feb 9, after the expiration of five trading days from the extended closing date of the takeover offer by Sime Darby.</p></div>

<div class=newsTextDataWrapInner><p>Previously, Sime Darby extended the deadline for its RM5 per share offer by two weeks to Jan 31, allowing more time for sh",新闻,,https://assets.theedgemarkets.com/umw-1_20240214150312_theedgemalaysia.jpg,https://assets.theedgemarkets.com/umw-1_20240214150312_theedgemalaysia.jpg,52,TheEdge,http://www.theedgemarkets.com/categories/malaysia
MMHE swings into a net loss of RM484mil in FY2023 on cost provisions,https://www.klsescreener.com/v2/news/view/1277305,2024-02-14 15:32:25,2024-02-14 15:32:25,2024-02-14 15:14:11,"KUALA LUMPUR: Malaysia Marine and Heavy Engineering Holdings Bhd&#039;s (MMHE) has posted a net loss of RM484.19 million in the financial year ended Dec 31, 2023 as compared to a net profit of RM67.77 million in financial year 2022.Revenue however rose ...","<div itemprop=""articleBody"" class=""dable-content-wrapper""><p>KUALA LUMPUR: Malaysia Marine and Heavy Engineering Holdings Bhd&#039;s (MMHE) has posted a net loss of RM484.19 million in the financial year ended Dec 31, 2023 as compared to a net profit of RM67.77 million in financial year 2022.</p><p>Revenue however rose to RM3.31 billion from RM1.65 billion in the previous year.</p><p>In a filing to Bursa Malaysia Securities Bhd, MMHE said the year under review was impacted by additional cost provisions recognised for ongoing heavy engineering projects, while the weakening of the ringgit agains",Corporate,,https://assets.nst.com.my/images/articles/mhe14_NSTfield_image_listing_featured_v2.var_1707895131.jpg,https://assets.nst.com.my/images/articles/mmhe_1707894839.jpg,79,NST,https://www.nst.com.my/business/corporate
Jasmine Loo: Jho Low had blank PMO letterheads for his own use and said he had proof he was acting on Najib's wishes,https://www.klsescreener.com/v2/news/view/1277303,2024-02-14 15:16:59,2024-02-15 06:04:01,2024-02-14 15:01:14,"KUALA LUMPUR (Feb 14): Former 1Malaysia Development Bhd (1MDB) general counsel Jasmine Loo Ai Swan said she had questioned Low Taek Jho (more commonly known as Jho Low) when a portion of the 1MDB investment money had ended up in former prime minister Datuk Seri Najib Razak’s personal bank account. However, the fugitive assured her that the money was for Umno and that Najib knew about it.","<blockquote class=""blockquote"">“Jho Low told me that this money [was] for political purposes of Barisan Nasional and Umno... He also said if anything happened to him, he has proof to show that what he did was from the wishes of Najib himself.”</blockquote>

<div class=newsTextDataWrapInner><p>KUALA LUMPUR (Feb 14): Former 1Malaysia Development Bhd (1MDB) general counsel Jasmine Loo Ai Swan said she had questioned Low Taek Jho when a portion of the 1MDB investment money ended up in former prime minister Datuk Seri Najib Razak’s personal bank account. However, the fugitive assured her that the",新闻,,https://assets.theedgemarkets.com/20240214_PEO_NAJIB RAZAK KL COURT_ZHD-750_20240214142544_theedgemalaysia.jpg,https://assets.theedgemarkets.com/20240214_PEO_NAJIB RAZAK KL COURT_ZHD-750_20240214142544_theedgemalaysia.jpg,52,TheEdge,http://www.theedgemarkets.com/categories/malaysia
Johari Ghani: Private sector should be involved in commercialisation of MPOB-developed palm oil tech,https://www.klsescreener.com/v2/news/view/1277299,2024-02-14 15:10:09,2024-02-14 15:10:09,2024-02-14 15:01:05,"KUALA LUMPUR: Plantation and Commodities Minister Datuk Seri Johari Abdul Ghani said the private sector should be involved in the commercialisation of palm oil technologies developed by the Malaysian Palm Oil Board (MPOB), especially in refining them, so that the ...","<div itemprop=""articleBody"" class=""dable-content-wrapper""><p>KUALA LUMPUR: Plantation and Commodities Minister Datuk Seri Johari Abdul Ghani said the private sector should be involved in the commercialisation of palm oil technologies developed by the Malaysian Palm Oil Board (MPOB), especially in refining them, so that the technologies can be used by the industry.</p><p>In a statement today, MPOB said it has successfully developed 714 technologies covering all sectors in the oil palm industry, including formulation of palm-based food and non-food products.</p><p>A total of 233 technologies or ",Corporate,,https://assets.nst.com.my/images/articles/mpob14_NSTfield_image_listing_featured_v2.var_1707894161.jpg,https://assets.nst.com.my/images/articles/jo_1707894055.jpg,79,NST,https://www.nst.com.my/business/corporate
Edunation: The powers that be!,https://www.klsescreener.com/v2/news/view/1277297,2024-02-14 15:05:59,2024-02-17 15:03:13,2024-02-14 15:00:00,"In October 2011, the Ministry of Education (MOE) launched a comprehensive review of the education system to develop a national education blueprint. The decision was made in the context of raising international education standards and to better prepare Malaysian children for the needs of the 21st century. The increased expectations of the public and parents on our education policy has certainly played a part in this education spring. The Malaysia Education Blueprint 2013-2025 (MEB) was developed with input from education experts and stakeholders following many townhall, roundtable and lab sessions where their opinions were obtained. The target was set, in that in 13 years, the country would achieve this intended path. With only one year left of the MEB’s timespan, how much have we really achieved?","<div class=newsTextDataWrapInner><p><span style=""font-style: italics;"">This article first appeared in Forum, The Edge Malaysia Weekly on February 12, 2024 - February 18, 2024</span></p></div><div class=newsTextDataWrapInner><p>In October 2011, the Ministry of Education (MOE) launched a comprehensive review of the education system to develop a national education blueprint. The decision was made in the context of raising international education standards and to better prepare Malaysian children for the needs of the 21st century. The increased expectations of the public and parents on our educati",Edge,,https://assets.theedgemarkets.com/forum-4_tem1510_thumb_20240213122513_theedgemalaysia.jpg,https://assets.theedgemarkets.com/forum-4_tem1510_thumb_20240213122513_theedgemalaysia.jpg,54,TheEdge,http://www.theedgemarkets.com/options/edge
Favourable supply and demand dynamics buffer petrochemical market amid excess capacity,https://www.klsescreener.com/v2/news/view/1277295,2024-02-14 15:05:58,2024-02-17 14:49:47,2024-02-14 15:00:00,"PETROCHEMICAL production in the US and China has seen a rapid rise, causing concerns that the excess capacity will exert more pressure on the industry players, which have been experiencing compressed margins and high operating costs.

Shawn Park, director at S&P Global Ratings, says ...","<div class=newsTextDataWrapInner><p><span style=""font-style: italics;"">This article first appeared in The Edge Malaysia Weekly on February 5, 2024 - February 11, 2024</span></p></div><div class=newsTextDataWrapInner><p>PETROCHEMICAL production in the US and China has seen a rapid rise, causing concerns that the excess capacity will exert more pressure on the industry players, which have been experiencing compressed margins and high operating costs.</p></div>

<div class=newsTextDataWrapInner><p>Shawn Park, director at S&amp;P Global Ratings, says petrochemical production usually surges in th",Edge,,https://assets.theedgemarkets.com/PetChem.jpg,https://assets.theedgemarkets.com/PetChem.jpg,54,TheEdge,http://www.theedgemarkets.com/options/edge
"AmInvestment stays 'overweight' on M'sian aviation, expects recovery to continue in 2024",https://www.klsescreener.com/v2/news/view/1277293,2024-02-14 15:04:05,2024-02-14 19:34:32,2024-02-14 14:56:23,"AmInvestment Bank Bhd expects the Malaysian aviation sector to sustain its recovery momentum throughout 2024, with foreign tourist arrivals surpassing pre-pandemic levels.","<div class=newsTextDataWrapInner><p>KUALA LUMPUR (Feb 14): AmInvestment Bank Bhd expects the Malaysian aviation sector to sustain its recovery momentum throughout 2024, with foreign tourist arrivals surpassing pre-pandemic levels.</p></div>

<div class=newsTextDataWrapInner><p>The bank said&nbsp;this projection is bolstered by “stronger&nbsp;government policy support, the ramping up&nbsp;of international air travel capacity, and firm&nbsp;demand from niche&nbsp;subsectors&nbsp;like medical tourism”.</p></div>

<div class=newsTextDataWrapInner><p>“Despite the less-than-ideal pace of recover",Edge,,https://assets.theedgemarkets.com/20210730_TRA_PHOTOS OF AEROPLANES 2_SY aviation airline airport travel tourism Mohd Suhaimi Mohamed Yusuf_20230612134228_theedgemalaysia_6.jpg,https://assets.theedgemarkets.com/20210730_TRA_PHOTOS OF AEROPLANES 2_SY aviation airline airport travel tourism Mohd Suhaimi Mohamed Yusuf_20230612134228_theedgemalaysia_6.jpg,52,TheEdge,http://www.theedgemarkets.com/categories/malaysia
MHB closes FY2023 in the red as 4Q net profit tumbles 77%,https://www.klsescreener.com/v2/news/view/1277291,2024-02-14 15:04:04,2024-02-14 23:19:08,2024-02-14 14:53:25,"Malaysia Marine and Heavy Engineering Holdings Bhd (MHB) incurred a net loss RM484.18 million for the year ended Dec 31, 2023 (FY2023), contrasting sharply with the RM67.77 million net profit recorded a year earlier, due additional cost provisions recognised for ongoing heavy engineering projects and the adverse impact of the weakening ringgit against the US dollar on the hedging of receivables for a heavy engineering project.","<div class=newsTextDataWrapInner><p>KUALA LUMPUR (Feb 14): Malaysia Marine and Heavy Engineering Holdings Bhd (MHB) incurred a net loss RM484.18 million for the year ended Dec 31, 2023 (FY2023), contrasting sharply with the RM67.77 million net profit recorded a year earlier, due additional cost provisions recognised for ongoing heavy engineering projects and the adverse impact of the weakening ringgit against the US dollar on the hedging of receivables for a heavy engineering project.</p></div>

<div class=newsTextDataWrapInner><p>This was despite its full-year revenue recording a two-fold s",新闻,,https://assets.theedgemarkets.com/Malaysia-Marine-and-Heavy-Engineering-Holdings-MMHE_MHB_20240214144012_mhb.com_.my_.jpg,https://assets.theedgemarkets.com/mhb-logo_2.jpg,52,TheEdge,http://www.theedgemarkets.com/categories/malaysia
Outcome of civil service salary review to be announced in Budget 2025,https://www.klsescreener.com/v2/news/view/1277289,2024-02-14 15:04:03,2024-02-14 22:04:16,2024-02-14 14:47:52,"The decision on the improvement in the civil service salary structure system is expected to be announced during the tabling of Budget 2025 later this year, said the Public Service Department (PSD).","<div class=newsTextDataWrapInner><p>KUALA LUMPUR (Feb 14): The decision&nbsp;on the improvement in the civil service salary structure system is expected to be announced during the tabling&nbsp;of&nbsp;Budget 2025 later this year, said the Public Service Department (PSD).</p></div><div class=newsTextDataWrapInner><p>It said that the proposed improvement would be finalised and presented to the Cabinet for approval at the beginning of the second quarter of this year at the latest.&nbsp;</p></div><div class=newsTextDataWrapInner><p>""Civil servants can still submit proposals to improve the existing",Edge,,https://assets.theedgemarkets.com/20231005_PLA_PUTRAJAYA VIEW HAZE_SB_4_20231005160949_theedgemalaysia_2.jpg,https://assets.theedgemarkets.com/20231005_PLA_PUTRAJAYA VIEW HAZE_SB_4_20231005160949_theedgemalaysia_2.jpg,52,TheEdge,http://www.theedgemarkets.com/categories/malaysia
"S'wak needs to manage politics properly, Affin Bank stake negotiations to conclude in two months, says Abang Johari",https://www.klsescreener.com/v2/news/view/1277281,2024-02-14 14:46:54,2024-02-14 21:49:09,2024-02-14 14:32:37,"Sarawak needs to manage politics properly to ensure continuous stability that will allow it to achieve a brighter future.

Premier Tan Sri Abang Johari Tun Openg indicated that with all the development that the state government had carried out, such as in renewable energy, there is a very bright future for the region.","<div class=newsTextDataWrapInner><p>SIBU (Feb 14): Sarawak needs to manage politics properly to ensure continuous stability that will allow it to achieve a brighter future.</p></div><div class=newsTextDataWrapInner><p>Premier Tan Sri Abang Johari Tun Openg indicated that with all the development that the state government had carried out, such as in renewable energy, there is a very bright future for the region.</p></div><div class=newsTextDataWrapInner><p>“Some say that Sarawak is the lynchpin in Malaysia, that we decide what happens in the country.</p></div><div class=inPageAd id=div-gpt-ad-i",新闻,,https://assets.theedgemarkets.com/Abang JOhari_20231205180430_bernama_6.jpg,https://assets.theedgemarkets.com/Abang JOhari_20231205180430_bernama_6.jpg,52,TheEdge,http://www.theedgemarkets.com/categories/malaysia
High Court quashes trafficking charge faced by couple,https://www.klsescreener.com/v2/news/view/1277279,2024-02-14 14:46:53,2024-02-14 21:45:26,2024-02-14 14:28:27,The High Court on Wednesday quashed a human trafficking charge faced by a couple as the court found it to be in violation of Article 7 of the Federal Constitution and Section 153 of the Criminal Procedure Code (CPC) regarding particulars of the offence.,"<div class=newsTextDataWrapInner><p>KUALA LUMPUR (Feb 14): The High Court on Wednesday quashed a human trafficking charge faced by a couple as the court found it to be in violation of Article 7 of the Federal Constitution and Section 153 of the Criminal Procedure Code (CPC) regarding particulars of the offence.</p></div><div class=newsTextDataWrapInner><p>Judge Datuk Noorin Badaruddin also ruled that the charge faced by Michael P Arthur Edward Chelliah and Alice Prethima Michael ought to have been quashed, as it amounted to a duplicity.</p></div><div class=newsTextDataWrapInner><p>Michael, 65,",Edge,,https://assets.theedgemarkets.com/gavel7864_20240214141818_reuters.jpg,https://assets.theedgemarkets.com/gavel7864_20240214141818_reuters.jpg,52,TheEdge,http://www.theedgemarkets.com/categories/malaysia
Court: Daim’s non-disclosed private companies intrigue,https://www.klsescreener.com/v2/news/view/1277257,2024-02-14 14:18:36,2024-02-17 11:18:00,2024-02-14 14:10:00,"FOR a person whose name doesn’t surface as a shareholder, the list of 14 privately held companies listed on Tun Daim Zainuddin’s charge sheet has been nothing short of intriguing.

The former finance minister, whom some would describe as a crafty businessman, has been charged with not de...","<div class=newsTextDataWrapInner><p><span style=""font-style: italics;"">This article first appeared in The Edge Malaysia Weekly on February 5, 2024 - February 11, 2024</span></p></div><div class=newsTextDataWrapInner><p>FOR a person whose name doesn’t surface as a shareholder, the list of 14 privately held companies listed on Tun Daim Zainuddin’s charge sheet has been nothing short of intriguing.</p></div>

<div class=newsTextDataWrapInner><p>The former finance minister, whom some would describe as a crafty businessman, has been charged with not declaring a substantial number of assets to the",Edge,,https://assets.theedgemarkets.com/Court2_TEM1509_20240207170112_theedgemalaysia.jpg,https://assets.theedgemarkets.com/Court2_TEM1509_20240207170112_theedgemalaysia.jpg,54,TheEdge,http://www.theedgemarkets.com/options/edge
IHH’s Indian subsidiary withdraws plan for IPO,https://www.klsescreener.com/v2/news/view/1277255,2024-02-14 14:16:49,2024-02-14 20:34:23,2024-02-14 14:05:45,"IHH Healthcare Bhd said Agilus Diagnostic Ltd, a subsidiary of its 31.17%-owned associate Fortis Healthcare Ltd, has decided to withdraw its initial public offer (IPO) application to the Securities and Exchange Board of India (Sebi).","<div class=newsTextDataWrapInner><p>KUALA LUMPUR (Feb 14): IHH Healthcare Bhd said Agilus Diagnostic Ltd, a subsidiary of its 31.17%-owned associate Fortis Healthcare Ltd, has decided to withdraw its initial public offer (IPO) application to the Securities and Exchange Board of India (Sebi).</p></div><div class=newsTextDataWrapInner><p>In a filing to Bursa Malaysia on Wednesday, IHH said the withdrawal was due to ""commercial considerations and in consultation and mutual agreement"" with Agilus’s private equity investors and selling shareholders, namely International Finance Corp, NYLIM Jacob Ba",,,https://assets.theedgemarkets.com/Fortis_20240214135806_reuters.jpg,https://assets.theedgemarkets.com/Fortis_20240214135806_reuters.jpg,52,TheEdge,http://www.theedgemarkets.com/categories/malaysia
MKH positions itself to tap growth opportunities from Nusantara development via plantation listing,https://www.klsescreener.com/v2/news/view/1277251,2024-02-14 14:03:48,2024-02-16 15:48:24,2024-02-14 14:00:00,"IN a few months, MKH Bhd will float the plantation assets under its wholly-owned MKH Oil Palm (East Kalimantan) Bhd ­(MKHOP) on Bursa Malaysia’s Main Market, in a move to tap growth opportunities near the new Indonesian capital Nusantara. The group’s existing (held via wholly-owned subsidary PT M...","<div class=newsTextDataWrapInner><p><span style=""font-style: italics;"">This article first appeared in The Edge Malaysia Weekly on February 5, 2024 - February 11, 2024</span></p></div><div class=newsTextDataWrapInner><p>IN a few months, MKH Bhd will float the plantation assets under its wholly-owned MKH Oil Palm (East Kalimantan) Bhd ­(MKHOP) on Bursa Malaysia’s Main Market, in a move to tap growth opportunities near the new Indonesian capital Nusantara. The group’s existing (held via wholly-owned subsidary PT MKH and PT SPS) and prospective plantation assets are located in Muara Kaman in East ",Edge,,https://assets.theedgemarkets.com/MKH_TEM1509_20240206164419_theedgemalaysia.jpg,https://assets.theedgemarkets.com/MKH_TEM1509_20240206164419_theedgemalaysia.jpg,54,TheEdge,http://www.theedgemarkets.com/options/edge
Bursa Malaysia ends midday in negative territory in line with regional markets,https://www.klsescreener.com/v2/news/view/1277269,2024-02-14 14:40:11,2024-02-14 14:40:11,2024-02-14 13:53:45,"KUALA LUMPUR: Bursa Malaysia was unable to pare losses and stayed in negative territory at midday break, in line with regional stock markets.At 12.30pm, the FTSE Bursa Malaysia KLCI slipped 0.38 per cent or 5.89 points to 1,525.48 versus Tuesday&#039;s close ...","<div itemprop=""articleBody"" class=""dable-content-wrapper""><p>KUALA LUMPUR: Bursa Malaysia was unable to pare losses and stayed in negative territory at midday break, in line with regional stock markets.</p><p>At 12.30pm, the FTSE Bursa Malaysia KLCI slipped 0.38 per cent or 5.89 points to 1,525.48 versus Tuesday&#039;s close of 1,531.37.</p><p>The key index which opened at 1,527.79 moved between 1,521.79 and 1,530.95 throughout the morning trading session.</p><p>The broader market was negative with losers surpassing gainers 519 to 300 and 418 counters remained unchanged.</p><p>The index board ",Corporate,,https://assets.nst.com.my/images/articles/mid14_NSTfield_image_listing_featured_v2.var_1707890020.jpg,https://assets.nst.com.my/images/articles/PIXX-20240124-BERNAMA-BURSA-MALAYSIA_1707890013.jpg,79,NST,https://www.nst.com.my/business/corporate
"PA Resources, Lee Swee Kiat, Warisan TC, Engtex, TH Plantations, MNRB",https://www.klsescreener.com/v2/news/view/1277249,2024-02-14 14:02:02,2024-02-14 20:34:20,2024-02-14 13:53:44,theedgemalaysia.com highlighted two stocks with positive momentum and four stocks with negative momentum at Bursa Malaysia's afternoon close on Wednesday.,<div class=newsTextDataWrapInner><p>KUALA LUMPUR (Feb 14): theedgemalaysia.com highlighted two stocks with positive momentum and four stocks with negative momentum at Bursa Malaysia's afternoon close on Wednesday. &nbsp;</p></div><h3>The stocks with positive momentum were:</h3><ul><li>PA&nbsp;Resources Bhd — up one sen or 2.86% to 36 sen &nbsp;</li><li>Lee Swee Kiat Group Bhd — down two sen or 1.75% to RM1.12</li></ul><h3>The stocks with negative momentum were:</h3><ul><li>Warisan TC Holdings Bhd — down five sen or 4.2% to RM1.14</li><li>Engtex Group Bhd — up four sen or 3.77% to RM1.10</li><l,,,//images.weserv.nl/?url=https://assets.theedgemarkets.com/Stocks-With-Momentum_20240214142532_theedgemalaysia.jpg&w=300,https://assets.theedgemarkets.com/Stocks-With-Momentum_20240214142532_theedgemalaysia.jpg,52,TheEdge,http://www.theedgemarkets.com/categories/malaysia
