title,url,created_at,updated_at,published_date,summary,content,category,author,thumbnail_url,image_url,publisher_id,publisher_name,publisher_url
SD Guthrie is ready for its close-up,https://www.klsescreener.com/v2/news/view/1343135,2024-06-17 00:16:53,2024-06-18 14:19:23,2024-06-17 00:00:00,"For companies, changing their name can be both a bittersweet and complicated process.

For one as well-known and as long-tenured as Sime Darby Plantation Bhd, it can be all that, but more importantly for the plantation group now known as SD Guthrie Bhd, it would represent an opportunity to step away from the familiar and explore much more than it has in the past.","<div class=newsTextDataWrapInner><p>For companies, changing their name can be both a bittersweet and complicated process.</p></div>

<div class=newsTextDataWrapInner><p>For one as well-known and as long-tenured as Sime Darby Plantation Bhd, it can be all that, but more importantly for the plantation group now known as SD Guthrie Bhd, it would represent an opportunity to step away from the familiar and explore much more than it has in the past.</p></div>

<div class=newsTextDataWrapInner><p>It will be on this that SD Guthrie will build on as it seeks to navigate the next phase of its growth",新闻,,https://assets.theedgemarkets.com/SD-Guthrie-BC17062024_thumb_tem.jpg,https://assets.theedgemarkets.com/SD-Guthrie-BC17062024_thumb_tem.jpg,52,TheEdge,http://www.theedgemarkets.com/categories/malaysia
NTW 2024: Driving innovation and economic growth through lifelong learning,https://www.klsescreener.com/v2/news/view/1343133,2024-06-17 00:16:52,2024-06-18 14:19:20,2024-06-17 00:00:00,"The pace of technological advancements, such as artificial intelligence (AI), automation and digitalisation, is reshaping industries and job markets at an unpreced...","<div class=""ceonothumb embed-right imgw-300""><img alt="""" src=""//myassets.theedgemalaysia.com/pics/2024/HRDC_logo_tem.jpg"" /></div>

<div class=newsTextDataWrapInner><p>The pace of technological advancements, such as artificial intelligence (AI), automation and digitalisation, is reshaping industries and job markets at an unprecedented rate, making it essential for workers to continuously update their skills and knowledge to keep up with these changes and remain relevant to the needs of their respective industries.</p></div>

<div class=newsTextDataWrapInner><p>Fostering a lifelong learning",新闻,,https://assets.theedgemarkets.com/HRDC_thumb_tem.jpg,https://assets.theedgemarkets.com/HRDC_thumb_tem.jpg,52,TheEdge,http://www.theedgemarkets.com/categories/malaysia
Eka Heights - The emerging gem within the Malaysia Vision Valley (MVV) Conurbation,https://www.klsescreener.com/v2/news/view/1343131,2024-06-17 00:16:51,2024-06-18 14:04:49,2024-06-17 00:00:00,"Find a forever home against a backdrop of verdant landscapes and a tranquil lake at Eka Heights — Matrix Concepts Holdings Bhd’s new township development west of Seremban and minutes away from the developer’s established 6,800-acre Bandar Sri Sendayan.","<div class=""ceonothumb pb-5 imgw-800 mx-auto d-block""><a class=""mobx embedimg-icon"" data-rel=""ceolightbox"" href=""https://assets.theedgemarkets.com/pics/2024/Matrix-BC17062024_img1v3_tem.jpg""><img alt="""" src=""https://assets.theedgemarkets.com/pics/2024/Matrix-BC17062024_img1v3_tem.jpg"" /></a>
<div class=""thumb-cap text-center"">Eka Heights Residential (Artist's Illustration)</div>
</div>

<div class=newsTextDataWrapInner><p>Find a forever home against a backdrop of verdant landscapes and a tranquil lake at Eka Heights — Matrix Concepts Holdings Bhd’s new township development west of Seremban",,,https://assets.theedgemarkets.com/Matrix-BC17062024_thumb_tem.jpg,https://assets.theedgemarkets.com/Matrix-BC17062024_thumb_tem.jpg,52,TheEdge,http://www.theedgemarkets.com/categories/malaysia
Fuel subsidy revamp a dampener on loan growth,https://www.klsescreener.com/v2/news/view/1343209,2024-06-17 08:33:36,2024-06-17 08:33:36,2024-06-17 00:00:00,"PETALING JAYA: The banking sector is anticipated to come under pressure and post slower loan growth this year amid weaker spending underpinned, among others, by the government’s fuel subsidy rationalisation policy.","<div class=""inline-img""><div class=""story-image""></div></div><div id=""story-body"" class=""story bot-15 relative""><p>PETALING JAYA: The banking sector is anticipated to come under pressure and post slower loan growth this year amid weaker spending underpinned, among others, by the government’s fuel subsidy rationalisation policy.</p><p>RAM Rating Services Bhd co-head of financial institution ratings Sophia Lee told StarBiz she expects slower loan growth of 5% this year from 5.3% in 2023.</p><p>She foresees retail loans to likely moderate as credit demand may be dampened by possible squeeze on co",,,https://apicms.thestar.com.my/uploads/images/2024/06/17/2752703.jpg,https://apicms.thestar.com.my/uploads/images/2024/06/17/2752834.jpg,28,TheStar,http://www.thestar.com.my/news/latest/?tag=Business
UUE Holdings poised for earnings uptrend on strong order book,https://www.klsescreener.com/v2/news/view/1343207,2024-06-17 08:33:35,2024-06-17 08:33:35,2024-06-17 00:00:00,"PETALING JAYA: UUE Holdings Bhd is expected to register growth in its core earnings in the coming financial years, driven by its RM233.4mil worth of order book and helped by its project replenishment target of RM100mil per year and contribution from its subsea project, says TA Research.","<div class=""inline-img""><div class=""story-image""></div></div><div id=""story-body"" class=""story bot-15 relative""><p>PETALING JAYA: UUE Holdings Bhd is expected to register growth in its core earnings in the coming financial years, driven by its RM233.4mil worth of order book and helped by its project replenishment target of RM100mil per year and contribution from its subsea project, says TA Research.</p><p>The research house estimated UUE Holdings’ earnings to grow by 34.1%, 15.2% and 15.5% to RM19.2mil, RM22.1mil and RM25.6mil for financial year 2024 (FY24), FY25 and FY26, respectively.</p><p>",,,https://apicms.thestar.com.my/uploads/images/2024/06/17/2752695.JPG,https://apicms.thestar.com.my/uploads/images/2024/06/17/2752695.JPG,28,TheStar,http://www.thestar.com.my/news/latest/?tag=Business
Mixed outlook for Glomac on below-expectation FY24 performance,https://www.klsescreener.com/v2/news/view/1343205,2024-06-17 08:33:34,2024-06-17 08:33:34,2024-06-17 00:00:00,"PETALING JAYA: Analysts have mixed views on property developer Glomac Bhd, as its performance for financial year 2024 (FY24) came in below expectations.","<div class=""inline-img""><div class=""story-image""></div></div><div id=""story-body"" class=""story bot-15 relative""><p>PETALING JAYA: Analysts have mixed views on property developer <a href=""/business/marketwatch/stocks/?qcounter=GLOMAC"" target=""_blank"">Glomac Bhd</a><a href=""http://charts.thestar.com.my/?s=GLOMAC"" target=""_blank""><img class=""go-chart"" src=""https://cdn.thestar.com.my/Themes/img/chart.png""></a>, as its performance for financial year 2024 (FY24) came in below expectations.</p><p>Glomac closed its FY24 ended April 30 with a 25.11% year-on-year (y-o-y) drop in net profit to RM23.59mil",,,https://apicms.thestar.com.my/uploads/images/2024/06/17/2752692.png,https://apicms.thestar.com.my/uploads/images/2024/06/17/2752692.png,28,TheStar,http://www.thestar.com.my/news/latest/?tag=Business
Property and construction likely to get bigger index representation,https://www.klsescreener.com/v2/news/view/1343203,2024-06-17 08:33:33,2024-06-17 08:33:33,2024-06-17 00:00:00,PETALING JAYA: The recent review of the Bursa Malaysia indices saw additions of a number of property and construction counters on key indices.,"<div class=""inline-img""><div class=""story-image""></div></div><div id=""story-body"" class=""story bot-15 relative""><p>PETALING JAYA: The recent review of the Bursa Malaysia indices saw additions of a number of property and construction counters on key indices.</p><p>The FBM KLCI saw the addition of <a href=""/business/marketwatch/stocks/?qcounter=SUNWAY"" target=""_blank"">Sunway Bhd</a><a href=""http://charts.thestar.com.my/?s=SUNWAY"" target=""_blank""><img class=""go-chart"" src=""https://cdn.thestar.com.my/Themes/img/chart.png""></a> while the FBM70 Index saw the inclusion of <a href=""/business/marketwat",,,https://apicms.thestar.com.my/uploads/images/2024/06/17/2752697.jpg,https://apicms.thestar.com.my/uploads/images/2024/06/17/2752697.jpg,28,TheStar,http://www.thestar.com.my/news/latest/?tag=Business
Right time to resume FTA talks with EU,https://www.klsescreener.com/v2/news/view/1343201,2024-06-17 08:33:33,2024-06-17 08:33:33,2024-06-17 00:00:00,"PETALING JAYA: Malaysia is better positioned to negotiate a free trade agreement (FTA) with the European Union (EU) this time around as geopolitics and supply chain realignment gives it some edge, say industry observers.","<div class=""inline-img""><div class=""story-image""><p class=""caption""> In March this year, Prime Minister Datuk Seri Anwar Ibrahim said “the time is ripe to rekindle discussions on the Malaysia-EU FTA”. </p></div></div><div id=""story-body"" class=""story bot-15 relative""><p>PETALING JAYA: Malaysia is better positioned to negotiate a free trade agreement (FTA) with the European Union (EU) this time around as geopolitics and supply chain realignment gives it some edge, say industry observers.</p><p>Universiti Tunku Abdul Rahman economics professor Wong Chin Yoong attributes this to the nation’s trad",,,https://apicms.thestar.com.my/uploads/images/2024/06/17/2752698.png,https://apicms.thestar.com.my/uploads/images/2024/06/17/2752698.png,28,TheStar,http://www.thestar.com.my/news/latest/?tag=Business
Pakistan to raise power prices in move to secure IMF loan,https://www.klsescreener.com/v2/news/view/1343199,2024-06-17 08:33:32,2024-06-17 08:33:32,2024-06-17 00:00:00,LAHORE: Pakistan is raising power prices by an average of 20% to bolster its chances of securing a new loan from the International Monetary Fund (IMF).,"<div class=""inline-img""><div class=""story-image""></div></div><div id=""story-body"" class=""story bot-15 relative""><p>LAHORE: Pakistan is raising power prices by an average of 20% to bolster its chances of securing a new loan from the International Monetary Fund (IMF).</p><p>The National Electric Power Regulatory Authority will increase the power tariff by an average 5.72 rupees to 35.50 rupees per kilowatt-hour for Pakistan’s 10 power distribution companies for the next fiscal year starting from July 1, authority spokesman Sajid Akram said by phone.</p><p>Pakistan cut power tariffs for industrie",,,https://apicms.thestar.com.my/uploads/images/2024/06/17/2752428.jpg,https://apicms.thestar.com.my/uploads/images/2024/06/17/2752428.jpg,28,TheStar,http://www.thestar.com.my/news/latest/?tag=Business
Impact on diesel vehicle sales minimal,https://www.klsescreener.com/v2/news/view/1343197,2024-06-17 08:22:58,2024-06-17 08:22:58,2024-06-17 00:00:00,"PETALING JAYA: The implementation of the targeted subsidy for diesel, which saw the price of the fuel shoot up to RM3.35 per litre from the blanket subsidised price of RM2.15, is expected to pose minimal impact on the sales of diesel vehicles.","<div class=""inline-img""><div class=""story-image""><p class=""caption"">Still selling: A motorist fuelling up a diesel vehicle at a petrol station. For some, diesel vehicles are practical due to their durability, longer range, and fuel efficiency. — Bernama</p></div></div><div id=""story-body"" class=""story bot-15 relative""><p>PETALING JAYA: The implementation of the targeted subsidy for diesel, which saw the price of the fuel shoot up to RM3.35 per litre from the blanket subsidised price of RM2.15, is expected to pose minimal impact on the sales of diesel vehicles.</p><p>The move, however, might sp",,,https://apicms.thestar.com.my/uploads/images/2024/06/17/2752391.JPG,https://apicms.thestar.com.my/uploads/images/2024/06/17/2752391.JPG,28,TheStar,http://www.thestar.com.my/news/latest/?tag=Business
How convenience stores become big names in Asia,https://www.klsescreener.com/v2/news/view/1343195,2024-06-17 08:22:57,2024-06-17 08:22:57,2024-06-17 00:00:00,"SEOUL: South Korean convenience store operators facing a saturated market at home are now eyeing expansion overseas, especially in South-East and Central Asia where rapid economic growth and the popularity of South Korean content are leading to a growing demand for South Korean-style comprehensive convenience stores.","<div class=""inline-img""><div class=""story-image""><p class=""caption"">Affordable choice: Shoppers in the Myeongdong district of Seoul. Convenience stores in South Korea experienced rapid growth during the economic crisis in the late 1990s and early 2000s, as ready-made meals such as instant cup noodles became popular. — AFP</p></div></div><div id=""story-body"" class=""story bot-15 relative""><p>SEOUL: South Korean convenience store operators facing a saturated market at home are now eyeing expansion overseas, especially in South-East and Central Asia where rapid economic growth and the popularity o",,,https://apicms.thestar.com.my/uploads/images/2024/06/17/2752407.jpg,https://apicms.thestar.com.my/uploads/images/2024/06/17/2752407.jpg,28,TheStar,http://www.thestar.com.my/news/latest/?tag=Business
Steps to cap excess volatility when won trades longer,https://www.klsescreener.com/v2/news/view/1343193,2024-06-17 08:22:54,2024-06-17 08:22:54,2024-06-17 00:00:00,SEOUL: South Korea has pledged to intervene to curb any volatility in the won as the nation extends trading hours for the currency starting next month.,"<div class=""inline-img""><div class=""story-image""></div></div><div id=""story-body"" class=""story bot-15 relative""><p>SEOUL: South Korea has pledged to intervene to curb any volatility in the won as the nation extends trading hours for the currency starting next month.</p><p>Foreign-exchange authorities will take timely market-stabilising measures in case of excessive swings, the finance ministry said in a statement.</p><p>Close monitoring of market trends would also be put into place during the extended hours, it said.</p><p>South Korea’s onshore currency will trade until 2am Seoul time from Jul",,,https://apicms.thestar.com.my/uploads/images/2024/06/17/2752684.jpg,https://apicms.thestar.com.my/uploads/images/2024/06/17/2752684.jpg,28,TheStar,http://www.thestar.com.my/news/latest/?tag=Business
"Republicans are inventors, Democrats are innovators",https://www.klsescreener.com/v2/news/view/1343191,2024-06-17 08:22:53,2024-06-17 08:22:53,2024-06-17 00:00:00,DOES it matter which political party your urologist belongs to? Or that inventors are more likely to be Republicans than Democrats?,"<div class=""inline-img""><div class=""story-image""></div></div><div id=""story-body"" class=""story bot-15 relative""><p>DOES it matter which political party your urologist belongs to? Or that inventors are more likely to be Republicans than Democrats?</p><p>Not everything is political, of course, but everything has a politics, including the professions.</p><p>Knowing which kinds of partisans tend to dominate which sectors can help you manage expectations not only as you go about your own life, but also as you try to understand trends in the broader economy.</p><p>Evidence from campaign contribution",,,https://apicms.thestar.com.my/uploads/images/2024/06/17/2752690.jpg,https://apicms.thestar.com.my/uploads/images/2024/06/17/2752690.jpg,28,TheStar,http://www.thestar.com.my/news/latest/?tag=Business
Adidas probes bribery allegations in China,https://www.klsescreener.com/v2/news/view/1343189,2024-06-17 08:22:53,2024-06-17 08:22:53,2024-06-17 00:00:00,"LONDON: Adidas has launched an investigation into allegations of large-scale bribery in China after the company received a whistleblower complaint that accused senior staff of embezzling “millions of euros”, the Financial Times (FT) has reported.","<div class=""inline-img""><div class=""story-image""><p class=""caption"">REUTERS/Andreas Gebert</p></div></div><div id=""story-body"" class=""story bot-15 relative""><p>LONDON: Adidas has launched an investigation into allegations of large-scale bribery in China after the company received a whistleblower complaint that accused senior staff of embezzling “millions of euros”, the Financial Times (FT) has reported.</p><p>The anonymous letter, which claims to have been written by “employees of Adidas China”, names several Chinese Adidas employees including a senior manager involved with the marketing budge",,,https://apicms.thestar.com.my/uploads/images/2024/06/17/2752619.JPG,https://apicms.thestar.com.my/uploads/images/2024/06/17/2752619.JPG,28,TheStar,http://www.thestar.com.my/news/latest/?tag=Business
Japan to think about allowing nuclear plant expansions,https://www.klsescreener.com/v2/news/view/1343187,2024-06-17 08:22:52,2024-06-17 08:22:52,2024-06-17 00:00:00,"TOKYO: Japan’s economy ministry is considering allowing the expansion of nuclear plants as older ones are being decommissioned, according to the Asahi newspaper.","<div class=""inline-img""><div class=""story-image""><p class=""caption"">— AP </p></div></div><div id=""story-body"" class=""story bot-15 relative""><p>TOKYO: Japan’s economy ministry is considering allowing the expansion of nuclear plants as older ones are being decommissioned, according to the Asahi newspaper.</p><p>The permission would likely be part of revisions to Japan’s national energy strategy, which is reviewed every three years, the paper reported, without saying where it got the information.</p><p>The revision is expected to include a provision allowing power companies that are decommissioni",,,https://apicms.thestar.com.my/uploads/images/2024/06/17/2752429.jpg,https://apicms.thestar.com.my/uploads/images/2024/06/17/2752429.jpg,28,TheStar,http://www.thestar.com.my/news/latest/?tag=Business
Lula: Haddad will not be weakened,https://www.klsescreener.com/v2/news/view/1343185,2024-06-17 08:22:52,2024-06-17 08:22:52,2024-06-17 00:00:00,MILAN: Brazil’s President Luiz Inacio Lula da Silva denies that Finance Minister Fernando Haddad is weakened after Congress refused to act on a provisional measure considered crucial for the country’s fiscal balance.,"<div class=""inline-img""><div class=""story-image""><p class=""caption"">Brazil's President Luiz Inacio Lula da Silva looks on as he speaks during the inauguration of the International Book Fair (FilBo) in Bogota, Colombia April 17, 2024. REUTERS/Luisa Gonzalez/File Photo</p></div></div><div id=""story-body"" class=""story bot-15 relative""><p>MILAN: Brazil’s President Luiz Inacio Lula da Silva denies that Finance Minister Fernando Haddad is weakened after Congress refused to act on a provisional measure considered crucial for the country’s fiscal balance.</p><p>“Haddad will never be weakened as long a",,,https://apicms.thestar.com.my/uploads/images/2024/06/17/2752426.JPG,https://apicms.thestar.com.my/uploads/images/2024/06/17/2752426.JPG,28,TheStar,http://www.thestar.com.my/news/latest/?tag=Business
"Adelson heir steers Mavericks, plays the long game on casino",https://www.klsescreener.com/v2/news/view/1343183,2024-06-17 08:22:51,2024-06-17 08:22:51,2024-06-17 00:00:00,"NEW YORK: As Game 3 of the NBA Finals tipped off at the American Airlines Centre last Wednesday, Patrick Dumont, the new co-owner of the Dallas Mavericks (Mavs), sat courtside amid a pantheon of Texas athletic elite.","<div class=""inline-img""><div class=""story-image""><p class=""caption"">Emmitt Smith, Dirk Nowitzki, Steve Nash, and Patrick Dumont during Game 3 of the NBA basketball finals in Dallas on June 12.- Photographer: Sam Hodde/AP Photo</p></div></div><div id=""story-body"" class=""story bot-15 relative""><p>NEW YORK: As Game 3 of the NBA Finals tipped off at the American Airlines Centre last Wednesday, Patrick Dumont, the new co-owner of the Dallas Mavericks (Mavs), sat courtside amid a pantheon of Texas athletic elite.</p><p>To his right: former NBA stars Dirk Nowitzki and Steve Nash, and three-time Super",,,https://apicms.thestar.com.my/uploads/images/2024/06/17/2752424.jpg,https://apicms.thestar.com.my/uploads/images/2024/06/17/2752424.jpg,28,TheStar,http://www.thestar.com.my/news/latest/?tag=Business
Roaring Kitty’s gain of US$262mil stirs sceptics,https://www.klsescreener.com/v2/news/view/1343181,2024-06-17 08:22:51,2024-06-17 08:22:51,2024-06-17 00:00:00,"NEW YORK: As a renewed bout of GameStop Corp fever gripped the meme-stock faithful, fans of trading influencer Keith Gill waited for one moment: The day their hero, aka “Roaring Kitty” would become a billionaire.","<div class=""inline-img""><div class=""story-image""><p class=""caption"">FILE PHOTO: Traders work at the post where GameStop is traded on the floor at the New York Stock Exchange (NYSE) in New York City, U.S., June 12, 2024.  REUTERS/Brendan McDermid/File Photo</p></div></div><div id=""story-body"" class=""story bot-15 relative""><p>NEW YORK: As a renewed bout of GameStop Corp fever gripped the meme-stock faithful, fans of trading influencer Keith Gill waited for one moment: The day their hero, aka “Roaring Kitty” would become a billionaire.</p><p>The notion was hardly far-fetched. Over the course of t",,,https://apicms.thestar.com.my/uploads/images/2024/06/17/2752425.JPG,https://apicms.thestar.com.my/uploads/images/2024/06/17/2752425.JPG,28,TheStar,http://www.thestar.com.my/news/latest/?tag=Business
Takeda signs option to market Ascentage’s drug,https://www.klsescreener.com/v2/news/view/1343179,2024-06-17 08:22:50,2024-06-17 08:22:50,2024-06-17 00:00:00,"TOKYO: Takeda Pharmaceutical Co has signed an option agreement with Chinese drug developer Ascentage Pharma Group International for the development of a blood-cancer drug, as the Japanese drug maker attempts to revive its drug pipeline and boost growth.","<div class=""inline-img""><div class=""story-image""></div></div><div id=""story-body"" class=""story bot-15 relative""><p>TOKYO: Takeda Pharmaceutical Co has signed an option agreement with Chinese drug developer Ascentage Pharma Group International for the development of a blood-cancer drug, as the Japanese drug maker attempts to revive its drug pipeline and boost growth.</p><p>Takeda will have the option to exclusive marketing for Olverembatinib outside of mainland China, Hong Kong, Macau, Taiwan and Russia, the Japanese company said in statement.</p><p>The drug, under development, is designed to t",,,https://apicms.thestar.com.my/uploads/images/2024/06/17/2752427.jpg,https://apicms.thestar.com.my/uploads/images/2024/06/17/2752427.jpg,28,TheStar,http://www.thestar.com.my/news/latest/?tag=Business
India in talks with Equinor on oil reserves,https://www.klsescreener.com/v2/news/view/1343177,2024-06-17 08:22:50,2024-06-17 08:22:50,2024-06-17 00:00:00,"NEW DELHI: India is in talks with Norway’s Equinor ASA for its participation in the country’s strategic petroleum reserves, as well as for long-term liquefied natural gas deals from the company’s US and Qatar portfolios, says the Mint newspaper.","<div class=""inline-img""><div class=""story-image""></div></div><div id=""story-body"" class=""story bot-15 relative""><p>NEW DELHI: India is in talks with Norway’s Equinor ASA for its participation in the country’s strategic petroleum reserves, as well as for long-term liquefied natural gas deals from the company’s US and Qatar portfolios, says the Mint newspaper.</p><p>Securing a commitment from Equinor will mark the second such deal for India after a similar contract with Abu Dhabi National Oil Co, according to the newspaper.</p><p>India, the world’s third biggest energy consumer, is also asking E",,,https://apicms.thestar.com.my/uploads/images/2024/06/17/2752682.JPG,https://apicms.thestar.com.my/uploads/images/2024/06/17/2752682.JPG,28,TheStar,http://www.thestar.com.my/news/latest/?tag=Business
Sabah’s first woman deputy chief minister dies at 86,https://www.klsescreener.com/v2/news/view/1343097,2024-06-16 16:48:53,2024-06-18 14:04:46,2024-06-16 16:38:23,"Sabah’s first woman Deputy Chief Minister Datuk Ariah Tengku Ahmad passed away in her sleep at her residence here Sunday at the age of 86, said her son Tengku Datuk Fuad Tengku Ahmad.","<div class=newsTextDataWrapInner><p>KOTA KINABALU (June 16): Sabah’s first woman Deputy Chief Minister Datuk Ariah Tengku Ahmad passed away in her sleep at her residence here Sunday at the age of 86, said her son Tengku Datuk Fuad Tengku Ahmad.</p></div>

<div class=newsTextDataWrapInner><p>Tengku Fuad, who is a lawyer, characterised his mother’s life as one of distinction and service.</p></div>

<div class=newsTextDataWrapInner><p>He said she had captained the Jesselton athletics team, was Miss Jesselton 1956, a radio announcer, journalist, Kawang State Assembly member, Sabah minister of ",,,https://assets.theedgemarkets.com/Ariah Tengku Ahmad.jpg,https://assets.theedgemarkets.com/Ariah Tengku Ahmad.jpg,52,TheEdge,http://www.theedgemarkets.com/categories/malaysia
