title,url,created_at,updated_at,published_date,summary,content,category,author,thumbnail_url,image_url,publisher_id,publisher_name,publisher_url
Bursa closes mixed on cautious mood,https://www.klsescreener.com/v2/news/view/1307917,2024-04-12 17:36:20,2024-04-15 00:02:33,2024-04-12 17:21:06,"Bursa Malaysia closed mixed on Friday, trended within a tight range as investors exercised caution amid the volatile sentiment across the region, said Rakuten Trade Sdn Bhd.","<div class=newsTextDataWrapInner><p>KUALA LUMPUR (April 12): Bursa Malaysia closed mixed on Friday, trended within a tight range as investors exercised caution amid the volatile sentiment across the region, said Rakuten Trade Sdn Bhd.</p></div>

<div class=newsTextDataWrapInner><p>At 5pm, the FTSE Bursa Malaysia KLCI (FBM KLCI) declined 2.47 points or 0.16% to 1,551.04 from Tuesday's close of 1,553.51.</p></div>

<div class=newsTextDataWrapInner><p>The benchmark index opened 0.58 of a point higher at 1,554.09, and moved between 1,548.27 and 1,556.64 throughout the trading session.</p></div",新闻,,https://assets.theedgemarkets.com/closing-market-flat_20240412171936_theedgemalaysia.jpg,https://assets.theedgemarkets.com/closing-market-flat_20240412171936_theedgemalaysia.jpg,52,TheEdge,http://www.theedgemarkets.com/categories/malaysia
Anwar confident Malaysians can tap economic potential,https://www.klsescreener.com/v2/news/view/1307903,2024-04-12 17:17:00,2024-04-14 23:04:39,2024-04-12 17:12:04,"Prime Minister Datuk Seri Anwar Ibrahim said he is confident in the ability of Malaysians to realise the country’s potential in economic development, especially in high-value investments.","<div class=newsTextDataWrapInner><p>KUALA LUMPUR (April 12): Prime Minister Datuk Seri Anwar Ibrahim said he is confident in the ability of Malaysians to realise the country’s potential in economic development, especially in high-value investments.</p></div>

<div class=newsTextDataWrapInner><p>Sharing a video report from the World Economic Forum Facebook page on Malaysia’s growing potential in the semiconductor industry on Friday, Anwar said the Madani government is committed to building a new, high-tech and innovation-driven future for the country.</p></div>

<div class=newsTextDataWrapI",Edge,,https://assets.theedgemarkets.com/anwar-FW1341252_USA15_17112023_PM-lpr_20240412171105_bernama.jpg,https://assets.theedgemarkets.com/anwar-FW1341252_USA15_17112023_PM-lpr_20240412171105_bernama.jpg,52,TheEdge,http://www.theedgemarkets.com/categories/malaysia
"Xpeng expands into Hong Kong, Macau via Sime Darby Motors partnership",https://www.klsescreener.com/v2/news/view/1307893,2024-04-12 17:04:25,2024-04-14 22:34:30,2024-04-12 16:48:32,"KUALA LUMPUR (April 12): XPENG Motors (XPENG), a Chinese smart electric vehicle (Smart EV) company, has expanded its footprint through a dealer partnership with Sime Darby Motors Sdn Bhd in Hong Kong.","<div class=newsTextDataWrapInner><p>KUALA LUMPUR (April 12): XPENG Motors (XPENG), a Chinese smart electric vehicle (Smart EV) company, has expanded&nbsp;its footprint through a dealer partnership with Sime Darby Motors Sdn Bhd in Hong Kong.&nbsp;</p></div>

<div class=newsTextDataWrapInner><p>Sime Darby Motors is the automotive arm of Sime Darby Bhd.</p></div>

<div class=newsTextDataWrapInner><p dir=""ltr"">The partnership will enable XPENG to bring its latest smart EVs to local consumers in the Hong Kong market with branded showrooms, after-sales support, and comprehensive guidance throug",,,https://assets.theedgemarkets.com/XPENG-Motors-GuangzouXiaopengMotorsTechnology-logo-illust-Jan16.2024px-DadoRuvic_20240412163316_reuters.jpg,https://assets.theedgemarkets.com/XPENG-Motors-GuangzouXiaopengMotorsTechnology-logo-illust-Jan16.2024px-DadoRuvic_20240412163316_reuters.jpg,52,TheEdge,http://www.theedgemarkets.com/categories/malaysia
Singapore keeps monetary policy unchanged as inflation risks linger,https://www.klsescreener.com/v2/news/view/1307881,2024-04-12 16:55:26,2024-04-12 16:55:26,2024-04-12 16:46:00,"SINGAPORE: Singapore's central bank left its monetary policy unchanged on Friday, in line with expectations, as authorities looked for signs inflation in the city-state was moderating before they consider loosening settings.","<div class=""inline-img""><div class=""story-image""></div></div><div id=""story-body"" class=""story bot-15 relative""><p>SINGAPORE: Singapore's central bank left its monetary policy unchanged on Friday, in line with expectations, as authorities looked for signs inflation in the city-state was moderating before they consider loosening settings.</p><p>The Monetary Authority of Singapore (MAS) said it will maintain the prevailing rate of appreciation of its exchange rate-based policy band known as the Nominal Effective Exchange Rate, or S$NEER.</p><p>The width and the level at which the band is centred",,,https://apicms.thestar.com.my/uploads/images/2024/04/12/2640060.jpeg,https://apicms.thestar.com.my/uploads/images/2024/04/12/2640060.jpeg,28,TheStar,http://www.thestar.com.my/news/latest/?tag=Business
"Kenanga maintains 'outperform' call on Aeon Credit, TP at RM8.55",https://www.klsescreener.com/v2/news/view/1307891,2024-04-12 17:04:24,2024-04-14 22:30:27,2024-04-12 16:45:08,"Kenanga Investment Bank Bhd has maintained its 'outperform' call on Aeon Credit Service (M) Bhd, with a target price of RM8.55.

In a note on Friday, the research firm said it continues to believe in Aeon Credit’s fundamentals, as they stand out against conventional banking institutions with return on equity prospects of 15% with more modest dividend yields.","<div class=newsTextDataWrapInner><p>KUALA LUMPUR (April 12): Kenanga Investment Bank Bhd has maintained&nbsp;its 'outperform'&nbsp;call on Aeon Credit Service (M) Bhd,&nbsp;with a target price of RM8.55.</p></div>

<div class=newsTextDataWrapInner><p>In a note on Friday, the research firm said&nbsp;it continues to believe in Aeon&nbsp;Credit’s fundamentals, as they stand out against conventional banking institutions with return on equity prospects of 15% with more modest dividend yields.</p></div>

<div class=newsTextDataWrapInner><p>“Aeon Credit’s guidance for the financial year ending Fe",Edge,,https://assets.theedgemarkets.com/aeon credit-2_20240412164327_aeoncredit.com_.jpg,https://assets.theedgemarkets.com/aeon credit-2_20240412164327_aeoncredit.com_.jpg,52,TheEdge,http://www.theedgemarkets.com/categories/malaysia
"China&#039;s March exports and imports shrink, miss forecasts by big margins",https://www.klsescreener.com/v2/news/view/1307873,2024-04-12 16:40:19,2024-04-12 16:40:19,2024-04-12 16:38:12,"BEIJING: China&#039;s March exports contracted sharply, while imports also unexpectedly shrank, both undershooting market forecasts by big margins, customs data showed on Friday, highlighting the stiff task facing policymakers as they try to bolster a shaky economic recovery.Shipments ...","<div itemprop=""articleBody"" class=""dable-content-wrapper""><p>BEIJING: China&#039;s March exports contracted sharply, while imports also unexpectedly shrank, both undershooting market forecasts by big margins, customs data showed on Friday, highlighting the stiff task facing policymakers as they try to bolster a shaky economic recovery.</p><p>Shipments from China slumped 7.5 per cent year-on-year last month, marking the biggest fall since August last year and compared with a 2.3 per cent decline forecast in a Reuters poll of economists. They rose 7.1 per cent in the January-February period.</p>",Corporate,,https://assets.nst.com.my/images/articles/cex12_NSTfield_image_listing_featured_v2.var_1712911088.jpg,https://assets.nst.com.my/images/articles/china_1712911081.jpg,79,NST,https://www.nst.com.my/business/corporate
"US topples China as Taiwan&#039;s largest export market due to chips, AI demand",https://www.klsescreener.com/v2/news/view/1307871,2024-04-12 16:40:18,2024-04-12 16:40:18,2024-04-12 16:36:20,"TAIPEI: The United States has topped long-time leader China as Taiwan&#039;s main export market for four consecutive months due to a surge in demand for microchip products and AI technology, Taipei&#039;s Finance Ministry said Friday.Self-ruled Taiwan is ...","<div itemprop=""articleBody"" class=""dable-content-wrapper""><p>TAIPEI: The United States has topped long-time leader China as Taiwan&#039;s main export market for four consecutive months due to a surge in demand for microchip products and AI technology, Taipei&#039;s Finance Ministry said Friday.</p><p>Self-ruled Taiwan is a microchip-manufacturing powerhouse, churning out the world&#039;s most advanced silicon wafers necessary to power everything from e-vehicles and satellites to fighter jets and increasingly to power AI technology.</p><p>For two decades, its top export market has been China – ",Corporate,,https://assets.nst.com.my/images/articles/ust12_NSTfield_image_listing_featured_v2.var_1712910977.jpg,https://assets.nst.com.my/images/articles/micropchip_1712910970.jpg,79,NST,https://www.nst.com.my/business/corporate
"Bankman-Fried appeals FTX fraud conviction, 25-year sentence",https://www.klsescreener.com/v2/news/view/1307869,2024-04-12 16:40:18,2024-04-12 16:40:18,2024-04-12 16:32:55,"NEW YORK: Sam Bankman-Fried, facing the prospect of spending much of his adult life behind bars, on Thursday appealed his conviction and 25-year prison sentence for stealing US$8 billion from customers of the now-bankrupt FTX cryptocurrency exchange he founded.Defense ...","<div itemprop=""articleBody"" class=""dable-content-wrapper""><p>NEW YORK: Sam Bankman-Fried, facing the prospect of spending much of his adult life behind bars, on Thursday appealed his conviction and 25-year prison sentence for stealing US$8 billion from customers of the now-bankrupt FTX cryptocurrency exchange he founded.</p><p>Defense lawyer Marc Mukasey had announced plans for the appeal to the Manhattan-based 2nd U.S. Circuit Court of Appeals during Bankman-Fried&#039;s March 28 sentencing hearing.</p><p>The 32-year-old former billionaire crypto wunderkind was convicted in November on seven ",Corporate,,https://assets.nst.com.my/images/articles/sb12_NSTfield_image_listing_featured_v2.var_1712910771.jpg,https://assets.nst.com.my/images/articles/sam_bankman.jpg_1712910764.jpg,79,NST,https://www.nst.com.my/business/corporate
"Safe-haven gold snaps record highs, bullion at all-time high of RM11,439.7",https://www.klsescreener.com/v2/news/view/1307865,2024-04-12 16:30:21,2024-04-12 16:30:21,2024-04-12 16:28:11,"Gold prices climbed on Friday to hit a historic peak as central bank purchases amid geopolitical tensions sustained the momentum for the yellow metal, while strong U.S. economic data failed to dampen bullion&#039;s allure.Spot gold was up 0.9 ...","<div itemprop=""articleBody"" class=""dable-content-wrapper""><p>Gold prices climbed on Friday to hit a historic peak as central bank purchases amid geopolitical tensions sustained the momentum for the yellow metal, while strong U.S. economic data failed to dampen bullion&#039;s allure.</p><p>Spot gold was up 0.9 per cent at US$2,395.56 per ounce, as of 0740 GMT. Bullion hit a record high of US$2,398.49 earlier in the session. U.S. gold futures gained 1.7 per cent to US$2,413.00.</p><p>""One thing that is definitely fulfilling this gold buy from central banks are the wars happening around the globe",Corporate,,https://assets.nst.com.my/images/articles/bull12_NSTfield_image_listing_featured_v2.var_1712910488.jpg,https://assets.nst.com.my/images/articles/Oro_Italia_916_Gold_Bangles_1712910481.jpg,79,NST,https://www.nst.com.my/business/corporate
"XPENG expands into Hong Kong, Macau via Sime Darby Motors partnership",https://www.klsescreener.com/v2/news/view/1307879,2024-04-12 16:55:25,2024-04-12 16:55:25,2024-04-12 16:28:00,"KUALA LUMPUR: XPENG Motors (XPENG), a Chinese smart electric vehicle (Smart EV) company, has expanded its footprint through a dealer partnership with Sime Darby Motors in Hong Kong.","<div class=""inline-img""><div class=""story-image""><p class=""caption"">XPENG Motor vice chairman and president Dr. Brian Gu (left) and Sime Darby Motors (HK) Limited managing director of Hong Kong &amp; Macau Tommy Wong (right). </p></div></div><div id=""story-body"" class=""story bot-15 relative""><p>KUALA LUMPUR: XPENG Motors (XPENG), a Chinese smart electric vehicle (Smart EV) company, has expanded its footprint through a dealer partnership with Sime Darby Motors in Hong Kong.</p><p>The partnership will enable XPENG to bring its latest smart EVs to local consumers in the Hong Kong market with bran",,,https://apicms.thestar.com.my/uploads/images/2024/04/12/2640023.jpg,https://apicms.thestar.com.my/uploads/images/2024/04/12/2640023.jpg,28,TheStar,http://www.thestar.com.my/news/latest/?tag=Business
"U.S. large cap stocks see biggest weekly outflow in 16 months, says BofA report",https://www.klsescreener.com/v2/news/view/1307863,2024-04-12 16:30:21,2024-04-12 16:30:21,2024-04-12 16:24:09,"LONDON: U.S. large cap stocks suffered their largest weekly outflow since December 2022 in the week to Wednesday, Bank of America said, with traders nervous that sticky inflation will push rate cuts further out and geopolitical tensions adding to caution....","<div itemprop=""articleBody"" class=""dable-content-wrapper""><p>LONDON: U.S. large cap stocks suffered their largest weekly outflow since December 2022 in the week to Wednesday, Bank of America said, with traders nervous that sticky inflation will push rate cuts further out and geopolitical tensions adding to caution.</p><p>U.S. large caps saw US$15.8 billion of outflows in the week, while stocks in general saw outflows of US$19.6 billion, Bank of America said in its weekly round up of flows in and out of world markets using EPFR data.</p><p>The week to Wednesday covered last Thursday&#039;s tumb",Corporate,,https://assets.nst.com.my/images/articles/usc12_NSTfield_image_listing_featured_v2.var_1712910341.jpg,https://assets.nst.com.my/images/articles/USA-FED_INFLATION_1712910334.jpg,79,NST,https://www.nst.com.my/business/corporate
Mosti to launch Single Window Initiative to strengthen Malaysia’s startup ecosystem,https://www.klsescreener.com/v2/news/view/1307867,2024-04-12 16:34:26,2024-04-14 19:04:17,2024-04-12 16:18:29,"KUALA LUMPUR (April 12): The Ministry of Science, Technology and Innovation (Mosti) will be launching the Single Window Initiative to strengthen Malaysia’s startup ecosystem by streamlining processes and consolidating resources under one platform.","<div class=newsTextDataWrapInner><p>KUALA LUMPUR (April 12): The&nbsp;Ministry of Science, Technology&nbsp;and Innovation (Mosti) will be launching the Single Window Initiative to strengthen Malaysia’s&nbsp;startup ecosystem by streamlining processes and consolidating resources under one&nbsp;platform.</p></div>

<div class=newsTextDataWrapInner><p>Its minister Chang Lih Kang said the&nbsp;initiative will dismantle bureaucratic hurdles, expedite approvals and empower&nbsp;entrepreneurs to navigate the startup journey with greater ease.</p></div>

<div class=newsTextDataWrapInner><p>“This i",Edge,,https://assets.theedgemarkets.com/20230619-launch-PROTON DX-ZHD-56-Mosti-Min-Chang-Lih-Kang_20240412160811_theedgemalaysia.jpg,https://assets.theedgemarkets.com/20230619-launch-PROTON DX-ZHD-56-Mosti-Min-Chang-Lih-Kang_20240412160811_theedgemalaysia.jpg,52,TheEdge,http://www.theedgemarkets.com/categories/malaysia
"Gamuda Land partners Kiddypedia to introduce place-based, play-based learning centres at Gamuda Gardens, twentyfive7",https://www.klsescreener.com/v2/news/view/1307861,2024-04-12 16:17:12,2024-04-14 18:45:24,2024-04-12 16:11:27,"Gamuda Land, the property arm of Gamuda Bhd, signed a memorandum of agreement on April 6 with Kiddypedia, an educational event company, to introduce Kiddypedia Discovery Centres at the developer's townships, namely Gamuda Gardens in Rawang and twentyfive7 in Telok Panglima Garang, according to a press statement on Friday.","<div class=newsTextDataWrapInner><p>KUALA LUMPUR (April 12):&nbsp;Gamuda Land, the property arm of Gamuda Bhd,&nbsp;signed a memorandum of agreement on April 6 with Kiddypedia, an educational event company, to introduce Kiddypedia Discovery Centres at the developer's townships, namely Gamuda Gardens in Rawang and twentyfive7 in Telok Panglima Garang, according to a press statement on Friday.&nbsp;</p></div>

<div class=newsTextDataWrapInner><p>The Kiddypedia Discovery Centres will offer edutainment experiences for families by integrating sports, arts, STEM (science, technology, engineering a",,,https://assets.theedgemarkets.com/Gamuda Land x Kiddypedia (1)_20240412160244_gamuda land.jpg,https://assets.theedgemarkets.com/Gamuda Land x Kiddypedia (1)_20240412160244_gamuda land.jpg,52,TheEdge,http://www.theedgemarkets.com/categories/malaysia
"Safe-haven gold snaps record highs, heads for fourth weekly gain",https://www.klsescreener.com/v2/news/view/1307859,2024-04-12 16:11:23,2024-04-12 16:11:23,2024-04-12 15:58:00,"GOLD prices climbed on Friday to hit a historic peak as central bank purchases amid geopolitical tensions sustained the momentum for the yellow metal, while strong U.S. economic data failed to dampen bullion's allure.","<div class=""inline-img""><div class=""story-image""><p class=""caption"">Bullion at Gold Investments Ltd. - file pic</p></div></div><div id=""story-body"" class=""story bot-15 relative""><p>GOLD prices climbed on Friday to hit a historic peak as central bank purchases amid geopolitical tensions sustained the momentum for the yellow metal, while strong U.S. economic data failed to dampen bullion's allure.</p><p>Spot gold was up 0.9% at $2,395.56 per ounce, as of 0740 GMT. Bullion hit a record high of 2,398.49 earlier in the session. U.S. gold futures gained 1.7% to $2,413.00.</p><p>""One thing that is de",,,https://apicms.thestar.com.my/uploads/images/2024/04/12/2639902.jpg,https://apicms.thestar.com.my/uploads/images/2024/04/12/2639902.jpg,28,TheStar,http://www.thestar.com.my/news/latest/?tag=Business
Yinson Holdings says Singapore unit looking to raise US$500mil via bond issuance,https://www.klsescreener.com/v2/news/view/1307853,2024-04-12 16:00:38,2024-04-12 16:00:38,2024-04-12 15:57:51,"KUALA LUMPUR: Yinson Holdings Bhd&#039;s Singapore unit Yinson Production Offshore Pte Ltd  is looking to raise up to US$500 million through a bonds issuance.In a filing with Bursa Malaysia Securities, the company said DNB Markets and Pareto Securities ...","<div itemprop=""articleBody"" class=""dable-content-wrapper""><p>KUALA LUMPUR: Yinson Holdings Bhd&#039;s Singapore unit Yinson Production Offshore Pte Ltd  is looking to raise up to US$500 million through a bonds issuance.</p><p>In a filing with Bursa Malaysia Securities, the company said DNB Markets and Pareto Securities as joint bookrunners, along with ABG Sundal Collier ASA as joint lead manager, is looking to arrange a series of fixed income investor meetings commencing on April 11.</p><p>Yinson Production said a new five-year senior secured bond issue of up to US$500 million may ensure from ",Corporate,,https://assets.nst.com.my/images/articles/yin12_NSTfield_image_listing_featured_v2.var_1712908668.jpg,https://assets.nst.com.my/images/articles/yinson_atlanta_1712908661.jpg,79,NST,https://www.nst.com.my/business/corporate
Federal Highway congestion due to installation of LRT3 bridge — JKR,https://www.klsescreener.com/v2/news/view/1307855,2024-04-12 16:04:48,2024-04-14 18:19:13,2024-04-12 15:51:59,"The Public Works Department (JKR) on Friday clarified that a pedestrian overhead steel bridge spanning both sides of the Federal Highway to the Universiti Teknologi Mara (UiTM) Light Rail Transit 3 (LRT3) Station was under construction, when a congestion occurred on the highway from 7.30pm on Wednesday to 1.30am on Thursday.","<div class=newsTextDataWrapInner><p>KUALA LUMPUR (April 12): The Public Works Department (JKR) on Friday clarified that a&nbsp;pedestrian overhead steel bridge spanning both sides&nbsp;of&nbsp;the Federal Highway to the Universiti Teknologi Mara (UiTM) Light Rail Transit 3 (LRT3) Station was under construction, when&nbsp;a congestion occurred on the highway from 7.30pm on Wednesday to 1.30am on Thursday.</p></div>

<div class=newsTextDataWrapInner><p>""A road closure notice was issued by the LRT3, Malaysian Resources Corp&nbsp;Bhd (MRCB) and the JKR on March 27, and was announced through soci",,,https://assets.theedgemarkets.com/JKR_20240412155042_www.jkr_.gov_.my_.jpg,https://assets.theedgemarkets.com/JKR_20240412155042_www.jkr_.gov_.my_.jpg,52,TheEdge,http://www.theedgemarkets.com/categories/malaysia
"China's economy on stable footing, experts say",https://www.klsescreener.com/v2/news/view/1307849,2024-04-12 15:55:25,2024-04-12 15:55:25,2024-04-12 15:43:00,"CHINA's economy has started 2024 on a stable footing, indicating a sustained trajectory of robust recovery throughout the year, despite pressures and challenges both at home and abroad, officials and analysts said on Thursday.","<div class=""inline-img""><div class=""story-image""></div></div><div id=""story-body"" class=""story bot-15 relative""><p>China's economy has started 2024 on a stable footing, indicating a sustained trajectory of robust recovery throughout the year, despite pressures and challenges both at home and abroad, officials and analysts said on Thursday.</p><p>While the relatively weak consumer price rises in March point to pressure from lackluster demand, analysts said they believe that China's economic conditions would continue to improve in the following months with more policy measures expected to help e",,,https://apicms.thestar.com.my/uploads/images/2024/04/12/2639853.jpg,https://apicms.thestar.com.my/uploads/images/2024/04/12/2639853.jpg,28,TheStar,http://www.thestar.com.my/news/latest/?tag=Business
Anwar yet to discuss PH candidacy for Kuala Kubu Baharu by-election,https://www.klsescreener.com/v2/news/view/1307845,2024-04-12 15:51:30,2024-04-14 17:34:14,2024-04-12 15:40:51,Prime Minister Datuk Seri Anwar Ibrahim said he had not held any discussions on the Pakatan Harapan (PH) candidate for the Kuala Kubu Baharu state by-election in Selangor.,"<div class=newsTextDataWrapInner><p>HULU SELANGOR (April 12): Prime Minister Datuk Seri Anwar Ibrahim said he had not held any discussions on the Pakatan Harapan (PH) candidate for the Kuala Kubu Baharu state by-election in Selangor.</p></div>

<div class=newsTextDataWrapInner><p>“I haven’t discussed with anybody about it (the by-election),” the&nbsp;PH chairman told reporters briefly when attending the Hari Raya Aidilfitri feast and Friday prayers at Masjid Bandar Utama Batang Kali here.</p></div>

<div class=newsTextDataWrapInner><p>The Election Commission has fixed&nbsp;May 11 as the po",Edge,,https://assets.theedgemarkets.com/Anwar 20240223_PEO_MALAYSIANS INTERNATIONAL FINANCIAL CENTRE_ZHD-867_20240412153923_theedgemalaysia.jpg,https://assets.theedgemarkets.com/Anwar 20240223_PEO_MALAYSIANS INTERNATIONAL FINANCIAL CENTRE_ZHD-867_20240412153923_theedgemalaysia.jpg,52,TheEdge,http://www.theedgemarkets.com/categories/malaysia
Yinson hires bankers for potential US$500m bond issue,https://www.klsescreener.com/v2/news/view/1307843,2024-04-12 15:51:29,2024-04-14 13:19:10,2024-04-12 15:29:39,"Oil-and-gas services firm Yinson Holdings Bhd has hired Nordic investment banks for a potential bond issue of up to US$500 million (RM2.37 billion).

YInson has mandated DNB Markets and Pareto Securities as joint bookrunners, and ABG Sundal Collier ASA as a joint lead manager to arrange a series of meeting with fixed-income investors since Thursday, the company said in an exchange filing on Friday. A new five-year senior secured issue may follow, it noted.","<div class=newsTextDataWrapInner><p>KUALA LUMPUR (April 12): Oil-and-gas services firm Yinson Holdings Bhd has hired Nordic investment banks for a potential bond issue of up to US$500 million (RM2.37 billion).</p></div>

<div class=newsTextDataWrapInner><p>Yinson has mandated DNB Markets and Pareto Securities as joint bookrunners, and ABG Sundal Collier ASA as a joint lead manager to arrange a series of meeting with fixed-income investors since Thursday, the company said in an exchange filing on Friday. A new five-year senior secured issue may follow, it noted.</p></div>

<div class=newsTe",新闻,,https://assets.theedgemarkets.com/Yinson_6.jpg,https://assets.theedgemarkets.com/Yinson_6.jpg,52,TheEdge,http://www.theedgemarkets.com/categories/malaysia
Vietnam c.bank to increase gold bar supplies to stablise market,https://www.klsescreener.com/v2/news/view/1307839,2024-04-12 15:30:42,2024-04-12 15:30:42,2024-04-12 15:27:49,HANOI: Vietnam&#039;s central bank said on Friday it will increase gold bar supplies to stablise the market as domestic prices have been much higher than global prices for the past months.The price of gold in the Southeast Asian ...,"<div itemprop=""articleBody"" class=""dable-content-wrapper""><p>HANOI: Vietnam&#039;s central bank said on Friday it will increase gold bar supplies to stablise the market as domestic prices have been much higher than global prices for the past months.</p><p>The price of gold in the Southeast Asian country has gained significantly this year, reaching a peak of 85 million dong (US$3,401.36) per tael on Friday morning, while on the global market each tael was trading at US$2,388.</p><p>One tael is equivalent to 37.5 grams or 1.21 troy ounces.</p><p>The State Bank of Vietnam (SBV), the central bank,",Corporate,,https://assets.nst.com.my/images/articles/viet12_NSTfield_image_listing_featured_v2.var_1712906866.jpg,https://assets.nst.com.my/images/articles/vietnam_1712906859.jpg,79,NST,https://www.nst.com.my/business/corporate
