title,url,created_at,updated_at,published_date,summary,content,category,author,thumbnail_url,image_url,publisher_id,publisher_name,publisher_url
SoftBank swings to Q4 profit in sign of comeback gaining steam,https://www.klsescreener.com/v2/news/view/1324083,2024-05-13 16:00:43,2024-05-13 16:00:43,2024-05-13 15:54:38,"TOKYO: Japanese technology giant SoftBank Group swung to a quarterly profit on Monday from a year earlier, reporting a net profit of 328.9 billion yen ($2.11 billion) for the January-March period.The result comes after Chief Financial Officer Yoshimitsu Goto in February ...","<div itemprop=""articleBody"" class=""dable-content-wrapper""><p>TOKYO: Japanese technology giant SoftBank Group swung to a quarterly profit on Monday from a year earlier, reporting a net profit of 328.9 billion yen ($2.11 billion) for the January-March period.</p><p>The result comes after Chief Financial Officer Yoshimitsu Goto in February declared the tech investment company - long known for volatile earnings and outsized bets on technology start-ups - was on a return to a ""growth trajectory"".</p><p>Although founder and Chief Executive Masayoshi Son has for years talked about the potential for a",Corporate,,https://assets.nst.com.my/images/articles/soft13_NSTfield_image_listing_featured_v2.var_1715586875.jpg,https://assets.nst.com.my/images/articles/softbank_1715586869.jpg,79,NST,https://www.nst.com.my/business/corporate
Mutang Tagal laid to rest at Fairy Park Miri Memorial,https://www.klsescreener.com/v2/news/view/1324089,2024-05-13 16:06:48,2024-05-13 20:49:28,2024-05-13 15:53:16,"Dewan Negara president Senator Datuk Mutang Tagal was laid to rest at the Fairy Park Miri Memorial, 33 kilometres from here on Monday.","<div class=newsTextDataWrapInner><p>MIRI (May 13): Dewan Negara president Senator Datuk Mutang Tagal was laid to rest at the Fairy Park Miri Memorial, 33 kilometres from here on Monday.</p></div><div class=newsTextDataWrapInner><p>The funeral was attended by almost 1,000 people, comprising family and friends, as well as members of the public.</p></div><div class=newsTextDataWrapInner><p>Earlier, Mutang’s body was transported from the BEM Airport Road Church to the BEM Canada Hill Church here for the funeral prayers.</p></div><div class=inPageAd id=div-gpt-ad-inpage></div><div class=newsTextDat",Edge,,https://assets.theedgemarkets.com/FW1369764_KL06_05032024_SENATOR-lpr2_20240510145810_bernama_0.jpg,https://assets.theedgemarkets.com/FW1369764_KL06_05032024_SENATOR-lpr2_20240510145810_bernama_0.jpg,52,TheEdge,http://www.theedgemarkets.com/categories/malaysia
Asian currencies weaken on caution ahead of US inflation data,https://www.klsescreener.com/v2/news/view/1324081,2024-05-13 15:55:27,2024-05-13 15:55:27,2024-05-13 15:48:00,"MOST Asian currencies slipped against the dollar on Monday, as traders awaited U.S. inflation data to assess the Federal Reserve's policy outlook, especially regarding potential interest rate cuts amid shifting market expectations. The Philippine peso slipped 0.7%, having retreated 4.2% so far this year.","<div class=""inline-img""><div class=""story-image""></div></div><div id=""story-body"" class=""story bot-15 relative""><p>MOST Asian currencies slipped against the dollar on Monday, as traders awaited U.S. inflation data to assess the Federal Reserve's policy outlook, especially regarding potential interest rate cuts amid shifting market expectations. The Philippine peso slipped 0.7%, having retreated 4.2% so far this year.</p><p>The Indonesian rupiah fell 0.3% to its lowest level in almost two weeks, below the psychologically important 16,000 per dollar level. The Bangko Sentral ng Pilipinas is slat",,,https://apicms.thestar.com.my/uploads/images/2024/05/13/2692301.jpg,https://apicms.thestar.com.my/uploads/images/2024/05/13/2692301.jpg,28,TheStar,http://www.thestar.com.my/news/latest/?tag=Business
Fire broke out at Frontken’s Kulim unit on Sunday; no injuries reported,https://www.klsescreener.com/v2/news/view/1324087,2024-05-13 16:06:47,2024-05-14 09:17:39,2024-05-13 15:46:36,"Frontken Corp Bhd (KL:FRONTKN) said a fire broke out at one of its facilities on Sunday (May 12) but was brought under control soon after, with no casualties reported.","<div class=newsTextDataWrapInner><p>KUALA LUMPUR (May 13): Frontken Corp Bhd (KL:FRONTKN) said a fire broke out at one of its facilities on Sunday (May 12) but was brought under control soon after, with no casualties reported.</p></div>

<div class=newsTextDataWrapInner><p>In a filing with Bursa Malaysia on Monday, the semiconductor support services firm said the fire broke out at the plant of Frontken Malaysia Sdn Bhd (FMSB) at around 2.45pm. The fire department is currently investigating the incident to ascertain the cause of the fire.</p></div>

<div class=newsTextDataWrapInner><p>“The ",,,https://assets.theedgemarkets.com/frontken-2_20240513154127_frontken.com_.jpg,https://assets.theedgemarkets.com/frontken-2_20240513154127_frontken.com_.jpg,52,TheEdge,http://www.theedgemarkets.com/categories/malaysia
"Serendib says Sarawak Cable’s rescue agreement still in force, cannot be terminated unilaterally",https://www.klsescreener.com/v2/news/view/1324085,2024-05-13 16:06:46,2024-05-13 20:19:37,2024-05-13 15:45:04,Serendib Capital Ltd said on Monday an agreement to rescue Sarawak Cable Bhd (KL:SCABLE) remains in force and cannot be terminated unilaterally.,"<div class=newsTextDataWrapInner><p>KUALA LUMPUR (May 13): Serendib Capital Ltd said on Monday an agreement to rescue Sarawak Cable Bhd (KL:SCABLE) remains in force and cannot be terminated unilaterally.</p></div><div class=newsTextDataWrapInner><p>Sarawak Cable’s announcement last Friday (May 10) of a “strong alternative party” keen on reviving the company was not discussed with any of the directors representing Serendib, the UK-based firm said in a statement. Serendib was also not notified ahead of time as required, it noted.</p></div><div class=newsTextDataWrapInner><p>Serendib intends to f",,,https://assets.theedgemarkets.com/sarawak-cable-logo_20240509133227_annual report_1.jpg,https://assets.theedgemarkets.com/sarawak-cable-logo_20240509133227_annual report_1.jpg,52,TheEdge,http://www.theedgemarkets.com/categories/malaysia
MIDF Amanah maintains 'positive' stance on construction sector,https://www.klsescreener.com/v2/news/view/1324079,2024-05-13 15:49:28,2024-05-13 20:19:34,2024-05-13 15:34:39,"MIDF Amanah Investment Bank Bhd has maintained a “positive” call on the construction sector in view of an expected strong pipeline of civil and private jobs in the second half of 2024 (2H2024).

In a research note on Monday, the investment bank said the industry would see the expected implementation of government projects in 2H2024 in tandem with the allocation under Budget 2024, which had set aside RM90 billion for development expenditure (DE).","<div class=newsTextDataWrapInner><p>KUALA LUMPUR (May 13): MIDF Amanah Investment Bank Bhd has maintained a “positive” call on the construction sector in view of an expected strong pipeline of civil and private jobs in the second half of 2024 (2H2024).</p></div><div class=newsTextDataWrapInner><p>In a research note on Monday, the investment bank said the industry would see the expected implementation of government projects in 2H2024 in tandem with the allocation under Budget 2024, which had set aside RM90 billion for development expenditure (DE).</p></div><div class=newsTextDataWrapInner><p>“F",,,https://assets.theedgemarkets.com/Construction-3_theedgemalaysia_0.jpg,https://assets.theedgemarkets.com/Construction-3_theedgemalaysia_0.jpg,52,TheEdge,http://www.theedgemarkets.com/categories/malaysia
"Malaysia Airlines, Firefly launch global campaign offering competitive airfares",https://www.klsescreener.com/v2/news/view/1324077,2024-05-13 15:49:27,2024-05-13 20:19:31,2024-05-13 15:30:12,"KUALA LUMPUR (May 13): The Malaysia Aviation Group Bhd (MAG) has launched a global campaign that offers one-way flight tickets for as low as RM69 via its airlines Malaysia Airlines and Firefly, to connect travellers to enriching travel experiences.","<div class=newsTextDataWrapInner><p>KUALA LUMPUR (May 13): The Malaysia Aviation Group Bhd (MAG) has launched a global campaign that offers one-way flight tickets for as low as RM69 via its airlines Malaysia Airlines and Firefly, to connect travellers to enriching travel experiences.</p></div><div class=newsTextDataWrapInner><p>Under the campaign themed “Time for Amazing Discoveries” that is available now across 21 markets until May 22, Malaysia Airlines is offering RM69 all-in for a one-way ticket from Kuala Lumpur to Kota Bharu, Kelantan; RM219 all-in for a one-way ticket from Kuala Lumpur t",,,https://assets.theedgemarkets.com/Msia-Airlines-2-MAG-1st-Boeing737-8-aircraft-lands-in-KL-Thurs16112023_20240513152821_malaysiaaviationgroup.jpg,https://assets.theedgemarkets.com/Msia-Airlines-2-MAG-1st-Boeing737-8-aircraft-lands-in-KL-Thurs16112023_20240513152821_malaysiaaviationgroup.jpg,52,TheEdge,http://www.theedgemarkets.com/categories/malaysia
Dubai's Emirates airline posts record full-year profit,https://www.klsescreener.com/v2/news/view/1324065,2024-05-13 15:33:27,2024-05-13 15:33:27,2024-05-13 15:23:00,"DUBAI: Dubai's Emirates airline on Monday reported full-year profit up more than 60% at 17.23 billion dirhams ($4.69 billion), comfortably beating the previous year's 10.6 billion dirhams.","<div class=""inline-img""><div class=""story-image""></div></div><div id=""story-body"" class=""story bot-15 relative""><p>DUBAI: Dubai's Emirates airline on Monday reported full-year profit up more than 60% at 17.23 billion dirhams ($4.69 billion), comfortably beating the previous year's 10.6 billion dirhams.</p><p>The airline carried 51.9 million passengers in the year to March 31, with seat capacity up 21.4%.</p><p>""The business outlook is positive, with projections of strong, sustained demand for international air transport and travel,"" Chairman and Chief Executive Sheikh Ahmed bin Saeed Al Maktou",,,https://apicms.thestar.com.my/uploads/images/2024/05/13/2692264.jpg,https://apicms.thestar.com.my/uploads/images/2024/05/13/2692264.jpg,28,TheStar,http://www.thestar.com.my/news/latest/?tag=Business
Speaker: Dewan Rakyat yet to receive notification on status of six Bersatu MPs,https://www.klsescreener.com/v2/news/view/1324069,2024-05-13 15:34:27,2024-05-13 20:19:28,2024-05-13 15:19:17,"The Dewan Rakyat has yet to receive any notification from Bersatu concerning the status of six of its Members of Parliament who had pledged support to Prime Minister Datuk Seri Anwar Ibrahim, following an amendment to the party constitution recently.","<div class=newsTextDataWrapInner><p>KUALA LUMPUR (May 13): The Dewan Rakyat has yet to receive any notification from Bersatu concerning the status of six of its Members of Parliament who had pledged support to Prime Minister Datuk Seri Anwar Ibrahim, following an amendment to the party constitution recently.</p></div><div class=newsTextDataWrapInner><p>Speaker&nbsp;Tan Sri Dr Johari Abdul said that as such, the status of the six MPs remains unchanged.</p></div><div class=newsTextDataWrapInner><p>“As long as it does not involve Parliament, I shall not be bothered. It’s their political issue, an",,,https://assets.theedgemarkets.com/5654427B-8546-4F12-9D60-0C51CFC02D16 Datuk JOhari Abdul Mohamad Shahril Basri_20230527183323_theedgemalaysia_1.jpg,https://assets.theedgemarkets.com/5654427B-8546-4F12-9D60-0C51CFC02D16 Datuk JOhari Abdul Mohamad Shahril Basri_20230527183323_theedgemalaysia_1.jpg,52,TheEdge,http://www.theedgemarkets.com/categories/malaysia
Construction sector expands 14.2 pct to RM36.8 bln in 1Q - DoSM,https://www.klsescreener.com/v2/news/view/1324059,2024-05-13 15:20:47,2024-05-13 15:20:47,2024-05-13 15:19:11,"KUALA LUMPUR: The construction sector work done value soared by 14.2 per cent year-on-year (y-o-y), amounting to RM36.8 billion in the first quarter of 2024 (1Q 2024), said the Department of Statistics Malaysia (DoSM).Chief statistician Datuk Seri Dr Mohd Uzir Mahidin said ...","<div itemprop=""articleBody"" class=""dable-content-wrapper""><p>KUALA LUMPUR: The construction sector work done value soared by 14.2 per cent year-on-year (y-o-y), amounting to RM36.8 billion in the first quarter of 2024 (1Q 2024), said the Department of Statistics Malaysia (DoSM).</p><p>Chief statistician Datuk Seri Dr Mohd Uzir Mahidin said the value of work done in the construction sector continued its upward trajectory compared to 4Q 2023&#039;s 6.8 per cent.</p><p>""The vibrant performance was attributable to the stronger expansion in the civil engineering sub-sector, which was at 24.7 per ce",Economy,,https://assets.nst.com.my/images/articles/cons13_NSTfield_image_listing_featured_v2.var_1715584747.jpg,https://assets.nst.com.my/images/articles/Cegah_1715584740.jpg,81,NST,https://www.nst.com.my/business/economy
What it takes to stay secure in the multi-cloud,https://www.klsescreener.com/v2/news/view/1324067,2024-05-13 15:34:26,2024-05-13 20:04:34,2024-05-13 15:16:01,"(May 13): Flexibility, innovation and cost-efficiency — these factors are often what springs to mind when thinking about multi-clouds. However, with transformation projects and workloads spread out across multiple platforms and locations, clearly defined boundaries are gone — and organisations ac...","<div class=newsTextDataWrapInner><p>(May 13): Flexibility, innovation and cost-efficiency — these factors are often what springs to mind when thinking about multi-clouds. However, with transformation projects and workloads spread out across multiple platforms and locations, clearly defined boundaries are gone — and organisations across the Asia Pacific are understandably worried.</p></div><div class=newsTextDataWrapInner><p>A Rackspace Technology-Microsoft joint survey found that cloud attacks were the chief concern for 63% of organisations in the region. Meanwhile, PwC finds that 40% of Malay",Edge,,https://assets.theedgemarkets.com/sandeep.jpg,https://assets.theedgemarkets.com/sandeep.jpg,52,TheEdge,http://www.theedgemarkets.com/categories/malaysia
"Immigration Dept, Home Ministry exploring QR code system at country’s entry points",https://www.klsescreener.com/v2/news/view/1324055,2024-05-13 15:17:13,2024-05-13 19:49:36,2024-05-13 15:11:54,"PUTRAJAYA (May 13): The Immigration Department and Home Ministry are exploring the implementation of a quick response (QR) code system at several main entry points of the country, to address congestion issues.","<div class=newsTextDataWrapInner><p>PUTRAJAYA (May 13): The Immigration Department&nbsp;and&nbsp;Home Ministry&nbsp;are exploring the implementation&nbsp;of a quick response (QR) code system&nbsp;at several main entry points of the country, to address congestion issues.</p></div><div class=newsTextDataWrapInner><p>Immigration director-general&nbsp;Datuk Ruslin Jusoh said studies on the use of QR codes at the country’s entry points have been carried out, with the current phase focusing on testing.</p></div><div class=newsTextDataWrapInner><p>He said that details about the testing phase would be",Edge,,https://assets.theedgemarkets.com/20220401-KLIA-open-border-ZHD-9088_20240513150421_theedgemalaysia.jpg,https://assets.theedgemarkets.com/20220401-KLIA-open-border-ZHD-9088_20240513150421_theedgemalaysia.jpg,52,TheEdge,http://www.theedgemarkets.com/categories/malaysia
TalentBank unveils list of universities favoured by employers,https://www.klsescreener.com/v2/news/view/1324049,2024-05-13 15:10:18,2024-05-13 15:10:18,2024-05-13 15:09:42,"KUALA LUMPUR: Talentbank has unveiled its 2024 Employers&#039; Choice of University list which offers future university students perspectives on which institutions are favoured by employers.This will help them make well-informed decisions to boost their job prospects after graduating, TalentBank said....","<div itemprop=""articleBody"" class=""dable-content-wrapper""><p>KUALA LUMPUR: Talentbank has unveiled its 2024 Employers&#039; Choice of University list which offers future university students perspectives on which institutions are favoured by employers.</p><p>This will help them make well-informed decisions to boost their job prospects after graduating, TalentBank said.</p><p>The insights provided are drawn from the comprehensive analysis of the Talentbank National Graduate Employability Index (GE Index), which evaluates the employability of graduates throughout Malaysia.</p><p>The GE Index is a",Corporate,,https://assets.nst.com.my/images/articles/telen13_NSTfield_image_listing_featured_v2.var_1715584179.jpg,https://assets.nst.com.my/images/articles/research_students_1715584172.jpg,79,NST,https://www.nst.com.my/business/corporate
Emirates Group announces record US$5.1 bln in annual profit,https://www.klsescreener.com/v2/news/view/1324047,2024-05-13 15:10:18,2024-05-13 15:10:18,2024-05-13 15:00:53,"DUBAI: Dubai&#039;s Emirates Group announced annual profits of US$5.1 billion on Monday, a rise of 71 per cent, as the airline company set a new record for the second year in a row.""The Emirates Group has once again raised ...","<div itemprop=""articleBody"" class=""dable-content-wrapper""><p>DUBAI: Dubai&#039;s Emirates Group announced annual profits of US$5.1 billion on Monday, a rise of 71 per cent, as the airline company set a new record for the second year in a row.</p><p>""The Emirates Group has once again raised the bar to deliver a new record performance,"" said chairman and chief executive Sheikh Ahmed bin Saeed Al Maktoum.</p><p>State-owned Emirates Group, operator of the world&#039;s largest long-haul carrier, announced a record US$3.0 billion in profits last year as it returned to the black after the pandemic.</",Corporate,,https://assets.nst.com.my/images/articles/emirate13_NSTfield_image_listing_featured_v2.var_1715583650.jpg,https://assets.nst.com.my/images/articles/TECHZMXJDZIZ3MSPVCWBOGTK6Y_1715583643.jpg,79,NST,https://www.nst.com.my/business/corporate
What’s next for SEGi after Navis’ exit?,https://www.klsescreener.com/v2/news/view/1324057,2024-05-13 15:19:22,2024-05-15 15:01:47,2024-05-13 15:00:00,SEG International Bhd (SEGi) received a notice of mandatory general offer (MGO) for 45 sen per share last week. The last time that the tertiary education group got an MGO was 12 years ago when Navis Capital Partners Ltd wanted to take it private at RM1.714 per share and RM1.214 per warrant in mid...,"<div class=newsTextDataWrapInner><p><span style=""font-style: italics;"">This article first appeared in The Edge Malaysia Weekly on May 6, 2024 - May 12, 2024</span></p></div><div class=newsTextDataWrapInner><p>SEG International Bhd (SEGi) received a notice of mandatory general offer (MGO) for 45 sen per share last week. The last time that the tertiary education group got an MGO was 12 years ago when Navis Capital Partners Ltd wanted to take it private at RM1.714 per share and RM1.214 per warrant in mid-May 2012.</p></div>

<div class=newsTextDataWrapInner><p>The latest MGO was launched by lon",Edge,,https://assets.theedgemarkets.com/SEGI_TEM1522_20240507162217_theedgemalaysia.jpg,https://assets.theedgemarkets.com/SEGI_TEM1522_20240507162217_theedgemalaysia.jpg,54,TheEdge,http://www.theedgemarkets.com/options/edge
Dollar steady as US inflation data takes spotlight,https://www.klsescreener.com/v2/news/view/1324033,2024-05-13 14:50:45,2024-05-13 14:50:45,2024-05-13 14:50:26,TOKYO: The dollar consolidated against major peers on Monday as market participants awaited U.S. inflation data to assess the prospects of interest rate cuts this year.After a softer-than-expected U.S. payrolls report for April and seemingly dovish Federal ...,"<div itemprop=""articleBody"" class=""dable-content-wrapper""><p>TOKYO: The dollar consolidated against major peers on Monday as market participants awaited U.S. inflation data to assess the prospects of interest rate cuts this year.</p><p>After a softer-than-expected U.S. payrolls report for April and seemingly dovish Federal Reserve policy announcement earlier this month, expectations have increased for rate reductions this year.</p><p>Markets have priced in a 61.2% chance of some degree of rate reductions to begin at the Fed&#039;s September meeting, with about 50 basis points of cuts in total ",Economy,,https://assets.nst.com.my/images/articles/doll13_NSTfield_image_listing_featured_v2.var_1715583023.jpg,https://assets.nst.com.my/images/articles/billie-dollar-money-background_1715583014.jpg,81,NST,https://www.nst.com.my/business/economy
Paramount Corp aims to acquire more land to sustain growth,https://www.klsescreener.com/v2/news/view/1324043,2024-05-13 15:04:39,2024-05-13 21:49:28,2024-05-13 14:50:06,"Paramount Corp Bhd (KL:PARAMON) will continue to invest and grow its land bank in Malaysia to sustain its growth, while looking for opportunities to expand overseas.","<div class=newsTextDataWrapInner><p>PETALING JAYA (May 13): Paramount Corp&nbsp;Bhd (KL:PARAMON) will continue to invest and grow its land bank&nbsp;in Malaysia to sustain its growth, while looking for opportunities to expand overseas.</p></div><div class=newsTextDataWrapInner><p>Group chief executive officer and director Jeffrey Chew Sun Teong said even at a high single-digit&nbsp;growth target for the Malaysian market, Paramount would need to buy more land&nbsp;in order to launch new projects.&nbsp;</p></div><div class=newsTextDataWrapInner><p>As for the group's overseas investments, he said",新闻,,https://assets.theedgemarkets.com/20240305_PEO_PARAMOUNT CORP BHD BRIEFING ON FY2023_SY (9) (1)_20240513144544_theedgemalaysia.jpg,https://assets.theedgemarkets.com/20240305_PEO_PARAMOUNT CORP BHD BRIEFING ON FY2023_SY (9) (1)_20240513144544_theedgemalaysia.jpg,52,TheEdge,http://www.theedgemarkets.com/categories/malaysia
Gold prices tick down as traders brace for key US inflation data,https://www.klsescreener.com/v2/news/view/1324031,2024-05-13 14:50:43,2024-05-13 14:50:43,2024-05-13 14:44:31,"Gold prices inched down on Monday as investors awaited key U.S. inflation reports, which could shed more light on the timing of the Federal Reserve&#039;s first rate cut.Spot gold fell 0.2 per cent at US$2,354.77 per ounce by 0448 ...","<div itemprop=""articleBody"" class=""dable-content-wrapper""><p>Gold prices inched down on Monday as investors awaited key U.S. inflation reports, which could shed more light on the timing of the Federal Reserve&#039;s first rate cut.</p><p>Spot gold fell 0.2 per cent at US$2,354.77 per ounce by 0448 GMT. Prices hit a two-week high in the previous session.</p><p>U.S. gold futures fell 0.6 per cent to US$2,361.</p><p>The U.S. producer price index (PPI) data is scheduled for release on Tuesday, followed by the consumer price index (CPI) on Wednesday.</p><p>Median forecasts are for core consumer pri",Economy,,https://assets.nst.com.my/images/articles/gold13_NSTfield_image_listing_featured_v2.var_1715582668.jpg,https://assets.nst.com.my/images/articles/E3CJ5OY5IZMR5KFSKDSO2RPM3I_1715582661.jpg,81,NST,https://www.nst.com.my/business/economy
"Chinese e-commerce giants face delicate balance between discounts, profit",https://www.klsescreener.com/v2/news/view/1324029,2024-05-13 14:50:25,2024-05-13 14:50:25,2024-05-13 14:41:04,"SHANGHAI: Quarterly earnings reports from Chinese e-commerce giants Alibaba and JD.com this week will be closely watched as barometers for the mood of consumers in the world&#039;s second-largest economy.Both firms, which combined account for about 69% of China&#039;...","<div itemprop=""articleBody"" class=""dable-content-wrapper""><p>SHANGHAI: Quarterly earnings reports from Chinese e-commerce giants Alibaba and JD.com this week will be closely watched as barometers for the mood of consumers in the world&#039;s second-largest economy.</p><p>Both firms, which combined account for about 69% of China&#039;s e-commerce market revenue, according to DBS estimates, have faced increasing competition in recent years from low-cost platforms, such as PDD Holding&#039;s Pinduoduo and ByteDance-owned Douyin.</p><p>Chinese consumers are seeking discounts and lower-cost shoppin",Corporate,,https://assets.nst.com.my/images/articles/ecom13_NSTfield_image_listing_featured_v2.var_1715582461.jpg,https://assets.nst.com.my/images/articles/21hmONLINEshop_1715582453.jpg,79,NST,https://www.nst.com.my/business/corporate
"Bank Negara, Bank of Korea renew bilateral swap arrangement",https://www.klsescreener.com/v2/news/view/1324023,2024-05-13 14:44:25,2024-05-13 14:44:25,2024-05-13 14:40:00,KUALA LUMPUR: Bank Negara and the Bank of Korea have renewed the bilateral swap arrangement (BSA) for a period of three years.,"<div class=""inline-img""><div class=""story-image""></div></div><div id=""story-body"" class=""story bot-15 relative""><p>KUALA LUMPUR: Bank Negara and the Bank of Korea have renewed the bilateral swap arrangement (BSA) for a period of three years.</p><p>In a joint statement, the central banks said the size of the arrangement was maintained at RM15bil/KRW5 trillion, which follows the BSA signed in 2020.</p><p>It said the swap arrangement can be extended by mutual agreement between the two banks.</p><p>""The BSA is aimed at further promoting bilateral trade between the two countries and strengthening t",,,https://apicms.thestar.com.my/uploads/images/2024/05/13/2692048.jpg,https://apicms.thestar.com.my/uploads/images/2024/05/13/2692048.jpg,28,TheStar,http://www.thestar.com.my/news/latest/?tag=Business
