title,url,created_at,updated_at,published_date,summary,content,category,author,thumbnail_url,image_url,publisher_id,publisher_name,publisher_url
Mida: Sarawak Petchem’s RM7b complex to reinforce country’s status as top methanol producer in Apac,https://www.klsescreener.com/v2/news/view/1363099,2024-07-23 20:47:06,2024-07-24 12:19:40,2024-07-23 20:41:50,"KUALA LUMPUR (July 23): The establishment of Sarawak Petchem Sdn Bhd’s RM7 billion methanol complex is a defining milestone in helping establish Malaysia as a leading methanol producer in the Asia-Pacific (Apac) region, says Investment, Trade, and Industry Minister Tengku Datuk Seri Zafrul Abdul Aziz.","<div class=newsTextDataWrapInner><p>KUALA LUMPUR (July 23): The establishment of Sarawak Petchem Sdn Bhd’s RM7 billion methanol complex is a defining milestone in&nbsp;helping&nbsp;establish Malaysia as a leading methanol producer in the Asia-Pacific (Apac) region, says Investment, Trade, and Industry Minister Tengku Datuk Seri Zafrul Abdul Aziz.</p></div>

<div class=newsTextDataWrapInner><p>“This will not only advance Malaysia’s capabilities in the chemical industry, as envisaged by the Chemical Industry Roadmap (CIR) 2030, but also drive job creation and stimulate our economy by providing",,,https://assets.theedgemarkets.com/20240718-PC-Miti-2Q-report-card-release-Tengku-Zafrul-ZHD-318_20240723203502_theedgemalaysia.jpg,https://assets.theedgemarkets.com/20240718-PC-Miti-2Q-report-card-release-Tengku-Zafrul-ZHD-318_20240723203502_theedgemalaysia.jpg,52,TheEdge,http://www.theedgemarkets.com/categories/malaysia
EVENING 5: Five things you need to know today,https://www.klsescreener.com/v2/news/view/1363125,2024-07-23 21:33:59,2024-07-24 12:15:25,2024-07-23 20:39:46,Here’s a quick look at some of the stories that made headlines today.,"<div class=""ceonothumb mx-auto pb-5"">
<div>
<div class=""iframe-w100-wrapper""><iframe allowfullscreen="""" frameborder=""0"" height=""500"" src=""https://www.youtube.com/embed/Z4DHhVLPr0U?si=EJn8MQBYV-CAV27h&amp;rel=0&amp;autoplay=1&amp;mute=1"" width=""840""></iframe></div>
</div>

<div class=newsTextDataWrapInner><p class=""thumb-cap"">EVENING 5: IOI Properties buys Tropicana Gardens Mall</p></div><div class=inPageAd id=div-gpt-ad-inpage></div>
</div>

<div class=newsTextDataWrapInner><p>Dirty dealings. Corporate battles. Consumer woes. Here are five things you need to know today.</p></div>

<d",Edge,,https://assets.theedgemarkets.com/TEM THUMBNAIL FINAL_1071.jpg,https://assets.theedgemarkets.com/TEM THUMBNAIL FINAL_1071.jpg,52,TheEdge,http://www.theedgemarkets.com/categories/malaysia
'BIizmatch Mega PKNS' Platform for entrepreneurs to expand business networks,https://www.klsescreener.com/v2/news/view/1363079,2024-07-23 20:34:20,2024-07-24 12:04:52,2024-07-23 20:28:46,"The Selangor State Development Corporation (PKNS) has organised the Bizmatch Mega PKNS: Himpunan Usahawan Selangor 2024 programme, a platform for entrepreneurs to enhance their business networks.","<div class=newsTextDataWrapInner><p>SHAH ALAM (July 23): The Selangor State Development Corporation (PKNS) has organised the Bizmatch Mega PKNS: Himpunan Usahawan Selangor 2024 programme, a platform for entrepreneurs to enhance their business networks.</p></div>

<div class=newsTextDataWrapInner><p>The second edition of the programme, organised by the PKNS Business Development Division, brought together 1,500 entrepreneurs from diverse sectors and offered participants the chance to meet and interact directly with over 30 selected agencies specialising in finance and entrepreneurship, which c",新闻,,https://assets.theedgemarkets.com/pkns.jpg,https://assets.theedgemarkets.com/pkns.jpg,52,TheEdge,http://www.theedgemarkets.com/categories/malaysia
Korea’s OCI said to be weighing RM1.5b IPO for Malaysian unit,https://www.klsescreener.com/v2/news/view/1363077,2024-07-23 20:34:19,2024-07-24 11:47:35,2024-07-23 20:27:31,"OCI Holdings Co is considering listing its Malaysian polysilicon unit on the Kuala Lumpur stock exchange to raise as much as RM1.5 billion, according to people familiar with the matter.","<div class=newsTextDataWrapInner><p>(July 23): OCI Holdings Co is considering listing its Malaysian polysilicon unit on the Kuala Lumpur stock exchange to raise as much as RM1.5 billion, according to people familiar with the matter.</p></div>

<div class=newsTextDataWrapInner><p>South Korea-based OCI is talking to financial advisers on a potential initial public offering that could value OCI Malaysia at up to RM6 billion, the people said, asking not to be identified as the process is private.</p></div>

<div class=newsTextDataWrapInner><p>An IPO to raise RM1 billion to RM1.5 billion may ta",新闻,,https://assets.theedgemarkets.com/img_hc0501_02.jpg,https://assets.theedgemarkets.com/img_hc0501_02.jpg,52,TheEdge,http://www.theedgemarkets.com/categories/malaysia
GHL's shares set to be suspended as NTT Data Japan's takeover offer closes,https://www.klsescreener.com/v2/news/view/1363053,2024-07-23 20:19:09,2024-07-24 11:34:55,2024-07-23 20:05:25,GHL Systems Bhd (KL:GHLSYS) said trading in its shares is set to be suspended next week after NTT Data Japan Corp secured 98.8% of GHL's shares at the close of the Japanese group's takeover offer for the payments services provider.,"<div class=newsTextDataWrapInner><p>KUALA LUMPUR (July 23): GHL Systems Bhd (KL:GHLSYS) said trading in its shares is set to be suspended next week after NTT Data Japan Corp secured 98.8% of GHL's shares at the close of the Japanese group's takeover offer for the payments services provider.</p></div>

<div class=newsTextDataWrapInner><p>“The offeror does not intend to maintain the listing status of GHL on the Main Market of Bursa Securities. In view of this, Bursa Securities will suspend the trading of the shares upon the expiry of five market days from the extended closing date,” GHL said i",Edge,,https://assets.theedgemarkets.com/GHL-2_NTT data_ghl.com_.jpg,https://assets.theedgemarkets.com/GHL-2_NTT data_ghl.com_.jpg,52,TheEdge,http://www.theedgemarkets.com/categories/malaysia
Malaysia's economic growth at high side of 5.0% in 2024 — Manulife IM,https://www.klsescreener.com/v2/news/view/1363051,2024-07-23 20:19:08,2024-07-24 10:49:49,2024-07-23 20:02:04,"Malaysia's economic growth will be on the high side of 5.0%, driven by a number of government initiatives and in line with the growth trajectory of other Asean countries, said Manulife Investment Management (Manulife IM) today.","<div class=newsTextDataWrapInner><p>KUALA LUMPUR (July 23): Malaysia's economic growth will be on the high side of 5.0%, driven by a number of government initiatives and in line with the growth trajectory of other Asean countries, said Manulife Investment Management (Manulife IM) today.</p></div>

<div class=newsTextDataWrapInner><p>Its senior portfolio manager on equities Marco Giubin said, however, that it would still have to be cognisant of the inflation rate for this year.</p></div>

<div class=newsTextDataWrapInner><p>“We don't expect Malaysia, in particular, to cut rates this year. W",新闻,,https://assets.theedgemarkets.com/manulife IM.jpg,https://assets.theedgemarkets.com/manulife IM.jpg,52,TheEdge,http://www.theedgemarkets.com/categories/malaysia
Tropicana to sell Tropicana Gardens Mall to IOI Properties for RM680mil,https://www.klsescreener.com/v2/news/view/1363039,2024-07-23 20:11:25,2024-07-23 20:11:25,2024-07-23 19:56:00,KUALA LUMPUR: Tropicana Corp Bhd has signed a sale and purchase agreement (SPA) with IOI Mall Damansara Sdn Bhd (IOI MD) for the sale of Tropicana Gardens Mall (TGM) for RM680mil.,"<div class=""inline-img""><div class=""story-image""><p class=""caption"">The centre court of Tropicana Gardens Mall</p></div></div><div id=""story-body"" class=""story bot-15 relative""><p>KUALA LUMPUR: <a href=""/business/marketwatch/stocks/?qcounter=TROP"" target=""_blank"">Tropicana Corp Bhd</a><a href=""http://charts.thestar.com.my/?s=TROP"" target=""_blank""><img class=""go-chart"" src=""https://cdn.thestar.com.my/Themes/img/chart.png""></a> has signed a sale and purchase agreement (SPA) with IOI Mall Damansara Sdn Bhd (IOI MD) for the sale of Tropicana Gardens Mall for RM680mil.</p><p>In a statement, Tropica",,,https://apicms.thestar.com.my/uploads/images/2024/07/23/2818331.jpg,https://apicms.thestar.com.my/uploads/images/2024/07/23/2818331.jpg,28,TheStar,http://www.thestar.com.my/news/latest/?tag=Business
"IOI Properties snaps up Tropicana Gardens Mall for RM680m, third deal with Tropicana Corp in eight months",https://www.klsescreener.com/v2/news/view/1363033,2024-07-23 20:04:26,2024-07-24 14:19:24,2024-07-23 19:53:09,"IOI Properties Group Bhd (KL:IOIPG) is continuing its buying spree with the purchase of Tropicana Gardens Mall in Petaling Jaya for RM680 million, cash, from Tropicana Corp Bhd (KL:TROP).","<div class=newsTextDataWrapInner><p>KUALA LUMPUR (July 23): IOI Properties Group Bhd (KL:IOIPG) is continuing its buying spree with the purchase of Tropicana Gardens Mall in Petaling Jaya for RM680 million, cash, from Tropicana Corp Bhd's (KL:TROP) 70% owned unit Tropicana Indah Sdn Bhd.</p></div>

<div class=newsTextDataWrapInner><p>Perbadanan Kemajuan Negeri Selangor (PKNS) owns the remaining 30% in Tropicana Indah.&nbsp;</p></div>

<div class=newsTextDataWrapInner><p>This marks its third acquisition over the last eight months. All in, IOI Properties has bought three assets worth a total",新闻,,//images.weserv.nl/?url=https://assets.theedgemarkets.com/Tropicana-Gardens-IOI_20240723195525_theedgemalaysia.jpg&w=300,https://assets.theedgemarkets.com/Tropicana-Gardens-IOI_20240723195525_theedgemalaysia.jpg,52,TheEdge,http://www.theedgemarkets.com/categories/malaysia
Malaysia may still hit 2024 deficit target without RON95 subsidy cut — Maybank IB,https://www.klsescreener.com/v2/news/view/1363029,2024-07-23 19:51:32,2024-07-24 13:04:41,2024-07-23 19:42:21,"Malaysia’s budget deficit target of 4.3% for 2024 could still be achievable even if the subsidy rationalisation for RON95 petrol were to be postponed to next year, according to Maybank Investment Bank (Maybank IB) chief economist Suhaimi Ilias.","<div class=newsTextDataWrapInner><p>KUALA LUMPUR (July 23): Malaysia’s budget deficit target of 4.3% for 2024 could still be achievable even if the subsidy rationalisation for RON95 petrol were to be postponed to next year, according to Maybank Investment Bank (Maybank IB) chief economist Suhaimi Ilias.</p></div>

<div class=newsTextDataWrapInner><p>“It is still possible, especially [with Malaysia’s] economic growth this year,” Suhaimi told a virtual media briefing on Malaysia’s outlook for the second half of 2024 (2HFY2024), noting the potential of Petroliam Nasional Bhd (Petronas) declarin",Edge,,https://assets.theedgemarkets.com/390289645-KL-KLCC-Malaysia-economy-GDP-px-Sun14082022_20240723193037_bloomberg.jpg,https://assets.theedgemarkets.com/MSY_0044_20240712111054_petrol_theedgemalaysia_0.jpg,52,TheEdge,http://www.theedgemarkets.com/categories/malaysia
Axis REIT records higher 2Q net profit of RM38.95mil,https://www.klsescreener.com/v2/news/view/1363021,2024-07-23 19:44:25,2024-07-23 19:44:25,2024-07-23 19:35:00,"KUALA LUMPUR: Axis Real Estate Investment Trust (REIT) recorded a higher net profit of RM38.95 million in the second quarter ended June 30, 2024 (2Q) compared with RM34.72 million in the same period last year.","<div class=""inline-img""><div class=""story-image""></div></div><div id=""story-body"" class=""story bot-15 relative""><p>KUALA LUMPUR: Axis Real Estate Investment Trust (REIT) recorded a higher net profit of RM38.95 million in the second quarter ended June 30, 2024 (2Q) compared with RM34.72 million in the same period last year.</p><p>Revenue also increased to RM76.53 million from RM68.45 million previously, it said in a filing with Bursa Malaysia today.</p><p>In a separate statement, Axis-REIT said it posted a 12.0 per cent year-on-year increase in property income to RM76.0 million and a 12.2 per c",,,https://apicms.thestar.com.my/uploads/images/2024/07/23/2818243.jpg,https://apicms.thestar.com.my/uploads/images/2024/07/23/2818243.jpg,28,TheStar,http://www.thestar.com.my/news/latest/?tag=Business
Ten suspects in RM24.7 mil fraudulent withdrawals case to be charged in KK,https://www.klsescreener.com/v2/news/view/1363017,2024-07-23 19:32:11,2024-07-24 10:45:27,2024-07-23 19:26:06,"Ten individuals, including a bank manager, believed to be involved in fraudulent withdrawals of RM24.7 million from fixed deposit accounts of bank account holders, will be charged in Kota Kinabalu on Thursday.","<div class=newsTextDataWrapInner><p>KUALA LUMPUR (July 23): Ten individuals, including a bank manager, believed to be involved in fraudulent withdrawals of RM24.7 million from fixed deposit accounts of bank account holders, will be charged in Kota Kinabalu on Thursday.</p></div>

<div class=newsTextDataWrapInner><p>Bukit Aman Commercial Crime Investigation Department (CCID) director Datuk Seri Ramli Mohamed Yoosuf said nine suspects would be charged under Section 130V(1) of the Penal Code (for being a member of an organised crime group) and one other under the National Registration Regulatio",Edge,,https://assets.theedgemarkets.com/gavel_3.png,https://assets.theedgemarkets.com/gavel_3.png,52,TheEdge,http://www.theedgemarkets.com/categories/malaysia
Ringgit stays higher against greenback ahead of Malaysia's CPI data,https://www.klsescreener.com/v2/news/view/1363011,2024-07-23 19:22:23,2024-07-23 19:22:23,2024-07-23 19:16:00,"KUALA LUMPUR: The ringgit ended higher against the US dollar today on renewed buying interest ahead of Malaysia’s consumer price index (CPI) report, said an analyst.","<div class=""inline-img""><div class=""story-image""></div></div><div id=""story-body"" class=""story bot-15 relative""><p>KUALA LUMPUR: The ringgit ended higher against the US dollar today on renewed buying interest ahead of Malaysia’s consumer price index (CPI) report, said an analyst.</p><p>The CPI report is scheduled to be released by the Department of Statistics Malaysia (DoSM) tomorrow.</p><p>At 6 pm, the ringgit increased by 85 basis points to 4.6720/6745 versus the US dollar from Monday’s closing of 4.6805/6835.</p><p>Bank Muamalat Malaysia Bhd chief economist Dr Mohd Afzanizam Abdul Rashid sa",,,https://apicms.thestar.com.my/uploads/images/2024/07/23/2818232.jpg,https://apicms.thestar.com.my/uploads/images/2024/07/23/2818232.jpg,28,TheStar,http://www.thestar.com.my/news/latest/?tag=Business
"WhatsApp, Telegram operators must be more responsible in addressing online misconduct — Fahmi",https://www.klsescreener.com/v2/news/view/1363015,2024-07-23 19:32:10,2024-07-24 10:34:57,2024-07-23 19:15:30,"Operators of Telegram and WhatsApp need to be more responsible in ensuring that no criminal misconduct is committed on the platforms, says Communications Minister Fahmi Fadzil.","<div class=newsTextDataWrapInner><p>KUALA LUMPUR (July 23): Operators of Telegram and WhatsApp need to be more responsible in ensuring that no criminal misconduct is committed on the platforms, says Communications Minister Fahmi Fadzil.</p></div>

<div class=newsTextDataWrapInner><p>He said that based on reports from the Bukit Aman Sexual, Women and Children Crime Investigation Division (D11), WhatsApp is found to be widely misused for the purpose of sexual grooming.</p></div>

<div class=newsTextDataWrapInner><p>“As for Telegram, we have also received many complaints, including from forme",,,https://assets.theedgemarkets.com/fahmi_20240709195334_theedgemalaysia_0.jpg,https://assets.theedgemarkets.com/fahmi_20240709195334_theedgemalaysia_0.jpg,52,TheEdge,http://www.theedgemarkets.com/categories/malaysia
Malaysia&#039;s corporate earnings may grow 15.5pct in second half: Maybank IB,https://www.klsescreener.com/v2/news/view/1363007,2024-07-23 19:20:30,2024-07-23 19:20:30,2024-07-23 19:11:10,KUALA LUMPUR: Corporate Malaysia&#039;s equities are expected return to growth in the second half of 2024 despite high volatility of foreign fund flows.Maybank Investment Bank Bhd head of equity research Wong Chew Hann also saiid listed companies&#039; earnings are ...,"<div itemprop=""articleBody"" class=""dable-content-wrapper""><p>KUALA LUMPUR: Corporate Malaysia&#039;s equities are expected return to growth in the second half of 2024 despite high volatility of foreign fund flows.</p><p>Maybank Investment Bank Bhd head of equity research Wong Chew Hann also saiid listed companies&#039; earnings are expected to expand 15.5 per cent after growing 20.1 per cent in the first half.</p><p>She said the earnings momentum of companies under its coverage are receiving an uplift.</p><p>""We are pretty comforted that our 15.5 per cent earnings forecast is actually quite re",Corporate,,https://assets.nst.com.my/images/articles/Earn23_NSTfield_image_listing_featured_v2.var_1721733067.jpg,https://assets.nst.com.my/images/articles/HQ190324AZ002_%283%29_1721733060.jpg,79,NST,https://www.nst.com.my/business/corporate
"Axis REIT's NPI up 12.9%, declares 2.25 sen income distribution",https://www.klsescreener.com/v2/news/view/1363001,2024-07-23 19:06:44,2024-07-24 09:35:09,2024-07-23 18:56:45,"Axis Real Estate Investment Trust's (KL:AXREIT) (Axis REIT) second quarter net property income (NPI) increased 12.86% to RM65.95 million from RM58.44 million a year ago, on the back of higher revenue.","<div class=newsTextDataWrapInner><p>KUALA LUMPUR (July 23): Axis Real Estate Investment Trust's (KL:AXREIT) (Axis REIT) second quarter net property income (NPI) increased 12.86% to RM65.95 million from RM58.44 million a year ago, on the back of higher revenue.</p></div>

<div class=newsTextDataWrapInner><p>Revenue for the quarter ended June 30, 2024, rose 11.8% to RM76.53 million from RM68.45 million in the previous corresponding quarter, Axis REIT's bourse filing showed.</p></div>

<div class=newsTextDataWrapInner><p>The REIT, which focuses on industrial assets, declared a second interim ",,,https://assets.theedgemarkets.com/axis reit.jpg,https://assets.theedgemarkets.com/axis reit.jpg,52,TheEdge,http://www.theedgemarkets.com/categories/malaysia
"MARKET PULSE PM JULY 23,2024 [WATCH]",https://www.klsescreener.com/v2/news/view/1362995,2024-07-23 18:40:09,2024-07-23 18:40:09,2024-07-23 18:35:32,"KUALA LUMPUR: News on stock, crypto and ringgit moves.Buying in blue chips helped the key index regain some of its losses from yesterday to close just shy of the one thousand six hundred thirty mark as bargain hunters swooped ...","<div itemprop=""articleBody"" class=""dable-content-wrapper""><p>KUALA LUMPUR: News on stock, crypto and ringgit moves.</p><p>Buying in blue chips helped the key index regain some of its losses from yesterday to close just shy of the one thousand six hundred thirty mark as bargain hunters swooped in.</p><p> It will likely trade within the one thousand six hundred ten and one thousand six hundred forty range this week.</p><p>The most traded cryptocurrency, Bitcoin, was trending upwards after staying in the red along with most other cryptocurrencies earlier. It was trading at three hundred twelve th",Corporate,,https://assets.nst.com.my/images/articles/mp23pm_NSTfield_image_listing_featured_v2.var_1721730928.jpg,https://assets.nst.com.my/images/articles/HQ190324AZ005_%282%29_1721730920.jpg,79,NST,https://www.nst.com.my/business/corporate
Uzma secures RM19 mil contract for infill well preparation services in Thailand,https://www.klsescreener.com/v2/news/view/1362997,2024-07-23 18:49:12,2024-07-24 09:30:33,2024-07-23 18:34:34,Uzma Bhd (KL:UZMA) said on Tuesday that its Thai unit has secured a RM19 million contract to provide infill well preparation services for offshore platforms.,"<div class=newsTextDataWrapInner><p>KUALA LUMPUR (July 23): Uzma Bhd (KL:UZMA) said on Tuesday that its Thai unit has secured a RM19 million contract to provide infill well preparation services for offshore platforms.</p></div>

<div class=newsTextDataWrapInner><p>The one-year contract, awarded by PTTEP Energy Development Company Ltd to Uzma's subsidiary MMSVS Group Holding Co Ltd Thailand, is valid until July 15, 2025, according to Uzma's bourse filing.</p></div>

<div class=newsTextDataWrapInner><p>The scope of work includes providing hydraulic workover unit equipment and services for in",新闻,,https://assets.theedgemarkets.com/Uzma.jpg,https://assets.theedgemarkets.com/Uzma.jpg,52,TheEdge,http://www.theedgemarkets.com/categories/malaysia
EU opens probe into possible online food-delivery cartel,https://www.klsescreener.com/v2/news/view/1362983,2024-07-23 18:30:50,2024-07-23 18:30:50,2024-07-23 18:29:36,"BRUSSELS: The EU launched an investigation on Tuesday to determine whether online food-delivery companies Delivery Hero and Glovo engaged in anti-competitive practices.The probe comes after surprise raids at the firms, which are two of the largest food delivery companies ...","<div itemprop=""articleBody"" class=""dable-content-wrapper""><p>BRUSSELS: The EU launched an investigation on Tuesday to determine whether online food-delivery companies Delivery Hero and Glovo engaged in anti-competitive practices.</p><p>The probe comes after surprise raids at the firms, which are two of the largest food delivery companies in Europe, in June 2022 and November 2023.</p><p>Delivery Hero, based in Germany, held a minority share in Spanish company Glovo from July 2018 before becoming the German online app&#039;s subsidiary in July 2022.</p><p>The European Commission is concerned tha",Corporate,,https://assets.nst.com.my/images/articles/euf23_NSTfield_image_listing_featured_v2.var_1721730573.jpg,https://assets.nst.com.my/images/articles/delivery_hero_1721730566.jpg,79,NST,https://www.nst.com.my/business/corporate
"Ringgit among Asian currencies best performers, to trade at 4.60 versus dollar: Maybank IB",https://www.klsescreener.com/v2/news/view/1362981,2024-07-23 18:30:33,2024-07-23 18:30:33,2024-07-23 18:27:52,"KUALA LUMPUR: The ringgit has been among the best regional performers to date, driven by the mix of favourable domestic and external factors.Maybank Investment Bank Bhd (Maybank IB) group chief economist Suhaimi Ilias said the ringgit has stabilised and ...","<div itemprop=""articleBody"" class=""dable-content-wrapper""><p>KUALA LUMPUR: The ringgit has been among the best regional performers to date, driven by the mix of favourable domestic and external factors.</p><p>Maybank Investment Bank Bhd (Maybank IB) group chief economist Suhaimi Ilias said the ringgit has stabilised and has been trading below 4.70 against the US dollar for almost two weeks.</p><p>Domestically, he noted that the government and Bank Negara Malaysia&#039;s efforts to stabilise the ringgit and rebuild reserves are underway, supported by government-linked companies.</p><p>""We do be",Economy,,https://assets.nst.com.my/images/articles/Git23_NSTfield_image_listing_featured_v2.var_1721730468.jpg,https://assets.nst.com.my/images/articles/ringgit-us-dollar-reuters-1025_3409737_20230825102033_1721730461.jpg,81,NST,https://www.nst.com.my/business/economy
Gardenia Bakeries JV-owner QAF expects improved 1H earnings,https://www.klsescreener.com/v2/news/view/1362985,2024-07-23 18:32:15,2024-07-24 08:49:28,2024-07-23 18:22:27,SINGAPORE (July 23): QAF Ltd said it expects to see a better set of earnings for its 1HFY2024 period ended June 30.,"<div class=newsTextDataWrapInner><p>SINGAPORE (July 23): QAF Ltd said it expects to see a better set of earnings for its 1HFY2024 period ended June 30.</p></div>

<div class=newsTextDataWrapInner><p>The earnings improvement is attributed to the reinstation of production lines at QAF’s Malaysian factory in September 2023. The factory, which was damaged by floods in December 2021, has been supporting the normalisation of production and supply of bakery products, which contributed to overall improvement in the company’s<a href=""https://www.theedgesingapore.com/news/results/qaf-guides-improved-e",,,https://assets.theedgemarkets.com/Multi-industry-food-company-QAF-Gardenia-bread-px-svd-off-TES-Wed20072022_20240723181942_qaf.jpg,https://assets.theedgemarkets.com/Multi-industry-food-company-QAF-Gardenia-bread-px-svd-off-TES-Wed20072022_20240723181942_qaf.jpg,52,TheEdge,http://www.theedgemarkets.com/categories/malaysia
Etiqa Group appoints Fauziah Hisham as first woman chairperson,https://www.klsescreener.com/v2/news/view/1362989,2024-07-23 18:33:30,2024-07-23 18:33:30,2024-07-23 18:21:00,"KUALA LUMPUR: Etiqa Group has appointed Fauziah Hisham as its new chairperson, effective July 1, 2024, making her the first woman chairperson of the insurance group.","<div class=""inline-img""><div class=""story-image""><p class=""caption"">Etiqa Group chairperson Fauziah Hisham</p></div></div><div id=""story-body"" class=""story bot-15 relative""><p>KUALA LUMPUR: Etiqa Group has appointed Fauziah Hisham as its new chairperson, effective July 1, 2024, making her the first woman chairperson of the insurance group.</p><p>She succeeds Datuk R. Karunakaran, who has retired after serving more than seven years as chairman.</p><p>In a statement, Etiqa said Fauziah has served more than two years as a board member Etiqa International Holdings Sdn. Bhd and Maybank Ageas Holdin",,,https://apicms.thestar.com.my/uploads/images/2024/07/23/2818120.jpg,https://apicms.thestar.com.my/uploads/images/2024/07/23/2818120.jpg,28,TheStar,http://www.thestar.com.my/news/latest/?tag=Business
